18	153	regulation 32 is ancillary to regulation 30 and simply designed to ensure that out-of-country supplies are -LRB- in line with the scheme of the Sixth Directive -RRB- treated in the same way as taxable supplies . 	NAN	NAN	NAN	0.7	lord scott
18	154	This means , in effect , treating the word ` taxable supplies ' in regulation 30 -LRB- 2 -RRB- -LRB- d -RRB- in other than its ordinary sense . '' 	NAN	NAN	NAN	0.7	lord scott
18	155	32 . 	NAN	NAN	NAN	0.7	lord scott
18	156	The Court of Appeal disagreed : -LSB- 1999 -RSB- STC 424 with whose judgment Judge and Tuckey LJJ agreed , thought that `` taxable supplies '' in regulation 30 -LRB- 2 -RRB- -LRB- d -RRB- , and elsewhere in regulation 30 , had the meaning given by section 2 of the Act ie excluding out-of-country taxable supplies and that `` all supplies '' meant taxable supplies and exempt supplies and did not include out-of-country supplies . 	NAN	NAN	NAN	0.7	lord scott
18	157	He held , at p 430 , that regulation 32 `` was intended to constitute a separate regime for out-of - country and specified supplies '' ie separate from the regulation 30 regime . 	NAN	NAN	NAN	0.8	lord scott
18	158	33 . 	NAN	NAN	NAN	0.8	lord scott
18	159	Mr Cordara , in seeking on behalf of LIPA to overturn the Court of Appeal and uphold the tribunal and Carnwath J , had essentially two submissions . 	NAN	NAN	NAN	0.8	lord scott
18	160	34 . 	NAN	NAN	NAN	0.8	lord scott
18	161	He submitted that article 17.5 , coupled with article 19 , required a value-based approach to the apportionment of residual input tax as between supplies in respect of which input tax could be recovered ie in-country taxable supplies and out-of-country supplies that would have been taxable if they had been in-country supplies -LRB- article 17.2 and 17.3 -RRB- and supplies in respect of which input tax could not be deducted , eg exempt supplies . 	NAN	NAN	NAN	0.8	lord scott
18	162	Regulation 30 -LRB- 2 -RRB- -LRB- d -RRB- provided that value-based apportionment . 	NAN	NAN	NAN	0.8	lord scott
18	163	Regulation 32 was confined to determining the amount of input tax to be attributed to the out-of-country supplies . 	NAN	NAN	NAN	0.8	lord scott
18	164	It did not prevent the out-of-country supplies , which would have been taxable if made in-country , from being `` taxable supplies '' for all regulation 30 purposes . 	NAN	NAN	NAN	0.8	lord scott
18	165	35 . 	NAN	NAN	NAN	0.8	lord scott
18	166	But , if the Court of Appeal were right in regarding regulation 32 as a self-contained provision that removed out-of-country supplies for all purposes from regulation 30 , then , submitted Mr Cordara , regulation 32 was inconsistent with articles 17.5 and 19 and , at least to the extent of the inconsistency , must give way to the provisions of the Directive . 	NAN	NAN	NAN	0.8	lord scott
18	167	36 . 	NAN	NAN	NAN	0.8	lord scott
18	168	I am unable to accept these submissions . 	NAN	NAN	NAN	0.8	lord scott
18	169	In order to explain why not it is convenient to start with article 17.5 . 	NAN	NAN	NAN	0.8	lord scott
18	170	I accept that article 17.5 , coupled with article 19 , contemplates a value-based approach to apportionment of residual input tax . 	NAN	NAN	NAN	0.8	lord scott
18	171	But it does not insist on it . 	NAN	NAN	NAN	0.8	lord scott
18	172	Sub-paragraph -LRB- c -RRB- allows member states to bring into effect a regime under which the taxable person is required `` to make the deduction on the basis of the use of all or part of the goods or services '' , ie an apportionment on the basis of use . 	NAN	NAN	NAN	0.8	lord scott
18	173	Regulation 32 requires an apportionment to be made on the basis of use . 	NAN	NAN	NAN	0.8	lord scott
18	174	37 . 	NAN	NAN	NAN	0.8	lord scott
18	175	The regulation 32 use-based apportionment applies only in respect of out-of-country supplies . 	NAN	NAN	NAN	0.8	lord scott
18	176	Where input goods and services are used in part in making out-of-country supplies and in part in making in-country supplies , article 17.5 -LRB- c -RRB- does not , Mr Cordara submitted , enable a use-based apportionment to be imposed in respect of the out-of - country supplies with a value-based apportionment applying in respect of the in-country supplies . 	NAN	NAN	NAN	0.8	lord scott
18	177	He submitted , as I understood it , that there must be one regime , and one regime only , either the value-based regime of article 19 or a use-based regime imposed under article 17.5 -LRB- c -RRB- . 	NAN	NAN	NAN	0.8	lord scott
18	178	I do not accept that article 17.5 -LRB- c -RRB- requires this one regime approach . 	NAN	NAN	NAN	0.9	lord scott
18	179	Sub-paragraph -LRB- c -RRB- refers to apportionment `` on the basis of the use of all or part of the goods and services '' . 	NAN	NAN	NAN	0.9	lord scott
18	180	The `` goods and services '' referred to are the input goods and services . 	NAN	NAN	NAN	0.9	lord scott
18	181	So a use-based apportionment can be prescribed in respect of the input tax on some of the goods and services , leaving the input tax on the other goods and services to be apportioned by a value-based method . 	NAN	NAN	NAN	0.9	lord scott
18	182	There can , therefore , be two regimes . 	NAN	NAN	NAN	0.9	lord scott
18	183	It is true that regulation 32 does not split the input goods and services into some to which the use-based apportionment applies and others to which the regulation 30 -LRB- 2 -RRB- -LRB- d -RRB- value-based apportionment applies . 	NAN	NAN	NAN	0.9	lord scott
18	184	The regulation applies to all the goods and services used , or to be used , in making the out-of-country supplies . 	NAN	NAN	NAN	0.9	lord scott
18	185	But since there is no express restriction that prevents the use-based apportionment being applied only in respect of out-of-country supplies and since article 17.5 -LRB- c -RRB- contemplates that more than one basis of apportionment may be applicable in order to identify the amount of input tax deductible under article 17.3 , I can see nothing in regulation 32 that is inconsistent with the article 17 scheme . 	NAN	NAN	NAN	0.9	lord scott
18	186	In my opinion , the attack on the validity of regulation 32 fails . 	NAN	NAN	NAN	0.9	lord scott
18	187	38 . 	NAN	NAN	NAN	0.9	lord scott
18	188	Regulation 32 enables the amount of input tax used in making out-of-country supplies to be determined . 	NAN	NAN	NAN	0.9	lord scott
18	189	The tax thus determined is tax attributable to supplies within subsection -LRB- 2 -RRB- -LRB- b -RRB- of section 15 of the 1983 Act and , accordingly , is tax for which the taxpayer is entitled to credit under section 14 -LRB- 2 -RRB- . 	NAN	NAN	NAN	0.9	lord scott
18	190	It is not necessary for the supplies to be `` taxable supplies '' under regulation 30 in order for the taxpayer to be so entitled . 	NAN	NAN	NAN	0.9	lord scott
18	191	I agree , therefore , with the Court of Appeal that regulation 32 provides a separate regime for out-of-country supplies . 	NAN	NAN	NAN	0.9	lord scott
18	192	39 . 	NAN	NAN	NAN	0.9	lord scott
18	193	There remain difficulties of construction of regulation 30 -LRB- 2 -RRB- -LRB- d -RRB- . 	NAN	NAN	NAN	0.9	lord scott
18	194	In paragraph 2 -LRB- d -RRB- , and everywhere else in the regulation , `` taxable supplies '' means , in my opinion , supplies in the United Kingdom . 	NAN	NAN	NAN	0.9	lord scott
18	195	The meaning accords within the definition in section 2 of the Act -LRB- cf regulation 36 where `` taxable supplies '' is expressly given a different , extended meaning -RRB- . 	NAN	NAN	NAN	0.9	lord scott
18	196	`` All supplies '' in paragraph 2 -LRB- d -RRB- does not , in my opinion , include out-of-country supplies that would , if made in the United Kingdom , have been taxable . 	NAN	NAN	NAN	0.9	lord scott
18	197	Those supplies are dealt with under regulation 32 . 	NAN	NAN	NAN	0.9	lord scott
18	198	`` Exempt supplies '' , on the other hand , does include supplies made outside the United Kingdom that would be exempt if made in the United Kingdom -LRB- see regulation 29 -LRB- 1 -RRB- -LRB- a -RRB- -LRB- ii -RRB- -RRB- . 	NAN	NAN	NAN	0.9	lord scott
18	199	Otherwise the paragraph -LRB- 2 -RRB- -LRB- d -RRB- fraction would produce a distorted result . 	NAN	NAN	NAN	1	lord scott
18	200	I am , however , not clear how paragraph -LRB- 2 -RRB- -LRB- d -RRB- is intended to apply where the input goods and services have been used in making not only taxable supplies and exempt supplies but also non-business supplies -LRB- cf paragraph -LRB- 2 -RRB- -LRB- c -RRB- - `` used ... . 	NAN	NAN	NAN	1	lord scott
18	201	in carrying on any other activity ... . '' -RRB- 	NAN	NAN	NAN	1	lord scott
18	202	. 	NAN	NAN	NAN	1	lord scott
18	203	Presumably these supplies , too , should be included under `` all supplies '' . 	NAN	NAN	NAN	1	lord scott
18	204	40 . 	NAN	NAN	NAN	1	lord scott
18	205	The present case , however , does not involve non-business supplies . 	NAN	NAN	NAN	1	lord scott
18	206	It involves only taxable supplies , exempt supplies and supplies that would have been taxable if made in-country . 	NAN	NAN	NAN	1	lord scott
18	207	As to these , in my opinion , the Court of Appeal came to the correct conclusions . 	NAN	NAN	NAN	1	lord scott
18	208	I would dismiss the appeal . 	lord scott	self	outcome	1	lord scott
