3.15	68	314	334	34	hoffmann	That is certainly the view we would take of someone who , for example , refused to pay part of his taxes because he felt he could not conscientiously contribute to military expenditure , or insisted on chaining herself to a JCB because she thought it was morally offensive to destroy beautiful countryside to build a new motorway .	FRAMING	NONE	NONE	NONE	NONE	0	0	0	0	0	0
3.15	68	315	335	34	hoffmann	As judges we would respect their views but might feel it necessary to punish them all the same .	FRAMING	NONE	NONE	NONE	NONE	0	0	0	0	0	0
3.15	68	316	336	34	hoffmann	Whether we did so or not would be largely a pragmatic question .	FRAMING	NONE	NONE	NONE	NONE	0	0	0	0	0	0
3.15	68	317	337	34	hoffmann	We would take into account their moral views but would not accept an unqualified moral duty to give way to them .	FRAMING	NONE	NONE	NONE	NONE	0	0	0	0	0	0
3.15	68	318	338	34	hoffmann	On the contrary we might feel that although we sympathised and even shared the same opinions , we had to give greater weight to the need to enforce the law .	FRAMING	NONE	NONE	NONE	NONE	0	0	0	0	0	0
3.15	68	319	339	34	hoffmann	In deciding whether or not to impose punishment , the most important consideration would be whether it would do more harm than good .	FRAMING	NONE	NONE	NONE	NONE	0	0	0	0	0	0
3.15	68	320	340	34	hoffmann	This means that the objector has no right not to be punished .	FRAMING	NONE	NONE	NONE	NONE	0	0	0	0	0	0
3.15	68	321	341	34	hoffmann	It is a matter for the state ( including the judges ) to decide on utilitarian grounds whether to do so or not .	FRAMING	NONE	NONE	NONE	NONE	0	0	0	0	0	0
3.15	68	322	342	34	hoffmann	"As Ronald Dworkin said in A Matter of Principle ( 1985 ) , at p 114 : "" Utilitarianism may be a poor general theory of justice , but it states an excellent necessary condition for a just punishment . """	BACKGROUND	NONE	NONE	NONE	NONE	0	0	0	1	0	0
3.15	68	324	343	35	hoffmann	Mr Nicol was , I think , inclined to accept these principles as correct for most forms of civil disobedience .	PROCEEDINGS	NONE	NONE	NONE	NONE	0	0	0	0	0	0
3.15	68	325	344	35	hoffmann	Conscientious objection to a law is not enough to make punishment unjust .	PROCEEDINGS	NONE	NONE	NONE	NONE	0	0	0	0	0	0
3.15	68	326	345	35	hoffmann	It is not a reason why the objector has a right to be treated differently .	PROCEEDINGS	NONE	NONE	NONE	NONE	0	0	0	0	0	0
3.15	68	327	346	35	hoffmann	But he said that military service was different .	PROCEEDINGS	NONE	NONE	NONE	NONE	0	0	0	0	0	0
3.15	68	328	347	35	hoffmann	An obligation to kill people was something which the state could not justly impose upon anyone who had a deeply held objection to doing so .	PROCEEDINGS	NONE	NONE	NONE	NONE	0	0	0	0	0	0
3.15	68	330	348	36	hoffmann	The difficulty about this argument is that it is accepted that in general the state does have the right to impose upon its citizens an obligation to kill people in war .	FRAMING	NONE	NONE	NONE	NONE	0	0	0	0	0	0
3.15	68	331	349	36	hoffmann	It would of course be different if they were being asked to commit war crimes ; in such a case , anyone could legitimately object .	FRAMING	NONE	NONE	NONE	NONE	0	0	0	0	0	0
3.15	68	332	350	36	hoffmann	But ordinary army service , though demanding and often inconvenient , sometimes unpleasant and occasionally dangerous , is in many countries ( and was in many more , including the United Kingdom ) part of the citizen 's ordinary duty .	FRAMING	NONE	NONE	NONE	NONE	0	0	0	0	0	0
3.15	68	334	351	37	hoffmann	Mr Nicol did not offer a rational ground for distinguishing between objection to military service and objection to other laws .	FRAMING	NONE	NONE	NONE	NONE	0	0	0	0	0	0
3.15	68	335	352	37	hoffmann	One might feel intuitively that some such ground might be constructed around the notion of the sanctity of life , although I am not sure that even that could be described as rational .	FRAMING	NONE	NONE	NONE	NONE	0	0	0	0	0	0
3.15	68	336	353	37	hoffmann	In any event , it would not have served Mr Nicol 's purpose because it does not form the basis of these applicants ' objections .	FRAMING	NONE	NONE	NONE	NONE	0	0	0	0	0	0
3.15	68	337	354	37	hoffmann	They would have no objection to fighting in a war for a Turkish ( or Kurdish ) government of the right political complexion .	FRAMING	NONE	NONE	NONE	NONE	0	0	0	0	0	0
3.15	68	338	355	37	hoffmann	He appealed instead to the practice of nations and the opinions of jurists , which he says support the proposition that conscientious objection to military service on any religious or political ground should be recognised .	PROCEEDINGS	NONE	NONE	NONE	NONE	0	0	0	0	0	0
3.15	68	340	356	38	hoffmann	"The question in this appeal is the meaning of the term "" refugee "" in the Refugee Convention ."	FRAMING	NONE	NONE	NONE	NONE	0	1	0	0	0	0
3.15	68	341	357	38	hoffmann	"That in turn raises the question of what is meant by "" persecuted "" ."	FRAMING	NONE	NONE	NONE	NONE	0	0	0	0	0	0
3.15	68	342	358	38	hoffmann	Mr Nicol says that if people are subjected to punishment which would be regarded as discriminatory by reference to their fundamental human rights , they are being persecuted .	PROCEEDINGS	NONE	NONE	NONE	NONE	0	0	0	0	0	0
3.15	68	343	359	38	hoffmann	If those fundamental rights relate to their religious beliefs or political opinions , then they are being persecuted for reasons of those beliefs or opinions .	PROCEEDINGS	NONE	NONE	NONE	NONE	0	0	0	0	0	0
3.15	68	345	360	38	hoffmann	My Lords , I have not attempted to examine all aspects of these propositions but for present purposes I am content to accept them .	FRAMING	NONE	NONE	NONE	NONE	0	0	0	0	0	0
3.15	68	346	361	38	hoffmann	I shall therefore consider whether punishing conscientious objectors is an infringement of their fundamental human rights to freedom of conscience and opinion .	FRAMING	NONE	NONE	NONE	NONE	0	0	0	0	0	0
3.15	68	348	362	39	hoffmann	How does one establish the scope of fundamental human rights for the purposes of an international convention such as the Refugee Convention ?	FRAMING	NONE	NONE	NONE	NONE	0	1	0	0	0	0
3.15	68	349	363	39	hoffmann	"Many state parties to the Convention are also parties to human rights conventions , such as the ECHR and the International Covenant on Civil and Political Rights ( "" ICCPR "" ) ."	FRAMING	NONE	NONE	NONE	NONE	0	1	0	0	0	0
3.15	68	350	364	39	hoffmann	Mr Nicol says that the current state of human rights as expressed in those and other similar conventions is the best guide to their content for the purposes of the Refugee Convention .	PROCEEDINGS	NONE	NONE	NONE	NONE	0	1	0	0	0	0
3.15	68	352	365	40	hoffmann	Mr Howell QC , who appeared for the Secretary of State , said that the question was whether a right of conscientious objection had become part of customary international law .	PROCEEDINGS	NONE	NONE	NONE	NONE	0	0	0	0	0	1
3.15	68	353	366	40	hoffmann	For that purpose there had to have been a general and consistent practice of states which was recognised as conforming to a legal obligation : see Oppenheim 's International Law , vol 1 , 9th ed ( 1992 ) ( ed Jennings and Watts ) , pp 27 - 31 .	PROCEEDINGS	NONE	NONE	NONE	NONE	1	0	0	0	0	1
3.15	68	354	367	40	hoffmann	There was plainly no such settled practice relating to conscientious objection .	PROCEEDINGS	NONE	NONE	NONE	NONE	0	0	0	0	0	0
3.15	68	355	368	40	hoffmann	There are many countries , of which I shall mention some in a moment , which do not recognise it .	PROCEEDINGS	NONE	NONE	NONE	NONE	0	0	0	0	0	0
3.15	68	357	369	41	hoffmann	I do not think it is possible to apply the rules for the development of rules of international law concerning the relations of states with each other ( for example , as to how boundaries should be drawn ) to the fundamental human rights of citizens against the state .	FRAMING	NONE	NONE	NONE	NONE	0	0	0	0	0	0
3.15	68	358	370	41	hoffmann	There are unhappily many fundamental human rights which would fail such a test of state practice and the Refugee Convention is itself a recognition of this fact .	FRAMING	NONE	NONE	NONE	NONE	0	1	0	0	0	0
3.15	68	359	371	41	hoffmann	In my opinion a different approach is needed .	FRAMING	NONE	NONE	NONE	NONE	0	0	0	0	0	0
3.15	68	360	372	41	hoffmann	Fundamental human rights are the minimum rights which a state ought to concede to its citizens .	FRAMING	NONE	NONE	NONE	NONE	0	0	0	0	0	0
3.15	68	361	373	41	hoffmann	For the purpose of deciding what these minimum rights are , international instruments are important even if many state parties in practice disregard them .	FRAMING	NONE	NONE	NONE	NONE	0	0	0	0	0	0
3.15	68	362	374	41	hoffmann	( The African Charter on Human and People 's Rights , adopted in 1981 , is perhaps a conspicuous example ) .	FRAMING	NONE	NONE	NONE	NONE	0	0	0	0	0	0
3.15	68	363	375	41	hoffmann	But the instruments show recognition that such rights ought to exist .	FRAMING	NONE	NONE	NONE	NONE	0	0	0	0	0	0
3.15	68	364	376	41	hoffmann	The delinquent states do not normally deny this ; they usually pretend that they comply .	FRAMING	NONE	NONE	NONE	NONE	0	0	0	0	0	0
3.15	68	365	377	41	hoffmann	Equally , the fact that many states openly deny this existence of a human right is not necessarily a reason for saying that it does not exist .	FRAMING	NONE	NONE	NONE	NONE	0	0	0	0	0	0
3.15	68	366	378	41	hoffmann	One may think , so much the worse for them .	FRAMING	NONE	NONE	NONE	NONE	0	0	0	0	0	0
3.15	68	367	379	41	hoffmann	But state practice is nevertheless important because it is difficult to assert the existence of a universal fundamental human right disavowed by many states which take human rights seriously .	FRAMING	NONE	NONE	NONE	NONE	0	0	0	0	0	0
3.15	68	369	380	42	hoffmann	As I have said , there are many countries which do not , or did not until relatively recently , recognise any form of conscientious objection .	FRAMING	NONE	NONE	NONE	NONE	0	0	0	0	0	0
3.15	68	370	381	42	hoffmann	Those that do are not agreed on the grounds upon which it should be allowed .	FRAMING	NONE	NONE	NONE	NONE	0	0	0	0	0	0
3.15	68	371	382	42	hoffmann	"The Rapporteur of the Committee on Legal Affairs and Human Rights of the Council of Europe reported on 4 May 2001 on "" Exercise of the right of conscientious objection to military service in Council of Europe member states "" ( Doc 8809 revised ) , paragraph 24 :"	BACKGROUND	NONE	NONE	NONE	NONE	0	0	0	0	0	0
3.15	68	371	383	42.5	hoffmann	""" Grounds for exemption from military service range from a very limited list of reasons to a very broad interpretation of the concept of conscience . """	BACKGROUND	NONE	NONE	NONE	NONE	0	0	0	0	0	0
3.15	68	373	384	43	hoffmann	In the United Kingdom , for example , some forms of conscientious objection were recognised in both World Wars ; the practice of the tribunals which decided claims to conscientious objector status does not appear to have been uniform .	FRAMING	NONE	NONE	NONE	NONE	0	0	0	0	0	0
3.15	68	374	385	43	hoffmann	Likewise in the United States conscientious objection is recognised , but the statutory grounds are more specific : the objection must be to all war and not merely to the particular war for which one is being conscripted .	FRAMING	NONE	NONE	NONE	NONE	0	0	0	0	0	0
3.15	68	375	386	43	hoffmann	This ruled out people who did not object to serving in defence of their country but thought that the Vietnam War , for example , was immoral .	FRAMING	NONE	NONE	NONE	NONE	0	0	0	0	0	0
3.15	68	376	387	43	hoffmann	In France conscientious objection was not recognised until 1963 , after the end of the Algerian War , and in Germany it was recognised in the new 1949 constitution after the end of the Second World War , when the German Army was in abeyance .	FRAMING	NONE	NONE	NONE	NONE	0	0	0	0	0	0
3.15	68	377	388	43	hoffmann	On the other hand , in many countries there is conscription and no conscientious objection .	FRAMING	NONE	NONE	NONE	NONE	0	0	0	0	0	0
3.15	68	379	389	44	hoffmann	What conclusions can one draw from these mixed data ?	FRAMING	NONE	NONE	NONE	NONE	0	0	0	0	0	0
3.15	68	380	390	44	hoffmann	It seems to me that even in Europe and the United States , the recognition of conscientious objection , sometimes as a prelude to the abolition of conscription , does not demonstrate any recognition of a principle that conscientious objectors have a moral right to be treated differently .	FRAMING	NONE	NONE	NONE	NONE	0	0	0	0	0	0
3.15	68	381	391	44	hoffmann	On the contrary , I think that practice supports Dworkin 's view that recognition of the strength of the objector 's religious , moral or political feelings is only part of a complex judgment that includes the pragmatic question as to whether compelling conscientious objectors to enlist or suffer punishment will do more harm than good .	FRAMING	NONE	NONE	NONE	NONE	0	0	0	0	0	1
3.15	68	382	392	44	hoffmann	Among the other relevant factors are the following : first , martyrs attract sympathy , particularly if they suffer on religious grounds in a country which takes religion seriously ; secondly , unwilling soldiers may not be very effective ; thirdly , they tend to be articulate people who may spread their views in the ranks ; fourthly , modern military technology requires highly trained specialists and not masses of unskilled men .	FRAMING	NONE	NONE	NONE	NONE	0	0	0	0	0	0
3.15	68	384	393	45	hoffmann	I pass then from state practice to the opinions of jurists .	TEXTUAL	NONE	NONE	NONE	NONE	0	0	0	0	0	0
3.15	68	385	394	45	hoffmann	There seems little doubt that the framers of the ICCPR and the ECHR did not think that the Conventions conferred a right to conscientious objection .	FRAMING	NONE	NONE	NONE	NONE	0	1	0	0	0	0
3.15	68	386	395	45	hoffmann	"That is shown by the provisions of article 8 ( c ) ( ii ) of the ICCPR and article 4 ( 3 ) ( b ) of the ECHR which speak , in a different context , of countries "" where conscientious objection is recognised "" ."	FRAMING	NONE	NONE	NONE	NONE	1	0	0	0	0	0
3.15	68	387	396	45	hoffmann	That clearly indicates that the framers thought there might be state parties to the Convention in which conscientious objection was not recognised .	FRAMING	NONE	NONE	NONE	NONE	0	1	0	0	0	0
3.15	68	388	397	45	hoffmann	Of course that is not by any means conclusive .	FRAMING	NONE	NONE	NONE	NONE	0	0	0	0	0	0
3.15	68	389	398	45	hoffmann	The framers of the post-Civil War amendments to the constitution of the United States did not think that they were inconsistent with segregation , but the courts in the mid-twentieth century decided that they were .	FRAMING	NONE	NONE	NONE	NONE	0	0	0	0	0	0
3.15	68	390	399	45	hoffmann	"The broad concepts of human rights do not change in meaning : "" respect for ... private life "" always means the area of personal autonomy which the state must concede to the individual , but each generation of judges must give its own content to such concepts ."	FRAMING	NONE	NONE	NONE	NONE	0	0	0	0	0	0
3.15	68	391	400	45	hoffmann	They may think that the framers of the instrument were wrong in their assumptions or that the extent of the area of personal autonomy has changed with changes in the values of society : Goodwin v United Kingdom ( 2002 ) 35 EHRR 447 .	FRAMING	NONE	NONE	NONE	NONE	0	0	0	1	1	0
3.15	68	392	401	45	hoffmann	Perhaps even more important , there may be changes in what is perceived to be the appropriate balance between one human right ( e.g. respect for private life ) and another ( e.g. freedom of expression by newspapers ) or the extent to which a human right needs to be qualified in the interests of good government or on other utilitarian grounds .	FRAMING	NONE	NONE	NONE	NONE	0	0	0	0	0	0
3.15	68	394	402	46	hoffmann	In the present case , the human right relied upon as founding a right to conscientious objection is the freedom of thought conscience and religion : article 18 of the ICCPR and article 9 of the ECHR .	FRAMING	NONE	NONE	NONE	NONE	1	1	0	0	0	0
3.15	68	395	403	46	hoffmann	"Although both articles give an unqualified right to hold religious opinions and to manifest that belief in "" worship , observance , practice and teaching "" , the right to manifest a religion or belief in other ways may be limited so far as "" necessary to protect public safety , order , health , or morals or the fundamental rights and freedoms of others "" ."	BACKGROUND	NONE	NONE	NONE	NONE	0	0	0	0	0	0
3.15	68	396	404	46	hoffmann	The framers of the covenants appear to have believed , as I have said , that public safety was a legitimate reason for not allowing a religion or belief to be manifested by refusal to do military service .	FRAMING	NONE	NONE	NONE	NONE	0	0	0	0	0	0
3.15	68	397	405	46	hoffmann	So the question is whether that is no longer the right view to take .	FRAMING	NONE	NONE	NONE	NONE	0	0	0	0	0	0
3.15	68	399	406	47	hoffmann	The changes in the nature of warfare which I mentioned earlier do not seem to me a reason for recognising an international human right to conscientious objection .	DISPOSAL	NONE	NONE	NONE	NONE	0	0	0	0	0	0
3.15	68	400	407	47	hoffmann	They only strengthen the pragmatic reasons , in countries which have high technology armies but still have conscription , for not punishing conscientious objection .	FRAMING	NONE	NONE	NONE	NONE	0	0	0	0	0	0
3.15	68	401	408	47	hoffmann	But that is a matter of policy , not principle .	FRAMING	NONE	NONE	NONE	NONE	0	0	0	0	0	0
3.15	68	402	409	47	hoffmann	It is no reason for saying that a country which needs a citizen army to defend itself is obliged to put the conscience of a conscript before the needs of national defence and , perhaps as important , the principle of equality of sacrifice among citizens .	DISPOSAL	NONE	NONE	NONE	NONE	0	0	0	0	0	0
3.15	68	404	410	48	hoffmann	The notion that there is such a human right seems to be of recent origin .	FRAMING	NONE	NONE	NONE	NONE	0	0	0	0	0	0
3.15	68	405	411	48	hoffmann	"In LTK v Finland ( 1985 ) 94 ILR 396 the UN Human Rights Committee established under the ICCPR said flatly that "" the Covenant does not provide for the right to conscientious objection "" ."	BACKGROUND	NONE	NONE	NONE	NONE	0	0	0	1	1	0
3.15	68	406	412	48	hoffmann	"But in 1993 the committee issued "" General Comment 22 "" on 30 July 1993 in which it tentatively changed its mind and said :"	BACKGROUND	NONE	NONE	NONE	NONE	1	0	0	0	0	0
3.15	68	406	413	48.5	hoffmann	""" Many individuals have claimed the right to refuse to perform military service ( conscientious objection ) on the basis that such right derives from their freedoms under article 18 ."	BACKGROUND	NONE	NONE	NONE	NONE	1	0	0	0	0	0
3.15	68	407	414	48.5	hoffmann	In response to such claims , a growing number of states have in their laws exempted from compulsory military service citizens who genuinely hold religious or other beliefs that forbid the performance of military service and replaced it with alternative national service .	BACKGROUND	NONE	NONE	NONE	NONE	0	0	0	0	0	0
3.15	68	408	415	48.5	hoffmann	"The Covenant does not explicitly refer to a right to conscientious objection , but the committee believes that such a right can be derived from article 18 , inasmuch as the obligation to use lethal force may seriously conflict with the freedom of conscience and the right to manifest one 's religion or belief . """	BACKGROUND	NONE	NONE	NONE	NONE	1	0	0	0	0	0
3.15	68	410	416	49	hoffmann	There are two observations to be made .	TEXTUAL	NONE	NONE	NONE	NONE	0	0	0	0	0	0
3.15	68	411	417	49	hoffmann	First , the fact that ( a ) people claim a right to conscientious objection under article 18 and ( b ) a growing number of states concede a right to conscientious objection , does not by any means demonstrate that they recognise that such a right exists under article 18 .	FRAMING	NONE	NONE	NONE	NONE	1	0	0	0	0	0
3.15	68	412	418	49	hoffmann	It may show no more than that their military requirements make it sensible to tolerate some form of conscientious objection .	FRAMING	NONE	NONE	NONE	NONE	0	0	0	0	0	0
3.15	68	413	419	49	hoffmann	"Secondly , the statement that an obligation to use lethal force may "" seriously conflict with freedom of conscience etc "" does not even attempt to explain why such an obligation should be distinguished from other legal obligations which may similarly conflict ."	FRAMING	NONE	NONE	NONE	NONE	0	0	0	0	0	0
3.15	68	415	420	50	hoffmann	The European Court of Human Rights has never found it necessary to decide whether article 9 ( the equivalent of article 18 of the ICCPR ) entails a right of conscientious objection but the Commission has considered the matter several times .	BACKGROUND	NONE	NONE	NONE	NONE	1	0	1	0	0	0
3.15	68	416	421	50	hoffmann	On all the occasions when it considered that it was necessary to decide the point , it has said that article 9 does not : see , for example , Autio v Finland Application No 17086/90 , ( 1991 ) 72 DR 245 referring to earlier cases .	BACKGROUND	NONE	NONE	NONE	NONE	1	0	0	1	1	0
3.15	68	417	422	50	hoffmann	"In Tsirlis and Kouloumpas v Greece ( 1997 ) 25 EHRR 198 , 224 there was a single dissent from Mrs Liddy , who distinguished cases in which the action does not "" actually express the belief concerned "" ( like chaining oneself to the railings outside Parliament ) or "" has no specific conscientious implications in itself "" ( like paying tax ) ."	BACKGROUND	NONE	NONE	NONE	NONE	0	0	0	1	1	0
3.15	68	418	423	50	hoffmann	I find it hard to see the principle upon which these distinctions are made : they appear to involve questions of degree .	FRAMING	NONE	NONE	NONE	NONE	0	0	0	0	0	0
3.15	68	419	424	50	hoffmann	There is no reason why a religion should not require one to chain oneself to railings , not pay tax or fight a holy war and to say that such beliefs would be irrational or contrary to the public interest would seem to me to miss the point .	FRAMING	NONE	NONE	NONE	NONE	0	0	0	0	0	0
3.15	68	420	425	50	hoffmann	However , Mrs Liddy gained five more votes for a similar dissent in Thlimmenos v Greece Application 34369/97 , 4 December 1998 , and there the matter stands .	BACKGROUND	NONE	NONE	NONE	NONE	0	0	0	1	0	0
3.15	68	422	426	51	hoffmann	"Finally there is the recently adopted Charter of Fundamental Rights of the European Union ( 2000 / C 364/01 ) which provides in article 10 ( 2 ) that "" [ t ] he right to conscientious objection is recognised , in accordance with the national laws governing the exercise of this right "" ."	BACKGROUND	NONE	NONE	NONE	NONE	1	0	0	0	1	0
3.15	68	423	427	51	hoffmann	The reference to national laws enabled the European institutions which proclaimed the Charter ( the legal status of which is still undecided ) to avoid defining the nature of the right but this makes it difficult to provide a coherent theory as to why the right should exist .	FRAMING	NONE	NONE	NONE	NONE	0	0	0	0	0	0
3.15	68	424	428	51	hoffmann	Is it based upon particular respect for a religious or philosophical belief in the sanctity of life ?	FRAMING	NONE	NONE	NONE	NONE	0	0	0	0	0	0
3.15	68	425	429	51	hoffmann	In that case , it should be confined to objections , as in the United States , to all wars and perhaps only to combatant roles in the forces .	FRAMING	NONE	NONE	NONE	NONE	0	0	0	0	0	0
3.15	68	426	430	51	hoffmann	Or is it more broadly based on political objection to particular operations ?	FRAMING	NONE	NONE	NONE	NONE	0	0	0	0	0	0
3.15	68	427	431	51	hoffmann	In that case , how should it be distinguished from other aspects of government policy ?	FRAMING	NONE	NONE	NONE	NONE	0	0	0	0	0	0
3.15	68	428	432	51	hoffmann	It is difficult to escape the conclusion that this provision was adopted because all the member states either had no conscription or did not foresee a situation in which it would be necessary to force deeply unwilling recruits into their armed forces .	FRAMING	NONE	NONE	NONE	NONE	0	0	0	0	0	0
3.15	68	430	433	52	hoffmann	If one turns to consider what the European Union considers would amount to a violation of fundamental rights by other nations , a different story emerges .	FRAMING	NONE	NONE	NONE	NONE	0	0	0	0	0	0
3.15	68	431	434	52	hoffmann	"On 4 March 1996 the Council adopted , pursuant to the "" Third Pillar "" provisions of article K .3 of the Maastricht Treaty , a joint position on the interpretation of the Refugee Convention ( OJ 1996 L 63 - 2 ) ."	BACKGROUND	NONE	NONE	NONE	NONE	0	1	0	0	0	1
3.15	68	432	435	52	hoffmann	Point 10 said that fear of punishment for conscientious objection should in itself be insufficient to justify recognition of refugee status .	BACKGROUND	NONE	NONE	NONE	NONE	1	0	0	0	0	0
3.15	68	433	436	52	hoffmann	It might however amount to persecution if the punishment was discriminatory , if the conditions under which service had to be performed amounted in themselves to persecution or if they would require the applicant to commit war crimes or the like .	BACKGROUND	NONE	NONE	NONE	NONE	0	0	0	0	0	0
3.15	68	434	437	52	hoffmann	A similar position is adopted in the current draft of a Council Directive on refugees which was approved at the Justice and Home Affairs Council on 28 November 2002 ( 15068/02 ) .	BACKGROUND	NONE	NONE	NONE	NONE	0	1	0	0	0	0
3.15	68	435	438	52	hoffmann	These documents suggest that the European Union does not accept that a failure to recognise conscientious objection is a discriminatory breach of the fundamental human rights of the objectors .	DISPOSAL	NONE	NONE	NONE	NONE	0	0	0	0	0	0
3.15	68	437	439	53	hoffmann	In my opinion , therefore , the applicants have not made out their case for saying that there exists a core human right to refuse military service on conscientious grounds which entails that punishment of persons who hold such views is necessarily discriminatory treatment .	DISPOSAL	NONE	NONE	NONE	NONE	0	0	0	0	0	0
3.15	68	438	440	53	hoffmann	The existence of such a right is not supported by either a moral imperative or international practice .	FRAMING	NONE	NONE	NONE	NONE	0	0	0	0	0	0
