2.18	38	280	253	48.5	scott	He contends that there were three breaches of duty , that is the failure to take steps to procure Mr Brocklesby 's release from the obligations to the building society ; the failure to do anything with the executed contract / transfer ; and the failure to inform Mr Brocklesby of either of the first or second breaches of duty .	BACKGROUND	NONE	NONE	NONE	NONE	0	0	0	0	0	1
2.18	38	281	254	48.5	scott	"He suggests that each of them was deliberate in the sense of being intentional and each was committed in circumstances where , by their nature , they were unlikely to be discovered for some time . """	BACKGROUND	NONE	NONE	NONE	NONE	0	0	0	0	0	0
2.18	38	283	255	49	scott	After referring to Sheldon v R H M Outhwaite ( Underwriting Agencies ) Ltd [ 1996 ] AC 102 and King v Victor Parsons & Co [ 1973 ] 1 WLR 29 and to paragraph 2.9 of the Law Reform Committee 's Final Report on Limitation of Actions ( 1977 ) ( Cmnd 6923 ) that had preceded the 1980 Act , Morritt LJ expressed his conclusions in the following passage , at p 605 :	BACKGROUND	NONE	NONE	NONE	NONE	0	1	0	1	1	1
2.18	38	283	256	49.5	scott	""" When one turns to the terms of section 32 [ of the 1980 Act ] itself , under subsection ( 1 ) there is a clear contrast between the action based on fraud and paragraph ( b ) , the concealment of any fact relevant to the plaintiff 's right of action being deliberate ."	BACKGROUND	NONE	NONE	NONE	NONE	1	1	0	0	0	0
2.18	38	284	257	49.5	scott	The requirement is that the fact relevant to the cause of action has been deliberately concealed from him by the defendant .	BACKGROUND	NONE	NONE	NONE	NONE	0	0	0	0	0	0
2.18	38	285	258	49.5	scott	But subsection ( 2 ) amplifies what is meant by deliberate concealment and requires that for the purposes of subsection ( 1 ) deliberate commission of a breach of duty , etc , amounts to deliberate concealment of the facts involved in the breach of duty .	BACKGROUND	NONE	NONE	NONE	NONE	0	0	0	0	0	0
2.18	38	286	259	49.5	scott	Generally speaking , and I do not say that there may not be exceptions , the civil law , and , so far as I know , the criminal law , does not require that a person should know the legal consequences of the act which he commits .	BACKGROUND	NONE	NONE	NONE	NONE	0	0	0	0	0	0
2.18	38	287	260	49.5	scott	Generally speaking , if he knows of the act and he intends the act , but is unaware of the legal consequences , his unawareness is immaterial , for it is trite law that ignorance of the law is no defence .	BACKGROUND	NONE	NONE	NONE	NONE	0	0	0	0	0	0
2.18	38	288	261	49.5	scott	It appears to me that had Parliament intended in the case of a deliberate concealment under section 32 ( 1 ) ( b ) [ of the 1980 Act ] , as amplified by subsection ( 2 ) , that there should be both deliberate commission of an act in the sense of knowingly and intentionally committing the act and also knowledge that such commission gave rise to a particular legal consequence , then it required clearer words to spell that out than are to be found in subsection ( 2 ) or subsection ( 1 ) .	BACKGROUND	NONE	NONE	NONE	NONE	1	1	0	0	0	0
2.18	38	289	262	49.5	scott	"Accordingly , the conclusion I reach is that it is not necessary for the purpose of extending the limitation period pursuant to section 32 ( 1 ) ( b ) to demonstrate that the fact relevant to the plaintiff 's right of action has been deliberately concealed in any sense greater than that the commission of the act was deliberate in the sense of being intentional and that that act or omission , as the case may be , did involve a breach of duty whether or not the actor appreciated that legal consequence . """	BACKGROUND	NONE	NONE	NONE	NONE	1	0	0	0	0	0
2.18	38	291	263	50	scott	The result of this interpretation of section 32 ( 2 ) is that whenever there is an intentional act which constitutes , whether or not to the knowledge of the actor , a breach of duty in circumstances in which it , i e , the breach of duty , is unlikely to be discovered for some time , sub-section ( 2 ) comes into play .	FRAMING	15	NONE	NONE	NONE	1	0	0	0	0	0
2.18	38	292	264	50	scott	This interpretation reversed what previously had been believed to be the position , namely that mere negligence would never by itself be enough to bring about a section 32 ( 1 ) postponement of time .	FRAMING	NONE	NONE	NONE	NONE	1	0	0	0	0	0
2.18	38	294	265	51	scott	Basing himself on the view of section 32 ( 2 ) that I have described , Morritt LJ concluded that the pleaded particulars of Mr Brocklesby 's case were sufficient to sustain his cause of action against the Limitation Act defence and to resist the strike out application .	BACKGROUND	NONE	NONE	NONE	NONE	1	1	0	0	0	1
2.18	38	296	266	52	scott	It is worth noting , however , that the Lord Justice then went on to give an alternative , uncontroversial and , if I may respectfully say so , plainly sound reason for coming to the same conclusion .	BACKGROUND	NONE	NONE	NONE	NONE	0	0	0	0	0	1
2.18	38	297	267	52	scott	He said , at p 606 :	BACKGROUND	NONE	NONE	NONE	NONE	0	0	0	0	0	0
2.18	38	300	268	52.5	scott	""" in addition . . . I am concerned that the judge imposed too high a standard of particularity for the reply to be served at the stage which the action had reached ."	BACKGROUND	NONE	NONE	NONE	NONE	0	0	0	0	0	0
2.18	38	301	269	52.5	scott	Discovery of documents has not yet taken place .	BACKGROUND	NONE	NONE	NONE	NONE	0	0	0	0	0	0
2.18	38	302	270	52.5	scott	Most of the relevant facts were inevitably in the knowledge of the solicitors rather than Mr Brocklesby .	BACKGROUND	NONE	NONE	NONE	NONE	0	0	0	0	0	0
2.18	38	303	271	52.5	scott	"There was no imminent trial such that an insufficiently particularised pleading might be embarrassing . . . . It may be that in the light of what is disclosed on discovery he will be able to supplement the particulars already given but without such supplementation I do not consider that his case as pleaded is so thin that the court is justified in , in effect , striking it out . """	BACKGROUND	NONE	NONE	NONE	NONE	0	0	0	0	0	0
2.18	38	304	272	52.5	scott	The other member of the court , Wilson J , simply agreed .	BACKGROUND	NONE	NONE	NONE	NONE	0	0	0	0	0	1
2.18	38	306	273	53	scott	The Brocklesby decision was followed by Laddie J in Liverpool Roman Catholic Archdiocese v Goldberg [ 2001 ] 1 All ER 182 .	BACKGROUND	NONE	NONE	NONE	NONE	0	0	0	1	1	1
2.18	38	307	274	53	scott	The defendant , Mr David Goldberg QC , a well-known specialist in tax law , had given certain tax advice to the archdiocese .	BACKGROUND	NONE	NONE	NONE	NONE	0	0	0	0	0	0
2.18	38	308	275	53	scott	The archdiocese contended that the advice was wrong , had been negligently given and had caused the archdiocese financial loss .	BACKGROUND	NONE	NONE	NONE	NONE	0	0	0	0	0	0
2.18	38	309	276	53	scott	A negligence action was commenced .	BACKGROUND	NONE	NONE	NONE	NONE	0	0	0	0	0	0
2.18	38	310	277	53	scott	The problem was that the allegedly negligent advice had been given in 1989 and 1992 but the action was not commenced until 1997 .	BACKGROUND	NONE	NONE	NONE	NONE	0	0	0	0	0	0
2.18	38	311	278	53	scott	Mr Goldberg pleaded that an action inrespectof his 1989 advice was time barred .	BACKGROUND	NONE	NONE	NONE	NONE	0	0	0	0	0	0
2.18	38	312	279	53	scott	The archdiocese , in answer , sought to rely on the Brocklesby interpretation of section 32 ( 2 ) .	BACKGROUND	NONE	NONE	NONE	NONE	1	0	0	1	0	0
2.18	38	313	280	53	scott	They proposed to amend their pleading so as to allege , inter alia :	BACKGROUND	NONE	NONE	NONE	NONE	0	0	0	0	0	0
2.18	38	313	281	53.5	scott	""" ( a ) The acts and omissions pleaded in paragraph 14 of the statement of claim [ ie in relation to the 1989 advice ] constituted the deliberate commission of breach of duty within the meaning of section 32 ( 2 ) of the Act in that they were intentional ."	BACKGROUND	NONE	NONE	NONE	NONE	1	0	0	0	0	0
2.18	38	314	282	53.5	scott	"For the avoidance of doubt it is not alleged that the defendant knew that he was thereby committing a breach of duty . """	BACKGROUND	NONE	NONE	NONE	NONE	0	0	0	0	0	0
2.18	38	316	283	54	scott	The second sentence of the cited paragraph uses the same language as the passage in parenthesis in paragraph 3 .	FRAMING	NONE	NONE	NONE	NONE	0	0	0	0	0	0
2.18	38	317	284	54	scott	A ( i ) of the re-amended reply in the present case .	FRAMING	NONE	NONE	NONE	NONE	0	0	0	0	0	0
2.18	38	318	285	54	scott	This pleading might now , I suppose , be called the Brocklesby disclaimer .	FRAMING	NONE	NONE	NONE	NONE	0	0	0	0	0	0
2.18	38	319	286	54	scott	Laddie J applied , as he had to , the interpretation of section 32 ( 2 ) adopted in Brocklesby .	BACKGROUND	NONE	NONE	NONE	NONE	1	0	0	0	0	1
2.18	38	320	287	54	scott	He said , in paragraph 22 of his judgment , at pp 190 - 191 :	BACKGROUND	NONE	NONE	NONE	NONE	1	0	0	0	0	0
2.18	38	320	288	54.5	scott	""" ' deliberate commission of a breach of duty ' should be read consistently with the Brocklesby case ."	BACKGROUND	NONE	NONE	NONE	NONE	0	0	0	1	0	1
2.18	38	321	289	54.5	scott	Any intentional act which amounts to a breach of duty amounts to a deliberate commission of a breach of duty and triggers section 32 ( 2 ) of the 1980 Act .	BACKGROUND	15	NONE	NONE	NONE	1	1	0	0	0	0
2.18	38	322	290	54.5	scott	The fact that in the proposed amendment to the reply , the archdiocese concedes that Mr Goldberg did not know he was committing a breach of duty does not , therefore , exclude operation of the section .	BACKGROUND	NONE	NONE	NONE	NONE	0	0	0	0	0	0
2.18	38	323	291	54.5	scott	Mr Goldberg 's advice was given intentionally .	BACKGROUND	NONE	NONE	NONE	NONE	0	0	0	0	0	0
2.18	38	324	292	54.5	scott	"On the assumption , which I have to make for the purpose of this application , namely that it amounted to a breach of duty , that breach was committed deliberately within the meaning of the section . """	BACKGROUND	NONE	NONE	NONE	NONE	0	0	0	0	0	0
2.18	38	325	293	54.5	scott	The present case : Newman J	TEXTUAL	NONE	NONE	NONE	NONE	0	0	0	0	0	1
2.18	38	326	294	55	scott	In the present case Newman J at first instance , applying Brocklesby and concluding on the facts that the solicitors ' assumed breach of duty would have been unlikely to have been discovered for some time , held that section 32 ( 2 ) applied and that the six - year limitation period did not begin to run until , at earliest , February 1994 .	PROCEEDINGS	3	NONE	NONE	NONE	1	0	0	0	0	1
2.18	38	327	295	55	scott	So the action was commenced well within the six - year period .	PROCEEDINGS	NONE	NONE	NONE	NONE	0	0	0	0	0	0
2.18	38	329	296	56	scott	The judge held , also , that the three - year period prescribed by section 14A would have started to run from February 1994 .	PROCEEDINGS	NONE	NONE	NONE	NONE	1	0	0	0	0	0
2.18	38	330	297	56	scott	It followed that Mr Cave was unable to rely on section 14A as a ground for resisting the solicitors ' Limitation Act defence .	PROCEEDINGS	NONE	NONE	NONE	NONE	1	0	0	0	0	0
2.18	38	331	298	56	scott	Mr Cave did not appeal against this finding .	PROCEEDINGS	NONE	NONE	NONE	NONE	0	0	0	0	0	0
2.18	38	332	299	56.5	scott	The Court of Appeal	TEXTUAL	NONE	NONE	NONE	NONE	0	0	1	0	0	0
2.18	38	333	300	57	scott	The bulk of the argument in the Court of Appeal ( Potter , Sedley and Jonathan Parker LJJ ) [ 2002 ] 1 WLR 581 appears to have centred on the question whether the court was bound by the decision of the two - man Court of Appeal in Brocklesby .	PROCEEDINGS	NONE	NONE	NONE	NONE	0	0	1	1	1	0
2.18	38	334	301	57	scott	They held that they were .	PROCEEDINGS	3	NONE	NONE	NONE	0	0	0	0	0	0
2.18	38	335	302	57	scott	That being so , the decision to dismiss the solicitors ' appeal was inevitable .	PROCEEDINGS	3	NONE	NONE	NONE	0	0	0	0	0	0
2.18	38	336	303	57	scott	Jonathan Parker LJ , however , confessed to being uneasy about the decision in Brocklesby .	PROCEEDINGS	NONE	NONE	NONE	NONE	0	0	0	1	0	1
2.18	38	337	304	57	scott	"He noted that in Sheldon both Lord Browne-Wilkinson and Lord Nicholls of Birkenhead had regarded unconscionability and impropriety as the "" underlying rationale "" of section 32 ( see eg [ 1996 ] 1 AC at 145H ) . """	PROCEEDINGS	NONE	NONE	NONE	NONE	1	0	0	0	1	1
2.18	38	338	305	57	scott	"Yet "" , observed Jonathan Parker LJ , "" if Brocklesby is right , a wholly innocent act or omission may suffice to deprive a defendant of a limitation defence "" ."	PROCEEDINGS	NONE	NONE	NONE	NONE	0	0	0	0	0	1
2.18	38	339	306	57	scott	That this may be so is demonstrated by the Goldberg case and , indeed , also the present case .	FRAMING	NONE	NONE	NONE	NONE	0	0	0	1	0	0
2.18	38	340	307	57.5	scott	Was the Brocklesby construction of section 32 ( 2 ) correct ?	TEXTUAL	NONE	NONE	NONE	NONE	1	0	0	1	0	0
2.18	38	342	308	58	scott	In my opinion it was not .	DISPOSAL	16	NONE	NONE	NONE	0	0	0	0	0	0
2.18	38	343	309	58	scott	I would start by adopting the approach prescribed by Lord Browne-Wilkinson in Sheldon .	FRAMING	NONE	NONE	NONE	NONE	0	0	0	0	0	1
2.18	38	344	310	58	scott	Unless there is some ambiguity in the statutory language , recourse to legislative history is unnecessary and impermissible .	FRAMING	NONE	NONE	NONE	NONE	0	0	0	0	0	0
2.18	38	no match	311	58	scott	"The relevant words in section 32 ( 2 ) are "" deliberate commission of a breach of duty . . . amounts to deliberate concealment of the facts involved in that breach of duty . """	BACKGROUND	NONE	no match	no match	no match	1	0	0	0	0	0
2.18	38	349	312	58	scott	"These are clear words of English . """	FRAMING	NONE	NONE	NONE	NONE	0	0	0	0	0	0
2.18	38	350	313	58	scott	"Deliberate commission of a breach of duty "" is to be contrasted with a commission of a breach of duty which is not deliberate , i e , a breach of duty which is inadvertent , accidental , unintended - there is a number of adjectives that can be chosen for the purpose of the contrast , and it does not matter which is chosen ."	FRAMING	NONE	NONE	NONE	NONE	0	0	0	0	0	0
2.18	38	351	314	58	scott	Each would exclude a breach of duty that the actor was not aware he was committing .	FRAMING	17	NONE	NONE	NONE	0	0	0	0	0	0
2.18	38	353	315	59	scott	"Mr Doctor QC , counsel for Mr Cave , the respondent , submitted that in order for a fact to be "" deliberately concealed "" for subsection ( 1 ) ( b ) purposes , the concealment must be an intended concealment ."	PROCEEDINGS	NONE	NONE	NONE	NONE	0	0	0	0	0	0
2.18	38	354	316	59	scott	I would respectfully agree with that .	DISPOSAL	NONE	NONE	NONE	NONE	0	0	0	0	0	0
2.18	38	355	317	59	scott	He followed with the submission that in every case in which there was a deliberate commission of a breach of duty in circumstances in which the victim was unlikely to discover for some time that there had been a breach , there must have been a deliberate concealment for subsection ( 1 ) ( b ) purposes .	PROCEEDINGS	NONE	NONE	NONE	NONE	0	0	0	0	0	0
2.18	38	356	318	59	scott	In which case , he concluded , subsection ( 2 ) would add nothing to subsection ( 1 ) ( b ) .	PROCEEDINGS	NONE	NONE	NONE	NONE	0	0	0	0	0	0
2.18	38	357	319	59	scott	But Parliament must have intended subsection ( 2 ) to add something of significance to subsection ( 1 ) ( b ) and the Brocklesby interpretation does add something to subsection ( 1 ) ( b ) .	PROCEEDINGS	NONE	NONE	NONE	NONE	0	0	0	1	0	0
2.18	38	359	320	60	scott	I hope I have done justice to the argument but , in my opinion , it cannot be accepted .	DISPOSAL	NONE	NONE	NONE	NONE	0	0	0	0	0	0
2.18	38	360	321	60	scott	I find it easy to accept that Mr Doctor 's submissions as to the meaning of section 32 ( 1 ) ( b ) are correct .	DISPOSAL	NONE	NONE	NONE	NONE	1	0	0	0	0	0
2.18	38	361	322	60	scott	I agree that deliberate concealment for section 32 ( 1 ) ( b ) purposes may be brought about by an act or an omission and that , in either case , the result of the act or omission , i e , the concealment , must be an intended result .	DISPOSAL	NONE	NONE	NONE	NONE	1	0	0	0	0	0
2.18	38	362	323	60	scott	But I do not agree that that renders subsection ( 2 ) otiose .	DISPOSAL	NONE	NONE	NONE	NONE	0	0	0	0	0	0
2.18	38	363	324	60	scott	A claimant who proposes to invoke section 32 ( 1 ) ( b ) in order to defeat a Limitation Act defence must prove the facts necessary to bring the case within the paragraph .	FRAMING	NONE	NONE	NONE	NONE	1	1	0	0	0	0
2.18	38	364	325	60	scott	He can do so if he can show that some fact relevant to his right of action has been concealed from him either by a positive act of concealment or by a withholding of relevant information , but , in either case , with the intention of concealing the fact or facts in question .	FRAMING	NONE	NONE	NONE	NONE	0	0	0	0	0	0
2.18	38	365	326	60	scott	In many cases the requisite proof of intention might be quite difficult to provide .	FRAMING	NONE	NONE	NONE	NONE	0	0	0	0	0	0
2.18	38	366	327	60	scott	The standard of proof would be the usual balance of probabilities standard and inferences could of course be drawn from suitable primary facts but , nonetheless , proof of intention , particularly where an omission rather than a positive act is relied on , is often very difficult .	FRAMING	NONE	NONE	NONE	NONE	0	0	0	0	0	0
2.18	38	367	328	60	scott	Subsection ( 2 ) , however , provides an alternative route .	FRAMING	NONE	NONE	NONE	NONE	0	0	0	0	0	0
2.18	38	368	329	60	scott	The claimant need not concentrate on the allegedly concealed facts but can instead concentrate on the commission of the breach of duty .	FRAMING	NONE	NONE	NONE	NONE	0	0	0	0	0	0
2.18	38	369	330	60	scott	If the claimant can show that the defendant knew he was committing a breach of duty , or intended to commit the breach of duty - I can discern no difference between the two formulations ; each would constitute , in my opinion , a deliberate commission of the breach - then , if the circumstances are such that the claimant is unlikely to discover for some time that the breach of duty has been committed , the facts involved in the breach are taken to have been deliberately concealed for subsection ( 1 ) ( b ) purposes .	FRAMING	NONE	NONE	NONE	NONE	0	0	0	0	0	0
2.18	38	370	331	60	scott	I do not agree with Mr Doctor that the subsection , thus construed , adds nothing .	DISPOSAL	NONE	NONE	NONE	NONE	0	0	0	0	0	0
2.18	38	371	332	60	scott	It provides an alternative , and in some cases what may well be an easier , means of establishing the facts necessary to bring the case within section 32 ( 1 ) ( b ) .	FRAMING	NONE	NONE	NONE	NONE	1	0	0	0	0	0
2.18	38	373	333	61	scott	Morritt LJ said , in a passage I have cited , that in general a person is assumed to know the legal consequences of his actions and that , therefore , if an act has been done intentionally , the actor 's unawareness of its legal consequences would be immaterial and no defence .	BACKGROUND	NONE	NONE	NONE	NONE	0	0	0	0	0	1
2.18	38	374	334	61	scott	The premise is , in my opinion , much too wide to constitute a satisfactory approach to construction of a statutory provision such as section 32 ( 2 ) .	FRAMING	NONE	NONE	NONE	NONE	1	0	0	0	0	0
2.18	38	375	335	61	scott	A person may or may not know that an act of his or an omission to do or say something or other constitutes a breach of tortious or contractual duty .	FRAMING	NONE	NONE	NONE	NONE	0	0	0	0	0	0
2.18	38	376	336	61	scott	His knowledge or lack of it may well be immaterial to the question whether a cause of action for which he is liable has accrued to the person injured by the act or omission .	FRAMING	NONE	NONE	NONE	NONE	0	0	0	0	0	0
2.18	38	377	337	61	scott	But that is no reason at all why Parliament , in prescribing the circumstances in which the person injured by the act or omission can escape from a Limitation Act defence , should not distinguish between the case where the actor knows he is committing a breach of duty and the case where he does not .	FRAMING	NONE	NONE	NONE	NONE	0	1	0	0	0	0
2.18	38	378	338	61	scott	"The clear words of section 32 ( 2 ) - "" deliberate commission of a breach of duty "" - show that Parliament has made that distinction ."	FRAMING	NONE	NONE	NONE	NONE	1	0	0	0	0	0
2.18	38	380	339	62	scott	It follows that , in my opinion , the construction of section 32 ( 2 ) adopted in Brocklesby was wrong .	DISPOSAL	16	NONE	NONE	NONE	1	0	0	0	0	0
2.18	38	381	340	62	scott	I wish to make clear that I do not think the case was wrongly decided .	DISPOSAL	NONE	NONE	NONE	NONE	0	0	0	0	0	0
2.18	38	382	341	62	scott	As I have already said , Morritt LJ 's alternative ground for reaching the same decision seems to me to have been sound .	DISPOSAL	NONE	NONE	NONE	NONE	0	0	0	0	0	1
2.18	38	384	342	63	scott	I do , however , think that the Goldberg case was wrongly decided .	FRAMING	NONE	NONE	NONE	NONE	0	0	0	0	0	0
2.18	38	385	343	63	scott	The Brocklesby disclaimer required , in my opinion , the conclusion that section 32 ( 2 ) could not apply and that the archdiocese 's claim inrespectof the 1989 advice was time-barred .	FRAMING	NONE	NONE	NONE	NONE	1	0	0	0	0	0
2.18	38	387	344	64	scott	There is one further point I want to make on the construction of section 32 ( 1 ) ( b ) and section 32 ( 2 ) .	TEXTUAL	NONE	NONE	NONE	NONE	1	0	0	0	0	0
2.18	38	388	345	64	scott	Mr Davidson QC , counsel for the appellants , submitted that some degree of unconscionability in the conduct of a defendant was necessary before the defendant could be deprived under section 32 ( 1 ) ( b ) , with or without the help of section 32 ( 2 ) , of a Limitation Act defence .	PROCEEDINGS	NONE	NONE	NONE	NONE	1	1	0	0	0	0
2.18	38	389	346	64	scott	"This was , I think , based mainly on Lord Browne-Wilkinson 's comment in Sheldon that "" unconscionable behaviour by deliberately concealing the facts relevant to the plaintiffs ' cause of action "" was "" the underlying rationale "" of section 32 ."	FRAMING	NONE	NONE	NONE	NONE	1	0	0	0	0	0
2.18	38	391	347	65	scott	I respectfully agree that it is difficult to think of a case of deliberate concealment for section 32 ( 1 ) ( b ) purposes that would not involve unconscionable behaviour and that most cases of deliberate commission of breach of duty for section 32 ( 2 ) purposes would be in the same state .	DISPOSAL	NONE	NONE	NONE	NONE	1	0	0	0	0	0
2.18	38	392	348	65	scott	But the statutory language does not require that the behaviour of the defendant be unconscionable and its addition as a criterion to be satisfied before a case can be brought within section 32 is , in my opinion , unnecessary and unjustified .	FRAMING	NONE	NONE	NONE	NONE	1	0	0	0	0	0
2.18	38	393	349	65	scott	"The plain words of the statutory requirements , "" deliberately concealed "" and "" deliberate commission of a breach of duty "" need no embellishment ."	FRAMING	NONE	NONE	NONE	NONE	0	0	0	0	0	0
2.18	38	394	350	65.5	scott	The authority of the Brocklesby decision	TEXTUAL	NONE	NONE	NONE	NONE	0	0	0	1	0	0
2.18	38	395	351	66	scott	Your Lordships have not heard any argument on the question whether the Court of Appeal in the present case was correct to hold itself bound by the Brocklesby decision and I do not wish to express any view on that issue .	FRAMING	3	NONE	NONE	NONE	0	0	1	0	0	0
2.18	38	396	352	66.5	scott	The result	TEXTUAL	NONE	NONE	NONE	NONE	0	0	0	0	0	0
2.18	38	397	353	67	scott	In the present case the Brocklesby disclaimer in paragraph 3 .	DISPOSAL	NONE	NONE	NONE	NONE	0	0	0	0	0	0
2.18	38	398	354	67	scott	A of the re-amended reply means that that paragraph of the reply cannot succeed .	DISPOSAL	NONE	NONE	NONE	NONE	0	0	0	0	0	0
2.18	38	399	355	67	scott	Mr Cave still has , however , his paragraph 3 point and , under a conditional compromise agreed between the parties after the Court of Appeal judgments but before the hearing in this House , Mr Cave is entitled to recover an agreed sum from the respondent solicitors , albeit less than the agreed sum he would have been entitled to recover had your Lordships upheld the Brocklesby construction .	DISPOSAL	NONE	NONE	NONE	NONE	0	0	1	1	0	0
2.18	38	400	356	67.5	scott	68 .	TEXTUAL	NONE	NONE	NONE	NONE	0	0	0	0	0	0
2.18	38	401	357	67.5	scott	I would allow the appeal accordingly .	DISPOSAL	NONE	NONE	3	NONE	0	0	0	0	0	0
2.18	38	N/A	N/A	67.5	scott	Prepared	<prep-date>	NONE	NONE	NONE	NONE	0	0	0	0	0	0
2.18	38	N/A	N/A	67.5	scott	24	<prep-date>	NONE	NONE	NONE	NONE	0	0	0	0	0	0
2.18	38	N/A	N/A	67.5	scott	April	<prep-date>	NONE	NONE	NONE	NONE	0	0	0	0	0	0
2.18	38	N/A	N/A	67.5	scott	2002	<prep-date>	NONE	NONE	NONE	NONE	0	0	0	0	0	0
