3.15	68	195	223	18	bingham	It is no doubt true that the dependence of modern warfare on sophisticated weaponry and technological skill has lessened the need for mass armies and so diminished the dependence of some states on conscription .	FRAMING	NONE	NONE	NONE	NONE	0	0	0	0	0	0
3.15	68	196	224	18	bingham	Thus in Europe several states currently have no conscription , and of those that do the great majority recognise a right of conscientious objection .	NONE	NONE	NONE	NONE	NONE	0	0	0	0	0	0
3.15	68	197	225	18	bingham	But figures based on a 1998 report by War Registers International show a somewhat different picture world-wide .	FRAMING	NONE	NONE	NONE	NONE	0	0	0	0	0	0
3.15	68	198	226	18	bingham	Of 180 states surveyed , some form of conscription was found to exist in 95 .	FRAMING	NONE	NONE	NONE	NONE	0	0	0	0	0	0
3.15	68	199	227	18	bingham	In 52 of those 95 states the right of conscientious objection was found not to be recognised at all .	FRAMING	NONE	NONE	NONE	NONE	0	0	0	0	0	0
3.15	68	200	228	18	bingham	In a further 7 of those 95 states there was no known provision governing a right of conscientious objection .	FRAMING	NONE	NONE	NONE	NONE	0	0	0	0	0	0
3.15	68	201	229	18	bingham	In the remaining 36 states the right of conscientious objection appeared to be recognised to some extent .	FRAMING	NONE	NONE	NONE	NONE	0	0	0	0	0	0
3.15	68	202	230	18	bingham	It could not , currently , be said that there is de facto observance of anything approaching a uniform rule .	FRAMING	15	NONE	NONE	NONE	0	0	0	0	0	0
3.15	68	204	231	19	bingham	In the course of his judgment , in paragraphs 23 - 24 , Laws LJ quoted the works of two respected authorities on refugee law , Professor Hathaway , The Law of Refugee Status , ( 1991 ) and Professor Goodwin-Gill , The Refugee in International Law , 2nd ed ( 1996 ) .	PROCEEDINGS	NONE	NONE	NONE	NONE	0	0	0	0	0	1
3.15	68	205	232	19	bingham	It is unnecessary to repeat his citations , also relied on before the House .	TEXTUAL	NONE	NONE	NONE	NONE	0	0	0	0	0	0
3.15	68	206	233	19	bingham	"It is however noteworthy that Professor Hathaway , at p 182 , describes the right to conscientious objection as "" an emerging part of international human rights law "" and Professor Goodwin-Gill observes , at p 55 , that "" The international community nevertheless appears to be moving towards acceptance of a right of conscientious objection . . . "" ."	BACKGROUND	NONE	NONE	NONE	NONE	0	0	0	0	0	0
3.15	68	207	234	19	bingham	Both , in short , discern movement towards recognition of a right , but neither suggests it has yet been achieved .	FRAMING	15	NONE	NONE	NONE	0	0	0	0	0	0
3.15	68	208	235	19	bingham	In a report prepared for the appeal of the first applicant , it is true , Professor Goodwin-Gill went a little further ( see the judgment of Laws LJ , paragraph 25 ) ; but even then he suggests what states ought to do , and suggests that recognition of a right of conscientious objection ought to derive from the protection given to freedom of conscience by customary international law and universal human rights treaties .	FRAMING	NONE	NONE	NONE	NONE	0	0	0	0	0	1
3.15	68	209	236	19	bingham	The problem , to my mind , is that the treaties have treated compulsory military service as an exception from the forced labour prohibition without making any other provision , and I do not think there is , as yet , a new consensus .	FRAMING	18	NONE	NONE	NONE	0	0	0	0	0	0
3.15	68	211	237	20	bingham	On the main issue to which this opinion has so far been addressed , the Court of Appeal was divided .	PROCEEDINGS	NONE	NONE	NONE	NONE	0	0	1	0	0	0
3.15	68	212	238	20	bingham	Of absolute conscientious objectors Laws LJ concluded , in paragraph 79 :	PROCEEDINGS	NONE	NONE	NONE	NONE	0	0	0	0	0	1
3.15	68	212	239	20.5	bingham	""" In the result , I would hold that there is no material to establish a presently extant legal rule or principle which vouchsafes a right of absolute conscientious objection , such that where it is not respected , a good case to refugee status under the Convention may arise ."	PROCEEDINGS	NONE	NONE	NONE	NONE	0	1	0	0	0	0
3.15	68	213	240	20.5	bingham	"No such putative rule or principle is to be found in the Convention 's international autonomous meaning or common standard . """	PROCEEDINGS	NONE	NONE	NONE	NONE	0	1	0	0	0	0
3.15	68	214	241	20.5	bingham	Turning to partial conscientious objectors , in paragraph 84 , he reached a similar conclusion :	PROCEEDINGS	NONE	NONE	NONE	NONE	0	0	0	0	0	0
3.15	68	214	242	20.5	bingham	""" It is plain , however , that no matter how clear the political basis for a partial objection may be , there is in such a case no more of an international underpinning , by treaty or customary law , to quicken the objector 's claim into a legal right than in the case of the absolute objector ."	PROCEEDINGS	NONE	NONE	NONE	NONE	0	0	0	0	0	0
3.15	68	215	243	20.5	bingham	"In my judgment , therefore , such a claim is stillborn for all the reasons I have already given . """	PROCEEDINGS	NONE	NONE	NONE	NONE	0	0	0	0	0	0
3.15	68	216	244	20.5	bingham	Jonathan Parker LJ , in paragraph 100 , shared his view .	PROCEEDINGS	NONE	NONE	NONE	NONE	0	0	0	0	0	1
3.15	68	217	245	20.5	bingham	Waller LJ took a view more favourable in principle to the applicants .	PROCEEDINGS	NONE	NONE	NONE	NONE	0	0	0	0	0	1
3.15	68	218	246	20.5	bingham	Of absolute objectors he said , in paragraph 201 :	PROCEEDINGS	NONE	NONE	NONE	NONE	0	0	0	0	0	0
3.15	68	218	247	20.5	bingham	""" Thus if someone can show that he / she is a genuine conscientious objector , that he / she is to be conscripted into a military in a state that simply does not recognise the possibility of such conscientious belief , and that he / she will be prosecuted as a result , in my view he / she will have established a well founded fear of persecution for a Convention reason ."	PROCEEDINGS	NONE	NONE	NONE	NONE	0	1	0	0	0	0
3.15	68	219	248	20.5	bingham	"That however does not dispose of the appeals before us . """	PROCEEDINGS	NONE	NONE	NONE	NONE	0	0	0	0	0	0
3.15	68	220	249	20.5	bingham	His opinion , at paragraph 208 , in the case of partial objectors was similar :	PROCEEDINGS	NONE	NONE	NONE	NONE	0	0	0	0	0	0
3.15	68	220	250	20.5	bingham	""" In my view thus a partial objector may be able to show a deep-seated conscientious reason why he / she should not be conscripted by reference to the fact that he / she will be required to take part in a war against his / her own ethnic community , and may show an infringement of article 9 ( 1 ) , but it takes more than mere disagreement with a policy that allows Kurds to be conscripted to fight Kurds to establish that position . """	PROCEEDINGS	NONE	NONE	NONE	NONE	1	0	0	0	0	0
3.15	68	221	251	20.5	bingham	Thus although there was agreement on the outcome , there was disagreement on the intervening steps .	PROCEEDINGS	NONE	NONE	NONE	NONE	0	0	0	0	0	0
3.15	68	222	252	20.5	bingham	Despite my genuine respect for the care and thoroughness with which Waller LJ has put forward his conclusions , and with a measure of reluctance since they may well reflect the international consensus of tomorrow , I feel compelled to accept the view of the Court of Appeal majority on the state of the law today as revealed by the abundant materials before us .	DISPOSAL	NONE	NONE	NONE	NONE	0	0	1	0	0	1
3.15	68	223	253	20.5	bingham	That conclusion is fatal to the success of these appeals , which I would accordingly dismiss .	DISPOSAL	2	NONE	3	NONE	0	0	0	0	0	0
3.15	68	225	254	21	bingham	This conclusion makes it strictly unnecessary to determine a further issue raised by the respondent Secretary of State , but since the House heard full argument and the issue is one of great practical importance I think it desirable to express an opinion .	FRAMING	NONE	NONE	NONE	NONE	0	0	0	0	0	0
3.15	68	226	255	21	bingham	"It was argued that , in deciding whether an asylum applicant had been or would be persecuted for Convention reasons , "" the examination of the circumstances should be approached from the perspective of the persecutor , since that is the perspective that is determinative in inciting the persecution : Ward v Attorney General of Canada [ 1993 ] 2 SCR 689 , 747 . """	PROCEEDINGS	19	NONE	NONE	NONE	0	1	0	1	1	0
3.15	68	227	256	21	bingham	"Support for this approach is found in Immigration and Naturalization Service v Elias-Zacarias ( 1992 ) 502 US 478 , a decision very strongly criticised by Professor Hathaway ( "" The Causal Nexus in International Refugee Law "" ( 2002 ) 23 Michigan Journal of International Law 207 ) ."	PROCEEDINGS	NONE	NONE	NONE	NONE	0	0	0	1	1	0
3.15	68	228	257	21	bingham	The Court of Appeal unanimously rejected this argument ( paragraphs 92 , 154 and 182 ) and some of the authorities point towards a more objective approach : Chen Shi Hai v Minister for Immigration and Multicultural Affairs ( 2000 ) 201 CLR 293 , 304 , 313 , paras 33 and 65 ; Refugee Appeal No 72635/01 of the New Zealand Refugee Status Appeals Authority , ( unreported ) 6 September 2002 , paragraphs 167 - 173 .	PROCEEDINGS	NONE	NONE	NONE	NONE	0	1	1	1	1	0
3.15	68	230	258	22	bingham	I would express the test somewhat differently from the Court of Appeal in this case .	TEXTUAL	NONE	NONE	NONE	NONE	0	0	1	0	0	0
3.15	68	231	259	22	bingham	In his judgment in Sivakumar v Secretary of State for the Home Department [ 2001 ] EWCA Civ 1196 ; [ 2002 ] INLR 310 , 317 , para 23 , Dyson LJ stated :	BACKGROUND	20	NONE	NONE	NONE	0	0	0	1	1	1
3.15	68	231	260	22.5	bingham	""" It is necessary for the person who is considering the claim for asylum to assess carefully the real reason for the persecution . """	BACKGROUND	20	NONE	NONE	NONE	0	0	0	0	0	0
3.15	68	232	261	22.5	bingham	This seems to me to be a clear , simple and workmanlike test which gives effect to the 1951 Convention provided that it is understood that the reason is the reason which operates in the mind of the persecutor and not the reason which the victim believes to be the reason for the persecution , and that there may be more than one real reason .	FRAMING	20	NONE	NONE	NONE	0	1	0	0	0	0
3.15	68	233	262	22.5	bingham	The application of the test calls for the exercise of an objective judgment .	FRAMING	NONE	NONE	NONE	NONE	0	0	0	0	0	0
3.15	68	234	263	22.5	bingham	Decision-makers are not concerned ( subject to a qualification mentioned below ) to explore the motives or purposes of those who have committed or may commit acts of persecution , nor the belief of the victim as to those motives or purposes .	FRAMING	NONE	NONE	NONE	NONE	0	0	0	0	0	0
3.15	68	235	264	22.5	bingham	Having made the best assessment possible of all the facts and circumstances , they must label or categorise the reason for the persecution .	FRAMING	NONE	NONE	NONE	NONE	0	0	0	0	0	0
3.15	68	236	265	22.5	bingham	The qualification mentioned is that where the reason for the persecution is or may be the imputation by the persecutors of a particular belief or opinion ( or , for that matter , the attribution of a racial origin or nationality or membership of a particular social group ) one is concerned not with the correctness of the matter imputed or attributed but with the belief of the persecutor : the real reason for the persecution of a victim may be the persecutor 's belief that he holds extreme political opinions or adheres to a particular faith even if in truth the victim does not hold those opinions or belong to that faith .	FRAMING	NONE	NONE	NONE	NONE	0	0	0	0	0	0
3.15	68	237	266	22.5	bingham	I take this approach to reflect that put forward by McHugh J in Minister for Immigration and Multicultural Affairs v Ibrahim [ 2000 ] HCA 55 at paragraph 102 :	FRAMING	NONE	NONE	NONE	NONE	0	0	0	1	1	1
3.15	68	237	267	22.5	bingham	""" In this case , among the questions which the tribunal should have asked were ( a ) what harm does the applicant fear on his return to Somalia ?"	BACKGROUND	NONE	NONE	NONE	NONE	0	0	0	0	0	0
3.15	68	238	268	22.5	bingham	( b ) is that fear well-founded ?	BACKGROUND	NONE	NONE	NONE	NONE	0	0	0	0	0	0
3.15	68	239	269	22.5	bingham	( c ) why will the applicant be subjected to that harm ?	BACKGROUND	NONE	NONE	NONE	NONE	0	0	0	0	0	0
3.15	68	240	270	22.5	bingham	"and ( d ) if the answer to ( c ) is ' because of his membership of a particular social group ' , would the harm constitute persecution for the purpose of the Convention ? """	BACKGROUND	NONE	NONE	NONE	NONE	0	1	0	0	0	0
3.15	68	241	271	22.5	bingham	Treatment is not persecutory if it is treatment meted out to all and is not discriminatory : Applicant A v Minister for Immigration and Ethnic Affairs ( 1997 ) 190 CLR 225 , 258 , per McHugh J. .	BACKGROUND	NONE	NONE	NONE	NONE	0	0	0	1	1	1
3.15	68	242	272	22.5	bingham	The question held to be appropriate in the field of racial discrimination in Qureshi v Victoria University of Manchester [ 2001 ] ICR 863 at 874 , suitably adapted to the particular case , is in my view apt in this context also :	FRAMING	NONE	NONE	NONE	NONE	0	0	0	1	1	0
3.15	68	242	273	22.5	bingham	""" Were racial grounds an effective cause of the difference in treatment ? """	BACKGROUND	NONE	NONE	NONE	NONE	0	0	0	0	0	0
3.15	68	244	274	23	bingham	However difficult the application of the test to the facts of particular cases , I do not think that the test to be applied should itself be problematical .	FRAMING	NONE	NONE	NONE	NONE	0	0	0	0	0	0
3.15	68	245	275	23	bingham	The decision-maker will begin by considering the reason in the mind of the persecutor for inflicting the persecutory treatment .	FRAMING	NONE	NONE	NONE	NONE	0	0	0	0	0	0
3.15	68	246	276	23	bingham	That reason would , in this case , be the applicants ' refusal to serve in the army .	FRAMING	NONE	NONE	NONE	NONE	0	0	0	0	0	0
3.15	68	247	277	23	bingham	But the decision-maker does not stop there .	FRAMING	NONE	NONE	NONE	NONE	0	0	0	0	0	0
3.15	68	248	278	23	bingham	He asks if that is the real reason , or whether there is some other effective reason .	FRAMING	NONE	NONE	NONE	NONE	0	0	0	0	0	0
3.15	68	249	279	23	bingham	The victims ' belief that the treatment is inflicted because of their political opinions is beside the point unless the decision-maker concludes that the holding of such opinions was the , or a , real reason for the persecutory treatment .	FRAMING	NONE	NONE	NONE	NONE	0	0	0	0	0	0
3.15	68	250	280	23	bingham	On the facts here , that would not be a tenable view , since it is clear that anyone refusing to serve would be treated in the same way , whatever his personal grounds for refusing .	DISPOSAL	NONE	NONE	NONE	NONE	0	0	0	0	0	0
3.15	68	252	281	23.5	steyn	LORD STEYN	TEXTUAL	NONE	NONE	NONE	NONE	0	0	0	0	0	1
3.15	68	253	282	23.5	steyn	My Lords ,	TEXTUAL	NONE	NONE	NONE	NONE	0	0	0	0	0	0
3.15	68	255	283	24	steyn	I have had the privilege of reading the opinion of Lord Bingham of Cornhill .	TEXTUAL	NONE	NONE	NONE	bingham	0	0	0	0	0	1
3.15	68	256	284	24	steyn	I am in complete agreement with it .	DISPOSAL	22	bingham	NONE	NONE	0	0	0	0	0	0
3.15	68	257	285	24	steyn	For the reasons he has given I would also dismiss the appeals .	DISPOSAL	2	NONE	3	NONE	0	0	0	0	0	0
3.15	68	259	286	24.5	hoffmann	LORD HOFFMANN	TEXTUAL	NONE	NONE	NONE	NONE	0	0	0	0	0	1
3.15	68	260	287	24.5	hoffmann	My Lords ,	TEXTUAL	NONE	NONE	NONE	NONE	0	0	0	0	0	0
3.15	68	262	288	25	hoffmann	The applicants are Kurdish Turks who came to this country at the ages of 19 and 18 respectively .	FACT	NONE	NONE	NONE	NONE	0	0	0	0	0	0
3.15	68	263	289	25	hoffmann	They were shortly to become liable under Turkish law to military service .	FACT	NONE	NONE	NONE	NONE	0	0	0	0	0	0
3.15	68	264	290	25	hoffmann	On arrival in the United Kingdom they claimed asylum on various grounds , of which the only one now relied upon is a fear that if returned to Turkey they would be prosecuted for refusing to enlist .	PROCEEDINGS	NONE	NONE	NONE	NONE	0	0	0	0	0	0
3.15	68	265	291	25	hoffmann	They claim that their refusal was on the ground of their deeply held political objections to the policies of the then Turkish government towards the Kurdish minority .	PROCEEDINGS	NONE	NONE	NONE	NONE	0	0	0	0	0	0
3.15	68	266	292	25	hoffmann	"This , they say , was sufficient to entitle them to asylum because punishment for refusing military service on such grounds would be persecution for reasons of their political opinions within the meaning of the Convention relating to the Status of Refugees ( "" the Refugee Convention "" ) ."	PROCEEDINGS	NONE	NONE	NONE	NONE	0	1	0	0	0	0
3.15	68	268	293	26	hoffmann	I emphasise that the case is put simply on the basis that they would be liable to punishment for refusing to perform military service .	FRAMING	NONE	NONE	NONE	NONE	0	0	0	0	0	0
3.15	68	269	294	26	hoffmann	This is because of two important findings of fact by the special adjudicator which are now not challenged and which form part of the agreed statement of facts .	PROCEEDINGS	NONE	NONE	NONE	NONE	0	0	0	0	0	0
3.15	68	270	295	26	hoffmann	The first is that the penalty for draft evasion ( a prison sentence of 6 months to 3 years ) is not disproportionate or excessive .	PROCEEDINGS	NONE	NONE	NONE	NONE	0	0	0	0	0	0
3.15	68	271	296	26	hoffmann	The second is that there is no reasonable likelihood that the applicants would have been required to engage in military action contrary to basic rules of human conduct , whether against Kurds or anyone else .	PROCEEDINGS	NONE	NONE	NONE	NONE	0	0	0	0	0	0
3.15	68	273	297	27	hoffmann	The Secretary of State says that in these circumstances there is nothing wrong or unusual in Turkey having compulsory military service and suitable penalties for disobedience .	PROCEEDINGS	NONE	NONE	NONE	NONE	0	0	0	0	0	0
3.15	68	274	298	27	hoffmann	If the applicants refuse to serve , the state is entitled to punish them , not for their political opinions but for failing to enlist .	PROCEEDINGS	NONE	NONE	NONE	NONE	0	0	0	0	0	0
3.15	68	275	299	27	hoffmann	Their political opinions may be the reason why they refuse to serve but they are not the reason why they will be punished .	PROCEEDINGS	NONE	NONE	NONE	NONE	0	0	0	0	0	0
3.15	68	276	300	27	hoffmann	They are free to hold whatever opinions they please about Turkish policy towards the Kurds as long as they report for duty .	PROCEEDINGS	NONE	NONE	NONE	NONE	0	0	0	0	0	0
3.15	68	277	301	27	hoffmann	Putting the same point in a different way , imposing a punishment for failing to comply with a universal obligation of this kind is not persecution .	PROCEEDINGS	NONE	NONE	NONE	NONE	0	0	0	0	0	0
3.15	68	279	302	28	hoffmann	Mr Nicol QC , who appeared for the applicants , says that it is not so simple .	PROCEEDINGS	NONE	NONE	NONE	NONE	0	0	0	0	0	0
3.15	68	280	303	28	hoffmann	Treating some group of people in the same way as everyone else may be persecuting them if their group has a right to be treated differently .	PROCEEDINGS	NONE	NONE	NONE	NONE	0	0	0	0	0	0
3.15	68	281	304	28	hoffmann	For example , in Thlimmenos v Greece ( 2000 ) 31 EHRR 411 the appellant was refused appointment as a chartered accountant pursuant to a general law which disqualified anyone who had been convicted of felony .	BACKGROUND	NONE	NONE	NONE	NONE	0	0	0	1	1	0
3.15	68	282	305	28	hoffmann	The applicant 's felony had been a refusal to do military service on the ground of his religious convictions as a Jehovah 's Witness .	BACKGROUND	NONE	NONE	NONE	NONE	0	0	0	0	0	1
3.15	68	283	306	28	hoffmann	"The European Court of Human Rights held , at p 424 , that the disqualification infringed the anti-discrimination provisions of article 14 of the European Convention on Human Rights ( "" ECHR "" ) because it failed to treat his felony , committed because of his religious principles , differently from ordinary felonies :"	BACKGROUND	NONE	NONE	NONE	NONE	1	1	1	0	0	0
3.15	68	283	307	28.5	hoffmann	""" The right not to be discriminated against in the enjoyment of the rights guaranteed under the Convention is also violated when states without an objective and reasonable justification fail to treat differently persons whose situations are significantly different . """	BACKGROUND	NONE	NONE	NONE	NONE	0	1	0	0	0	0
3.15	68	285	308	29	hoffmann	The right guaranteed under the Convention inrespectof which there had been discrimination was the freedom of religion guaranteed by article 9 .	BACKGROUND	NONE	NONE	NONE	NONE	1	1	0	0	0	0
3.15	68	286	309	29	hoffmann	The court found that failure to treat the applicant differently had no objective justification .	BACKGROUND	NONE	NONE	NONE	NONE	0	0	0	0	0	0
3.15	68	287	310	29	hoffmann	The conviction had no relevance to his suitability as an accountant and he had already been punished by a prison sentence for his refusal to do military service .	BACKGROUND	NONE	NONE	NONE	NONE	0	0	0	0	0	0
3.15	68	288	311	29.5	hoffmann	30 .	TEXTUAL	NONE	NONE	NONE	NONE	0	0	0	0	0	0
3.15	68	289	312	29.5	hoffmann	Thlimmenos 's case therefore supports the proposition that , at any rate for the purposes of article 14 , a law of general application may have a discriminatory effect if it contains no exceptions for people who have a right to be treated differently .	FRAMING	NONE	NONE	NONE	NONE	1	0	0	0	0	1
3.15	68	290	313	29.5	hoffmann	But I note in passing that the court , while holding that Thlimmenos had a right to be treated differently inrespectof qualification as an accountant , expressed no view on the point which arises in this case , namely whether he would have had a right to be treated differently inrespectof his obligation to perform military service .	FRAMING	NONE	NONE	NONE	NONE	0	0	0	0	0	0
3.15	68	291	314	29.5	hoffmann	That would have required an altogether different assessment of objective justification .	FRAMING	NONE	NONE	NONE	NONE	0	0	0	0	0	0
3.15	68	293	315	31	hoffmann	I shall consider later whether this principle of discrimination by failing to treat different cases differently can be fitted into the language of the Refugee Convention .	FRAMING	NONE	NONE	NONE	NONE	0	1	0	0	0	0
3.15	68	294	316	31	hoffmann	Accepting for the moment that it can , I pass on to the next stage in Mr Nicol 's argument , which is to show that it applies to laws imposing a general obligation to do military service .	PROCEEDINGS	NONE	NONE	NONE	NONE	0	0	0	0	0	1
3.15	68	295	317	31	hoffmann	The question here is whether people who object to such service on conscientious religious or political grounds have a human right to be excused .	FRAMING	NONE	NONE	NONE	NONE	0	0	0	0	0	0
3.15	68	297	318	32	hoffmann	Mr Nicol accepts that ordinarily a conscientious religious or political objection is not a reason for being entitled to treat oneself as absolved from the laws of the state .	PROCEEDINGS	NONE	NONE	NONE	NONE	0	0	0	0	0	0
3.15	68	298	319	32	hoffmann	In many Western countries , including the United Kingdom , civil disobedience is an honourable tradition which goes back to Antigone .	FRAMING	NONE	NONE	NONE	NONE	0	0	0	0	0	0
3.15	68	299	320	32	hoffmann	It may be vindicated by history - think of the suffragettes - but often what makes it honourable and demonstrates the strength of conviction is willingness to accept the punishment .	FRAMING	NONE	NONE	NONE	NONE	0	0	0	0	0	0
3.15	68	300	321	32	hoffmann	( That is not to agree with Socrates that it would necessarily be dishonourable to try to avoid punishment ) .	FRAMING	NONE	NONE	NONE	NONE	0	0	0	0	0	0
3.15	68	301	322	32	hoffmann	The standard moral position is summarised by Ronald Dworkin in Taking Rights Seriously ( 1977 ) , at pp 186 - 187 :	BACKGROUND	NONE	NONE	NONE	NONE	0	0	0	1	0	0
3.15	68	301	323	32.5	hoffmann	""" In a democracy , or at least a democracy that in principle respects individual rights , each citizen has a general moral duty to obey all the laws , even though he would like some of them changed ."	BACKGROUND	NONE	NONE	NONE	NONE	0	0	0	0	0	0
3.15	68	302	324	32.5	hoffmann	He owes that duty to his fellow citizens , who obey laws that they do not like , to his benefit .	BACKGROUND	NONE	NONE	NONE	NONE	0	0	0	0	0	0
3.15	68	303	325	32.5	hoffmann	But this general duty cannot be an absolute duty , because even a society that is in principle just may produce unjust laws and policies , and a man has duties other than his duties to the state .	BACKGROUND	NONE	NONE	NONE	NONE	0	0	0	0	0	0
3.15	68	304	326	32.5	hoffmann	A man must honour his duties to his God and to his conscience , and if these conflict with his duty to the state , then he is entitled , in the end , to do what he judges to be right .	BACKGROUND	NONE	NONE	NONE	NONE	0	0	0	0	0	0
3.15	68	305	327	32.5	hoffmann	"If he decides that he must break the law , however , then he must submit to the judgment and punishment that the state imposes , in recognition of the fact that his duty to his fellow citizens was overwhelmed but not extinguished by his religious or moral obligations . """	BACKGROUND	NONE	NONE	NONE	NONE	0	0	0	0	0	0
3.15	68	307	328	33	hoffmann	This suggests that while the demonstrator or objector cannot be morally condemned , and may indeed be praised , for following the dictates of his conscience , it is not necessarily unjust for the state to punish him in the same way as any other person who breaks the law .	FRAMING	NONE	NONE	NONE	NONE	0	0	0	0	0	0
3.15	68	308	329	33	hoffmann	It will of course be different if the law itself is unjust .	FRAMING	NONE	NONE	NONE	NONE	0	0	0	0	0	0
3.15	68	309	330	33	hoffmann	The injustice of the law will carry over into its enforcement .	FRAMING	NONE	NONE	NONE	NONE	0	0	0	0	0	0
3.15	68	310	331	33	hoffmann	But if the law is not otherwise unjust , as conscription is accepted in principle to be , then it does not follow that because his objection is conscientious , the state is not entitled to punish him .	FRAMING	NONE	NONE	NONE	NONE	0	0	0	0	0	0
3.15	68	311	332	33	hoffmann	He has his reasons and the state , in the interests of its citizens generally , has different reasons .	FRAMING	NONE	NONE	NONE	NONE	0	0	0	0	0	0
3.15	68	312	333	33	hoffmann	Both might be right .	FRAMING	NONE	NONE	NONE	NONE	0	0	0	0	0	0
