257	120	Finally , ` mental disorder ' and three out of the four specific forms of mental disorder which may be relevant under the Act are defined in section 1 -LRB- 2 -RRB- : `` In this Act - ` Mental disorder ' means mental illness , arrested or incomplete development of mind , psychopathic disorder and any other disorder or disability of mind ; ` severe mental impairment ' means a state of arrested or incomplete development of mind which includes severe impairment of intelligence and social functioning and is associated with abnormally aggressive or seriously irresponsible conduct on the part of the person concerned ... ; ` mental impairment ' means a state of arrested or incomplete development of mind -LRB- not amounting to severe mental impairment -RRB- which includes significant impairment of intelligence and social functioning and is associated with abnormally aggressive or seriously irresponsible conduct on the part of the person concerned ... ; ` psychopathic disorder ' means a persistent disorder or disability of mind -LRB- whether or not including significant impairment of intelligence -RRB- which results in abnormally aggressive or seriously irresponsible conduct on the part of the person concerned ; ... '' Psychopathic disorder is usually seen as a particular type of personality disorder , defined in legal terms rather than by reference to any particular diagnostic category : it ` lacks an unambiguous clinical referent ' -LRB- Blackburn , Logan , Donnelly , and Renwick , `` Personality disorders , psychopathy and other mental disorders : co-morbidity among patients at English and Scottish high security hospitals '' -LRB- 2003 -RRB- 14 J Forensic Psych and Psychol 111 , 112 -RRB- . 	NAN	NAN	NAN	0.5	lady hale
257	121	Disorders of the personality are in theory distinguished from illnesses which overlay the patient 's underlying personality , but in practice the distinction may be hard to draw . 	NAN	NAN	NAN	0.5	lady hale
257	122	The issue 21 . 	NAN	NAN	NAN	0.5	lady hale
257	123	All psychiatric patients , but particularly those who are detained in high security conditions for long periods of time , are in a vulnerable situation . 	NAN	NAN	NAN	0.5	lady hale
257	124	However well meaning and professional their carers , they do risk being obliged to accept treatment which is inappropriate to their particular needs . 	NAN	NAN	NAN	0.5	lady hale
257	125	But they are already protected by the ordinary law of medical negligence , by the special safeguards in sections 57 and 58 against particularly intrusive or long term treatments , and by the remedies against any treatment decision which breaches their rights under articles 3 or 8 of the European Convention on Human Rights , either under section 7 of the Human Rights Act 1998 or in judicial review : see R -LRB- Wilkinson -RRB- v Broadmoor Special Hospital Authority -LSB- 2001 -RSB- EWCA Civ 1545 ; -LSB- 2002 -RSB- 1 WLR 419 . 	NAN	NAN	NAN	0.5	lady hale
257	126	The issue for us is whether , additionally , the only treatment which they may be given without their consent under section 63 is treatment for the particular form or forms of mental disorder from which they are recorded as suffering in the application , order or direction under which they are detained . 	NAN	NAN	NAN	0.5	lady hale
257	127	22 . 	NAN	NAN	NAN	0.5	lady hale
257	128	There are a great many reasons for thinking that section 63 is not so limited . 	NAN	NAN	NAN	0.5	lady hale
257	129	The first is the plain meaning of the words used . 	NAN	NAN	NAN	0.5	lady hale
257	130	The patient 's consent is not required for ` any medical treatment ' given to him for ` the mental disorder from which he is suffering ' . 	NAN	NAN	NAN	0.5	lady hale
257	131	The Act 's definition of ` mental disorder ' encompasses , not only each of the four specific forms of disorder which may be relevant under the Act , but the broader concepts of ` arrested or incomplete development of mind ' and ` any other disorder or disability of mind ' . 	NAN	NAN	NAN	0.5	lady hale
257	132	Thus , the natural and ordinary meaning of the words is that the patient may be treated without consent for any mental disorder from which he is suffering , and any treatment ancillary to that ; but treatment for any physical disorder can only be given with his consent or under the doctrine of necessity as it applies to patients who lack the capacity to consent : see B v Croydon Health Authority -LSB- 1995 -RSB- Fam 133 , CA. 23 . 	NAN	NAN	NAN	0.5	lady hale
257	133	Secondly , where it is important to be clear which of the four specific types of disorder the patient is suffering from , the Act uses the words ` form of ' disorder . 	NAN	NAN	NAN	0.5	lady hale
257	134	We see this in the reclassification powers in section 16 -LRB- 1 -RRB- and 72 -LRB- 5 -RRB- -LRB- paras 17 and 19 above -RRB- . 	NAN	NAN	NAN	0.6	lady hale
257	135	We also see it in the provisions requiring that both doctors signing the medical recommendations upon which an application for admission under section 3 is based , or the reports upon which a hospital order or transfer direction is based , agree that he is suffering from the same ` form of ' disorder , even if either of them also describes him as suffering from another form : see sections 11 -LRB- 6 -RRB- , 37 -LRB- 7 -RRB- and 47 -LRB- 4 -RRB- . 	NAN	NAN	NAN	0.6	lady hale
257	136	If it had been intended to limit section 63 to treatment for the specific form of mental disorder under which the patient was detained , then the section would have read ` for the form of mental disorder from which he is suffering ' . 	NAN	NAN	NAN	0.6	lady hale
257	137	24 . 	NAN	NAN	NAN	0.6	lady hale
257	138	Thirdly , section 63 applies to large numbers of compulsory patients who are not classified as suffering from one of those four forms of disorder at all . 	NAN	NAN	NAN	0.6	lady hale
257	139	Most compulsory patients are admitted for assessment under section 2 of the Act . 	NAN	NAN	NAN	0.6	lady hale
257	140	A small number are admitted under the Criminal Procedure -LRB- Insanity -RRB- Act 1964 or section 46 of the 1983 Act . 	NAN	NAN	NAN	0.6	lady hale
257	141	In all these cases , section 63 must refer to any mental disorder from which the patient is suffering . 	NAN	NAN	NAN	0.6	lady hale
257	142	It would be surprising if the same words had a different meaning when the patient is detained under these provisions from the meaning it has when he is detained under the others . 	NAN	NAN	NAN	0.6	lady hale
257	143	25 . 	NAN	NAN	NAN	0.6	lady hale
257	144	Fourthly , the statutory history of these provisions indicates that classification and reclassification relate to the criteria for admission and continued liability to detention rather than to the treatment which may be given while in hospital . 	NAN	NAN	NAN	0.6	lady hale
257	145	The Mental Health Act 1983 consolidated the Mental Health Act 1959 with later amendments mainly made by the Mental Health -LRB- Amendment -RRB- Act 1982 . 	NAN	NAN	NAN	0.6	lady hale
257	146	Both drew a clear distinction between the short term powers , which might be used for any kind of mental disorder , and the longer term powers , which could only be used for the more specific forms of disorder listed . 	NAN	NAN	NAN	0.6	lady hale
257	147	Both also distinguished between the ` major ' or more serious forms of disorder , namely mental illness and -LRB- under the 1959 Act -RRB- severe subnormality or -LRB- under the 1983 Act -RRB- severe mental impairment , and the lesser forms of disorder , namely psychopathic disorder and subnormality or mental impairment . 	NAN	NAN	NAN	0.6	lady hale
257	148	Under the 1959 Act , a patient with one of those lesser forms of disorder could not be admitted for treatment over the age of 21 , and had to be discharged no later than the age of 25 , unless he was dangerous to himself or others ; but he could be made subject to a hospital order or direction at any age if he had committed a criminal offence . 	NAN	NAN	NAN	0.6	lady hale
257	149	The Percy Commission -LRB- Report of the Royal Commission on the Law Relating to Mental Illness and Mental Deficiency 1954-1957 , 1957 , Cmnd 169 -RRB- was against the use of compulsory mental health powers to protect others from anti-social behaviour -LRB- para 348 -RRB- ; they thought that there was a case for compulsory training and treatment in adolescence and early adult life -LRB- para 354 -RRB- ; but ` we do not consider that there is sufficient justification for special compulsory powers in relation to adult psychopathic patients except where their conduct is anti-social to the extent of constituting an offence against the criminal law ' -LRB- para 356 -RRB- . 	NAN	NAN	NAN	0.6	lady hale
257	150	Hence for civil patients , it mattered a great deal whether the classification was ` severe subnormality ' or just ` subnormality ' or whether it was ` mental illness ' or ` psychopathic disorder ' : see W v L -LSB- 1974 -RSB- QB 711 , CA . 	NAN	NAN	NAN	0.6	lady hale
257	151	Thus provision was made for reclassification either by the RMO -LRB- 1959 Act , section 38 -RRB- or by an MHRT -LRB- 1959 Act , section 123 -LRB- 3 -RRB- -RRB- in very similar terms to that now contained in the 1983 Act . 	NAN	NAN	NAN	0.6	lady hale
257	152	It could not at that stage , however , have been thought that classification or reclassification had anything to do with what medical treatment might be given in hospital , because , surprising as it might seem , there was nothing in the 1959 Act dealing with what , if any , medical treatment might be given to the various kinds of patients detained under its provisions . 	NAN	NAN	NAN	0.6	lady hale
257	153	The view taken was that everyone detained with a view to treatment could be treated , against their will if necessary , as the consultant psychiatrist responsible for their care thought appropriate : see DHSS and others , Review of the Mental Health Act 1959 , 1978 , Cmnd 7320 , para 6.14 . 	NAN	NAN	NAN	0.6	lady hale
257	154	The 1983 Act clarified that position -LRB- in terms which are somewhat more permissive to the RMO than those recommended in the Review : see pp 80 - 81 -RRB- . 	NAN	NAN	NAN	0.6	lady hale
257	155	It enacted the general power in section 63 , defined in section 56 the patients to whom it applied , and provided safeguards for the most controversial treatments specified in or under sections 57 and 58 . 	NAN	NAN	NAN	0.6	lady hale
257	156	It did not , as we have seen , expressly link section 63 to the classified form of disorder , although it could easily have done so . 	NAN	NAN	NAN	0.6	lady hale
257	157	27 . 	NAN	NAN	NAN	0.6	lady hale
257	158	The classifications remained important for the authority to detain , but in a rather different way . 	NAN	NAN	NAN	0.7	lady hale
257	159	The age limits in the 1959 Act were repealed ; instead , the criteria for section 3 admissions for treatment and hospital orders for the lesser forms of disorder included a ` treatability ' test -LRB- in sections 3 -LRB- 2 -RRB- and 37 -LRB- 2 -RRB- -LRB- a -RRB- , paras 13 and 14 above -RRB- ; the same treatability test had now to be addressed at reclassification ` downwards ' under section 16 -LRB- see section 16 -LRB- 2 -RRB- , para 17 above -RRB- and was included in the criteria for renewal under section 20 -LRB- 4 -RRB- ; this applies to all four forms of disorder , but if the patient suffers from mental illness or severe mental impairment , it is an alternative that , if discharged , he would be unlikely to be able to care for himself , or obtain the care he needs or guard himself against serious exploitation ; that alternative is also relevant to an MHRT 's discretionary power to discharge such patients : see section 72 -LRB- 2 -RRB- -LRB- b -RRB- . 	NAN	NAN	NAN	0.7	lady hale
257	160	28 . 	NAN	NAN	NAN	0.7	lady hale
257	161	Fifthly , and following on from the above , the RMO has never had power to reclassify a restricted patient : section 16 , and its predecessor , did not apply . 	NAN	NAN	NAN	0.7	lady hale
257	162	The obvious reason for this was that the classification was irrelevant to the continued authority to detain . 	NAN	NAN	NAN	0.7	lady hale
257	163	This did not have to be renewed every so often , but continued until the patient was discharged , usually by the Home Secretary . 	NAN	NAN	NAN	0.7	lady hale
257	164	The MHRT had no power to discharge or reclassify restricted patients under the 1959 Act ; instead they could be referred to the tribunal for its advice : see 1959 Act , section 66 -LRB- 6 -RRB- , -LRB- 7 -RRB- , -LRB- 8 -RRB- -RRB- . 	NAN	NAN	NAN	0.7	lady hale
257	165	Under the 1983 Act , the tribunals ' powers of discharge and reclassification were extended to restricted patients , albeit with some important modifications : see sections 73 and 74 . 	NAN	NAN	NAN	0.7	lady hale
257	166	For the first time , therefore , it became possible to reclassify the form of mental disorder from which a restricted patient was suffering . 	NAN	NAN	NAN	0.7	lady hale
257	167	But the fact that a restricted patient can only be reclassified after an MHRT hearing reinforces the conclusion that classification has no bearing on treatment . 	NAN	NAN	NAN	0.7	lady hale
257	168	Patients may only apply at defined intervals : see section 70 . 	NAN	NAN	NAN	0.7	lady hale
257	169	The Home Secretary may refer a restricted patient at any time : see section 71 . 	NAN	NAN	NAN	0.7	lady hale
257	170	But the jurisdiction of the tribunal is aimed at discharge , with classification an after-thought if the patient is not discharged : see section 72 -LRB- 5 -RRB- . 	NAN	NAN	NAN	0.7	lady hale
257	171	The time taken to gather the necessary reports and evidence and to arrange a hearing can be considerable . 	NAN	NAN	NAN	0.7	lady hale
257	172	It is unlikely that Parliament intended that the patient could not be treated without his consent in the meantime , particularly as the patient may find ways of delaying the tribunal hearing . 	NAN	NAN	NAN	0.7	lady hale
257	173	29 . 	NAN	NAN	NAN	0.7	lady hale
257	174	For all those reasons , I conclude that the words of section 63 mean what they say . 	NAN	NAN	NAN	0.7	lady hale
257	175	They authorise a patient to be treated for any mental disorder from which he is suffering , irrespective of whether this falls within the form of disorder from which he is classified as suffering in the application , order or direction justifying his detention . 	NAN	NAN	NAN	0.7	lady hale
257	176	Policy 30 . 	NAN	NAN	NAN	0.7	lady hale
257	177	As I said earlier , compulsory patients are a vulnerable group who deserve protection from being forced to accept inappropriate treatment . 	NAN	NAN	NAN	0.7	lady hale
257	178	But restricting their treatment to that which is designed for their ` classified ' disorder is so haphazard as to be scarcely any protection at all . 	NAN	NAN	NAN	0.7	lady hale
257	179	It is obviously much more serious if the patient is given the wrong kind of medication , or the wrong kind of surgery , than it is if the patient is kept on a ward in the wrong kind of milieu . 	NAN	NAN	NAN	0.7	lady hale
257	180	This patient was at times thought to be suffering from one kind of mental illness , for which one family of drugs would be appropriate , and at times thought to be suffering from another kind of mental illness , for which a different family of drugs would be appropriate . 	NAN	NAN	NAN	0.7	lady hale
257	181	Similarly , ECT might have been thought appropriate to one kind of mental illness but not to the other . 	NAN	NAN	NAN	0.7	lady hale
257	182	His classification of mental illness would not have protected him from the wrong kind of drugs or the inappropriate use of ECT . 	NAN	NAN	NAN	0.7	lady hale
257	183	But section 58 is expressly designed for that purpose . 	NAN	NAN	NAN	0.8	lady hale
257	184	31 . 	NAN	NAN	NAN	0.8	lady hale
257	185	Secondly , psychiatry is not an exact science . 	NAN	NAN	NAN	0.8	lady hale
257	186	Diagnosis is not easy or clear cut . 	NAN	NAN	NAN	0.8	lady hale
257	187	As this and many other cases show , a number of different diagnoses may be reached by the same or different clinicians over the years . 	NAN	NAN	NAN	0.8	lady hale
257	188	As this case also shows , co-morbidity is very common : see also Mental Health Act Commission , Tenth Biennial Report 2001 - 2003 , Placed amongst strangers , para 7.30 , citing Blackburn , Logan , Donnelly and Renwick -LRB- 2003 -RRB- , para 20 above . 	NAN	NAN	NAN	0.8	lady hale
257	189	The Commission , at para 7.31 , observes -LRB- quoting the researchers , at 114 -RRB- : `` If there is widespread co-morbidity between personality disorders and mental illness irrespective of Mental Health Act classification , then ` the dichotomy imposed by legal classification is misleading and obscures the multiple problems shared by patients in the two categories ' . '' 	NAN	NAN	NAN	0.8	lady hale
257	190	It is not easy to disentangle which features of the patient 's presentation stem from a disease of the mind and which stem from his underlying personality traits . 	NAN	NAN	NAN	0.8	lady hale
257	191	The psychiatrist 's aim should be to treat the whole patient . 	NAN	NAN	NAN	0.8	lady hale
257	192	In this case , the patient 's mental illness having been stabilised on medication , the aim was to address the underlying features of his personality which were getting in the way of his transfer back to a less restrictive setting . 	NAN	NAN	NAN	0.8	lady hale
257	193	Once the state has taken away a person 's liberty and detained him in a hospital with a view to medical treatment , the state should be able -LRB- some would say obliged -RRB- to provide him with the treatment which he needs . 	NAN	NAN	NAN	0.8	lady hale
257	194	It would be absurd if a patient could be detained in hospital but had to be denied the treatment which his doctor thought he needed for an indefinite period while some largely irrelevant classification was rectified . 	NAN	NAN	NAN	0.8	lady hale
257	195	32 . 	NAN	NAN	NAN	0.8	lady hale
257	196	This problem would be even worse if , as the respondent contends , the patient can only be classified as suffering from a particular form of mental disorder if that form is , on its own , ` of a nature or degree warranting the patient 's detention in hospital ' . 	NAN	NAN	NAN	0.8	lady hale
257	197	On that argument , the patient could be suffering from mental illness , which was sufficiently controlled on medication not to require hospital treatment , and have a personality disorder causing behaviour which made it impossible to discharge him into the community , but was not such as to require him to be treated in hospital rather than prison ; but he could not be classified as suffering from either and could not therefore be treated for either , notwithstanding that his overall mental disorder was such as to make it highly appropriate for him to continue to receive treatment in hospital . 	NAN	NAN	NAN	0.8	lady hale
257	198	My construction of section 63 makes it unnecessary to resolve this issue and I would prefer not to do so in the present case . 	NAN	NAN	NAN	0.8	lady hale
257	199	In my view , however , the language of sections 3 -LRB- 2 -RRB- -LRB- a -RRB- and 37 -LRB- 2 -RRB- -LRB- a -RRB- -LRB- i -RRB- -LRB- paras 13 and 14 above -RRB- suggests , at the very least , that it may be the combination of classified forms of disorder which makes it appropriate for the patient to be in hospital . 	NAN	NAN	NAN	0.8	lady hale
257	200	33 . 	NAN	NAN	NAN	0.8	lady hale
257	201	That is not , of course , to say that where an RMO is satisfied that the patient should be reclassified under section 16 he need not do so . 	NAN	NAN	NAN	0.8	lady hale
257	202	Where the patient is reclassified ` upwards ' , to include mental illness as well as or instead of psychopathic disorder , the test to be applied at his next renewal or by an MHRT will be affected . 	NAN	NAN	NAN	0.8	lady hale
257	203	Where he is reclassified ` downwards ' , from mental illness to psychopathic disorder , the RMO must go on to consider the treatability test and discharge him if it is not met . 	NAN	NAN	NAN	0.8	lady hale
257	204	Reclassification also triggers a right of application to an MHRT : see section 66 -LRB- 1 -RRB- -LRB- d -RRB- . 	NAN	NAN	NAN	0.8	lady hale
257	205	Although section 16 -LRB- 1 -RRB- -LRB- and section 72 -LRB- 5 -RRB- -RRB- are framed in permissive terms , in my view the RMO -LRB- or the MHRT -RRB- should reclassify if they are satisfied that the recorded form -LRB- or forms - the singular includes the plural -RRB- of disorder should be changed . 	NAN	NAN	NAN	0.8	lady hale
257	206	Human rights 34 . 	NAN	NAN	NAN	0.8	lady hale
257	207	It is not , and could not be , argued that this patient 's treatment was in breach of his rights under the European Convention . 	NAN	NAN	NAN	0.9	lady hale
257	208	Rather , it is argued that there is the potential for such breaches unless section 63 is read in the way for which the respondent contends . 	NAN	NAN	NAN	0.9	lady hale
257	209	The detention of a patient in a psychiatric hospital can not be justified under article 5 -LRB- 1 -RRB- -LRB- e -RRB- of the Convention unless the three criteria laid down in Winterwerp v The Netherlands -LRB- 1979 -RRB- 2 EHRR 387 , 403 , para 39 , are satisfied : `` In the Court 's opinion , except in emergency cases , the individual concerned should not be deprived of his liberty unless he has been reliably shown to be of ` unsound mind ' . 	NAN	NAN	NAN	0.9	lady hale
257	210	The very nature of what has to be established before the competent national authority - that is , a true mental disorder - calls for objective medical expertise . 	NAN	NAN	NAN	0.9	lady hale
257	211	Further , the mental disorder must be of a kind or degree warranting compulsory confinement . 	NAN	NAN	NAN	0.9	lady hale
257	212	What is more , the validity of continued confinement depends upon the persistence of such a disorder . '' 	NAN	NAN	NAN	0.9	lady hale
257	213	Further , if a person is detained because he is of unsound mind within the meaning of article 5 -LRB- 1 -RRB- -LRB- e -RRB- he must be detained in a place appropriate for that purpose and not , for example , in a prison : see Aerts v Belgium -LRB- 1998 -RRB- 29 EHRR 50 . 	NAN	NAN	NAN	0.9	lady hale
257	214	But beyond that , article 5 -LRB- 1 -RRB- -LRB- e -RRB- is not concerned with suitable treatment or conditions : see Ashingdane v United Kingdom -LRB- 1985 -RRB- 7 EHRR 528 , 543 , para 44 . 	NAN	NAN	NAN	0.9	lady hale
257	215	Unnecessary detention in the stricter conditions of Broadmoor , rather than in the more liberal regime of a local psychiatric hospital , to which the patient would have been transferred had there not been opposition from the nursing unions , did not mean that his detention was arbitrary or for an ulterior purpose : it was still justified under article 5 -LRB- 1 -RRB- -LRB- e -RRB- . 	NAN	NAN	NAN	0.9	lady hale
257	216	35 . 	NAN	NAN	NAN	0.9	lady hale
257	217	If that is so in a case such as Ashingdane 's it must a fortiori be so in a case such as this , where the patient complains of transfer between one ward and another in the same hospital . 	NAN	NAN	NAN	0.9	lady hale
257	218	Furthermore , the doctors were not transferring him for any arbitrary or ulterior purpose but in order to place him in the milieu which they considered would be best for his condition . 	NAN	NAN	NAN	0.9	lady hale
257	219	The conditions of detention , and the treatment received in the hospital , must be considered , if at all , under articles 3 or 8 . 	NAN	NAN	NAN	0.9	lady hale
257	220	36 . 	NAN	NAN	NAN	0.9	lady hale
257	221	There is , of course , a not inconsiderable risk that the treatment of a patient in a psychiatric hospital will be in breach of either of those articles . 	NAN	NAN	NAN	0.9	lady hale
257	222	Nevertheless , the European Court of Human Rights has held that ` as a general rule , a measure which is a therapeutic necessity can not be regarded as inhuman or degrading ' , although the court had to satisfy itself that the medical necessity had convincingly been shown to exist : see Herczegfalvy v Austria -LRB- 1992 -RRB- 15 EHRR 437 , 484 , para 82 . 	NAN	NAN	NAN	0.9	lady hale
257	223	Even relatively minor medical treatment , if compulsory , may engage article 8 : see J and others v Switzerland -LRB- Application No 22398/93 -RRB- 5 April 1995 . 	NAN	NAN	NAN	0.9	lady hale
257	224	But in Herczegfalvy medical necessity was also an answer to the patient 's allegation that his treatment was in breach of article 8 : para 86 . 	NAN	NAN	NAN	0.9	lady hale
257	225	37 . 	NAN	NAN	NAN	0.9	lady hale
257	226	Nothing that happened to this patient came anywhere close to being a breach of either of those articles . 	NAN	NAN	NAN	0.9	lady hale
257	227	But if it had done , for the reasons given earlier , his classification would have given him no protection against treatment which was not a therapeutic necessity under the Herczegfalvy principle . 	NAN	NAN	NAN	0.9	lady hale
257	228	Much better protection is given by the specific safeguards in sections 57 and 58 ; by the ordinary law of negligence , which protects the patient against medical treatment which is not considered appropriate by a respectable body of medical opinion ; and by the Human Rights Act 1998 , which gives the patient remedies against treatment which does not comply with his Convention rights . 	NAN	NAN	NAN	0.9	lady hale
257	229	Mr Gordon QC , for the respondent , can point to nothing in the Strasbourg jurisprudence which requires prior safeguards against the inappropriate treatment of patients who are lawfully detained under the Convention . 	NAN	NAN	NAN	0.9	lady hale
257	230	But if there were to be such a requirement , classification would not be an adequate safeguard . 	NAN	NAN	NAN	0.9	lady hale
257	231	It would be far too blunt an instrument . 	NAN	NAN	NAN	1	lady hale
257	232	38 . 	NAN	NAN	NAN	1	lady hale
257	233	For all those reasons , there is no need to read section 63 as Mr Gordon would have us read it in order to make it compatible with the Convention rights . 	NAN	NAN	NAN	1	lady hale
