289	257	Although the respondent sought to pray in aid passages from the opinions of this House in Wilson v First County Trust Ltd -LRB- No 2 -RRB- -LSB- 2004 -RSB- 1 AC 816 , nothing in that case appears to me inconsistent with this view : on the contrary , as Lord Rodger of Earlsferry observed at para 204 : The contention that Middleton now applies to all inquests 48 . 	NAN	NAN	NAN	0.6	lord brown
289	258	Neither way the argument is put do I find persuasive and both were rightly rejected by the court below . 	NAN	NAN	NAN	0.6	lord brown
289	259	Middleton clearly accepted that Jamieson was correctly decided . 	NAN	NAN	NAN	0.6	lord brown
289	260	Were it otherwise , the House could simply have overruled it without recourse to the Human Rights Act at all , let alone section 3 . 	NAN	NAN	NAN	0.6	lord brown
289	261	It is plain that the House was not intending the Middleton approach thereafter to apply in all cases . 	NAN	NAN	NAN	0.6	lord brown
289	262	In the first place , an article 2 investigative obligation only arises in the comparatively few cases where the state 's responsibility is or may be engaged . 	NAN	NAN	NAN	0.6	lord brown
289	263	Secondly , even where the obligation does arise , it will often be satisfied without resort to a Middleton inquest -- in some cases by criminal proceedings , in particular `` where a defendant pleads not guilty and the trial involves a full exploration of the facts surrounding the death '' -LRB- para 30 of the Committee 's opinion delivered by Lord Bingham of Cornhill -RRB- ; in others , like McCann , where `` short verdicts in the traditional form will enable the jury to express their conclusion on the central issue canvassed at the inquest '' -LRB- para 31 of the opinion -RRB- . 	NAN	NAN	NAN	0.6	lord brown
289	264	All this is clear from the Committee 's opinion which in terms recognises -LRB- para 36 -RRB- that only sometimes will a change of approach be called for . 	NAN	NAN	NAN	0.6	lord brown
289	265	49 . 	NAN	NAN	NAN	0.6	lord brown
289	266	Why , then , should Jamieson now be re-interpreted ? 	NAN	NAN	NAN	0.6	lord brown
289	267	The difficulties with such a proposition seem to me many and various . 	NAN	NAN	NAN	0.6	lord brown
289	268	The first is this . 	NAN	NAN	NAN	0.6	lord brown
289	269	The contention that Jamieson must be re-interpreted to enable the United Kingdom to satisfy its international law obligation in those cases where otherwise it would be breached -LRB- no domestic law obligation ex hypothesi being engaged in respect of a pre-Human Rights Act death -RRB- flies in the face of the conclusion already reached as to the effect of McKerr : if McKerr necessarily precludes the use of section 3 to achieve the contended for result , so too surely it must preclude the achievement of the same result by the back door route now suggested . 	NAN	NAN	NAN	0.6	lord brown
289	270	That aside , any contention for the re-interpretation of section 11 -LRB- 5 -RRB- -LRB- b -RRB- -LRB- ii -RRB- requires first that it contains a relevant ambiguity i.e. that it is capable , within the ordinary canons of construction , of bearing one or other of two possible meanings . 	NAN	NAN	NAN	0.6	lord brown
289	271	Again , however , that seems to me irreconcilable with the House 's opinion in Middleton which , in widening the meaning of `` how '' , expressly relied on section 3 . 	NAN	NAN	NAN	0.6	lord brown
289	272	Section 3 is only invoked where , to achieve compliance with the Convention , the court must depart from the unambiguous meaning the legislation would otherwise bear . 	NAN	NAN	NAN	0.6	lord brown
289	273	Nor is it surprising that the House in Middleton thought it necessary to resort to section 3 : Jamieson apart , there was a series of authorities stretching back to R v Walthamstow Coroner , Ex p Rubenstein -LRB- unreported , 19 February 1982 -RRB- -LRB- itself cited in Jamieson -RRB- which had similarly construed the provision . 	NAN	NAN	NAN	0.6	lord brown
289	274	50 . 	NAN	NAN	NAN	0.6	lord brown
289	275	Even , moreover , were the respondent 's argument to satisfy the threshold condition of ambiguity , she would still have to show that it would be appropriate to resolve that ambiguity by reference to the presumption `` that Parliament intended to legislate in conformity with the Convention , not in conflict with it '' -LRB- Lord Bridge of Harwich 's formulation of this principle of construction in R v Secretary of State for the Home Department , Ex p Brind -LSB- 1991 -RSB- 1 AC 696,747-748 -RRB- . 	NAN	NAN	NAN	0.6	lord brown
289	276	That too , however , presents the respondent with real difficulties . 	NAN	NAN	NAN	0.6	lord brown
289	277	The meaning of the word `` how '' in this legislation was , as stated , first established in Ex p Rubenstein in 1982 . 	NAN	NAN	NAN	0.6	lord brown
289	278	Not only was the 1988 Act -LRB- in which the present provision appears -RRB- itself a consolidating Act -LRB- and concerned , therefore , to enshrine the existing law -RRB- but it was enacted at a time when Parliament can have had no thought that one day the United Kingdom might be under a procedural obligation to enquire into deaths pursuant to article 2 of the Convention . 	NAN	NAN	NAN	0.6	lord brown
289	279	As already observed , it was not until 1995 that the European Court of Human Rights in McCann itself identified any such Convention duty . 	NAN	NAN	NAN	0.6	lord brown
289	280	And , as the Commissioner points out , even had Parliament been aware of this duty , it might well have thought it sufficiently or better discharged by other means : criminal proceedings , a judicial inquiry or some different process . 	NAN	NAN	NAN	0.6	lord brown
289	281	It can hardly be supposed that Parliament would have wanted the wider Middleton approach to be adopted for all future inquests . 	NAN	NAN	NAN	0.6	lord brown
289	282	51 . 	NAN	NAN	NAN	0.6	lord brown
289	283	It should be noted that the Jamieson interpretation of the word `` how '' does not , of itself , place the United Kingdom in conflict with its international law obligations . 	NAN	NAN	NAN	0.6	lord brown
289	284	True it is that in Middleton the Committee said that : `` In the absence of full criminal proceedings , and unless otherwise notified , a coroner should assume that his inquest is the means by which the state will discharge its procedural investigative obligation under article 2 '' -LRB- para 47 -RRB- . 	NAN	NAN	NAN	0.6	lord brown
289	285	That , however , is very far from saying that section 11 must accordingly be construed in all cases to require a Middleton inquest . 	NAN	NAN	NAN	0.6	lord brown
289	286	Mr Starmer suggested that it would be for the coroner in each case to decide whether a Middleton inquest was appropriate . 	NAN	NAN	NAN	0.6	lord brown
289	287	That , however , can not be . 	NAN	NAN	NAN	0.6	lord brown
289	288	Of course , the scope of the inquiry is ultimately a matter for the coroner . 	NAN	NAN	NAN	0.7	lord brown
289	289	The `` verdict '' and findings , however , are not . 	NAN	NAN	NAN	0.7	lord brown
289	290	The Jamieson construction of `` how '' severely circumscribes these . 	NAN	NAN	NAN	0.7	lord brown
289	291	But where the Middleton construction applies , the verdict and findings are not merely permitted , but required to be wider : section 11 dictates that the inquisition `` shall set out , so far as such particulars have been proved how the deceased came by his death . '' 	NAN	NAN	NAN	0.7	lord brown
289	292	If in every case that means `` in what circumstances '' as well as `` by what means '' , the coroner will inevitably in many cases have to widen the scope of the inquiry beyond that which , under the Jamieson approach , he would otherwise regard to be appropriate . 	NAN	NAN	NAN	0.7	lord brown
289	293	52 . 	NAN	NAN	NAN	0.7	lord brown
289	294	I turn , therefore , to the other limb of this argument , the submission that Middleton is now binding authority on the meaning of section 11 in all circumstances , a conclusion , as already explained , plainly contrary to what the House in Middleton intended . 	NAN	NAN	NAN	0.7	lord brown
289	295	The answer to it in my judgment is to be found , as the intervener argues , in the analogous field of European Community law where , pursuant to Marleasing SA v La Comercial Internacional de Alimentacion SA -LSB- 1990 -RSB- ECR I-4135 , a similarly strong interpretive obligation is imposed on member states to construe domestic legislation whenever possible so as to produce compatibility with European Community law . 	NAN	NAN	NAN	0.7	lord brown
289	296	The closeness of this analogy has been recognised by the House in Ghaidan v Godin-Mendoza -LSB- 2004 -RSB- 2 AC 557 -- see particularly Lord Steyn 's opinion at para 45 . 	NAN	NAN	NAN	0.7	lord brown
289	297	Where the Marleasing approach applies , the interpretative effect it produces upon domestic legislation is strictly confined to those cases where , on their particular facts , the application of the domestic legislation in its ordinary meaning would produce a result incompatible with the relevant European Community legislation . 	NAN	NAN	NAN	0.7	lord brown
289	298	In cases where no European Community rights would be infringed , the domestic legislation is to be construed and applied in the ordinary way . 	NAN	NAN	NAN	0.7	lord brown
289	299	Thus in R v Secretary of State for Transport , Ex p Factortame Ltd -LSB- 1990 -RSB- 2 AC 85 , Part II of the Merchant Shipping Act 1988 was to be disapplied in those cases where its operation would infringe directly effective European Community rights ; but not otherwise . 	NAN	NAN	NAN	0.7	lord brown
289	300	Similarly in Imperial Chemical Industries plc v Colmer -LRB- Inspector of Taxes -RRB- -LRB- No 2 -RRB- -LSB- 1999 -RSB- 1 WLR 2035 the House , following a reference to the Court of Justice of the European Communities -LRB- Imperial Chemical Industries plc v Colmer -LSB- 1999 -RSB- 1 WLR 108 -RRB- , held that ICI remained bound by domestic legislation upon its ordinary meaning notwithstanding that in certain circumstances such a construction would be incompatible with European Community rights . 	NAN	NAN	NAN	0.7	lord brown
289	301	This principle was again applied by the Court of Appeal in Gingi v Secretary of State for Work and Pensions -LSB- 2002 -RSB- 1 CMLR 587 where Arden LJ expressly approved the following passage from Bennion , Statutory Interpretation , 4th ed -LRB- 2002 -RRB- , p1117 : Buxton LJ , who gave the leading judgment in Gingi , recognised the relevance of the principle to the present case and , as already stated , rejected this limb of the respondent 's argument . 	NAN	NAN	NAN	0.7	lord brown
289	302	He was right to do so . 	NAN	NAN	NAN	0.7	lord brown
289	303	The third issue 53 . 	NAN	NAN	NAN	0.7	lord brown
289	304	The third issue for the House 's determination on this appeal -LRB- stated as issue two but more conveniently dealt with in the light of the conclusions reached on the other two issues -RRB- is whether , in exercising his discretion under section 16 -LRB- 3 -RRB- of the Coroners Act , the coroner would require to take into account the United Kingdom 's international obligations under article 2 . 	NAN	NAN	NAN	0.7	lord brown
289	305	Having myself reached the conclusion that , even were the inquest now to be re-opened , it could only proceed in accordance with the Jamieson approach , the third issue collapses : the Court of Appeal 's conclusion that it was irrational not to resume it was necessarily dependent upon their holding that section 3 applied -LRB- or upon the respondent making good her alternative argument for saying that a Middleton inquest would now be held -RRB- . 	NAN	NAN	NAN	0.7	lord brown
289	306	54 . 	NAN	NAN	NAN	0.7	lord brown
289	307	Since , however , the point was fully argued , and since Buxton LJ 's view that `` Even before the HRA domestic tribunals were bound to give full weight to the United Kingdom 's international obligations to be found in the ECHR '' has caused some concern in particular to the intervener , I shall briefly indicate why , from my part , I think the Court of Appeal were in error on this issue too , even supposing , as for this purpose one must , that to re-open the inquest would enable the coroner to satisfy the UK 's international obligations in respect of Mr Hurst 's death . 	NAN	NAN	NAN	0.7	lord brown
289	308	55 . 	NAN	NAN	NAN	0.7	lord brown
289	309	Must a statutory discretion be exercised `` to give full weight to the UK 's international obligations ? '' 	NAN	NAN	NAN	0.7	lord brown
289	310	There are , of course , many dicta of high authority supporting the proposition that it is lawful to have regard to unincorporated treaty obligations in the exercise of a discretion . 	NAN	NAN	NAN	0.7	lord brown
289	311	One such , in the context of the Convention , appears in Lord Bingham 's opinion in R v Lyons -LSB- 2003 -RSB- 1 AC 976 , para 13 : 56 . 	NAN	NAN	NAN	0.7	lord brown
289	312	It is another thing , however , to say that the decision-maker is bound to have regard to such obligations and , moreover , -LRB- a necessary further part of the respondent 's argument -RRB- , bound to give effect to them unless there is good reason not to . 	NAN	NAN	NAN	0.7	lord brown
289	313	Such a contention appears to run flatly counter to this House 's authoritative decision in R v Secretary of State for the Home Department , Ex p Brind -LSB- 1991 -RSB- 1 AC 696 . 	NAN	NAN	NAN	0.7	lord brown
289	314	It was there held that decision-makers are under no obligation to exercise discretionary powers conferred upon them in domestic law so as to comply with unincorporated international obligations . 	NAN	NAN	NAN	0.7	lord brown
289	315	Of the argument that by the same token that international obligations will determine the construction of ambiguous legislation so too where a discretion can be exercised either so as to conform to or to infringe a basic human right it must be exercised so as to conform , Lord Bridge said this -LRB- at p 748 -RRB- : Similar views are to be found in the other speeches . 	NAN	NAN	NAN	0.7	lord brown
289	316	As , indeed , Neill LJ was later to observe in R v Secretary of State for the Environment , Ex p NALGO -LRB- 1992 -RRB- 5 Admin LR 785 , 798 , only Lord Templeman thought that article 10 was `` a relevant matter to be taken into account . '' 	NAN	NAN	NAN	0.7	lord brown
289	317	A series of earlier Court of Appeal decisions had been to the same effect : R v Chief Immigration Officer , Heathrow Airport , Ex p Salamat Bibi -LSB- 1976 -RSB- 1 WLR 979 , Fernandes v Secretary of State -LSB- 1981 -RSB- Imm AR 1 ; Chundawadra v Immigration Appeal Tribunal -LSB- 1988 -RSB- Imm AR 161 . 	NAN	NAN	NAN	0.7	lord brown
289	318	57 . 	NAN	NAN	NAN	0.7	lord brown
289	319	Some considerations are required to be taken into account by decision makers . 	NAN	NAN	NAN	0.7	lord brown
289	320	Others are required not to be . 	NAN	NAN	NAN	0.7	lord brown
289	321	But there is a third category : those considerations which the decision maker may choose for himself whether or not to take into account . 	NAN	NAN	NAN	0.7	lord brown
289	322	As was stated by Cooke J in the New Zealand case of CREEDNZ Inc v Governor General -LSB- 1981 -RSB- 1 NZLR 172 , 183 : A little later he added that even if the statute was silent , Lord Scarman in In re Findlay -LSB- 1985 -RSB- 1 AC 318,334 approved those two passages in Cooke J 's judgment as `` a correct statement of principle . '' 	NAN	NAN	NAN	0.7	lord brown
289	323	58 . 	NAN	NAN	NAN	0.7	lord brown
289	324	Applying that principle to the present case it seems to me quite impossible to say that the unincorporated international obligation on the UK here was `` so obviously material '' to the coroner 's decision whether or not to resume this inquest that he was required to give it `` direct consideration '' . 	NAN	NAN	NAN	0.7	lord brown
289	325	Still less in my judgment was he obliged to give effect to it , the very contention so roundly rejected in Brind . 	NAN	NAN	NAN	0.7	lord brown
289	326	59 . 	NAN	NAN	NAN	0.7	lord brown
289	327	Even , therefore , had the coroner recognised and felt able to satisfy the international law obligation upon the United Kingdom by re-opening the inquest , I for my part would not hold his refusal to do so irrational or otherwise unlawful . 	NAN	NAN	NAN	0.7	lord brown
289	328	Section 22 -LRB- 4 -RRB- 60 . 	NAN	NAN	NAN	0.7	lord brown
289	329	There remains one final argument advanced by the respondent as a basis for upholding the Court of Appeal 's decision , the contention -LRB- not previously advanced but nonetheless entertained by the House -RRB- that , even were she not otherwise able to rely on section 3 of the 1998 Act , she can do so here in reliance upon sections 22 -LRB- 4 -RRB- and 7 -LRB- 1 -RRB- -LRB- b -RRB- of the Act . 	NAN	NAN	NAN	0.7	lord brown
289	330	Those sections provide : -LRB- Section 7 -LRB- 6 -RRB- provides that `` legal proceedings '' in section 7 -LRB- 1 -RRB- -LRB- b -RRB- includes `` proceedings brought by or at the instigation of a public authority . '' -RRB- 	NAN	NAN	NAN	0.7	lord brown
289	331	61 . 	NAN	NAN	NAN	0.7	lord brown
289	332	It is Mr Starmer 's submission that a coroner 's inquest is a proceeding `` brought by or at the instigation of a public authority '' and that the respondent is accordingly entitled to rely on her Convention right to an article 2 compliant inquest notwithstanding that her son 's death occurred before 2 October 2000 so that the coroner would not otherwise be acting unlawfully under section 6 of the Act . 	NAN	NAN	NAN	0.8	lord brown
289	333	I would reject this argument for reasons which can be very briefly stated . 	NAN	NAN	NAN	0.8	lord brown
289	334	62 . 	NAN	NAN	NAN	0.8	lord brown
289	335	Whilst it is clearly the case that the coroner is a public authority and that it is he who , in circumstances prescribed by section 8 of the Coroners Act , is required to `` hold an inquest into the death of the deceased '' , it does not seem to me that the holding of an inquest constitutes the bringing -LRB- or instigating -RRB- of proceedings within the meaning of this legislation . 	NAN	NAN	NAN	0.8	lord brown
289	336	There has been a great deal of discussion in the case law about the true scope of section 22 -LRB- 4 -RRB- . 	NAN	NAN	NAN	0.8	lord brown
289	337	Essentially , however , it has been recognised to operate so as to allow victims to invoke rights which would otherwise be unenforceable in domestic law . 	NAN	NAN	NAN	0.8	lord brown
289	338	Convention rights may be used as a shield to defeat proceedings brought against victims by public authorities , but not as a sword . 	NAN	NAN	NAN	0.8	lord brown
289	339	As the late Peter Duffy QC explained in the annotations to section 22 -LRB- 4 -RRB- in Current Law Statutes , vol 3 -LRB- 1999 -RRB- , it was `` to enable the Act to be used defensively against public authorities with retrospective effect but not , it appears , offensively '' , an explanation noted by Lord Hope of Craighead in R v Kansal -LRB- No 2 -RRB- -LSB- 2002 -RSB- 2 AC 69 at para 56 . 	NAN	NAN	NAN	0.8	lord brown
289	340	63 . 	NAN	NAN	NAN	0.8	lord brown
289	341	Section 7 -LRB- 1 -RRB- -LRB- a -RRB- allows the victim of an actual or threatened unlawful act to `` bring proceedings against the authority '' . 	NAN	NAN	NAN	0.8	lord brown
289	342	Section 7 -LRB- 1 -RRB- -LRB- b -RRB- allows him to rely on his Convention rights in legal proceedings brought by the authority . 	NAN	NAN	NAN	0.8	lord brown
289	343	Only in the latter case can he rely on conduct violating his rights which was not unlawful in domestic law when it took place . 	NAN	NAN	NAN	0.8	lord brown
289	344	64 . 	NAN	NAN	NAN	0.8	lord brown
289	345	Inquest proceedings are in no sense brought against those participating in them . 	NAN	NAN	NAN	0.8	lord brown
289	346	Least of all are they brought against those like this respondent whose sole concern is that such proceedings should be brought . 	NAN	NAN	NAN	0.8	lord brown
289	347	In the present case , your Lordships will appreciate , the inquest stands adjourned and it is the respondent who seeks , the coroner who refuses , its re-opening . 	NAN	NAN	NAN	0.8	lord brown
289	348	The true analysis here is that the respondent is herself `` bring -LSB- ing -RSB- proceedings against the authority '' within the meaning of section 7 -LRB- 1 -RRB- -LRB- a -RRB- rather than relying on a Convention right in a legal proceeding brought by a public authority within the meaning of section 7 -LRB- 1 -RRB- -LRB- b -RRB- . 	NAN	NAN	NAN	0.8	lord brown
289	349	65 . 	NAN	NAN	NAN	0.8	lord brown
289	350	In my opinion , therefore , none of the respondent 's arguments for upholding the Court of Appeal 's judgment are sustainable . 	NAN	NAN	NAN	0.8	lord brown
289	351	I would accordingly allow the Commissioner 's appeal and hold the coroner 's decision of 19 November 2002 to have been lawful . 	lord brown	self	outcome	0.8	lord brown
289	352	------------- NEW JUDGE --------------- 	NAN	NAN	NAN	0.8	lord brown
289	353	LORD MANCE 	NAN	NAN	NAN	0.8	lord brown
289	354	My Lords , 	NAN	NAN	NAN	0.8	lord brown
289	355	Introduction 66 . 	NAN	NAN	NAN	0.8	lord brown
289	356	I have had the advantage of reading in draft the opinions of my noble and learned friends , Lord Bingham of Cornhill , Lord Rodger of Earlsferry , Baroness Hale of Richmond and Lord Brown of Eaton-under-Heywood . 	lord mance	all	ackn	0.8	lord brown
289	357	67 . 	NAN	NAN	NAN	0.8	lord brown
289	358	Three issues requiring resolution by the House were identified in the agreed Statement of Facts and Issues . 	NAN	NAN	NAN	0.8	lord brown
289	359	They were : '' -LRB- i -RRB- Whether by virtue of section 3 of the Human Rights Act 1998 , sections 16 and 11 -LRB- 5 -RRB- -LRB- b -RRB- -LRB- ii -RRB- of the -LSB- Coroners Act 1988 -RSB- are to be read and given effect so as to be compatible with Article 2 of the Convention -LSB- on Human Rights -RSB- . 	NAN	NAN	NAN	0.8	lord brown
289	360	-LRB- ii -RRB- Alternatively , whether irrespective of the Human Rights Act 1998 being applicable to the discharge of his statutory duties , in exercising his discretion under section 16 -LRB- 3 -RRB- of the 1988 Act , the coroner was required to take into account the United Kingdom 's international obligations under Article 2 of the Convention . 	NAN	NAN	NAN	0.8	lord brown
289	361	-LRB- iii -RRB- If the inquest is only resumed in accordance with -LRB- ii -RRB- above , what does section 11 -LRB- 5 -RRB- -LRB- b -RRB- -LRB- ii -RRB- of the 1988 Act require the scope of the inquiry to be . '' 	NAN	NAN	NAN	0.8	lord brown
289	362	68 . 	NAN	NAN	NAN	0.8	lord brown
289	363	In his case , Mr Starmer QC for Mrs Hurst identified a wider-ranging set of issues . 	NAN	NAN	NAN	0.8	lord brown
289	364	These included a new argument under section 22 -LRB- 4 -RRB- of the Human Rights Act 1998 , which the House undertook to resolve . 	NAN	NAN	NAN	0.8	lord brown
289	365	It is in substance another route by which Mr Starmer seeks to succeed on issue -LRB- i -RRB- . 	NAN	NAN	NAN	0.8	lord brown
289	366	They also included a suggestion that , quite apart from the Convention , the coroner 's decision not to resume the inquest was based upon too narrow an interpretation of his discretion under section 16 -LRB- 3 -RRB- of the 1988 Act . 	NAN	NAN	NAN	0.8	lord brown
289	367	In oral submissions before the House , Mr Starmer recognised realistically that he could not pursue any such suggestion . 	NAN	NAN	NAN	0.8	lord brown
289	368	69 . 	NAN	NAN	NAN	0.8	lord brown
289	369	Mr Starmer continued however to support the affirmative answer which was given by the Court of Appeal to issue -LRB- ii -RRB- : cf paragraphs 29 and 31 per Buxton LJ -LRB- with whose reasons the other two members of the court agreed -RRB- . 	NAN	NAN	NAN	0.8	lord brown
289	370	This constituted one of two `` separate and distinct conclusions '' which led Buxton LJ to order the coroner to resume the inquest : paragraph 64 . 	NAN	NAN	NAN	0.8	lord brown
289	371	The other -LRB- matching issue -LRB- i -RRB- -RRB- was that section 11 -LRB- 5 -RRB- -LRB- b -RRB- -LRB- ii -RRB- of the 1988 Act should , in the light of section 3 of the Human Rights Act 1998 , be read compatibly with the United Kingdom 's international duty under article 2 of the Convention to hold a full inquest meeting the standard set by the European Court of Human Rights in McCann v United Kingdom -LRB- 1995 -RRB- 21 EHRR 97 : cf paragraphs 62 and 64 per Buxton LJ . 	NAN	NAN	NAN	0.8	lord brown
289	372	70 . 	NAN	NAN	NAN	0.8	lord brown
289	373	Buxton LJ 's description of these two conclusions as separate and distinct indicates that he did not regard the first conclusion as in any way dependent on his conclusion on issue -LRB- i -RRB- . 	NAN	NAN	NAN	0.8	lord brown
289	374	However , in addressing issue -LRB- ii -RRB- , Mr Starmer accepted that , even if he succeeded on issue -LRB- ii -RRB- , `` it would be hard '' for him to challenge the coroner 's refusal to resume the inquest as a matter of discretion unless he could also show that the inquest , when held , would have been `` Convention-compliant '' . 	NAN	NAN	NAN	0.8	lord brown
289	375	During the course of his submissions , he nevertheless carefully examined the scope of pre-Human Rights Act case-law , including Jamieson , with a view to showing that if offered , as he put it , a sufficient `` basis for an investigative inquest in this case - ie were reasonable steps taken to protect Troy Hurst ? '' 	NAN	NAN	NAN	0.8	lord brown
289	376	, even without any such adjustment as he submitted should , if necessary , be made under issue -LRB- i -RRB- . 	NAN	NAN	NAN	0.9	lord brown
