133	212	For these reasons , as well as for those to be given by Lord Walker and Lord Neuberger , with which I agree , I would allow the appeals and make the orders proposed by Lord Walker . 	lord rodger	lord walker	fullagr	0.4	lord neuberger, lord rodger, lord walker
133	212	For these reasons , as well as for those to be given by Lord Walker and Lord Neuberger , with which I agree , I would allow the appeals and make the orders proposed by Lord Walker . 	lord rodger	lord neuberger	fullagr	0.4	lord neuberger, lord rodger, lord walker
133	212	For these reasons , as well as for those to be given by Lord Walker and Lord Neuberger , with which I agree , I would allow the appeals and make the orders proposed by Lord Walker . 	lord rodger	self	outcome	0.4	lord neuberger, lord rodger, lord walker
133	212	For these reasons , as well as for those to be given by Lord Walker and Lord Neuberger , with which I agree , I would allow the appeals and make the orders proposed by Lord Walker . 	lord rodger	lord walker	outcome	0.4	lord neuberger, lord rodger, lord walker
133	213	------------- NEW JUDGE --------------- 	NAN	NAN	NAN	0.4	lord neuberger, lord rodger, lord walker
133	214	LORD WALKER OF GESTINGTHORPE 	NAN	NAN	NAN	0.4	lord neuberger, lord rodger, lord walker
133	215	My Lords , 	NAN	NAN	NAN	0.4	lord neuberger, lord rodger, lord walker
133	216	The reference to the Court of Justice 34 . 	NAN	NAN	NAN	0.4	lord neuberger, lord rodger, lord walker
133	217	The Working Time Regulations 1998 SI 1998/1833 -LRB- `` WTR '' -RRB- were made under the European Communities Act 1972 in order to transpose into national law the provisions of the Working Time Directive 1993/104/EC . 	NAN	NAN	NAN	0.5	lord neuberger, lord rodger, lord walker
133	218	As appears from its recitals , the Directive was intended to promote health and safety at work by restricting the working day and the working week and requiring workers to be given rest periods and paid holidays -LRB- described in the English-language version as annual leave -RRB- . 	NAN	NAN	NAN	0.5	lord neuberger, lord rodger, lord walker
133	219	35 . 	NAN	NAN	NAN	0.5	lord neuberger, lord rodger, lord walker
133	220	All the appellants formerly worked for the respondent Commissioners of Inland Revenue -LRB- now HM Revenue & Customs -RRB- but most had retired , or been required to retire , after long absences because of illness . 	NAN	NAN	NAN	0.5	lord neuberger, lord rodger, lord walker
133	221	The main issue in these appeals was the effect of the annual leave provisions , as transposed by paras 13-16 of the WTR , in relation to employees like the appellants who had been on long-term sick leave . 	NAN	NAN	NAN	0.5	lord neuberger, lord rodger, lord walker
133	222	Since the appeals raised an important issue of Community law the House decided , when the appeals came on for hearing on 30 October 2006 , to make a reference to the Court of Justice under Article 234 of the Treaty . 	NAN	NAN	NAN	0.5	lord neuberger, lord rodger, lord walker
133	223	36 . 	NAN	NAN	NAN	0.5	lord neuberger, lord rodger, lord walker
133	224	The Grand Chamber of the Court of Justice considered the reference together with another reference , raising the same issues , from Germany . 	NAN	NAN	NAN	0.5	lord neuberger, lord rodger, lord walker
133	225	On 30 January 2009 the Court gave judgment in both cases -LRB- Case C-350 / 06 Schultz-Hoff v Deutsche Rentenversicherung Bund , Case C-520 / 06 Stringer v HM Revenue and Customs -RRB- in terms favourable to the former employees . 	NAN	NAN	NAN	0.5	lord neuberger, lord rodger, lord walker
133	226	The Court of Justice 's interpretation differed from that adopted by the Court of Appeal -LRB- IRC v Ainsworth -LSB- 2005 -RSB- ICR 1149 -RRB- , which had itself differed from the Employment Appeal Tribunal . 	NAN	NAN	NAN	0.5	lord neuberger, lord rodger, lord walker
133	227	Counsel agree that on the main issue the appropriate course for your Lordships is simply to allow the appeals and restore the orders of the Employment Appeal Tribunal . 	NAN	NAN	NAN	0.5	lord neuberger, lord rodger, lord walker
133	228	The jurisdiction issue 37 . 	NAN	NAN	NAN	0.5	lord neuberger, lord rodger, lord walker
133	229	Mr Ainsworth -LRB- who was an Inspector of Taxes based at Chester but became ill at the end of 2000 -RRB- and some of the other appellants made their applications to the employment tribunal not only under the WTR but also under sections 13 -LRB- Right not to suffer unauthorised deductions -RRB- and 23 -LRB- Complaints to employment tribunals -RRB- of the Employment Rights Act 1996 -LRB- `` ERA '' -RRB- . 	NAN	NAN	NAN	0.5	lord neuberger, lord rodger, lord walker
133	230	That gives rise to the only remaining issue before the House : whether a claim under the ERA was available to these appellants . 	NAN	NAN	NAN	0.5	lord neuberger, lord rodger, lord walker
133	231	That issue might be described as technical and in some cases -LRB- where an aggrieved employee applies to the employment tribunal promptly -RRB- it is of no more than academic interest . 	NAN	NAN	NAN	0.5	lord neuberger, lord rodger, lord walker
133	232	But it becomes a matter of practical importance if the normal three-month time limit for an application to the employment tribunal has expired since the complaint arose , and other grounds for extending the time limit are not available . 	NAN	NAN	NAN	0.5	lord neuberger, lord rodger, lord walker
133	233	That is because section 23 of the ERA permits -LRB- but regulation 30 -LRB- Remedies -RRB- of the WTR , the corresponding procedural provision , does not permit -RRB- an aggrieved employee to make a claim in respect of the whole of a `` series '' of deductions of which he complains if he acts within three months of the latest deduction in the series . 	NAN	NAN	NAN	0.5	lord neuberger, lord rodger, lord walker
133	234	-LRB- There is some case law about the meaning of `` series '' , which has been fairly generously interpreted , but it is unnecessary to consider that point in these appeals . -RRB- 	NAN	NAN	NAN	0.5	lord neuberger, lord rodger, lord walker
133	235	38 . 	NAN	NAN	NAN	0.5	lord neuberger, lord rodger, lord walker
133	236	The time limit point is of practical importance not only to employers and workers but also to those engaged in administering employment tribunals . 	NAN	NAN	NAN	0.5	lord neuberger, lord rodger, lord walker
133	237	Sometimes a point of principle about entitlement to holiday pay affects a large class of employees and arises every time any of them takes a few days ' holiday . 	NAN	NAN	NAN	0.5	lord neuberger, lord rodger, lord walker
133	238	The sums involved may be relatively small on each occasion but if employees feel that they are not getting their full entitlement , and conciliation fails , they will wish to take the matter to an employment tribunal . 	NAN	NAN	NAN	0.5	lord neuberger, lord rodger, lord walker
133	239	This has been strikingly illustrated by the large number of small claims made by pilots employed by BA and other airlines in disputes over whether holiday pay should be calculated on basic pay alone , or should take account of flying time supplements and TAFB -LRB- time away from base -RRB- allowances : see British Airways plc v Williams -LSB- 2008 -RSB- EWCA Civ 281 , 19 March 2009 . 	NAN	NAN	NAN	0.5	lord neuberger, lord rodger, lord walker
133	240	39 . 	NAN	NAN	NAN	0.5	lord neuberger, lord rodger, lord walker
133	241	For that reason the President of the Employment Appeal Tribunal readily gave the Revenue permission to appeal to the Court of Appeal on this issue as well as on the main issue which was referred to the Court of Justice , and the Court of Appeal decided to consider the point even though Mr Ainsworth 's counsel submitted , at that stage , that the point was academic to his client and should not be argued . 	NAN	NAN	NAN	0.5	lord neuberger, lord rodger, lord walker
133	242	Since in allowing the appeal the Court of Appeal overruled the Employment Appeal Tribunal 's decisions in List Design Group Ltd v Douglas -LSB- 2002 -RSB- ICR 686 and Canada Life Ltd v Gray -LSB- 2004 -RSB- ICR 673 it is clearly appropriate for your Lordships to consider the matter , even if it is no longer important to any of the appellants themselves . 	NAN	NAN	NAN	0.5	lord neuberger, lord rodger, lord walker
133	243	Employment tribunals and the WTR 40 . 	NAN	NAN	NAN	0.5	lord neuberger, lord rodger, lord walker
133	244	I must give a fuller account of the relevant provisions of the WTR and the ERA . 	NAN	NAN	NAN	0.5	lord neuberger, lord rodger, lord walker
133	245	But as this appeal is concerned with the jurisdiction and powers of employment tribunals they are the best starting point . 	NAN	NAN	NAN	0.5	lord neuberger, lord rodger, lord walker
133	246	Employment tribunals -LRB- renamed in 1998 , having previously been industrial tribunals -RRB- are regulated mainly by the Employment Tribunals Act 1996 -LRB- formerly the Industrial Tribunals Act 1996 -RRB- . 	NAN	NAN	NAN	0.5	lord neuberger, lord rodger, lord walker
133	247	Their jurisdiction is entirely statutory , conferred by a wide range of primary and secondary legislation including the Equal Pay Act 1970 , the Health and Safety at Work Act 1974 , other statutes against discrimination and -LRB- most relevantly -RRB- the WTR and the ERA . 	NAN	NAN	NAN	0.5	lord neuberger, lord rodger, lord walker
133	248	41 . 	NAN	NAN	NAN	0.5	lord neuberger, lord rodger, lord walker
133	249	Because the WTR are concerned primarily with health and safety , breaches of some of the provisions in Part II of the WTR , such as regulations 10 -LRB- Daily rest -RRB- , 11 -LRB- Weekly rest period -RRB- , 12 -LRB- Rest breaks -RRB- and 13 -LRB- Entitlement to annual leave -RRB- do not give rise to readily quantifiable monetary claims . 	NAN	NAN	NAN	0.5	lord neuberger, lord rodger, lord walker
133	250	If a worker works and receives a week 's pay , when he should have had a week 's holiday with pay , it is rest and recreation , not money as such , that he has lost . 	NAN	NAN	NAN	0.5	lord neuberger, lord rodger, lord walker
133	251	Consequently regulation 30 -LRB- Remedies -RRB- provides for statutory compensation to be awarded by the employment tribunal as is just and equitable in the circumstances , having regard to the employer 's default and any loss sustained by the worker -LRB- see regulation 30 -LRB- 1 -RRB- -LRB- a -RRB- -LRB- i -RRB- , -LRB- 3 -RRB- and -LRB- 4 -RRB- -RRB- . 	NAN	NAN	NAN	0.5	lord neuberger, lord rodger, lord walker
133	252	Some other claims under Part II , that is under regulations 14 -LRB- Compensation related to entitlement to leave -RRB- and 16 -LRB- Payment in respect of periods of leave -RRB- , are liquidated in nature . 	NAN	NAN	NAN	0.5	lord neuberger, lord rodger, lord walker
133	253	For them the remedy is an order for payment of the amount due : see regulation 30 -LRB- 1 -RRB- -LRB- b -RRB- and -LRB- 5 -RRB- . 	NAN	NAN	NAN	0.5	lord neuberger, lord rodger, lord walker
133	254	42 . 	NAN	NAN	NAN	0.5	lord neuberger, lord rodger, lord walker
133	255	Mr Ainsworth 's claim , so far as brought under the WTR , was brought under regulation 14 -LRB- Compensation related to entitlement to leave -RRB- , the first two paragraphs of which are in the following terms : `` -LRB- 1 -RRB- This regulation applies where - -LRB- a -RRB- a worker 's employment is terminated during the course of his leave year , and -LRB- b -RRB- on the date on which the termination takes effect -LRB- ` the termination date ' -RRB- , the proportion he has taken of the leave to which he is entitled in the leave year under regulation 13 differs from the proportion of the leave year which has expired . 	NAN	NAN	NAN	0.5	lord neuberger, lord rodger, lord walker
133	256	-LRB- 2 -RRB- Where the proportion of leave taken by the worker is less than the proportion of the leave year which has expired , his employer shall make him a payment in lieu of leave in accordance with paragraph -LRB- 3 -RRB- . '' 	NAN	NAN	NAN	0.5	lord neuberger, lord rodger, lord walker
133	257	43 . 	NAN	NAN	NAN	0.5	lord neuberger, lord rodger, lord walker
133	258	A worker with contractual rights can not claim them on top of his rights under the WTR , but can opt for whichever rights are the more favourable . 	NAN	NAN	NAN	0.5	lord neuberger, lord rodger, lord walker
133	259	That is the effect of regulation 17 -LRB- Entitlements under other provisions -RRB- : `` Where during any period a worker is entitled to a rest period , rest break or annual leave both under a provision of these Regulations and under a separate provision -LRB- including a provision of his contract -RRB- , he may not exercise the two rights separately , but may , in taking a rest period , break or leave during that period , take advantage of whichever right is , in any particular respect , the more favourable . '' 	NAN	NAN	NAN	0.5	lord neuberger, lord rodger, lord walker
133	260	44 . 	NAN	NAN	NAN	0.5	lord neuberger, lord rodger, lord walker
133	261	The Working Time Directive required member states to transpose its provisions into national law by 23 November 1996 . 	NAN	NAN	NAN	0.5	lord neuberger, lord rodger, lord walker
133	262	In the United Kingdom the Directive was a subject of great political controversy . 	NAN	NAN	NAN	0.5	lord neuberger, lord rodger, lord walker
133	263	When it was being negotiated the Conservative government opposed many of the proposals , including in particular the proposal for a maximum 48-hour working week from which employers and workers could not agree to opt out . 	NAN	NAN	NAN	0.5	lord neuberger, lord rodger, lord walker
133	264	The government went so far as to challenge , in proceedings before the Court of Justice , whether the Directive was under the Treaty -LRB- as it then stood -RRB- capable of being approved by only a qualified majority of the member states . 	NAN	NAN	NAN	0.5	lord neuberger, lord rodger, lord walker
133	265	The challenge was unsuccessful : Case C-84 / 94 United Kingdom v Council of the European Union -LSB- 1996 -RSB- ECR I -577 . 	NAN	NAN	NAN	0.5	lord neuberger, lord rodger, lord walker
133	266	The WTR were eventually made on 30 July 1998 , over 20 months after the final date fixed by the Directive , and contained provisions facilitating the United Kingdom 's derogation from the mandatory 48-hour week -LRB- see Article 17 of the Directive and Regulation 31 of the WTR , inserting a new section 45A in the ERA in order to comply with the conditions for derogation -RRB- . 	NAN	NAN	NAN	0.6	lord neuberger, lord rodger, lord walker
133	267	The ERA 45 . 	NAN	NAN	NAN	0.6	lord neuberger, lord rodger, lord walker
133	268	The ERA is a consolidating Act . 	NAN	NAN	NAN	0.6	lord neuberger, lord rodger, lord walker
133	269	The immediate predecessor to Part II -LRB- Protection of wages -RRB- was the Wages Act 1986 , but parts of it have much older roots , going back to the Truck Act 1831 . 	NAN	NAN	NAN	0.6	lord neuberger, lord rodger, lord walker
133	270	Section 13 , which is the first section in Part II , provides -LRB- so far as now relevant -RRB- : `` -LRB- 1 -RRB- An employer shall not make a deduction from wages of a worker employed by him unless - -LRB- a -RRB- the deduction is required or authorised to be made by virtue of a statutory provision or a relevant provision of the worker 's contract , or -LRB- b -RRB- the worker has previously signified in writing his agreement or consent to the making of the deduction . 	NAN	NAN	NAN	0.6	lord neuberger, lord rodger, lord walker
133	271	-LRB- 2 -RRB- defines `` relevant provision '' -LRB- 3 -RRB- Where the total amount of wages paid on any occasion by an employer to a worker employed by him is less than the total amount of the wages properly payable by him to the worker on that occasion -LRB- after deductions -RRB- , the amount of the deficiency shall be treated for the purposes of this Part as a deduction made by the employer from the worker 's wages on that occasion . '' 	NAN	NAN	NAN	0.6	lord neuberger, lord rodger, lord walker
133	272	46 . 	NAN	NAN	NAN	0.6	lord neuberger, lord rodger, lord walker
133	273	The purpose of section 13 -LRB- 3 -RRB- is not immediately apparent but it has been interpreted as having two important effects . 	NAN	NAN	NAN	0.6	lord neuberger, lord rodger, lord walker
133	274	In Delaney v Staples -LSB- 1991 -RSB- 2 QB 47 the Court of Appeal -LRB- Lord Donaldson of Lymington MR , Ralph Gibson LJ and Nicholls LJ -RRB- relied on its predecessor -LRB- section 8 -LRB- 3 -RRB- of the Wages Act 1986 -RRB- for the conclusion that `` a deduction from wages '' can for this purpose cover a total failure to pay any wages when due -LRB- in that case , contractual commission and holiday pay -RRB- . 	NAN	NAN	NAN	0.6	lord neuberger, lord rodger, lord walker
133	275	But the Court of Appeal also held that the employment tribunal had no jurisdiction to make an award in respect of an unliquidated contractual claim for a payment in lieu of notice . 	NAN	NAN	NAN	0.6	lord neuberger, lord rodger, lord walker
133	276	The House of Lords -LSB- 1992 -RSB- 1 AC 687 dismissed the ex-employee 's claim on the latter point -LRB- on which the law has since been changed , in 1994 , to give employment tribunals a limited jurisdiction to hear certain contractual claims for unliquidated sums -RRB- . 	NAN	NAN	NAN	0.6	lord neuberger, lord rodger, lord walker
133	277	There was no cross-appeal against the Court of Appeal 's decision as to the meaning of `` a deduction from wages '' , nor was it challenged before your Lordships . 	NAN	NAN	NAN	0.6	lord neuberger, lord rodger, lord walker
133	278	47 . 	NAN	NAN	NAN	0.6	lord neuberger, lord rodger, lord walker
133	279	The other decision of the Court of Appeal on section 13 -LRB- 3 -RRB- is New Century Cleaning Co Ltd v Church -LSB- 2000 -RSB- IRLR 27 . 	NAN	NAN	NAN	0.6	lord neuberger, lord rodger, lord walker
133	280	In that case the Court of Appeal -LRB- Beldam and Morritt LJJ , Sedley LJ dissenting -RRB- held , on unusual facts arising out of the way a team of window cleaners operated , that the effect of the words `` properly payable by him to the worker on that occasion '' excluded anything in the nature of an unliquidated claim from coming within section 13 . 	NAN	NAN	NAN	0.6	lord neuberger, lord rodger, lord walker
133	281	Again , that decision has not been challenged before your Lordships . 	NAN	NAN	NAN	0.6	lord neuberger, lord rodger, lord walker
133	282	It is not directly relevant to Mr Ainsworth 's claim but it shows that the very wide definition of `` wages '' in section 27 of the ERA -LRB- the last section in Part II -RRB- must in effect be filtered , for the purposes of a claim under section 13 , by eliminating any unliquidated amounts . 	NAN	NAN	NAN	0.6	lord neuberger, lord rodger, lord walker
133	283	The definition of `` wages '' in section 27 -LRB- to which I now proceed -RRB- does contain some items -LRB- for instance , some of those in subsection -LRB- 1 -RRB- -LRB- e -RRB- and -LRB- f -RRB- : see sections 60 -LRB- 3 -RRB- and -LRB- 4 -RRB- and 70 -LRB- 6 -RRB- and -LRB- 7 -RRB- of the ERA -RRB- which , like statutory compensation under regulation 30 -LRB- 3 -RRB- and -LRB- 4 -RRB- of the WTR , can not be quantified until the employment tribunal makes its own evaluative judgment on a claim . 	NAN	NAN	NAN	0.6	lord neuberger, lord rodger, lord walker
133	284	48 . 	NAN	NAN	NAN	0.6	lord neuberger, lord rodger, lord walker
133	285	Section 27 -LRB- 1 -RRB- provides as follows : `` -LRB- 1 -RRB- In this Part ` wages ' , in relation to a worker , means any sums payable to the worker in connection with his employment , including - -LRB- a -RRB- any fee , bonus , commission , holiday pay or other emolument referable to his employment , whether payable under his contract or otherwise , -LRB- b -RRB- statutory sick pay under Part XI of the Social Security Contributions and Benefits Act 1992 , -LRB- c -RRB- statutory maternity pay under Part XII of that Act , -LSB- -LRB- ca -RRB- statutory paternity pay under Part 12ZA of that Act , -LRB- cb -RRB- statutory adoption pay under Part 12ZB of that Act , -RSB- -LRB- d -RRB- a guarantee payment -LRB- under section 28 of this Act -RRB- , -LRB- e -RRB- any payment for time off under Part VI of this Act or section 169 of the Trade Union and Labour Relations -LRB- Consolidation -RRB- Act 1992 -LRB- payment for time off for carrying out trade union duties etc -RRB- , -LRB- f -RRB- remuneration on suspension on medical grounds under section 64 of this Act and remuneration on suspension on maternity grounds under section 68 of this Act , -LRB- g -RRB- any sum payable in pursuance of an order for reinstatement or re-engagement under section 113 of this Act , -LRB- h -RRB- any sum payable in pursuance of an order for the continuation of a contract of employment under section 130 of this Act or section 164 of the Trade Union and Labour Relations -LRB- Consolidation -RRB- Act 1992 , and -LRB- j -RRB- remuneration under a protective award under section 189 of that Act , but excluding any payments within subsection -LRB- 2 -RRB- . 	NAN	NAN	NAN	0.6	lord neuberger, lord rodger, lord walker
133	286	Subsection -LRB- 2 -RRB- then makes five general exclusions : -LRB- a -RRB- an advance by way of loan ; -LRB- b -RRB- a payment of expenses ; -LRB- c -RRB- a payment making provision on retirement or for loss of office ; -LRB- d -RRB- a redundancy payment ; and -LRB- e -RRB- any payment to the worker otherwise than in the capacity of a worker . 	NAN	NAN	NAN	0.6	lord neuberger, lord rodger, lord walker
133	287	49 . 	NAN	NAN	NAN	0.6	lord neuberger, lord rodger, lord walker
133	288	Section 23 provides for complaints to employment tribunals by workers alleging breaches of a number of provisions , including section 13 . 	NAN	NAN	NAN	0.6	lord neuberger, lord rodger, lord walker
133	289	It sets time limits as follows : `` -LRB- 2 -RRB- Subject to subsection -LRB- 4 -RRB- , an -LSB- employment tribunal -RSB- shall not consider a complaint under this section unless it is presented before the end of the period of three months beginning with -- -LRB- a -RRB- in the case of a complaint relating to a deduction by the employer , the date of payment of the wages from which the deduction was made , or -LRB- b -RRB- in the case of a complaint relating to a payment received by the employer , the date when the payment was received . 	NAN	NAN	NAN	0.6	lord neuberger, lord rodger, lord walker
133	290	-LRB- 3 -RRB- Where a complaint is brought under this section in respect of -- -LRB- a -RRB- a series of deductions or payments , or -LRB- b -RRB- a number of payments falling within subsection -LRB- 1 -RRB- -LRB- d -RRB- and made in pursuance of demands for payment subject to the same limit under section 21 -LRB- 1 -RRB- but received by the employer on different dates , the references in subsection -LRB- 2 -RRB- to the deduction or payment are to the last deduction or payment in the series or to the last of the payments so received . 	NAN	NAN	NAN	0.6	lord neuberger, lord rodger, lord walker
133	291	-LRB- 4 -RRB- Where the -LSB- employment tribunal -RSB- is satisfied that it was not reasonably practicable for a complaint under this section to be presented before the end of the relevant period of three months , the tribunal may consider the complaint if it is presented within such further period as the tribunal considers reasonable . '' 	NAN	NAN	NAN	0.6	lord neuberger, lord rodger, lord walker
133	292	The correct construction of section 27 of the ERA 50 . 	NAN	NAN	NAN	0.6	lord neuberger, lord rodger, lord walker
133	293	It is common ground that section 13 of the ERA has a wide scope , extending to a variety of statutory and contractual entitlements to liquidated sums , provided always that they fall within the definition of `` wages '' in section 27 . 	NAN	NAN	NAN	0.6	lord neuberger, lord rodger, lord walker
133	294	That definition is at the heart of these appeals . 	NAN	NAN	NAN	0.6	lord neuberger, lord rodger, lord walker
133	295	51 . 	NAN	NAN	NAN	0.6	lord neuberger, lord rodger, lord walker
133	296	It is on its face a very wide definition . 	NAN	NAN	NAN	0.6	lord neuberger, lord rodger, lord walker
133	297	Section 27 -LRB- 1 -RRB- starts with words of a generous ambit , `` Any sums payable to the worker in connection with his employment ... '' The ambit of these words is cut down by the five general exclusions in section 27 -LRB- 2 -RRB- , but none of them has any possible application here . 	NAN	NAN	NAN	0.6	lord neuberger, lord rodger, lord walker
133	298	The wide opening words of section 27 -LRB- 1 -RRB- are then followed -LRB- in the subsection as amended -RRB- by eleven paragraphs of specific inclusions , the first of which is itself in wide and general terms : `` -LRB- a -RRB- any fee , bonus , commission , holiday pay or other emolument referable to his employment , whether payable under his contract or otherwise . '' 	NAN	NAN	NAN	0.6	lord neuberger, lord rodger, lord walker
133	299	The remaining ten paragraphs refer with differing degrees of particularity to various statutory entitlements , including statutory maternity pay -LRB- included in section 27 -LRB- 1 -RRB- -LRB- c -RRB- as originally enacted -RRB- and statutory paternity and adoption pay -LRB- added as paragraphs -LRB- ca -RRB- and -LRB- cb -RRB- by amendments made by the Employment Act 2002 -RRB- . 	NAN	NAN	NAN	0.6	lord neuberger, lord rodger, lord walker
133	300	52 . 	NAN	NAN	NAN	0.6	lord neuberger, lord rodger, lord walker
133	301	Mr Cavanagh QC -LRB- appearing with Mr Tolley for the Revenue -RRB- relied on the absence of any reference to the WTR in the long list of statutory rights enumerated in section 27 -LRB- 1 -RRB- -LRB- b -RRB- to -LRB- j -RRB- . 	NAN	NAN	NAN	0.6	lord neuberger, lord rodger, lord walker
133	302	It was significant , he submitted , that Parliament made amendments specifically mentioning some new rights but had not done the same when the WTR were made in 1998 . 	NAN	NAN	NAN	0.6	lord neuberger, lord rodger, lord walker
