107	0	https://publications.parliament.uk/pa/ld199900/ldjudgmt/jd000217/newell-1.htm 	NAN	NAN	NAN	0	lord hope
107	1	------------- NEW JUDGE --------------- 	NAN	NAN	NAN	0	lord hope
107	2	LORD BROWNE-WILKINSON 	NAN	NAN	NAN	0	lord hope
107	3	My Lords , 	NAN	NAN	NAN	0	lord hope
107	4	I have read the speech prepared by my noble and learned friend , Lord Hope of Craighead . 	lord browne-wilkinson	lord hope	ackn	0	lord hope
107	5	For the reasons which he gives I would dismiss the appeals . 	lord browne-wilkinson	lord hope	fullagr	0	lord hope
107	5	For the reasons which he gives I would dismiss the appeals . 	lord browne-wilkinson	self	outcome	0	lord hope
107	6	------------- NEW JUDGE --------------- 	NAN	NAN	NAN	0	lord hope
107	7	LORD HOPE OF CRAIGHEAD 	NAN	NAN	NAN	0	lord hope
107	8	My Lords , 	NAN	NAN	NAN	0	lord hope
107	9	The appellants in these conjoined appeals were at all material times the freehold owners of parcels of land at Sundorne to the east of Shrewsbury . 	NAN	NAN	NAN	0	lord hope
107	10	I shall refer to them as `` the landowners . '' 	NAN	NAN	NAN	0	lord hope
107	11	It will be convenient to refer to the land owned by Joseph Newell , Elspeth Georgina Longmore and William Hugh Longmore , the Executors of J.V. Longmore , as `` the Longmore land '' and to the land owned by Fletcher Estates -LRB- Harlescott -RRB- Limited as `` the Fletcher land . '' 	NAN	NAN	NAN	0.1	lord hope
107	12	These parcels of land formed , in each case , part of larger areas of land in their respective ownerships . 	NAN	NAN	NAN	0.1	lord hope
107	13	On 30 January 1986 the Secretary of State for Transport gave notice of the making of draft compulsory purchase orders for the acquisition of land including the Fletcher land and the Longmore land for the purpose of constructing the A49 by-pass to the east of Shrewsbury . 	NAN	NAN	NAN	0.1	lord hope
107	14	The date of entry in each case was 5 July 1990 . 	NAN	NAN	NAN	0.1	lord hope
107	15	The landowners then applied , on 19 October 1992 in respect of the Fletcher land and 4 December 1992 in respect of the Longmore land , under section 17 -LRB- 3 -RRB- of the Land Compensation Act 1961 for certificates of appropriate development . 	NAN	NAN	NAN	0.1	lord hope
107	16	On 8 May 1993 the Borough Council issued certificates under section 17 -LRB- 4 -RRB- -LRB- a -RRB- of the Act . 	NAN	NAN	NAN	0.1	lord hope
107	17	In the case of the Fletcher land the certificate was for residential development . 	NAN	NAN	NAN	0.1	lord hope
107	18	In the case of the Longmore land it was for residential and industrial development . 	NAN	NAN	NAN	0.1	lord hope
107	19	The Secretary of State for Transport appealed against those certificates under section 18 of the Act . 	NAN	NAN	NAN	0.1	lord hope
107	20	On 4 July 1996 , having considered the report by an Inspector following a public inquiry held under section 18 -LRB- 3 -RRB- of the Act in Shrewsbury , the Secretary of State for the Environment allowed the appeals , cancelled the certificates which the Borough Council had issued and replaced them with certificates issued under section 17 -LRB- 4 -RRB- -LRB- b -RRB- . 	NAN	NAN	NAN	0.1	lord hope
107	21	In the certificates which he issued the Secretary of State certified that , if the land were not proposed to be acquired by an authority possessing compulsory purchase powers , planning permission would have been granted for the road scheme for which the land was being acquired but that it would not have been granted for any other development . 	NAN	NAN	NAN	0.1	lord hope
107	22	The landowners applied to the High Court under section 21 of the 1961 Act to quash the decisions of the Secretary of State to issue certificates under section 17 -LRB- 4 -RRB- -LRB- b -RRB- of the Act . 	NAN	NAN	NAN	0.1	lord hope
107	23	On 10 June 1997 Dyson J. ordered that the applications be allowed and that the decisions of the Secretary of State be quashed . 	NAN	NAN	NAN	0.1	lord hope
107	24	On 11 June 1998 the Court of Appeal -LRB- Nourse , Peter Gibson and Buxton L.JJ . -RRB- set aside the orders of Dyson J. and restored the decisions of the Secretary of State . 	NAN	NAN	NAN	0.1	lord hope
107	25	Two issues were argued before the Court of Appeal . 	NAN	NAN	NAN	0.1	lord hope
107	26	The first issue related to the date at which the determination of the certificates of appropriate alternative development under section 17 -LRB- 4 -RRB- had to be made . 	NAN	NAN	NAN	0.1	lord hope
107	27	The question was whether this was the date when notice was given of the proposal to acquire the interest in land by the authority possessing compulsory purchase powers , as was held by Dyson J. , or the date of entry to the land by the acquiring authority , as the Secretary of State had contended . 	NAN	NAN	NAN	0.1	lord hope
107	28	The Court of Appeal affirmed the judgment of Dyson J. on this point . 	NAN	NAN	NAN	0.1	lord hope
107	29	The second issue related to the assumption which has to be made by the local planning authority under section 17 -LRB- 4 -RRB- when it is considering the question whether planning permission would have been granted for development if the land were not proposed to be acquired by an authority possessing compulsory purchase powers . 	NAN	NAN	NAN	0.1	lord hope
107	30	The competing arguments on this issue were described by Dyson J. in the following passage in his judgment which , as Buxton L.J. observed in the Court of Appeal -LSB- 1999 -RSB- Q.B. 1144 , 1150C , provides a neat summary of the competing arguments : '' -LSB- The landowners -RSB- contended that the policies and facts applicable at the relevant date should have been viewed as if the bypass scheme had never been conceived at all . 	NAN	NAN	NAN	0.1	lord hope
107	31	-LSB- The Secretary of State -RSB- contended that the policies and facts should be taken on the relevant date as if the scheme had been cancelled on that date , and not as if the scheme had never been conceived at all . '' 	NAN	NAN	NAN	0.1	lord hope
107	32	Dyson J. upheld the landowners ' argument , but the Court of Appeal disagreed with him on this issue . 	NAN	NAN	NAN	0.1	lord hope
107	33	It held that , in making its determination , the local planning authority had to disregard the proposal for acquisition only and not any fact or policy attributable at any time in the past to the underlying scheme . 	NAN	NAN	NAN	0.2	lord hope
107	34	The Court of Appeal gave leave to appeal to the landowners against its decision that the orders of Dyson J. should be set aside . 	NAN	NAN	NAN	0.2	lord hope
107	35	It granted leave to the Secretary of State to cross-appeal on the first issue as to the relevant date for the determination of the certificates . 	NAN	NAN	NAN	0.2	lord hope
107	36	The Secretary of State presented cross-appeals on this issue , and they were conjoined with the appeals which had been presented on the second issue by the landowners . 	NAN	NAN	NAN	0.2	lord hope
107	37	But in his written case the Secretary of State intimated that he no longer wished to pursue his cross-appeals on the first issue . 	NAN	NAN	NAN	0.2	lord hope
107	38	In the result it was common ground before your Lordships that the relevant date for the determination of a certificate of alternative development under section 17 -LRB- 4 -RRB- of the Act of 1961 is the date of the notice that the interest in land is proposed to be acquired by an authority possessing powers of compulsory acquisition . 	NAN	NAN	NAN	0.2	lord hope
107	39	That is the date which is described in section 22 -LRB- 2 -RRB- of the Act . 	NAN	NAN	NAN	0.2	lord hope
107	40	The issue on which your Lordships heard argument was the second issue , as to the assumption which has to be made by the local planning authority when it is determining the application for a certificate . 	NAN	NAN	NAN	0.2	lord hope
107	41	The statutory framework The certification by planning authorities of appropriate alternative development is an important part of the law relating to the assessment of compensation for the compulsory acquisition of interests in land which was consolidated by the Land Compensation Act 1961 . 	NAN	NAN	NAN	0.2	lord hope
107	42	Section 1 of that Act provides that questions of disputed compensation are to be determined by the Lands Tribunal . 	NAN	NAN	NAN	0.2	lord hope
107	43	The provisions for determining the amount of compensation are set out in Part II of the Act . 	NAN	NAN	NAN	0.2	lord hope
107	44	The basic rules are laid down in section 5 . 	NAN	NAN	NAN	0.2	lord hope
107	45	Among these rules are rule -LRB- 1 -RRB- which states that no allowance shall be made on account of the acquisition being compulsory , and rule -LRB- 2 -RRB- which states that the value of land shall , subject to the qualifications in the remaining rules , be taken to be the amount which the land if sold in the open market by a willing seller might be expected to realise . 	NAN	NAN	NAN	0.2	lord hope
107	46	Section 9 adds to these basic rules another rule which is expressed in these terms -LRB- as amended by section 108 of and Schedule 11 to the Town and Country Planning Act 1968 -RRB- : `` No account shall be taken of any depreciation of the value of the relevant interest which is attributable to the fact that -LRB- whether by way of allocation or other particulars contained in the current development plan , or by any other means -RRB- an indication has been given that the relevant land is , or is likely , to be acquired by an authority possessing compulsory purchase powers . '' 	NAN	NAN	NAN	0.2	lord hope
107	47	Applying the Pointe Gourde principle -LRB- Pointe Gourde Quarrying and Transport Co. Ltd. v. Sub-Intendent of Crown Lands -LSB- 1947 -RSB- A.C. 565 -RRB- , the reverse situation is regulated by the common law . 	NAN	NAN	NAN	0.2	lord hope
107	48	The compensation can not include an increase in value which is due to the scheme underlying the acquisition . 	NAN	NAN	NAN	0.2	lord hope
107	49	So the whole question must be approached upon a consideration of the state of affairs which would have existed if there had been no scheme . 	NAN	NAN	NAN	0.2	lord hope
107	50	But the value of land can not be determined under these rules without making assumptions about the planning permission , if any , which would have been granted for the development of the land if it were not proposed to be acquired compulsorily . 	NAN	NAN	NAN	0.2	lord hope
107	51	Section 14 provides that the assumptions which are to be made for the purpose of assessing compensation are those set out in sections 15 and 16 , and that any planning permission which is to be assumed in accordance with any of the provisions of those sections is in addition to any planning permission which may be in force at the date of service of the notice to treat . 	NAN	NAN	NAN	0.2	lord hope
107	52	These provisions must be read together with those in Part III of the Act relating to certificates of appropriate alternative development , with which they are linked in two ways . 	NAN	NAN	NAN	0.2	lord hope
107	53	Section 14 -LRB- 3 -RRB- provides that , in determining whether planning permission for any development could reasonably have been expected to be granted in any particular circumstances , regard shall be had to any contrary opinion expressed in relation to that land in any certificate issued under Part III . 	NAN	NAN	NAN	0.2	lord hope
107	54	This is a reference to a certificate issued under section 17 -LRB- 4 -RRB- -LRB- b -RRB- , which is conveniently referred to as a negative certificate . 	NAN	NAN	NAN	0.3	lord hope
107	55	Section 15 -LRB- 5 -RRB- provides that , where a certificate has been issued under Part III , it shall be assumed that any planning permission which , according to the certificate , might reasonably have been expected to be granted in respect of the land or part thereof would be so granted . 	NAN	NAN	NAN	0.3	lord hope
107	56	This is a reference to a certificate issued under section 17 -LRB- 4 -RRB- -LRB- a -RRB- , referred to as a positive certificate . 	NAN	NAN	NAN	0.3	lord hope
107	57	As Lord Bridge of Harwich explained in Grampian Regional Council v. Secretary of State for Scotland -LSB- 1993 -RSB- 1 W.L.R. 1340 , 1343H-1344B : `` The sole purpose of the certification procedure is to provide a basis for determining the development value , if any , to be taken into account in assessing the compensation payable on compulsory acquisition . 	NAN	NAN	NAN	0.3	lord hope
107	58	If a positive certificate is issued , it is to be assumed that the certified permission would be granted , subject to such conditions and at such future time , if any , as may be specified in the certificate ... If a negative certificate is issued , `` regard is to be had '' to the negative opinion certified ... Although this is not conclusive , it is difficult to envisage a situation in practice in which the Lands Tribunal , when assessing compensation , could be persuaded to act on a contrary opinion to that certified by the planning authority or the Secretary of State on appeal . '' 	NAN	NAN	NAN	0.3	lord hope
107	59	The certification procedure which Part III lays down is set out in section 17 . 	NAN	NAN	NAN	0.3	lord hope
107	60	Subsection -LRB- 1 -RRB- of that section , as substituted by section 65 -LRB- 1 -RRB- of the Planning and Compensation Act 1991 , provides that , where an interest in land is proposed to be acquired by an authority possessing compulsory purchase powers , either of the parties may apply to the local planning authority for a certificate under that section . 	NAN	NAN	NAN	0.3	lord hope
107	61	That subsection must be read together with section 22 -LRB- 2 -RRB- of the Act of 1961 , which prescribes the circumstances in which , for the purposes of sections 17 and 18 , `` an interest in land shall be taken to be an interest proposed to be acquired by an authority possessing compulsory purchase powers . '' 	NAN	NAN	NAN	0.3	lord hope
107	62	There are three prescribed circumstances , namely -LRB- a -RRB- the publication or service of a notice of the making of a compulsory purchase order ; -LRB- b -RRB- the service of a notice to purchase under any enactment ; and -LRB- c -RRB- the making of an offer to negotiate for the purchase by or on behalf of the authority . 	NAN	NAN	NAN	0.3	lord hope
107	63	In the present case the landowners ' interests in the Fletcher land and the Longmore land respectively became interests in land which were `` proposed to be acquired by an authority possessing compulsory powers '' for the purposes of section 17 when the Secretary of State gave notice on 30 January 1986 of the making of the draft compulsory purchase orders . 	NAN	NAN	NAN	0.3	lord hope
107	64	The procedure which section 17 lays down deals with the making of the application for the certificate and its determination by the local planning authority . 	NAN	NAN	NAN	0.3	lord hope
107	65	The relevant provisions , as substituted -LRB- in the case of subsection -LRB- 4 -RRB- -RRB- by section 65 of the Act of 1991 , are these : '' -LRB- 3 -RRB- An application for a certificate under this section - -LRB- a -RRB- shall state whether or not there are , in the applicant 's opinion , any classes of development which , either immediately or at a future time , would be appropriate for the land in question if it were not proposed to be acquired by any authority possessing compulsory purchase powers and , if so , shall specify the classes of development and the times at which they would be so appropriate ; -LRB- b -RRB- shall state the applicant 's grounds for holding that opinion ; and -LRB- c -RRB- shall be accompanied by a statement specifying the date on which a copy of the application has been or will be served on the other party directly concerned . 	NAN	NAN	NAN	0.3	lord hope
107	66	-LRB- 4 -RRB- Where an application is made to the local planning authority for a certificate under this section in respect of an interest in land , the local planning authority shall , not earlier than 21 days after the date specified in the statement mentioned in paragraph -LRB- c -RRB- of subsection -LRB- 3 -RRB- of this section , issue to the applicant a certificate stating either of the following to be the opinion of the local planning authority regarding the grant of planning permission in respect of the land in question , if it were not proposed to be acquired by an authority possessing compulsory purchase powers , that is to say - -LRB- a -RRB- that planning permission would have been granted for development of one or more classes specified in the certificate -LRB- whether specified in the application or not -RRB- and for any development for which the land is to be acquired , but would not have been granted for any other development ; or -LRB- b -RRB- that planning permission would have been granted for any development for which the land is to be acquired , but would not have been granted for any other development , and for the purposes of this subsection development is development for which the land is to be acquired if the land is to be acquired for purposes which involve the carrying out of proposals of the acquiring authority for that development . '' 	NAN	NAN	NAN	0.3	lord hope
107	67	Section 17 -LRB- 7 -RRB- provides that , in determining whether planning permission for any particular class of development would have been expected to be granted , the local planning authority shall not treat development of that class as development for which planning permission would have been refused by reason only that it would have involved development otherwise than in accordance with the development plan . 	NAN	NAN	NAN	0.3	lord hope
107	68	The facts It is now necessary for me to say a bit more about the facts in order to set the scene for an examination of the issue as to the assumption which the local planning authority must make when it is determining the application for a certificate . 	NAN	NAN	NAN	0.3	lord hope
107	69	A scheme for an improvement of the A49 to the east of Shrewsbury was originally proposed as part of the 1952 Shrewsbury Town Map . 	NAN	NAN	NAN	0.3	lord hope
107	70	A protected route for an A49 by-pass was first defined across the Fletcher land and the Longmore land in November 1970 . 	NAN	NAN	NAN	0.3	lord hope
107	71	The effect of this , in terms of Article 9 of the Town and Country Planning General Development Order 1963 as amended , was that any planning application affecting land within 220 feet of the proposed route had to be referred to the Minister of Transport . 	NAN	NAN	NAN	0.3	lord hope
107	72	Between 1963 and 1971 planning permission for residential development was refused on six occasions on various parcels of land owned by Fletcher Estates Limited because of the proposal for the by-pass . 	NAN	NAN	NAN	0.3	lord hope
107	73	During the early 1970s , in response to a Department of the Environment Circular directing local authorities to release more land for housing , Shropshire County Council drew up advisory plans for the development of four areas in and around Shrewsbury . 	NAN	NAN	NAN	0.3	lord hope
107	74	One of these , the Sundorne Advisory Plan , was adopted by the County Council in May 1973 . 	NAN	NAN	NAN	0.3	lord hope
107	75	This plan included land for housing to the west of the protected route for the by-pass and to the north of it . 	NAN	NAN	NAN	0.3	lord hope
107	76	But land on the protected route and to the east of it was excluded from the proposed housing development . 	NAN	NAN	NAN	0.4	lord hope
107	77	The Shropshire County Structure Plan , which was approved in February 1980 , required the urgent identification of additional housing land . 	NAN	NAN	NAN	0.4	lord hope
107	78	In 1984 a public inquiry was held into the scheme for the by-pass . 	NAN	NAN	NAN	0.4	lord hope
107	79	Consideration was given to an alternative route identified by the objectors which lay to the east of the Fletcher land and the Longmore land . 	NAN	NAN	NAN	0.4	lord hope
107	80	In 1985 it was confirmed that the A49 by-pass would be built on the alignment of the preferred route across the Fletcher land and the Longmore land which had been defined in 1970 . 	NAN	NAN	NAN	0.4	lord hope
107	81	In the Shrewsbury Urban Area Local Plan , which was adopted in June 1985 , the preferred route for the A49 by-pass across the Fletcher land and the Longmore land was protected and it was thus shown as not available for any other development . 	NAN	NAN	NAN	0.4	lord hope
107	82	The Plan allocated a large area of land for development for housing at The Moveage in the urban area of Shrewsbury . 	NAN	NAN	NAN	0.4	lord hope
107	83	From this brief history it can be seen that the scheme for the A49 by-pass can be traced back to 1952 , when the improvement scheme was first included in the Shrewsbury Town Map . 	NAN	NAN	NAN	0.4	lord hope
107	84	By 1970 the route for the by-pass had been clearly identified . 	NAN	NAN	NAN	0.4	lord hope
107	85	From that date onwards until the date when the notice of the making of the proposed compulsory purchase orders was published this had the effect that the Fletcher land and the Longmore land was excluded from consideration as land for residential and other development . 	NAN	NAN	NAN	0.4	lord hope
107	86	This was on the ground that they lay on the route of the proposed by-pass . 	NAN	NAN	NAN	0.4	lord hope
107	87	The larger areas of land to the east in the same ownership were also excluded from development . 	NAN	NAN	NAN	0.4	lord hope
107	88	Other land was identified as suitable for development to meet the need for more land for housing in the area . 	NAN	NAN	NAN	0.4	lord hope
107	89	The Inspector concluded , after considering the evidence led at the public inquiry under section 18 -LRB- 3 -RRB- of the Act of 1961 , that there was no reasonable basis for considering residential development as appropriate on any part of the Fletcher land or residential and industrial development as appropriate on any part of the Longmore land as at 30 January 1986 , which was the date of the publication of the notice of the proposed compulsory purchase orders , if it was to be assumed that the by-pass would have been built on the alternative route to the east which was considered and rejected at the 1984 inquiry . 	NAN	NAN	NAN	0.4	lord hope
107	90	The Secretary of State for the Environment , acting on the same assumption , accepted the Inspector 's conclusions on this point when he decided to cancel the certificates issued by the local planning authority and to replace them with negative certificates . 	NAN	NAN	NAN	0.4	lord hope
107	91	The issue in this appeal It is now possible to identify more precisely the issue which divided the parties to this appeal , bearing in mind that they were agreed that the relevant date for determining the content of the certificates of alternative development is the date of publication of the notices of the proposed compulsory purchase orders . 	NAN	NAN	NAN	0.4	lord hope
107	92	The issue relates to the meaning and effect of the direction in section 17 -LRB- 4 -RRB- of the Act of 1961 that the local planning authority must issue its opinion regarding the grant of planning permission in respect of the land in question `` if it were not proposed to be acquired by an authority possessing compulsory purchase powers . '' 	NAN	NAN	NAN	0.4	lord hope
107	93	It is plain that the assumption which the local planning authority is directed to make by this subsection requires it to ignore the fact that an interest in the land is proposed to be acquired by an authority possessing compulsory purchase powers as described in section 22 -LRB- 2 -RRB- . 	NAN	NAN	NAN	0.4	lord hope
107	94	This involves disregarding the publication of the notice of the proposed compulsory purchase order , which is the circumstance referred to in section 22 -LRB- 2 -RRB- -LRB- a -RRB- that is relevant to this case . 	NAN	NAN	NAN	0.4	lord hope
107	95	The question is - how much else must the local planning authority disregard when making its assumption ? 	NAN	NAN	NAN	0.4	lord hope
107	96	Mr. Ouseley Q.C. for the Secretary of State accepted that the assumption extended to the proposal that the land was to be acquired by an authority possessing compulsory purchase powers for the purposes of the A49 by-pass as it stood at the relevant date . 	NAN	NAN	NAN	0.4	lord hope
107	97	As at that date the route for the proposed by-pass was shown as a protected route on the Shrewsbury Urban Area Local Plan . 	NAN	NAN	NAN	0.5	lord hope
107	98	He accepted that it would not be possible to make sense of section 17 -LRB- 4 -RRB- if that proposal could be taken into account by the local planning authority when it was considering the content of the certificate , as this was the same proposal as that which had led to publication of the notices that the land was to be acquired compulsorily . 	NAN	NAN	NAN	0.5	lord hope
107	99	He accepted that , if the planning status of the land was to be considered on the basis that it was to be assumed that the land was not proposed to be acquired compulsorily on the relevant date , the proposal underlying that acquisition as it stood at the relevant date must also be disregarded . 	NAN	NAN	NAN	0.5	lord hope
107	100	So , when the assumption was made that the section 22 -LRB- 2 -RRB- -LRB- a -RRB- notices had been cancelled , the underlying proposal which led to the publication of those notices must also be assumed to have been cancelled as at the relevant date Mr. Purchas Q.C. for the landowners submitted that the statutory assumption required the local planning authority to disregard not only the underlying proposal as it stood at the relevant date but also all the effects of that proposal which had arisen before that date . 	NAN	NAN	NAN	0.5	lord hope
107	101	According to his argument it was necessary , in order to give effect to the statutory assumption , to eliminate all the consequences of the safeguarding of the proposed route for the by-pass from the date when the proposal first began to affect the planning history of the land which was proposed to be acquired . 	NAN	NAN	NAN	0.5	lord hope
