209	367	It is of course open to the court to say that the act in question falls wholly outside the ambit of the discretionary power . 	NAN	NAN	NAN	0.7	lord bingham, lord hoffmann
209	368	But that is not the case here . 	NAN	NAN	NAN	0.7	lord bingham, lord hoffmann
209	369	The decision to go to war , whether one thinks it was right or wrong , fell squarely within the discretionary powers of the Crown to defend the realm and conduct its foreign affairs . 	NAN	NAN	NAN	0.7	lord bingham, lord hoffmann
209	370	67 . 	NAN	NAN	NAN	0.7	lord bingham, lord hoffmann
209	371	To say that these matters are not justiciable may be simply another way of putting the same point . 	NAN	NAN	NAN	0.7	lord bingham, lord hoffmann
209	372	But I would not accept the implication , inherent in the way the certified questions are formulated , that one can first decide whether aggression is a crime in English domestic law and then go on to consider whether the issues which it raises are justiciable . 	NAN	NAN	NAN	0.7	lord bingham, lord hoffmann
209	373	Mr Rabinder Singh QC , who appeared for the defendants in Ayliffe v Director of Public Prosecutions submitted that it would be contrary to the right to a fair trial under article 6 of the Convention for a defendant to be told that he could not rely on a defence otherwise open to him because it raised questions which were not justiciable . 	NAN	NAN	NAN	0.7	lord bingham, lord hoffmann
209	374	There seemed to me to be much force in this submission . 	NAN	NAN	NAN	0.7	lord bingham, lord hoffmann
209	375	But , as Mr Singh readily acknowledged , article 6 does not require that , as a matter of substantive criminal law , any particular defence should be available to the defendant : compare Matthews v Ministry of Defence -LSB- 2003 -RSB- 1 AC 1163 . 	NAN	NAN	NAN	0.7	lord bingham, lord hoffmann
209	376	The discretionary nature or non-justiciability of the power to make war is in my opinion simply one of the reasons why aggression is not a crime in domestic law . 	NAN	NAN	NAN	0.7	lord bingham, lord hoffmann
209	377	It follows that an intention to prevent aggression can not be a defence under section 3 of the 1967 Act . 	NAN	NAN	NAN	0.7	lord bingham, lord hoffmann
209	378	Disposition 68 . 	NAN	NAN	NAN	0.7	lord bingham, lord hoffmann
209	379	It follows that the first part of the certified question in R v Jones -LRB- Margaret -RRB- can be answered no and that is sufficient to enable the appeals by the defendants to be dismissed . 	NAN	NAN	NAN	0.7	lord bingham, lord hoffmann
209	380	As the prosecution has not appealed , there is no need to answer the second certified question and , since the appeal is interlocutory and the case must go back to the Bristol Crown Court for trial , it is unnecessary to say anything more about it . 	NAN	NAN	NAN	0.7	lord bingham, lord hoffmann
209	381	69 . 	NAN	NAN	NAN	0.7	lord bingham, lord hoffmann
209	382	The first parts of the certified questions in Ayliffe v Director of Public Prosecutions can likewise be answered no and the appeals dismissed . 	NAN	NAN	NAN	0.7	lord bingham, lord hoffmann
209	383	But Mr David Perry , who appeared for the prosecution in the latter case , invited your Lordships , in both his printed case and oral submissions , to dismiss the appeals on broader grounds . 	NAN	NAN	NAN	0.7	lord bingham, lord hoffmann
209	384	These raised issues of very considerable public importance concerning the scope of justification for acts of civil disobedience . 	NAN	NAN	NAN	0.7	lord bingham, lord hoffmann
209	385	Mr Keir Starmer QC , who appeared for the appellants in R v Jones -LRB- Margaret -RRB- , said that the House should confine itself to the certified questions and not say anything about the grounds upon which Mr Perry relied . 	NAN	NAN	NAN	0.7	lord bingham, lord hoffmann
209	386	But the jurisdiction of the House in dealing with the appeals is not limited to answering the certified questions : see Attorney-General for Northern Ireland v Gallagher -LSB- 1963 -RSB- AC 349 and your Lordships may dispose of the proceedings in Ayliffe v Director of Public Prosecutions on any grounds which appear to be appropriate . 	NAN	NAN	NAN	0.7	lord bingham, lord hoffmann
209	387	Those proceedings will now be finally concluded . 	NAN	NAN	NAN	0.7	lord bingham, lord hoffmann
209	388	I do not think that your Lordships should refrain from expressing your opinions on matters fairly raised by the respondents simply because they may be thought to have some relevance to the conduct of the trial in R v Jones -LRB- Margaret -RRB- when it returns to the Bristol Crown Court . 	NAN	NAN	NAN	0.7	lord bingham, lord hoffmann
209	389	That will be a matter for the judge at the trial . 	NAN	NAN	NAN	0.7	lord bingham, lord hoffmann
209	390	70 . 	NAN	NAN	NAN	0.7	lord bingham, lord hoffmann
209	391	Put shortly , Mr Perry 's submission was that even if aggression was a crime in domestic law and the defendants honestly believed that the United Kingdom was about to commit it , section 3 of the 1967 Act would not justify the action which they took . 	NAN	NAN	NAN	0.7	lord bingham, lord hoffmann
209	392	The section says that a person may use `` such force as is reasonable '' and it was not reasonable in all the circumstances for the defendants to have taken it into their own hands to use any force at all . 	NAN	NAN	NAN	0.7	lord bingham, lord hoffmann
209	393	71 . 	NAN	NAN	NAN	0.7	lord bingham, lord hoffmann
209	394	My Lords , 	NAN	NAN	NAN	0.7	lord bingham, lord hoffmann
209	395	I pass over the question of whether damaging property counts as the use of force within the meaning of section 3 of the 1967 Act . 	NAN	NAN	NAN	0.7	lord bingham, lord hoffmann
209	396	There is much to be said for the view that offences against property have their own provisions for justification , such as `` reasonable excuse '' as defined in section 5 of the 1971 Act and that `` force '' in section 3 means force against persons committing crimes or escaping arrest . 	NAN	NAN	NAN	0.7	lord bingham, lord hoffmann
209	397	But I am willing to assume for the sake of argument that chaining oneself to railings or putting sugar into the petrol tanks of lorries involves the use of force for the purposes of section 3 of the 1967 Act . 	NAN	NAN	NAN	0.7	lord bingham, lord hoffmann
209	398	72 . 	NAN	NAN	NAN	0.7	lord bingham, lord hoffmann
209	399	In R v Baker and Wilkins -LSB- 1997 -RSB- Crim LR 497 the Court of Appeal decided that in considering whether a defendant was entitled to rely upon section 3 , it must be assumed that the events which the defendant apprehended were actually going to happen . 	NAN	NAN	NAN	0.7	lord bingham, lord hoffmann
209	400	Provided that his belief was honest , it did not matter that it was unreasonable . 	NAN	NAN	NAN	0.7	lord bingham, lord hoffmann
209	401	If those events would in law constitute a crime , he was entitled to use such force as was reasonable to prevent it . 	NAN	NAN	NAN	0.7	lord bingham, lord hoffmann
209	402	73 . 	NAN	NAN	NAN	0.7	lord bingham, lord hoffmann
209	403	My Lords , 	NAN	NAN	NAN	0.7	lord bingham, lord hoffmann
209	404	I have no difficulty with these propositions . 	NAN	NAN	NAN	0.7	lord bingham, lord hoffmann
209	405	I am willing to assume that , in judging whether the defendant acted reasonably , it must be assumed that the facts were as he honestly believed them to be . 	NAN	NAN	NAN	0.7	lord bingham, lord hoffmann
209	406	But the question remains as to whether in such circumstances his use of force would be reasonable . 	NAN	NAN	NAN	0.7	lord bingham, lord hoffmann
209	407	And that is an objective question . 	NAN	NAN	NAN	0.7	lord bingham, lord hoffmann
209	408	The position may be different under section 5 of the 1971 Act but section 3 of the 1967 Act does not excuse a defendant if he uses such force as he himself thinks to be reasonable . 	NAN	NAN	NAN	0.7	lord bingham, lord hoffmann
209	409	It must actually have been reasonable . 	NAN	NAN	NAN	0.7	lord bingham, lord hoffmann
209	410	74 . 	NAN	NAN	NAN	0.7	lord bingham, lord hoffmann
209	411	The crucial question , in my opinion , is whether one judges the reasonableness of the defendant 's actions as if he was the sheriff in a Western , the only law man in town , or whether it should be judged in its actual social setting , in a democratic society with its own appointed agents for the enforcement of the law . 	NAN	NAN	NAN	0.8	lord bingham, lord hoffmann
209	412	I take , by way of example only , the statement by Margaret Jones and Paul Milling appended to their printed case , which states their beliefs when they entered RAF Fairford : 75 . 	NAN	NAN	NAN	0.8	lord bingham, lord hoffmann
209	413	That is a fair picture of what an observer from the United Kingdom would have thought of a somewhat ineffectual attempt by a Second World War résistante to sabotage a German airfield in occupied France . 	NAN	NAN	NAN	0.8	lord bingham, lord hoffmann
209	414	It assumes the defendant to be a lonely individual resisting the acts of a hostile and alien state to which she owes no loyalty . 	NAN	NAN	NAN	0.8	lord bingham, lord hoffmann
209	415	But the state in this case was the defendant 's own state , the state which protected and sustained her and to which she owed allegiance . 	NAN	NAN	NAN	0.8	lord bingham, lord hoffmann
209	416	And the legal system which had to judge the reasonableness of her actions was that of the United Kingdom itself . 	NAN	NAN	NAN	0.8	lord bingham, lord hoffmann
209	417	76 . 	NAN	NAN	NAN	0.8	lord bingham, lord hoffmann
209	418	It is a fundamental characteristic of the state as a social structure that , in the classic formulation of Max Weber -LRB- Politics as a Vocation -LRB- Politik als Beruf -RRB- , 1918 -RRB- , it 77 . 	NAN	NAN	NAN	0.8	lord bingham, lord hoffmann
209	419	That formulation does not of course answer the questions which arise in these appeals , because the appellants say that the state , by its legislation , did indeed permit them to use physical force in the circumstances which existed , or which they honestly thought to exist . 	NAN	NAN	NAN	0.8	lord bingham, lord hoffmann
209	420	But when Parliament speaks of a person being entitled to use such force as is reasonable in the circumstances , the court must , in judging what is reasonable , take into account the reason why the state claims the monopoly of the legitimate use of physical force . 	NAN	NAN	NAN	0.8	lord bingham, lord hoffmann
209	421	A tight control of the use of force is necessary to prevent society from sliding into anarchy , what Hobbes -LRB- Leviathan , Chapter 13 -RRB- called the state of nature in which 78 . 	NAN	NAN	NAN	0.8	lord bingham, lord hoffmann
209	422	In principle , therefore , the state entrusts the power to use force only to the armed forces , the police and other similarly trained and disciplined law enforcement officers . 	NAN	NAN	NAN	0.8	lord bingham, lord hoffmann
209	423	Ordinary citizens who apprehend breaches of the law , whether affecting themselves , third parties or the community as a whole , are normally expected to call in the police and not to take the law into their own hands . 	NAN	NAN	NAN	0.8	lord bingham, lord hoffmann
209	424	In Southwark London Borough Council v Williams -LSB- 1971 -RSB- Ch 734 , 745 Edmund Davies LJ said : 79 . 	NAN	NAN	NAN	0.8	lord bingham, lord hoffmann
209	425	There are exceptions when the threat of serious unlawful injury is imminent and it is not practical to call for help . 	NAN	NAN	NAN	0.8	lord bingham, lord hoffmann
209	426	The most obvious example is the right of self-defence . 	NAN	NAN	NAN	0.8	lord bingham, lord hoffmann
209	427	As Hobbes said -LRB- Leviathan , Chapter 27 -RRB- : But , he went on to say : 80 . 	NAN	NAN	NAN	0.8	lord bingham, lord hoffmann
209	428	In the same spirit as Hobbes , Lord Upjohn said in Burmah Oil Co Ltd v Lord Advocate -LSB- 1965 -RSB- AC 75 , 164 - 165 : 81 . 	NAN	NAN	NAN	0.8	lord bingham, lord hoffmann
209	429	What is true of the use of self-help to protect one 's own interests is a fortiori true of the use of self-help to protect the interests of third parties or the community at large . 	NAN	NAN	NAN	0.8	lord bingham, lord hoffmann
209	430	In a moment of emergency , when individual action is necessary to prevent some imminent crime or to apprehend an escaping criminal , it may be legitimate , praiseworthy even , for the citizen to use force on his own initiative . 	NAN	NAN	NAN	0.8	lord bingham, lord hoffmann
209	431	But when law enforcement officers , if called upon , would be in a position to do whatever is necessary , the citizen must leave the use of force to them . 	NAN	NAN	NAN	0.8	lord bingham, lord hoffmann
209	432	82 . 	NAN	NAN	NAN	0.8	lord bingham, lord hoffmann
209	433	What if the sovereign power , when called , will not come ? 	NAN	NAN	NAN	0.8	lord bingham, lord hoffmann
209	434	Sometimes this is for operational reasons , as when the police lack the resources to provide protection -LRB- see , for example , R v Chief Constable of Sussex , Ex p International Trader 's Ferry Ltd -LSB- 1999 -RSB- 2 AC 418 -RRB- . 	NAN	NAN	NAN	0.8	lord bingham, lord hoffmann
209	435	A citizen whose person or property is under threat would in such a case be entitled to take reasonable steps to protect himself . 	NAN	NAN	NAN	0.8	lord bingham, lord hoffmann
209	436	So in R v Chief Constable of Devon and Cornwall , Ex p Central Electricity Generating Board -LSB- 1982 -RSB- QB 458 , where the police refused to intervene to prevent protesters from obstructing a survey of land with a view to building a nuclear power station , the Court of Appeal said that the Board was legally entitled to use reasonable force to repel the protesters . 	NAN	NAN	NAN	0.8	lord bingham, lord hoffmann
209	437	But the court did its best to discourage them from exercising this right . 	NAN	NAN	NAN	0.8	lord bingham, lord hoffmann
209	438	Lord Denning MR suggested that the Board should be content with erecting a barbed wire fence . 	NAN	NAN	NAN	0.8	lord bingham, lord hoffmann
209	439	83 . 	NAN	NAN	NAN	0.8	lord bingham, lord hoffmann
209	440	The right of the citizen to use force on his own initiative is even more circumscribed when he is not defending his own person or property but simply wishes to see the law enforced in the interests of the community at large . 	NAN	NAN	NAN	0.8	lord bingham, lord hoffmann
209	441	The law will not tolerate vigilantes . 	NAN	NAN	NAN	0.8	lord bingham, lord hoffmann
209	442	If the citizen can not get the courts to order the law enforcement authorities to act -LRB- compare R v Commissioner of Police of the Metropolis , Ex p Blackburn -LSB- 1968 -RSB- 2 QB 118 -RRB- then he must use democratic methods to persuade the government or legislature to intervene . 	NAN	NAN	NAN	0.8	lord bingham, lord hoffmann
209	443	84 . 	NAN	NAN	NAN	0.8	lord bingham, lord hoffmann
209	444	Often the reason why the sovereign power will not intervene is because it takes the view that the threatened action is not a crime . 	NAN	NAN	NAN	0.8	lord bingham, lord hoffmann
209	445	In such a case too , the citizen is not entitled to take the law into his own hands . 	NAN	NAN	NAN	0.8	lord bingham, lord hoffmann
209	446	The rule of law requires that disputes over whether action is lawful should be resolved by the courts . 	NAN	NAN	NAN	0.8	lord bingham, lord hoffmann
209	447	If the citizen is dissatisfied with the law as laid down by the courts , he must campaign for Parliament to change it . 	NAN	NAN	NAN	0.8	lord bingham, lord hoffmann
209	448	So in Monsanto v Tilly -LSB- 2000 -RSB- Env LR 313 a landowner claimed an injunction against protesters who threatened to trespass upon his land and dig up genetically modified crops . 	NAN	NAN	NAN	0.8	lord bingham, lord hoffmann
209	449	They claimed to be acting in the public interest and to protect third parties from damage which the crops might cause . 	NAN	NAN	NAN	0.8	lord bingham, lord hoffmann
209	450	The Court of Appeal said that this was no defence . 	NAN	NAN	NAN	0.8	lord bingham, lord hoffmann
209	451	Mummery LJ said -LRB- at p 338 -RRB- : 85 . 	NAN	NAN	NAN	0.8	lord bingham, lord hoffmann
209	452	It was clear that the Department , if called upon , would have done nothing to stop the growing of the genetically modified crops . 	NAN	NAN	NAN	0.8	lord bingham, lord hoffmann
209	453	It had granted Monsanto a licence under the relevant legislation for the specific purpose of enabling them to be grown . 	NAN	NAN	NAN	0.8	lord bingham, lord hoffmann
209	454	But , as Stuart-Smith LJ pointed out -LRB- at p 329 -RRB- , the protesters ' remedy , if any , was to challenge the legality of the licence by judicial review . 	NAN	NAN	NAN	0.8	lord bingham, lord hoffmann
209	455	Or , if that failed , they could seek to have the law changed . 	NAN	NAN	NAN	0.8	lord bingham, lord hoffmann
209	456	But that must be effected by lawful means . 	NAN	NAN	NAN	0.8	lord bingham, lord hoffmann
209	457	Whatever the honest apprehension of danger to the community , it is not reasonable to resort to force . 	NAN	NAN	NAN	0.8	lord bingham, lord hoffmann
209	458	86 . 	NAN	NAN	NAN	0.8	lord bingham, lord hoffmann
209	459	My Lords , 	NAN	NAN	NAN	0.8	lord bingham, lord hoffmann
209	460	to legitimate the use of force in such cases would be to set a most dangerous precedent . 	NAN	NAN	NAN	0.8	lord bingham, lord hoffmann
209	461	As Lord Prosser said in Lord Advocate 's Reference No 1 of 2000 2001 JC 143 , 160G-H : 87 . 	NAN	NAN	NAN	0.8	lord bingham, lord hoffmann
209	462	A time of war is the extreme example of the dangers . 	NAN	NAN	NAN	0.8	lord bingham, lord hoffmann
209	463	Of course citizens are entitled , indeed required , to refuse to participate in war crimes . 	NAN	NAN	NAN	0.8	lord bingham, lord hoffmann
209	464	But if they are allowed to use force against military installations simply to give effect to their own honestly held view of the legality of what the armed forces of the Crown are doing , the Statute of Treason would become a dead letter . 	NAN	NAN	NAN	0.8	lord bingham, lord hoffmann
209	465	88 . 	NAN	NAN	NAN	0.9	lord bingham, lord hoffmann
209	466	In my opinion , therefore , the District Judges would have been right to convict even if aggression had been a crime in domestic law . 	NAN	NAN	NAN	0.9	lord bingham, lord hoffmann
209	467	The apprehension , however honest , that such a crime was about to be committed could not have made it reasonable for the defendants to use force of any kind to obstruct military activities at Marchwood or Fairford . 	NAN	NAN	NAN	0.9	lord bingham, lord hoffmann
209	468	89 . 	NAN	NAN	NAN	0.9	lord bingham, lord hoffmann
209	469	My Lords , 	NAN	NAN	NAN	0.9	lord bingham, lord hoffmann
209	470	civil disobedience on conscientious grounds has a long and honourable history in this country . 	NAN	NAN	NAN	0.9	lord bingham, lord hoffmann
209	471	People who break the law to affirm their belief in the injustice of a law or government action are sometimes vindicated by history . 	NAN	NAN	NAN	0.9	lord bingham, lord hoffmann
209	472	The suffragettes are an example which comes immediately to mind . 	NAN	NAN	NAN	0.9	lord bingham, lord hoffmann
209	473	It is the mark of a civilised community that it can accommodate protests and demonstrations of this kind . 	NAN	NAN	NAN	0.9	lord bingham, lord hoffmann
209	474	But there are conventions which are generally accepted by the law-breakers on one side and the law-enforcers on the other . 	NAN	NAN	NAN	0.9	lord bingham, lord hoffmann
209	475	The protesters behave with a sense of proportion and do not cause excessive damage or inconvenience . 	NAN	NAN	NAN	0.9	lord bingham, lord hoffmann
209	476	And they vouch the sincerity of their beliefs by accepting the penalties imposed by the law . 	NAN	NAN	NAN	0.9	lord bingham, lord hoffmann
209	477	The police and prosecutors , on the other hand , behave with restraint and the magistrates impose sentences which take the conscientious motives of the protesters into account . 	NAN	NAN	NAN	0.9	lord bingham, lord hoffmann
209	478	The conditional discharges ordered by the magistrates in the cases which came before them exemplifies their sensitivity to these conventions . 	NAN	NAN	NAN	0.9	lord bingham, lord hoffmann
209	479	90 . 	NAN	NAN	NAN	0.9	lord bingham, lord hoffmann
209	480	These appeals and similar cases concerned with controversial activities such as animal experiments , fox hunting , genetically modified crops , nuclear weapons and the like , suggest the emergence of a new phenomenon , namely litigation as the continuation of protest by other means . 	NAN	NAN	NAN	0.9	lord bingham, lord hoffmann
209	481	-LRB- See , for examples , R v Hill -LRB- 1988 -RRB- 89 Cr App R 74 -LRB- nuclear weapons -RRB- Blake v Director of Public Prosecutions -LSB- 1993 -RSB- Crim LR 586 -LRB- Gulf War -RRB- Morrow , Geach and Thomas v Director of Public Prosecutions -LSB- 1994 -RSB- Crim LR 58 -LRB- anti-abortion -RRB- Hibberd v Director of Public Prosecutions -LRB- 27 November 1996 -RRB- Divisional Court , unreported -LRB- Newbury by-pass -RRB- Hutchinson v Newbury Magistrates ' Court -LRB- 2000 -RRB- 122 ILR 499 -LRB- Trident missiles -RRB- Nelder v Crown Prosecution Service -LRB- 3 June 1998 -RRB- Divisional Court , unreported -LRB- fox hunting -RRB- Lord Advocate 's Reference No 1 of 2000 2001 JC 143 -LRB- Trident missiles -RRB- Director of Public Prosecutions v Tilly -LSB- 2002 -RSB- Crim LR 128 -LRB- genetically modified crops -RRB- Monsanto v Tilly -LSB- 2000 -RSB- Env LR 313 -LRB- genetically modified crops -RRB- . -RRB- 	NAN	NAN	NAN	0.9	lord bingham, lord hoffmann
209	482	The protesters claim that their honestly held opinion of the legality or dangerous character of the activities in question justifies trespass , causing damage to property or the use of force . 	NAN	NAN	NAN	0.9	lord bingham, lord hoffmann
209	483	By this means they invite the court to adjudicate upon the merits of their opinions and provide themselves with a platform from which to address the media on the subject . 	NAN	NAN	NAN	0.9	lord bingham, lord hoffmann
209	484	They seek to cause expense and , if possible , embarrassment to the prosecution by exorbitant demands for disclosure , such as happened in this case . 	NAN	NAN	NAN	0.9	lord bingham, lord hoffmann
209	485	91 . 	NAN	NAN	NAN	0.9	lord bingham, lord hoffmann
209	486	In Hutchinson v Newbury Magistrates ' Court -LRB- 2000 -RRB- 122 ILR 499 , where a protester sought to justify causing damage to a fence at Aldermaston on the ground that she was trying to halt the production of nuclear warheads , Buxton LJ said : 92 . 	NAN	NAN	NAN	0.9	lord bingham, lord hoffmann
209	487	I respectfully agree . 	NAN	NAN	NAN	0.9	lord bingham, lord hoffmann
209	488	The judge then went on to deal with Mrs Hutchinson 's real motive , which -LRB- `` on express instructions '' -RRB- her counsel had frankly avowed . 	NAN	NAN	NAN	0.9	lord bingham, lord hoffmann
209	489	It was to `` bring the issue of the lawfulness of the government 's policy before a court , preferably a Crown Court . '' 	NAN	NAN	NAN	0.9	lord bingham, lord hoffmann
209	490	Buxton LJ said : 93 . 	NAN	NAN	NAN	0.9	lord bingham, lord hoffmann
209	491	My Lords , 	NAN	NAN	NAN	0.9	lord bingham, lord hoffmann
209	492	I do not think that it would be inconsistent with our traditional respect for conscientious civil disobedience for your Lordships to say that there will seldom if ever be any arguable legal basis upon which these forensic tactics can be deployed . 	NAN	NAN	NAN	0.9	lord bingham, lord hoffmann
209	493	94 . 	NAN	NAN	NAN	0.9	lord bingham, lord hoffmann
209	494	The practical implications of what I have been saying for the conduct of the trials of direct action protesters are clear . 	NAN	NAN	NAN	0.9	lord bingham, lord hoffmann
209	495	If there is an issue as to whether the defendants were justified in doing acts which would otherwise be criminal , the burden is upon the prosecution to negative that defence . 	NAN	NAN	NAN	0.9	lord bingham, lord hoffmann
209	496	But the issue must first be raised by facts proved or admitted , either by the prosecution or the defence , on which a jury could find that the acts were justified . 	NAN	NAN	NAN	0.9	lord bingham, lord hoffmann
209	497	In a case in which the defence requires that the acts of the defendant should in all the circumstances have been reasonable , his acts must be considered in the context of a functioning state in which legal disputes can be peacefully submitted to the courts and disputes over what should be law or government policy can be submitted to the arbitrament of the democratic process . 	NAN	NAN	NAN	0.9	lord bingham, lord hoffmann
209	498	In such circumstances , the apprehension , however honest or reasonable , of acts which are thought to be unlawful or contrary to the public interest , can not justify the commission of criminal acts and the issue of justification should be withdrawn from the jury . 	NAN	NAN	NAN	0.9	lord bingham, lord hoffmann
209	499	Evidence to support the opinions of the protesters as to the legality of the acts in question is irrelevant and inadmissible , disclosure going to this issue should not be ordered and the services of international lawyers are not required . 	NAN	NAN	NAN	0.9	lord bingham, lord hoffmann
209	500	95 . 	NAN	NAN	NAN	0.9	lord bingham, lord hoffmann
209	501	I would dismiss these appeals . 	lord hoffmann	self	outcome	0.9	lord bingham, lord hoffmann
209	502	------------- NEW JUDGE --------------- 	NAN	NAN	NAN	0.9	lord bingham, lord hoffmann
209	503	LORD RODGER OF EARLSFERRY 	NAN	NAN	NAN	0.9	lord bingham, lord hoffmann
209	504	My Lords , 	NAN	NAN	NAN	0.9	lord bingham, lord hoffmann
209	505	96 . 	NAN	NAN	NAN	0.9	lord bingham, lord hoffmann
209	506	I have had the privilege of considering the speeches of my noble and learned friends , Lord Bingham of Cornhill and Lord Hoffmann , in draft . 	lord rodger	lord bingham	ackn	0.9	lord bingham, lord hoffmann
209	506	I have had the privilege of considering the speeches of my noble and learned friends , Lord Bingham of Cornhill and Lord Hoffmann , in draft . 	lord rodger	lord hoffmann	ackn	0.9	lord bingham, lord hoffmann
