242	209	If , to go back to an example used earlier in this judgment , a driver who declined to exercise the option were to satisfy the court that he would have exercised it if he had realised that a doctor would be called to take a specimen of blood , then it would be open to the court to conclude that a breath specimen should not be used because had the option been properly explained to the driver he would have provided a specimen of a different kind . 	NAN	NAN	NAN	0.8	lord hutton
242	210	Accordingly I conclude that in each of the seven cases with which we are concerned the failure of the constable to comply in every particular with the Warren formula is immaterial because : -LRB- 1 -RRB- The driver in each case having elected not to provide a replacement specimen , the prosecution relied upon the analysis of the original specimen of breath which was untainted by the later breach of the Warren formula . 	NAN	NAN	NAN	0.8	lord hutton
242	211	-LRB- 2 -RRB- In no case is there any evidence to suggest that the constable 's failure to give the full formula deprived the driver of the opportunity to exercise the option , or caused him to exercise it in a way that he or she would not have done had everything been said . 	NAN	NAN	NAN	0.8	lord hutton
242	212	Indeed in some cases the evidence positively suggests otherwise , for example in Ruxton v. Director of Public Prosecutions -LRB- Note -- 1994 -RRB- -LSB- 1996 -RSB- R.T.R. 266J who said ` It 's four over , I 'm quite happy with that . ' 	NAN	NAN	NAN	0.8	lord hutton
242	213	In fact she under-quantified the excess . 	NAN	NAN	NAN	0.8	lord hutton
242	214	Although it is important to comply with the statutory provisions , as interpreted by this court and the House of Lords , it is also important to have regard to the overall intention of Parliament when this statute was enacted . 	NAN	NAN	NAN	0.8	lord hutton
242	215	The relevant provisions were intended to enable a driver to provide a replacement specimen in a situation in which , as Lord Bridge has pointed out , the driver faces conviction on the basis of a specimen already provided . 	NAN	NAN	NAN	0.8	lord hutton
242	216	The provisions were not intended to provide a series of hazards for police officers which if not skilfully negotiated with complete precision would enable drivers to escape conviction entirely . '' 	NAN	NAN	NAN	0.8	lord hutton
242	217	In my opinion the approach taken by the Divisional Court in Robinson v. Director of Public Prosecutions -LSB- 1997 -RSB- R.T.R. 403 and Director of Public Prosecutions v. Charles -LSB- 1996 -RSB- R.T.R. 247 was correct and demonstrates that unmeritorious acquittals would take place if the Warren requirements were regarded as mandatory so that any breach of them would result in the dismissal of the charge even if the breach had caused no unfairness or prejudice to the defendant . 	NAN	NAN	NAN	0.8	lord hutton
242	218	However I would respectfully differ from the view expressed by Kennedy L.J. in Charles at p. 270B as to the onus of proof and I refer to this point in a later part of this judgment . 	NAN	NAN	NAN	0.8	lord hutton
242	219	It was submitted on behalf of the defendant Jackson that if the Warren -LSB- 1993 -RSB- A.C. 319 requirements were regarded as being guides to ensure fairness rather than as being mandatory there would be uncertainty as to the law and the administration of this branch of it would be brought into disrepute . 	NAN	NAN	NAN	0.8	lord hutton
242	220	It was submitted that this result would follow because the same facts in one part of England would lead to an acquittal , while exactly the same facts would cause a conviction in another part of the country . 	NAN	NAN	NAN	0.8	lord hutton
242	221	I do not accept that submission because the many decisions in the Divisional Court show how different are the precise facts which come before the justices . 	NAN	NAN	NAN	0.8	lord hutton
242	222	Moreover it is a frequent occurrence in a criminal trial that the justices or the judge have to give a ruling on fairness in the particular circumstances of the case , and this does not cause uncertainty or bring the law into disrepute . 	NAN	NAN	NAN	0.9	lord hutton
242	223	Therefore I am of opinion that the guidance given in Warren 's case should be regarded as having the following effect . 	NAN	NAN	NAN	0.9	lord hutton
242	224	The requirements stated by Lord Bridge , with three exceptions , are not to be treated as mandatory but as indicating the matters of which a driver should be aware so that , whether in a section 7 -LRB- 3 -RRB- case or a section 8 -LRB- 2 -RRB- case , he may know the role of a doctor in the taking of a specimen of blood and in determining any medical objections which he may raise to the giving of such a specimen . 	NAN	NAN	NAN	0.9	lord hutton
242	225	The requirements , constituting the three exceptions , which should be regarded as mandatory so that non-compliance should lead to an acquittal are : -LRB- 1 -RRB- in a section 7 -LRB- 3 -RRB- case the warning as to the risk of prosecution required by section 7 -LRB- 7 -RRB- ; -LRB- 2 -RRB- in a section 7 -LRB- 3 -RRB- case the statement of the reason under that subsection why breath specimens can not be taken or used ; and -LRB- 3 -RRB- in a section 8 -LRB- 2 -RRB- case the statement that the specimen of breath which the driver has given containing the lower proportion of alcohol does not exceed 50 microgrammes of alcohol in 100 millilitres of breath . 	NAN	NAN	NAN	0.9	lord hutton
242	226	As well as complying with these three mandatory requirements police officers , in order to seek to ensure that a driver will be aware of the role of the doctor , should continue to use the formula in a section 7 -LRB- 3 -RRB- case and the formula in a section 8 -LRB- 2 -RRB- case set out by Lord Bridge -LSB- 1993 -RSB- A.C. 319 , 327-328 or words to the same effect -LRB- subject to two points to which I refer later -RRB- . 	NAN	NAN	NAN	0.9	lord hutton
242	227	But what is necessary is that the driver should be aware -LRB- whether or not he is told by the police officer -RRB- of the role of the doctor so that he does not suffer prejudice . 	NAN	NAN	NAN	0.9	lord hutton
242	228	Therefore if the driver appreciates that a specimen of blood will be taken by a doctor and not by a police officer , the charge should not be dismissed by the justices because the police officer failed to tell the driver that the specimen would be taken by a doctor . 	NAN	NAN	NAN	0.9	lord hutton
242	229	Accordingly in relation to the Warren requirements there will be two issues for the justices to decide . 	NAN	NAN	NAN	0.9	lord hutton
242	230	The first issue is whether the matters set out in the Warren formula appropriate to a section 7 -LRB- 3 -RRB- case or a section 8 -LRB- 2 -RRB- case -LRB- with the respective changes to which I refer later -RRB- have been brought to the attention of the driver by the police officer . 	NAN	NAN	NAN	0.9	lord hutton
242	231	The second issue , if the answer to the first issue is `` No , '' is whether in relation to the non-mandatory requirements K Kthe police officer 's failure to give the full formula deprived the driver of the opportunity to exercise the option , or caused him to exercise it in a way which he would not have done had everything been said . 	NAN	NAN	NAN	0.9	lord hutton
242	232	If the answer to the second issue is `` Yes '' then the driver should be acquitted , but if the answer is `` No '' the failure by the police officer to use the full formula should not be a reason for an acquittal . 	NAN	NAN	NAN	0.9	lord hutton
242	233	As the second issue is directed to the question whether the driver has suffered prejudice , I consider that it would only be in exceptional cases that the justices would acquit on that ground without having heard evidence from the driver himself raising the issue that he had suffered prejudice . 	NAN	NAN	NAN	0.9	lord hutton
242	234	Both issues are issues of fact , and therefore if the justices , having heard the evidence of the driver to raise the second issue , are left with a reasonable doubt as to whether or not he was prejudiced , they should acquit . 	NAN	NAN	NAN	0.9	lord hutton
242	235	As I have indicated there are two respects in which I would word the requirements stated by Lord Bridge in a different way . 	NAN	NAN	NAN	0.9	lord hutton
242	236	-LRB- 1 -RRB- I consider that there is nothing in the wording of the relevant subsections and there are no considerations of fairness which require a police officer to ask the driver if there are any non-medical reasons why a specimen of blood can not or should not be taken . 	NAN	NAN	NAN	0.9	lord hutton
242	237	If there is some non-medical reason which would support a reasonable excuse under section 7 -LRB- 6 -RRB- this is a matter for the justices to decide . 	NAN	NAN	NAN	0.9	lord hutton
242	238	Therefore I am of opinion that in Lord Bridge 's speech -LSB- 1993 -RSB- A.C. 319 , 328 in relation to a section 7 -LRB- 3 -RRB- case the words `` ask the driver if there are any reasons why a specimen can not or should not be taken from him by a doctor '' should read `` ask the driver if there are any medical reasons why a specimen can not or should not be taken from him by a doctor . '' 	NAN	NAN	NAN	0.9	lord hutton
242	239	Therefore my opinion on this point accords with the sixth observation made by the Divisional Court in Jackson 's case : `` While it may well be prudent for the police officer to enquire whether there are reasons other than medical ones for a sample not being given , in order to avoid the -LRB- outside -RRB- possibility of prosecutions for refusal in which the court holds that a reasonable excuse was present under section 7 -LRB- 6 -RRB- , there is in our view nothing in the 1988 Act that justifies a requirement that the officer should make such enquiry , and every reason in commonsense to assume that if a driver has a reason for not giving a specimen that is sufficiently compelling to qualify under section 7 -LRB- 6 -RRB- he will volunteer that reason of his own motion . '' 	NAN	NAN	NAN	0.9	lord hutton
242	240	-LRB- 2 -RRB- I also consider that in a section 8 -LRB- 2 -RRB- case , in addition to telling the driver that a specimen of blood `` will be taken by a doctor unless the doctor considers that there are medical reasons for not taking blood '' , the police officer should ask the driver if there are any medical reasons why a specimen can not or should not be taken from him by a doctor . 	NAN	NAN	NAN	0.9	lord hutton
242	241	I observe that the pro forma instructions of some police forces do set out this question in a section 8 -LRB- 2 -RRB- case . 	NAN	NAN	NAN	0.9	lord hutton
242	242	The judgements of the Divisional Court in both Jackson and Stanley referred to the decisions in Fraser v. Director of Public Prosecutions -LSB- 1997 -RSB- 373 and Director of Public Prosecutions v. Donnelly -LSB- 1998 -RSB- R.T.R. 188 . 	NAN	NAN	NAN	0.9	lord hutton
242	243	In those two cases the Divisional Court considered that the argument on behalf of the respective defendants that the full Warren formula had not been followed by the police was unmeritorious and held that the failure should not lead to an acquittal . 	NAN	NAN	NAN	0.9	lord hutton
242	244	The Divisional Court came to these decisions by ruling that the matters set out in the Warren formula relating to the role of the doctor need not be stated to the driver at the outset but can be stated at a later stage in the procedure . 	NAN	NAN	NAN	0.9	lord hutton
242	245	I consider , with respect , that this approach is erroneous and that the driver should be told of the role of the doctor at the outset before he has to make the decision to give blood . 	NAN	NAN	NAN	0.9	lord hutton
242	246	If the driver is not told at the outset of the role of the doctor it will be for the justices to decide whether that omission prejudiced the driver and deprived him of the opportunity to make an informed decision . 	NAN	NAN	NAN	0.9	lord hutton
242	247	The decisions of the Divisional Court in the cases of Jackson and Stanley I now return to the decisions of the Divisional Court in the two cases to consider whether those decisions were correct . 	NAN	NAN	NAN	0.9	lord hutton
242	248	In Jackson I consider that the Divisional Court was right to reject the defendant 's argument that the statement to the police sergeant `` I do n't like needles '' raised a potential medical reason for not providing a specimen of blood . 	NAN	NAN	NAN	1	lord hutton
242	249	It was a question of fact whether the statement raised a potential medical reason , and the Divisional Court was entitled to find on the facts of the case that the police officer was not under an obligation to investigate further . 	NAN	NAN	NAN	1	lord hutton
242	250	As regards the other main argument of the defendant which succeeded before the Divisional Court , I am in agreement , as I have stated , with the view expressed by the Divisional Court , and to which it would have given effect if it had not considered itself bound by the Warren decision , that there is no need for a police officer to ask whether there are non-medical reasons for a blood specimen not being given . 	NAN	NAN	NAN	1	lord hutton
242	251	Moreover the defendant made it entirely clear to the police officer that he was not going to give a specimen of blood or urine , and therefore the defendant suffered no prejudice . 	NAN	NAN	NAN	1	lord hutton
242	252	Accordingly I consider that the appeal of the Director of Public Prosecutions should succeed and I would set aside the order of the Divisional Court , but the appellant does not seek an order that the case be remitted to the justices . 	lord hutton	self	outcome	1	lord hutton
242	253	I have sought to answer the certified question in the body of this judgment . 	NAN	NAN	NAN	1	lord hutton
242	254	In Stanley 's case in respect of the first argument advanced on behalf of the defendant I consider that the Divisional Court was right to hold that it was a question of fact whether the statement `` No , I do n't want no needle '' raised a medical issue which required further enquiry from the police officer , and that it was open to the Crown Court to conclude on the evidence that it did not amount to a medical reason . 	NAN	NAN	NAN	1	lord hutton
242	255	The second issue raised before the Divisional Court was that specified in the question certified by it . 	NAN	NAN	NAN	1	lord hutton
242	256	The question is stated in general terms and is not confined to the specific facts of the case , and I have sought to answer the general question in the body of this judgment . 	NAN	NAN	NAN	1	lord hutton
242	257	Applying the judgment to the second point raised on behalf of the defendant and having regard to the specific facts of the case , I consider that the Divisional Court was correct in rejecting that point and in upholding the conviction . 	NAN	NAN	NAN	1	lord hutton
242	258	I am of this opinion because the defendant was told by the police officer that a blood specimen would be taken by a doctor and the police officer also said to him `` I should tell you that your only right to object to giving blood and to give urine instead will be for medical reasons to be determined by a medical practitioner . '' 	NAN	NAN	NAN	1	lord hutton
242	259	I consider therefore that the omission to ask expressly the question whether there were any medical reasons for his refusal to supply a specimen of blood did not cause any injustice to the defendant because that question was implicit in the statement that he had a right to object for medical reasons to be determined by a medical practitioner and did not raise a reasonable possibility that the defendant had been deprived of the opportunity to exercise the option under section 8 -LRB- 2 -RRB- or caused him to exercise it in a way that he would not have done had that question been asked . 	NAN	NAN	NAN	1	lord hutton
242	260	Therefore I would dismiss the appeal of the defendant Stanley . 	lord hutton	self	outcome	1	lord hutton
