209	127	It is true that some states parties to the Rome statute have sought an extended and more specific definition of aggression . 	NAN	NAN	NAN	0.2	lord bingham, lord hoffmann
209	128	It is also true that there has been protracted discussion of whether a finding of aggression against a state by the Security Council should be a necessary pre-condition of the court 's exercise of jurisdiction to try a national of that state accused of committing the crime . 	NAN	NAN	NAN	0.2	lord bingham, lord hoffmann
209	129	I do not , however , think that either of these points undermines the appellants ' essential proposition that the core elements of the crime of aggression have been understood , at least since 1945 , with sufficient clarity to permit the lawful trial -LRB- and , on conviction , punishment -RRB- of those accused of this most serious crime . 	NAN	NAN	NAN	0.2	lord bingham, lord hoffmann
209	130	It is unhistorical to suppose that the elements of the crime were clear in 1945 but have since become in any way obscure . 	NAN	NAN	NAN	0.2	lord bingham, lord hoffmann
209	131	-LRB- 3 -RRB- Crimes recognised in customary international law are -LRB- without the need for any domestic statute or judicial decision -RRB- recognised and enforced by the domestic law of England and Wales . 	NAN	NAN	NAN	0.2	lord bingham, lord hoffmann
209	132	20 . 	NAN	NAN	NAN	0.2	lord bingham, lord hoffmann
209	133	In supporting this proposition the appellants were able to rely on the great authority of Blackstone who -LRB- in Book IV , chap 5 , p 68 , of his Commentaries -RRB- listed the `` principal offences against the law of nations , animadverted on as such by the municipal laws of England '' as violation of safe conducts , infringement of the rights of ambassadors and piracy . 	NAN	NAN	NAN	0.2	lord bingham, lord hoffmann
209	134	21 . 	NAN	NAN	NAN	0.2	lord bingham, lord hoffmann
209	135	Each of these offences has a long legal genealogy . 	NAN	NAN	NAN	0.2	lord bingham, lord hoffmann
209	136	A statute enacted in the reign of Edward III -LRB- see Holdsworth , A History of English Law , 1936 , vol 2 , p 450 -RRB- made it treason to kill an ambassador , and a statute of Henry V -LRB- 2 Henry V c. 6 -RRB- imposed penalties on those who broke truces or violated safe conducts . 	NAN	NAN	NAN	0.2	lord bingham, lord hoffmann
209	137	The immunity of ambassadors when performing diplomatic duties was confirmed by the statute 7 Anne c. 12 , but this statute has been repeatedly recognised as declaring what the law of England , deriving from the law of nations , already was : Triquet v Bath -LRB- 1764 -RRB- 3 Burr 1478 , 1478-1479 , 1481 ; Viveash v Becker -LRB- 1814 -RRB- 3 M and S 284 , 292 ; Novello v Toogood -LRB- 1823 -RRB- 1 B and C 554 , 562 ; Taylor v Best -LRB- 1854 -RRB- 14 CB 487 , 519 ; Magdalena Steam Navigation Company v Martin -LRB- 1859 -RRB- 2 E1 and E1 94 , 114 . 	NAN	NAN	NAN	0.3	lord bingham, lord hoffmann
209	138	A long series of domestic statutes dating back to 15 Ric II c. 3 addressed the crime of piracy , but the report of the Privy Council delivered by Viscount Sankey LC in Re Piracy Jure Gentium -LSB- 1934 -RSB- AC 586 , 594 , made plain that a distinction must be drawn between piracy under any municipal Act of a particular country and piracy jure gentium . 	NAN	NAN	NAN	0.3	lord bingham, lord hoffmann
209	139	22 . 	NAN	NAN	NAN	0.3	lord bingham, lord hoffmann
209	140	While the appellants acknowledged the paucity of authority on the assimilation of customary international law crimes into municipal law , other than those listed by Blackstone , they contended that war crimes earned inclusion in any modern list . 	NAN	NAN	NAN	0.3	lord bingham, lord hoffmann
209	141	It is true that certain practices have , since mediaeval times , been regarded as contrary to the laws and usages of war . 	NAN	NAN	NAN	0.3	lord bingham, lord hoffmann
209	142	After the Second World War some countries provided for the trial of those accused of this crime by statute -LRB- as in Australia -RRB- , or Order in Council under statutory authority -LRB- Canada -RRB- , and the United States appointed military commissions , a practice which pre-dated the Constitution and was recognised but not established by statute : see Rogers , `` War Crimes Trials under the Royal Warrant : British Practice 1945-1949 '' -LRB- 1990 -RRB- 39 ICLQ 780 , 787 . 	NAN	NAN	NAN	0.3	lord bingham, lord hoffmann
209	143	In this country , an enabling statute was discussed -LRB- Rogers , op . 	NAN	NAN	NAN	0.3	lord bingham, lord hoffmann
209	144	cit. , pp 788-789 -RRB- but in the event a Royal Warrant was issued under the royal prerogative on 18 June 1945 to provide for the trial in military courts of persons charged with `` violations of the laws and usages of war '' , which were treated as synonymous with war crimes . 	NAN	NAN	NAN	0.3	lord bingham, lord hoffmann
209	145	Such courts were to take judicial notice of the laws and usages of war . 	NAN	NAN	NAN	0.3	lord bingham, lord hoffmann
209	146	Pursuant to this instrument some 500 trials were held during the years 1945-1949 -LRB- Rogers , op . cit. , p 795 -RRB- . 	NAN	NAN	NAN	0.3	lord bingham, lord hoffmann
209	147	Re Sandrock and Others -LRB- 1945 -RRB- 13 ILR 297 , which concerned the summary execution of a prisoner of war , is one reported example . 	NAN	NAN	NAN	0.3	lord bingham, lord hoffmann
209	148	Since , by 1945 , the creation of new offences lay outwith the royal prerogative , the underlying premise of the Royal Warrant must , I think , have been that war crimes , recognised as such in customary international law , had been assimilated into our domestic law . 	NAN	NAN	NAN	0.3	lord bingham, lord hoffmann
209	149	It was , however , contemplated that an Act of Indemnity should be passed to give retrospective validity to the proceedings -LRB- Rogers , op . cit. , pp 788-799 -RRB- , which may betray some uncertainty on the point . 	NAN	NAN	NAN	0.3	lord bingham, lord hoffmann
209	150	But history has moved on . 	NAN	NAN	NAN	0.3	lord bingham, lord hoffmann
209	151	In 1950 the International Law Commission , summarising the Principles of International Law Recognized in the Charter of the Nürnberg Tribunal and in the Judgment of the Tribunal , listed war crimes -LRB- `` Violations of the laws or customs of war '' -RRB- as crimes under international law . 	NAN	NAN	NAN	0.3	lord bingham, lord hoffmann
209	152	In section 1 -LRB- 1 -RRB- of the War Crimes Act 1991 , jurisdiction was conferred on British courts to try charges of murder , manslaughter or culpable homicide against a person in this country irrespective of his nationality at the time of the alleged offence if that offence was committed between 1 September 1939 and 5 June 1945 in a place which at the time was part of Germany or under German occupation and `` constituted a violation of the laws and customs of war '' , an expression which it was not thought necessary to define . 	NAN	NAN	NAN	0.3	lord bingham, lord hoffmann
209	153	It would seem to me at least arguable that war crimes , recognised as such in customary international law , would now be triable and punishable under the domestic criminal law of this country irrespective of any domestic statute . 	NAN	NAN	NAN	0.3	lord bingham, lord hoffmann
209	154	But it is not necessary to decide that question , since war crimes are something quite distinct from the crime of aggression . 	NAN	NAN	NAN	0.3	lord bingham, lord hoffmann
209	155	23 . 	NAN	NAN	NAN	0.3	lord bingham, lord hoffmann
209	156	I would accordingly accept that a crime recognised in customary international law may be assimilated into the domestic criminal law of this country . 	NAN	NAN	NAN	0.3	lord bingham, lord hoffmann
209	157	The appellants , however , go further and contend that that result follows automatically . 	NAN	NAN	NAN	0.3	lord bingham, lord hoffmann
209	158	The authorities , as I read them , do not support that proposition . 	NAN	NAN	NAN	0.3	lord bingham, lord hoffmann
209	159	Lord Cockburn CJ rejected it in R v Keyn -LRB- 1876 -RRB- 2 Ex D 63 , 203 , when he said : In R v Bow Street Metropolitan Stipendiary Magistrate , Ex p Pinochet Ugarte -LRB- No 3 -RRB- -LSB- 2000 -RSB- 1 AC 147 the issue was whether British courts had jurisdiction , before section 134 of the Criminal Justice Act 1988 came into force , to try those accused of torture abroad . 	NAN	NAN	NAN	0.3	lord bingham, lord hoffmann
209	160	But I agree with the observation of Buxton LJ in Hutchinson v Newbury Magistrates ' Court -LRB- 2000 -RRB- 122 ILR 499 , 506 , where a contention similar to the appellants ' was advanced : In the context of genocide , an argument based on automatic assimilation was rejected by a majority of the Federal Court of Australia in Nulyarimma v Thompson -LRB- 1999 -RRB- 120 ILR 353 . 	NAN	NAN	NAN	0.3	lord bingham, lord hoffmann
209	161	In the context of abduction it was rejected by the Supreme Court of the United States in Sosa v Alvarez-Machain et al 542 US 692 -LRB- 2004 -RRB- . 	NAN	NAN	NAN	0.3	lord bingham, lord hoffmann
209	162	It is , I think , true that `` customary international law is applicable in the English courts only where the constitution permits '' : O'Keefe , `` Customary International Crimes in English Courts '' -LRB- 2001 -RRB- BYIL 293 , 335 . 	NAN	NAN	NAN	0.3	lord bingham, lord hoffmann
209	163	I respectfully agree with the observations of Sir Franklin Berman -LRB- Asserting Jurisdiction : International and European Legal Perspectives , ed M Evans and S Konstantinidis , 2003 , p 11 -RRB- answering the question whether customary international law is capable of creating a crime directly triable in a national court : -LRB- 4 -RRB- `` Crime '' in section 3 of the 1967 Act covers a crime established in customary international law , such as the crime of aggression . 	NAN	NAN	NAN	0.3	lord bingham, lord hoffmann
209	164	24 . 	NAN	NAN	NAN	0.3	lord bingham, lord hoffmann
209	165	Section 3 of the Criminal Law Act 1967 provides : A side-note `` Use of force in making arrest , etc '' follows a draft of the Criminal Law Revision Committee , 7th Report , 1965 -LRB- Cmnd 2659 -RRB- which recommended the substance of the provision . 	NAN	NAN	NAN	0.3	lord bingham, lord hoffmann
209	166	It is accepted that the reasonableness of the force used must be judged objectively in the circumstances which the defendant believed to exist , but this belief can extend only to facts and not to the legal consequences or implications of those facts . 	NAN	NAN	NAN	0.3	lord bingham, lord hoffmann
209	167	25 . 	NAN	NAN	NAN	0.3	lord bingham, lord hoffmann
209	168	I have some doubt whether section 3 was ever intended to apply to conduct like the appellants ' which , although causing damage to property in some cases , was entirely peaceable and involved no violence of any kind to any person . 	NAN	NAN	NAN	0.3	lord bingham, lord hoffmann
209	169	In its Report on Offences of Damage to Property 1970 -LRB- Law Com No 29 -RRB- , para 49 , the Law Commission appears to have considered that a policeman who forced open a door to execute a warrant of arrest could raise a defence of lawful excuse under what became the 1971 Act , and in Hutchinson v Newbury Magistrates ' Court -LRB- 2000 -RRB- 122 ILR 499 , 508 , Buxton LJ understood section 3 to have been introduced to deal with physical force to the person . 	NAN	NAN	NAN	0.3	lord bingham, lord hoffmann
209	170	It was , however , common ground before Grigson J that what the Fairford appellants did or intended to do involved a use of force ; there is authority to support that view -LRB- Swales v Cox -LSB- 1981 -RSB- QB 849 ; R v Renouf -LSB- 1986 -RSB- 1 WLR 522 -RRB- ; this question of interpretation was not the subject of appeal ; and it has not been fully investigated . 	NAN	NAN	NAN	0.3	lord bingham, lord hoffmann
209	171	I shall therefore treat the section as applicable to acts such as the appellants did . 	NAN	NAN	NAN	0.3	lord bingham, lord hoffmann
209	172	26 . 	NAN	NAN	NAN	0.3	lord bingham, lord hoffmann
209	173	The main object of the 1967 Act was to amend the law of England and Wales by abolishing the distinction between felonies and misdemeanours as recommended by the Criminal Law Revision Committee . 	NAN	NAN	NAN	0.3	lord bingham, lord hoffmann
209	174	Part I of the Act , headed `` Felony and Misdemeanour '' , includes section 3 and contains provisions governing matters such as arrest , trial and penalties on conviction . 	NAN	NAN	NAN	0.3	lord bingham, lord hoffmann
209	175	Part II abolished a number of obsolete crimes . 	NAN	NAN	NAN	0.3	lord bingham, lord hoffmann
209	176	Part III abolished tortious liability for maintenance and champerty . 	NAN	NAN	NAN	0.3	lord bingham, lord hoffmann
209	177	The focus of the Act is entirely domestic , and it would seem to me very highly unlikely that Parliament understood `` crime '' in section 3 as covering crimes recognised in customary international law but not assimilated into our domestic law by any statute or judicial decision . 	NAN	NAN	NAN	0.3	lord bingham, lord hoffmann
209	178	In construing a domestic statute the ordinary practice is to treat `` offence '' , in the absence of an express provision to the contrary , as referring to an offence committed here against a common law or statutory rule : R -LRB- Rottman -RRB- v Commissioner of Police of the Metropolis -LSB- 2002 -RSB- UKHL 20 , -LSB- 2002 -RSB- 2 AC 692 , para 67 . 	NAN	NAN	NAN	0.3	lord bingham, lord hoffmann
209	179	The same approach must apply to `` crime '' . 	NAN	NAN	NAN	0.3	lord bingham, lord hoffmann
209	180	Nothing in the Act or in the Report on which it was based suggests a contrary intention in this case . 	NAN	NAN	NAN	0.3	lord bingham, lord hoffmann
209	181	I can not , therefore , accept the appellants ' submission on this issue . 	NAN	NAN	NAN	0.3	lord bingham, lord hoffmann
209	182	-LRB- 5 -RRB- Alternatively , `` crime '' in section 3 means a crime in the domestic law of England and Wales , and the crime of aggression is such . 	NAN	NAN	NAN	0.3	lord bingham, lord hoffmann
209	183	27 . 	NAN	NAN	NAN	0.3	lord bingham, lord hoffmann
209	184	I approach this proposition assuming the correctness of the conclusions already reached , that `` crime '' in section 3 means a crime in the domestic law of England and Wales and that a crime recognised as such in customary international law -LRB- such as the crime of aggression -RRB- may , but need not , become part of the domestic law of England and Wales without the need for any domestic statute or judicial decision . 	NAN	NAN	NAN	0.3	lord bingham, lord hoffmann
209	185	28 . 	NAN	NAN	NAN	0.3	lord bingham, lord hoffmann
209	186	The lack of any statutory incorporation is not , however , a neutral factor , for two main reasons . 	NAN	NAN	NAN	0.3	lord bingham, lord hoffmann
209	187	The first is that there now exists no power in the courts to create new criminal offences , as decided by a unanimous House in Knuller -LRB- Publishing , Printing and Promotions -RRB- Ltd v Director of Public Prosecutions -LSB- 1973 -RSB- AC 435 . 	NAN	NAN	NAN	0.3	lord bingham, lord hoffmann
209	188	While old common law offences survive until abolished or superseded by statute , new ones are not created . 	NAN	NAN	NAN	0.3	lord bingham, lord hoffmann
209	189	Statute is now the sole source of new criminal offences . 	NAN	NAN	NAN	0.3	lord bingham, lord hoffmann
209	190	The second reason is that when it is sought to give domestic effect to crimes established in customary international law , the practice is to legislate . 	NAN	NAN	NAN	0.3	lord bingham, lord hoffmann
209	191	Examples may be found in the Geneva Conventions Act 1957 and the Geneva Conventions -LRB- Amendment -RRB- Act 1995 , dealing with breaches of the Geneva Conventions of 1949 and the Additional Protocols of 1977 ; the Genocide Act 1969 , giving effect to the Genocide Convention of 1948 ; the Criminal Justice Act 1988 , s 134 , giving effect to the Torture Convention of 1984 ; the War Crimes Act 1991 , giving jurisdiction to try war crimes committed abroad by foreign nationals ; the Merchant Shipping and Maritime Security Act 1997 , s 26 , giving effect to provisions of the United Nations Convention on the Law of the Sea 1982 relating to piracy ; and sections 51 and 52 of the International Criminal Court Act 2001 , giving effect to the Rome Statute by providing for the trial here of persons accused of genocide , crimes against humanity and war crimes , but not , significantly , the crime of aggression . 	NAN	NAN	NAN	0.3	lord bingham, lord hoffmann
209	192	It would be anomalous if the crime of aggression , excluded -LRB- obviously deliberately -RRB- from the 2001 Act , were to be treated as a domestic crime , since it would not be subject to the constraints -LRB- as to the need for the Attorney General 's consent , the mode of trial , the requisite mens rea , the liability of secondary parties and maximum penalties -RRB- applicable to the crimes which were included . 	NAN	NAN	NAN	0.4	lord bingham, lord hoffmann
209	193	29 . 	NAN	NAN	NAN	0.4	lord bingham, lord hoffmann
209	194	These reasons , taken together , are very strong grounds for rejecting the appellants ' contention , since they reflect what has become an important democratic principle in this country : that it is for those representing the people of the country in Parliament , not the executive and not the judges , to decide what conduct should be treated as lying so far outside the bounds of what is acceptable in our society as to attract criminal penalties . 	NAN	NAN	NAN	0.4	lord bingham, lord hoffmann
209	195	One would need very compelling reasons for departing from that principle . 	NAN	NAN	NAN	0.4	lord bingham, lord hoffmann
209	196	30 . 	NAN	NAN	NAN	0.4	lord bingham, lord hoffmann
209	197	In the present case , involving the crime of aggression , there are compelling reasons for not departing . 	NAN	NAN	NAN	0.4	lord bingham, lord hoffmann
209	198	A charge of aggression , if laid against an individual in a domestic court , would involve determination of his responsibility as a leader but would presuppose commission of the crime by his own state or a foreign state . 	NAN	NAN	NAN	0.4	lord bingham, lord hoffmann
209	199	Thus resolution of the charge would -LRB- unless the issue had been decided by the Security Council or some other third party -RRB- call for a decision on the culpability in going to war either of Her Majesty 's Government or a foreign government , or perhaps both if the states had gone to war as allies . 	NAN	NAN	NAN	0.4	lord bingham, lord hoffmann
209	200	But there are well-established rules that the courts will be very slow to review the exercise of prerogative powers in relation to the conduct of foreign affairs and the deployment of the armed services , and very slow to adjudicate upon rights arising out of transactions entered into between sovereign states on the plane of international law . 	NAN	NAN	NAN	0.4	lord bingham, lord hoffmann
209	201	The first of these rules is vouched by authorities such as Chandler v Director of Public Prosecutions -LSB- 1964 -RSB- AC 763 , 791 , 796 ; Council of Civil Service Unions v Minister for the Civil Service -LSB- 1985 -RSB- AC 374 , 398 ; Lord Advocate 's Reference No 1 of 2000 2001 JC 143 , para 60 ; R -LRB- Marchiori -RRB- v The Environment Agency -LSB- 2002 -RSB- EWCA Civ 03 , -LSB- 2002 -RSB- EuLR 225 , paras 38-40 . 	NAN	NAN	NAN	0.4	lord bingham, lord hoffmann
209	202	The second rule is supported by such authorities as Buttes Gas and Oil Co v Hammer -LSB- 1982 -RSB- AC 888 , 932 ; J H Rayner -LRB- Mincing Lane -RRB- Limited v Department for Trade and Industry -LSB- 1990 -RSB- 2 AC 418 , 499 ; Westland Helicopters Limited v Arab Organisation for Industrialisation -LSB- 1995 -RSB- QB 282 , 292 ; and R -LRB- on the application of Campaign for Nuclear Disarmament -RRB- v Prime Minister of the United Kingdom -LSB- 2002 -RSB- EWHC 2777 -LRB- Admin -RRB- , -LSB- 2003 -RSB- 3 LRC 335 , paras 38 , 40 . 	NAN	NAN	NAN	0.4	lord bingham, lord hoffmann
209	203	In Buttes , at p 933 , Lord Wilberforce cited with approval the words of Fuller CJ in the United States Supreme Court in Underhill v Hernandez 168 US 250 -LRB- 1897 -RRB- , 252 : I do not suggest that these rules admit of no exceptions : cases such as Oppenheimer v Cattermole -LSB- 1976 -RSB- AC 249 and Kuwait Airways Corporation v Iraqi Airways Company -LRB- Nos 4 and 5 -RRB- -LSB- 2002 -RSB- UKHL 19 , -LSB- 2002 -RSB- 2 AC 883 may fairly be seen as exceptions . 	NAN	NAN	NAN	0.4	lord bingham, lord hoffmann
209	204	Nor , in the present context , is the issue one of justiciability , to which many of these authorities were directed . 	NAN	NAN	NAN	0.4	lord bingham, lord hoffmann
209	205	In considering whether the customary international law crime of aggression has been , or should be , tacitly assimilated into our domestic law , it is nonetheless very relevant not only that Parliament has , so far , refrained from taking this step but also that it would draw the courts into an area which , in the past , they have entered , if at all , with reluctance and the utmost circumspection . 	NAN	NAN	NAN	0.4	lord bingham, lord hoffmann
209	206	31 . 	NAN	NAN	NAN	0.4	lord bingham, lord hoffmann
209	207	The potential and readily foreseeable problems which might arise if it were permissible to impede military preparations or action by the existing government in this country on the ground of their unlawfulness would not end there . 	NAN	NAN	NAN	0.4	lord bingham, lord hoffmann
209	208	For a person so acting could , at least arguably , on facts more significant than those relied on here , be said to `` be adherent to the King 's enemies in his realm , giving to them aid and comfort in the realm , or elsewhere '' within the meaning of the Treason Act 1351 , or to commit the common law offence of sedition by exciting disaffection against the government or the constitution . 	NAN	NAN	NAN	0.4	lord bingham, lord hoffmann
209	209	It has never been a defence to such a charge that the Crown or the government had committed itself to an unjust or unlawful cause . 	NAN	NAN	NAN	0.4	lord bingham, lord hoffmann
209	210	It would be strange if the same conduct could be both a crime and a defence . 	NAN	NAN	NAN	0.4	lord bingham, lord hoffmann
209	211	The justification relied on by the appellants would also , if legally available , give rise to applications for disclosure which , if allowed , would be likely to result in the discontinuance of any prosecution . 	NAN	NAN	NAN	0.4	lord bingham, lord hoffmann
209	212	As the House observed in R v H -LSB- 2004 -RSB- UKHL 3 , -LSB- 2004 -RSB- 2 AC 134 , para 35 , I am of the clear opinion that the crime of aggression is not a crime in the domestic law of England and Wales within the meaning of section 3 . 	NAN	NAN	NAN	0.4	lord bingham, lord hoffmann
209	213	-LRB- 6 -RRB- `` Offence '' in section 68 -LRB- 2 -RRB- of the 1994 Act covers an offence established in customary international law , such as the crime of aggression . 	NAN	NAN	NAN	0.4	lord bingham, lord hoffmann
209	214	32 . 	NAN	NAN	NAN	0.4	lord bingham, lord hoffmann
209	215	Section 68 of the 1994 Act , so far as relevant to these appeals and as originally enacted , provides : The original object of the section was to penalise the activities of trespassing hunt saboteurs and animal rights activists , but the section has been widened by deleting reference to the open air . 	NAN	NAN	NAN	0.4	lord bingham, lord hoffmann
209	216	By virtue of section 172 -LRB- 10 -RRB- the section applies throughout the United Kingdom . 	NAN	NAN	NAN	0.4	lord bingham, lord hoffmann
209	217	33 . 	NAN	NAN	NAN	0.4	lord bingham, lord hoffmann
209	218	The 1994 Act is a long and detailed statute , addressing a large number of criminal justice matters , particularly in England and Wales but also in Scotland and Northern Ireland . 	NAN	NAN	NAN	0.4	lord bingham, lord hoffmann
209	219	Although some provisions of the Act have a wider reach -LRB- section 160 extends the powers of constables to United Kingdom waters -RRB- , section 68 is directed to land within one or other of the three domestic jurisdictions . 	NAN	NAN	NAN	0.4	lord bingham, lord hoffmann
209	220	There is no suggestion that those whose activities the Marchwood appellants and the appellant Swain sought to obstruct or disrupt were themselves trespassers . 	NAN	NAN	NAN	0.4	lord bingham, lord hoffmann
209	221	So the only question is whether `` offence '' in section 68 -LRB- 2 -RRB- should be understood to cover an offence under customary international law . 	NAN	NAN	NAN	0.4	lord bingham, lord hoffmann
209	222	34 . 	NAN	NAN	NAN	0.4	lord bingham, lord hoffmann
209	223	The answer to that question must be negative , for very much the same reasons as are given in para 26 above . 	NAN	NAN	NAN	0.4	lord bingham, lord hoffmann
209	224	`` Offence '' is not defined in the Act . 	NAN	NAN	NAN	0.4	lord bingham, lord hoffmann
209	225	It must be understood as meaning an offence under the domestic criminal law of the relevant UK jurisdiction . 	NAN	NAN	NAN	0.4	lord bingham, lord hoffmann
209	226	35 . 	NAN	NAN	NAN	0.4	lord bingham, lord hoffmann
209	227	This proposition must be rejected , for the reasons given in paragraphs 28 to 31 above . 	NAN	NAN	NAN	0.4	lord bingham, lord hoffmann
209	228	It is a conclusion which involves , in my opinion , no substantial injustice to the Marchwood appellants and the appellant Swain since , even if this proposition were accepted it would be all but unarguable that those whose activities these appellants obstructed or disrupted at Marchwood and Fairford were themselves committing the crime of aggression or that there was a sufficient nexus between the conduct of these appellants and the preparation for or waging of an aggressive war even if -LRB- which is not a matter for decision -RRB- the hostilities against Iraq could be properly so described . 	NAN	NAN	NAN	0.4	lord bingham, lord hoffmann
