277	253	Mr. Milne submitted that regulation 23 -LRB- 1 -RRB- did not operate to prevent a court from holding that Svenska had made supplies to the London Branch prior to 1 August 1991 notwithstanding that prior to that date no payment had been received and no tax invoice had been issued , and he contended that the effect of regulation 23 -LRB- 1 -RRB- was to prevent the time for the tax becoming chargeable occurring until receipt of payment or the issuing of a tax invoice , but the regulation did not alter the fact that a supply of services had taken place before such an event . 	NAN	NAN	NAN	0.8	lord hutton
277	254	In support of this submission Mr. Milne pointed to the wording of Article 10 of the Sixth Council Directive of 17 May 1977 -LRB- 77/388/E.E.C . -RRB- 	NAN	NAN	NAN	0.8	lord hutton
277	255	: `` 1 . 	NAN	NAN	NAN	0.8	lord hutton
277	256	-LRB- a -RRB- ` Chargeable event ' shall mean the occurrence by virtue of which the legal conditions necessary for tax to become chargeable are fulfilled . 	NAN	NAN	NAN	0.8	lord hutton
277	257	-LRB- b -RRB- The tax becomes ` chargeable ' when the tax authority becomes entitled under the law at a given moment to claim the tax from the person liable to pay , notwithstanding that the time of payment may be deferred . 	NAN	NAN	NAN	0.8	lord hutton
277	258	2 . 	NAN	NAN	NAN	0.8	lord hutton
277	259	The chargeable event shall occur and the tax shall become chargeable when the goods are delivered or the services are performed . 	NAN	NAN	NAN	0.8	lord hutton
277	260	Deliveries of goods other than those referred to in Article 5 -LRB- 4 -RRB- -LRB- b -RRB- and supplies of services which give rise to successive statements of account or payments shall be regarded as being completed at the time when the periods to which such statements of account or payments pertain expire . 	NAN	NAN	NAN	0.8	lord hutton
277	261	However , where a payment is to be made on account before the goods are delivered or the services are performed , the tax shall become chargeable on receipt of the payment and on the amount received . 	NAN	NAN	NAN	0.8	lord hutton
277	262	By way of derogation from the above provisions , Member States may provide that the tax shall become chargeable , for certain transactions or for certain categories of taxable person , either : -- no later than the issue of the invoice or of the document serving as invoice , or -- no later than receipt of the price , or -- where an invoice or document serving as invoice is not issued , or is issued late , within a specified period from the date of the chargeable event . '' 	NAN	NAN	NAN	0.8	lord hutton
277	263	Mr. Milne submitted that Article 10 drew a distinction between the `` chargeable event '' and the tax becoming `` chargeable '' , and that regulation 23 -LRB- 1 -RRB- related to the time when the tax became `` chargeable '' and not to the `` chargeable event , '' so that the regulation did not prevent the services in fact supplied by Svenska to London Branch prior to 1 August 1991 being taxable supplies . 	NAN	NAN	NAN	0.8	lord hutton
277	264	Mr. Milne also referred to the decision of this House in Customs and Excise Commissioners v. Thorn Materials Supplies Ltd. -LSB- 1998 -RSB- S.T.C. 725 , and submitted that it established that when `` the time of supply '' provisions fixed a supply to take place at a time when the two parties were in a group that `` supply '' should be ignored , but that it did not follow that the delivery of goods or the supply of services which took place between the parties was not a `` taxable supply '' chargeable to tax . 	NAN	NAN	NAN	0.8	lord hutton
277	265	My Lords , 	NAN	NAN	NAN	0.8	lord hutton
277	266	I am unable to accept those submissions . 	NAN	NAN	NAN	0.8	lord hutton
277	267	In my opinion section 5 -LRB- 9 -RRB- of the Act of 1983 and regulation 23 -LRB- 1 -RRB- make it clear that where there is a continuous supply of services , no supply shall be treated as having been made until there has been a payment or a tax invoice has been issued . 	NAN	NAN	NAN	0.8	lord hutton
277	268	In Thorn 's case two companies , at a time when they were members of the same VAT group , entered into an agreement whereby company A agreed to sell motor cars to company B. Ninety per cent of the price was payable immediately as a prepayment and the balance was payable on delivery . 	NAN	NAN	NAN	0.8	lord hutton
277	269	Company B duly made the prepayment and a week later company A ceased to be a member of the VAT group and became separately registered for VAT On a subsequent date company A delivered the motor cars to company B and company B then paid company A the remaining ten per cent of the price . 	NAN	NAN	NAN	0.8	lord hutton
277	270	The Commissioners claimed that VAT was payable upon the whole of the value of the goods , that was upon the whole of the purchase price , whereas the companies contended that VAT was payable only in respect of ten per cent . of the purchase price . 	NAN	NAN	NAN	0.8	lord hutton
277	271	Section 4 of the 1983 Act provides : '' -LRB- 1 -RRB- The provisions of this section and section 5 below shall apply for determining the time when a supply of goods or services is to be treated as taking place for the purposes of the charge to tax . 	NAN	NAN	NAN	0.8	lord hutton
277	272	-LRB- 2 -RRB- Subject to the provisions of section 5 below , a supply of goods shall be treated as taking place -- -LRB- a -RRB- if the goods are to be removed , at the time of the removal ; -LRB- b -RRB- if the goods are not to be removed , at the time when they are made available to the person to whom they are supplied '' Section 5 -LRB- 1 -RRB- provides : `` If , before the time applicable under subsection -LRB- 2 -RRB- of section 4 above , the person making the supply issues a tax invoice in respect of it or if , before the time applicable under paragraph -LRB- a -RRB- or -LRB- b -RRB- of subsection -LRB- 2 -RRB- of that section , he receives a payment in respect of it , the supply shall , to the extent covered by the invoice or payment , be treated as taking place at the time the invoice is issued or the payment is received . '' 	NAN	NAN	NAN	0.8	lord hutton
277	273	The companies argued that the prepayments fell within the terms of section 5 -LRB- 1 -RRB- and therefore to the extent of the prepayments of ninety per cent the supplies were to be treated as taking place at the time when the payments were received . 	NAN	NAN	NAN	0.8	lord hutton
277	274	At that time the two companies were members of the same VAT group and therefore pursuant to section 29 -LRB- 1 -RRB- the supply of goods had to be disregarded to the extent of ninety per cent. , and only the balance of ten per cent . was subject to tax . 	NAN	NAN	NAN	0.8	lord hutton
277	275	The contrary argument of the Commissioners was that as the two companies were members of the same group on the date of prepayment the supply between them arising by reason of the prepayment pursuant to section 5 -LRB- 1 -RRB- had to be disregarded pursuant to section 29 -LRB- 1 -RRB- -LRB- a -RRB- . 	NAN	NAN	NAN	0.9	lord hutton
277	276	Therefore there was no supply under section 5 -LRB- 1 -RRB- and the only relevant supply which took place for VAT purposes was pursuant to section 4 -LRB- 2 -RRB- -LRB- b -RRB- when the cars were delivered to the purchaser at a time when the group relationship no longer existed and therefore tax was payable on the basis that the value of the supply was the full value of the consideration . 	NAN	NAN	NAN	0.9	lord hutton
277	277	In rejecting the argument of the companies Lord Nolan -LRB- with whose judgment Lord Browne-Wilkinson and Lord Lloyd of Berwick agreed -RRB- stated at p. 733D : `` When Materials and Resources left the Thorn EMI Plc. group they emerged into the VAT world as separate taxable persons , each carrying on its own business for VAT purposes . 	NAN	NAN	NAN	0.9	lord hutton
277	278	The delivery of the goods by them to Home undoubtedly constituted a transfer of the whole property in the goods in the course of business . 	NAN	NAN	NAN	0.9	lord hutton
277	279	It constituted a supply of the goods within the meaning of para 1 -LRB- 1 -RRB- of Sch . 2 , taxable under section 10 -LRB- 2 -RRB- upon the amount of the consideration whether already paid or still payable . 	NAN	NAN	NAN	0.9	lord hutton
277	280	The appellants ' objection that this approach disregards the fact that , to the extent of 90 per cent. , the supply was to be treated as having taken place when the advance payment was made must fail because this disregard is precisely what s 29 -LRB- 1 -RRB- requires . 	NAN	NAN	NAN	0.9	lord hutton
277	281	It follows that , in my judgement , the whole value of the supplies in question falls fairly and squarely within the charging provisions of the 1983 Act according to the normal principles of construction which should be applied to a taxing statute . '' 	NAN	NAN	NAN	0.9	lord hutton
277	282	In my opinion Svenska can not derive assistance from that decision . 	NAN	NAN	NAN	0.9	lord hutton
277	283	In Thorn section 29 -LRB- 1 -RRB- required the supply which was to be treated as taking place at the time of the payment of ninety per cent . of the price to be disregarded . 	NAN	NAN	NAN	0.9	lord hutton
277	284	Therefore there was a supply which took place in the normal way at the time of delivery of the motor cars pursuant to section -LRB- 4 -RRB- -LRB- 2 -RRB- -LRB- b -RRB- . 	NAN	NAN	NAN	0.9	lord hutton
277	285	But in the present case Svenska can not argue that as after 1 August 1991 the supplies provided by it to the London Branch are to be disregarded pursuant to section 29 -LRB- 1 -RRB- because they were members of the same group , the consequence must be that the `` actual supplies '' provided by Svenska to the London Branch prior to 1 August 1991 can be regarded as supplies for VAT purposes . 	NAN	NAN	NAN	0.9	lord hutton
277	286	The reason why Svenska can not advance this as a valid argument is because the effect of regulation 23 -LRB- 1 -RRB- is that those `` actual supplies '' can not be treated as supplies for VAT purposes . 	NAN	NAN	NAN	0.9	lord hutton
277	287	In short , the distinction between the present case and Thorn is that in the latter the Act and the 1985 Regulations permitted the delivery of the motor cars to be treated as a supply , whereas in the present case regulation 23 -LRB- 1 -RRB- prohibits the `` actual supplies '' provided by Svenska to London Branch between 1987 and 1 August 1991 being treated as supplies because prior to the latter date no payment had been received and no tax invoice had been issued . 	NAN	NAN	NAN	0.9	lord hutton
277	288	Accordingly the present case has to be approached on the basis that , no matter that in fact Svenska supplied services to London Branch prior to 1 August 1991 , as a matter of the law governing VAT no supplies were made during the period 1987 to 1 August 1991 . 	NAN	NAN	NAN	0.9	lord hutton
277	289	I am also of opinion that Svenska can not derive assistance from the judgment of the European Court of Justice in Belgium v. Ghent Coal Terminal N.V. -LSB- 1998 -RSB- S.T.C. 260 . 	NAN	NAN	NAN	0.9	lord hutton
277	290	Svenska submits that that case confirms that the right to deduct input tax , once acquired , can not be retrospectively withdrawn because it becomes impossible to make the taxable supply as originally intended , provided that the inward supplies are not actually used to make exempt supplies . 	NAN	NAN	NAN	0.9	lord hutton
277	291	But I consider that the Ghent case is distinguishable from the present case because it related to circumstances where the taxable person could not make the intended supply because of circumstances outside its control . 	NAN	NAN	NAN	0.9	lord hutton
277	292	Ghent Coal deducted VAT paid on the goods and services supplied for investment work carried out for the development of land which was not , in the final event , used for the purpose initially envisaged because the municipal authorities of Ghent required Ghent Coal to exchange the land for other land belonging to the town . 	NAN	NAN	NAN	0.9	lord hutton
277	293	The opinion of the Advocate General , at p. 262 , para . 5 stated that it was common ground between the parties that : '' . 	NAN	NAN	NAN	0.9	lord hutton
277	294	. 	NAN	NAN	NAN	0.9	lord hutton
277	295	. 	NAN	NAN	NAN	0.9	lord hutton
277	296	` the invested goods had been in the normal course of events intended for use in taxable transactions , that the exchange had not been foreseen or planned in advance by the respondent , and that it could not have been avoided by the respondent in the normal course of its business and even constituted economic force majeure for it ' . '' 	NAN	NAN	NAN	0.9	lord hutton
277	297	And in the conclusion of his opinion the Advocate General stated at p. 270 , para . 67 : `` I therefore propose that the Court of Justice should answer the question referred by the Hof van Cassatie as follows : `` Article 17 -LRB- 2 -RRB- of the Sixth Directive allows an undertaking to deduct the VAT paid in connection with the acquisition of goods and the receipt of services corresponding to investment works originally intended to be used in its business activity but which , for reasons beyond its control , were never in fact put to use by the undertaking . 	NAN	NAN	NAN	0.9	lord hutton
277	298	The adjustment of those deductions must be effected as provided for in article 20 of that Directive . '' 	NAN	NAN	NAN	0.9	lord hutton
277	299	The court stated at p. 273 : 22 . 	NAN	NAN	NAN	0.9	lord hutton
277	300	However , when circumstances beyond the control of the taxable person have prevented him from using the goods or services giving rise to deduction for the needs of his taxable transactions , there is no risk of fraud or abuse capable of justifying subsequent repayment . 	NAN	NAN	NAN	0.9	lord hutton
277	301	23 . 	NAN	NAN	NAN	0.9	lord hutton
277	302	Finally , it must be pointed out that a supply of investment goods during the adjustment period , such as occurred in the main proceedings in this case , may give rise to an adjustment of the deduction under the conditions set out in art 20 -LRB- 3 -RRB- of the Sixth Directive . 	NAN	NAN	NAN	0.9	lord hutton
277	303	24 . 	NAN	NAN	NAN	0.9	lord hutton
277	304	The answer to the question submitted must therefore be that art 17 of the Sixth Directive must be construed as allowing a taxable person acting as such to deduct the VAT payable by him on goods or services supplied to him for the purpose of investment work intended to be used in connection with taxable transactions . 	NAN	NAN	NAN	0.9	lord hutton
277	305	The right to deduct remains acquired where , by reason of circumstances beyond his control , the taxable person has never made use of those goods or services for the purpose of carrying out taxable transactions . 	NAN	NAN	NAN	0.9	lord hutton
277	306	A supply of investment goods during the adjustment period , where such occurs , may give rise to an adjustment of the deduction under the conditions set out in art 20 -LRB- 3 -RRB- of the Sixth Directive . '' 	NAN	NAN	NAN	0.9	lord hutton
277	307	But in the present case the bringing of London Branch into the group was not by reason of circumstances beyond the control of Svenska but was made with the concurrence of Svenska . 	NAN	NAN	NAN	1	lord hutton
277	308	Mr. Milne 's second main submission was that , as Carnwath J. had held , the Commissioners had failed to point to anything done by Svenska which could be regarded as a use or appropriation by it . 	NAN	NAN	NAN	1	lord hutton
277	309	In my opinion Mr. Pleming Q.C. , for the Commissioners , succeeded by reliance on the provisions of the Act of 1983 and the 1985 Regulations in demonstrating that under VAT law there had been a use by Svenska , within the meaning of regulation of 34 -LRB- 1 -RRB- -LRB- b -RRB- , of supplies received by it in making exempt supplies . 	NAN	NAN	NAN	1	lord hutton
277	310	The Commissioners ' argument consists of the following propositions . 	NAN	NAN	NAN	1	lord hutton
277	311	Svenska received supplies which were attributable to an intended taxable supply by it to the London Branch . 	NAN	NAN	NAN	1	lord hutton
277	312	These supplies received by Svenska could not be treated as supplied by it to the London Branch prior to 1 August 1991 because prior to that date neither a payment was received nor a tax invoice was issued . 	NAN	NAN	NAN	1	lord hutton
277	313	After 1 August these services were to be treated as used in supplying services -LRB- some of which were exempt -RRB- to the customers of the London Branch . 	NAN	NAN	NAN	1	lord hutton
277	314	But the London Branch was then a member of the VAT group of which Svenska was the representative member and accordingly , pursuant to section 29 -LRB- 1 -RRB- , those services to third parties were to be treated as a supply by Svenska . 	NAN	NAN	NAN	1	lord hutton
277	315	Therefore the services received by Svenska between 1987 and 1 August 1991 were to be treated as used by Svenska after 1 August 1991 in making supplies which were , in part , exempt . 	NAN	NAN	NAN	1	lord hutton
277	316	In my opinion the Commissioners ' argument is valid . 	NAN	NAN	NAN	1	lord hutton
277	317	It is based upon artificial concepts , but the Act of 1983 and the 1985 Regulations require tribunals and courts to apply artificial concepts . 	NAN	NAN	NAN	1	lord hutton
277	318	The requirement under regulation 23 -LRB- 1 -RRB- in relation to continuous supplies of services that services which , in the real world of commerce , have actually been supplied to , and already used by , another person are not to be treated as supplied until a payment has been received or a tax invoice has been issued gives support to the view that such supplies can be deemed to be used at a time subsequent to their `` actual '' use and gives weight to Mr Pleming 's submission that such supplies do not simply `` disappear into limbo . '' 	NAN	NAN	NAN	1	lord hutton
277	319	In the circumstances of the present case I consider , artificial though the concept is , that the effect of section 29 and of Regulations 23 -LRB- 1 -RRB- and 34 -LRB- 1 -RRB- when read together is that the supplies received by Svenska , for which it received credit , were used or appropriated for use by it in making partly exempt supplies to the customers of the London Branch after 1 August 1991 . 	NAN	NAN	NAN	1	lord hutton
277	320	Carnwath J. 's decision was largely based on his opinion that there must be some action or decision by the taxable person which can be characterised as a `` use or appropriation for use '' and that the Commissioners had failed to point to anything done by Svenska which could be regarded as a use or appropriation . 	NAN	NAN	NAN	1	lord hutton
277	321	But I consider that the judgment of Aldous L.J. was correct and that after 1 August 1991 , by virtue of section 29 and Regulation 23 -LRB- 1 -RRB- , the partly exempt services supplied by the London Branch to its customers were to be treated as supplied by Svenska so that there was a use or appropriation for use by it of the inward supplies which it had received . 	NAN	NAN	NAN	1	lord hutton
277	322	Accordingly for the reasons which I have given I would dismiss this appeal . 	lord hutton	self	outcome	1	lord hutton
