209	229	This was the conclusion reached by the courts below , and I agree with it . 	NAN	NAN	NAN	0.4	lord bingham, lord hoffmann
209	230	36 . 	NAN	NAN	NAN	0.4	lord bingham, lord hoffmann
209	231	For these reasons , which are much the same as those given by the Court of Appeal and followed by the Administrative Court , I would answer the certified questions in paragraphs 4 and 9 above together , as follows : the crime against peace -LRB- or crime of aggression -RRB- is not capable of being a `` crime '' within the meaning of section 3 of the Criminal Law Act 1967 or an `` offence '' within the meaning of section 68 -LRB- 2 -RRB- of the Criminal Justice and Public Order Act 1994 . 	NAN	NAN	NAN	0.4	lord bingham, lord hoffmann
209	232	I would accordingly dismiss all the appeals . 	lord bingham	self	outcome	0.4	lord bingham, lord hoffmann
209	233	------------- NEW JUDGE --------------- 	NAN	NAN	NAN	0.4	lord bingham, lord hoffmann
209	234	LORD HOFFMANN 	NAN	NAN	NAN	0.4	lord bingham, lord hoffmann
209	235	My Lords , 	NAN	NAN	NAN	0.4	lord bingham, lord hoffmann
209	236	Demonstrations against war 37 . 	NAN	NAN	NAN	0.4	lord bingham, lord hoffmann
209	237	The war against Iraq began with the bombing of Baghdad on 20 March 2003 . 	NAN	NAN	NAN	0.4	lord bingham, lord hoffmann
209	238	It caused deep divisions among the people of the United Kingdom . 	NAN	NAN	NAN	0.4	lord bingham, lord hoffmann
209	239	Many people thought that it was morally wrong and contrary to international law . 	NAN	NAN	NAN	0.4	lord bingham, lord hoffmann
209	240	On 15 February 2003 there was a demonstration in central London in which about a million people marched through the streets to demonstrate their opposition . 	NAN	NAN	NAN	0.4	lord bingham, lord hoffmann
209	241	Others thought that it was justified , necessary and lawful . 	NAN	NAN	NAN	0.4	lord bingham, lord hoffmann
209	242	A motion in support of the war was passed by the House of Commons on 18 March by a majority of 396 to 217 . 	NAN	NAN	NAN	0.4	lord bingham, lord hoffmann
209	243	38 . 	NAN	NAN	NAN	0.4	lord bingham, lord hoffmann
209	244	In the weeks before the war , some people protested by acts of civil disobedience at military installations . 	NAN	NAN	NAN	0.4	lord bingham, lord hoffmann
209	245	These appeals are concerned with incidents which occurred during February and March 2003 at a military port facility at Marchwood , Southampton and at the airbase at RAF Fairford in Gloucestershire . 	NAN	NAN	NAN	0.4	lord bingham, lord hoffmann
209	246	At Marchwood demonstrators entered the port area and chained themselves to railings and to tanks which were about to be loaded onto ships . 	NAN	NAN	NAN	0.4	lord bingham, lord hoffmann
209	247	At Fairford they entered by cutting the perimeter fence and caused damage to vehicles or otherwise disrupted activities at the base . 	NAN	NAN	NAN	0.5	lord bingham, lord hoffmann
209	248	The appellants were arrested and charged . 	NAN	NAN	NAN	0.5	lord bingham, lord hoffmann
209	249	The charges 39 . 	NAN	NAN	NAN	0.5	lord bingham, lord hoffmann
209	250	Most of the demonstrators were prosecuted summarily before the Magistrates ' Courts -LRB- at Southampton or Cirencester respectively -RRB- on charges of aggravated trespass or criminal damage . 	NAN	NAN	NAN	0.5	lord bingham, lord hoffmann
209	251	Aggravated trespass is an offence under section 68 of the Criminal Justice and Public Order Act 1994 . 	NAN	NAN	NAN	0.5	lord bingham, lord hoffmann
209	252	At the time of these events -LRB- the scope of the offence has since been broadened -RRB- it was committed by a person who -- 40 . 	NAN	NAN	NAN	0.5	lord bingham, lord hoffmann
209	253	Criminal damage is an offence under section 1 -LRB- 1 -RRB- of the Criminal Damage Act 1971 : 41 . 	NAN	NAN	NAN	0.5	lord bingham, lord hoffmann
209	254	Section 5 enlarges upon the concept of reasonable excuse : 42 . 	NAN	NAN	NAN	0.5	lord bingham, lord hoffmann
209	255	In addition , one group of Fairford demonstrators was charged with offences such as conspiracy to cause criminal damage , which can be tried only on indictment . 	NAN	NAN	NAN	0.5	lord bingham, lord hoffmann
209	256	They were brought before the Crown Court at Bristol . 	NAN	NAN	NAN	0.5	lord bingham, lord hoffmann
209	257	For reasons which I shall explain , the trial has not yet taken place . 	NAN	NAN	NAN	0.5	lord bingham, lord hoffmann
209	258	The defences 43 . 	NAN	NAN	NAN	0.5	lord bingham, lord hoffmann
209	259	In essence , all the demonstrators said that their actions were justified , not only morally but also legally , because they were aimed at preventing a greater evil , namely the war in Iraq and its probable consequences . 	NAN	NAN	NAN	0.5	lord bingham, lord hoffmann
209	260	Translating these generalities into the terms of the various statutes , they said that their acts of disruption were not aggravated trespass because the activities of the Crown at Marchwood and Fairford were not lawful within the meaning of section 68 . 	NAN	NAN	NAN	0.5	lord bingham, lord hoffmann
209	261	They involved the commission of criminal offences associated with the prosecution of the war . 	NAN	NAN	NAN	0.5	lord bingham, lord hoffmann
209	262	Likewise , the intention to prevent the commission of a crime was a `` lawful excuse '' for causing damage to property within the meaning of section 1 of the 1971 Act . 	NAN	NAN	NAN	0.5	lord bingham, lord hoffmann
209	263	And , in respect of any of the offences charged , they were entitled to rely upon section 3 of the Criminal Law Act 1967 : 44 . 	NAN	NAN	NAN	0.5	lord bingham, lord hoffmann
209	264	All these defences thus depend upon the proposition that the war in Iraq was a crime as well as a mistake . 	NAN	NAN	NAN	0.5	lord bingham, lord hoffmann
209	265	What was that crime ? 	NAN	NAN	NAN	0.5	lord bingham, lord hoffmann
209	266	Various offences were suggested but all except one have either fallen by the wayside or been left for further consideration at a later stage . 	NAN	NAN	NAN	0.5	lord bingham, lord hoffmann
209	267	The one which remains is the crime of aggression , the unlawful use of war as an instrument of national policy . 	NAN	NAN	NAN	0.5	lord bingham, lord hoffmann
209	268	There is no doubt that this is a recognised crime in international law . 	NAN	NAN	NAN	0.5	lord bingham, lord hoffmann
209	269	Twelve of the major German war criminals were convicted of aggression in one form or another by the International Military Tribunal at Nuremberg and eight of them were executed . 	NAN	NAN	NAN	0.5	lord bingham, lord hoffmann
209	270	This decision has since received general international approbation . 	NAN	NAN	NAN	0.5	lord bingham, lord hoffmann
209	271	Article 5 of the Rome Statute of the International Criminal Court lists `` the crime of aggression '' together with genocide , crimes against humanity and war crimes as the crimes over which the Court is to have jurisdiction , these being `` the most serious crimes of concern to the international community as a whole '' . 	NAN	NAN	NAN	0.5	lord bingham, lord hoffmann
209	272	But the Statute postpones the exercise of jurisdiction over the crime of aggression until the adoption of a provision which defines the crime and sets out the conditions under which the jurisdiction is to be exercised . 	NAN	NAN	NAN	0.5	lord bingham, lord hoffmann
209	273	45 . 	NAN	NAN	NAN	0.5	lord bingham, lord hoffmann
209	274	Anticipating that the prosecution might not share its view that the war constituted aggression , the defendants proposed that the issue be determined by the District Judges at Southampton and Cirencester or the jury at Bristol . 	NAN	NAN	NAN	0.5	lord bingham, lord hoffmann
209	275	For this purpose , they made applications for disclosure of a wide range of documents of which the following -LRB- taken from the proceedings in Southampton -RRB- is a small sample : 46 . 	NAN	NAN	NAN	0.5	lord bingham, lord hoffmann
209	276	In the event , the applications for disclosure were rejected because the District Judges at both Southampton and Cirencester ruled that aggression was not an offence within the meaning of section 68 of the 1994 Act or a crime within the meaning of section 3 of the 1967 Act . 	NAN	NAN	NAN	0.5	lord bingham, lord hoffmann
209	277	It was therefore unnecessary to decide whether the war had been lawful or not . 	NAN	NAN	NAN	0.5	lord bingham, lord hoffmann
209	278	The District Judges said that there was no evidence that the activities of the Crown upon the land involved the commission of any other offences and convicted all the defendants . 	NAN	NAN	NAN	0.5	lord bingham, lord hoffmann
209	279	They were conditionally discharged . 	NAN	NAN	NAN	0.5	lord bingham, lord hoffmann
209	280	The defendants appealed by way of case stated to the Divisional Court . 	NAN	NAN	NAN	0.5	lord bingham, lord hoffmann
209	281	47 . 	NAN	NAN	NAN	0.5	lord bingham, lord hoffmann
209	282	At Bristol , there was a preparatory hearing before Grigson J under section 29 of the Criminal Procedure and Investigations Act 1996 . 	NAN	NAN	NAN	0.5	lord bingham, lord hoffmann
209	283	The judge was invited to give preliminary rulings as to various matters , including the extent to which the defendants could rely upon the alleged illegality of the war -LRB- or their beliefs as to its illegality -RRB- for the purposes of section 3 of the 1967 Act , `` lawful excuse '' under section 1 of the 1971 Act and the common law defence of necessity . 	NAN	NAN	NAN	0.5	lord bingham, lord hoffmann
209	284	It is not necessary to set out the terms of the judge 's rulings because they were all appealed by one side or the other to the Court of Appeal . 	NAN	NAN	NAN	0.5	lord bingham, lord hoffmann
209	285	The appeals 48 . 	NAN	NAN	NAN	0.5	lord bingham, lord hoffmann
209	286	The appeal from the Bristol Crown Court came before the Court of Appeal in June 2004 : see R v Jones -LRB- Margaret -RRB- -LSB- 2005 -RSB- QB 259 . 	NAN	NAN	NAN	0.5	lord bingham, lord hoffmann
209	287	The Court decided that `` crime '' in section 3 of the 1967 Act meant a crime in domestic law . 	NAN	NAN	NAN	0.5	lord bingham, lord hoffmann
209	288	It was not sufficient that it was a crime under a foreign or international law . 	NAN	NAN	NAN	0.5	lord bingham, lord hoffmann
209	289	It then proceeded to consider whether , by virtue of the principle that international law forms part of English law , the crime of aggression had been incorporated into domestic law . 	NAN	NAN	NAN	0.5	lord bingham, lord hoffmann
209	290	It rejected this submission on the ground that the definition of aggression was too uncertain . 	NAN	NAN	NAN	0.5	lord bingham, lord hoffmann
209	291	The article defining the crime for the purposes of the Rome Statute had not yet been agreed . 	NAN	NAN	NAN	0.5	lord bingham, lord hoffmann
209	292	There was no international agreement over whether , for example , the International Criminal Court could exercise its jurisdiction without there having been a determination of the Security Council . 	NAN	NAN	NAN	0.5	lord bingham, lord hoffmann
209	293	So the Court of Appeal said : 49 . 	NAN	NAN	NAN	0.5	lord bingham, lord hoffmann
209	294	On the questions of lawful excuse and necessity , the court said that it was only necessary to decide whether these defences could raise an issue as to the legality of the war in Iraq . 	NAN	NAN	NAN	0.5	lord bingham, lord hoffmann
209	295	It decided that no such issue could arise because , assuming the other elements in the defence to be made out , all that mattered was the honest opinion of the defendants about the need for action . 	NAN	NAN	NAN	0.5	lord bingham, lord hoffmann
209	296	The court rejected a prosecution argument that the threatened damage to property must be unlawful and that it could not be a lawful excuse that one had intended to prevent damage which would be the inevitable consequences of warfare . 	NAN	NAN	NAN	0.5	lord bingham, lord hoffmann
209	297	50 . 	NAN	NAN	NAN	0.5	lord bingham, lord hoffmann
209	298	The appeal from the Magistrates ' Courts was heard by the Divisional Court in February 2005 : see Ayliffe v Director of Public Prosecutions -LSB- 2006 -RSB- QB 227 . 	NAN	NAN	NAN	0.5	lord bingham, lord hoffmann
209	299	The court followed the decision of the Court of Appeal in rejecting the arguments that aggression was a `` crime '' for the purposes of the 1967 Act . 	NAN	NAN	NAN	0.5	lord bingham, lord hoffmann
209	300	It held that it was likewise not an `` offence '' for the purposes of section 68 -LRB- 2 -RRB- of the 1994 Act . 	NAN	NAN	NAN	0.5	lord bingham, lord hoffmann
209	301	The Divisional Court also dealt with the question of whether there was any ground for an argument that the defendants were acting to prevent war crimes , that is to say , crimes like wilful killing or taking hostages , committed in the course of what might otherwise be a lawful war . 	NAN	NAN	NAN	0.6	lord bingham, lord hoffmann
209	302	These had been made offences in English domestic law by section 51 of and Schedule 8 to the International Criminal Court Act 2001 . 	NAN	NAN	NAN	0.6	lord bingham, lord hoffmann
209	303	The court said that no issue had been raised at the trial as to whether such crimes were likely to be committed and in any case there could be no connection between the actions at Marchwood and Fairford and possible war crimes in Iraq . 	NAN	NAN	NAN	0.6	lord bingham, lord hoffmann
209	304	Jack J put the reasoning in a single sentence : `` The reality is that these were protests and ... not attempts to prevent crimes . '' 	NAN	NAN	NAN	0.6	lord bingham, lord hoffmann
209	305	The certified question 51 . 	NAN	NAN	NAN	0.6	lord bingham, lord hoffmann
209	306	The Court of Appeal in R v Jones -LRB- Margaret -RRB- certified two questions of general public importance : 52 . 	NAN	NAN	NAN	0.6	lord bingham, lord hoffmann
209	307	The second question was presumably included at the request of the prosecution . 	NAN	NAN	NAN	0.6	lord bingham, lord hoffmann
209	308	But only the defendants sought the leave of the House to appeal , which was granted on 1 November 2004 . 	NAN	NAN	NAN	0.6	lord bingham, lord hoffmann
209	309	53 . 	NAN	NAN	NAN	0.6	lord bingham, lord hoffmann
209	310	In Ayliffe v Director of Public Prosecutions the Divisional Court certified two questions of general public importance : The House gave the defendants leave to appeal on 28 July 2005 . 	NAN	NAN	NAN	0.6	lord bingham, lord hoffmann
209	311	Section 3 of the 1967 Act 54 . 	NAN	NAN	NAN	0.6	lord bingham, lord hoffmann
209	312	I think it is clear that `` crime '' in section 3 means a crime in domestic law . 	NAN	NAN	NAN	0.6	lord bingham, lord hoffmann
209	313	The Act was passed to give effect to the Seventh Report of the Criminal Law Revision Committee , Felonies and Misdemeanours , which had been published in May 1965 . 	NAN	NAN	NAN	0.6	lord bingham, lord hoffmann
209	314	The Committee recommended the abolition of the ancient distinction between felonies and misdemeanours and dealt with certain questions which would need to be clarified once the distinction had gone . 	NAN	NAN	NAN	0.6	lord bingham, lord hoffmann
209	315	One of these arose out of the existence of some old authority -LRB- `` very obscure '' -RRB- which suggested that extreme force could be used to arrest a person or prevent a crime only when the crime was a felony . 	NAN	NAN	NAN	0.6	lord bingham, lord hoffmann
209	316	The Committee -LRB- paragraphs 20-23 -RRB- recommended against any attempt to clarify the degree of force which could be used or the circumstances in which it could be justified . 	NAN	NAN	NAN	0.6	lord bingham, lord hoffmann
209	317	But they suggested a clause to make it clear that it should make no difference whether the offence had been a felony or a misdemeanour . 	NAN	NAN	NAN	0.6	lord bingham, lord hoffmann
209	318	That clause became section 3 . 	NAN	NAN	NAN	0.6	lord bingham, lord hoffmann
209	319	55 . 	NAN	NAN	NAN	0.6	lord bingham, lord hoffmann
209	320	This background suggests that `` crime '' in section 3 means something which had previously been either a felony or a misdemeanour : a form of classification peculiar to the common law and inapplicable to foreign or international law . 	NAN	NAN	NAN	0.6	lord bingham, lord hoffmann
209	321	And , as my noble and learned friend Lord Rodger of Earlsferry pointed out in the course of argument , that is confirmed by the long title of the Act : 56 . 	lord hoffmann	lord rodger	partagr	0.6	lord bingham, lord hoffmann
209	322	`` Crimes '' in the long title are self-evidently domestic crimes and in my opinion `` crime '' in section 3 must have the same meaning . 	NAN	NAN	NAN	0.6	lord bingham, lord hoffmann
209	323	57 . 	NAN	NAN	NAN	0.6	lord bingham, lord hoffmann
209	324	The main thrust of the appellants ' argument is that aggression is indeed a crime in English domestic law . 	NAN	NAN	NAN	0.6	lord bingham, lord hoffmann
209	325	They point out that in Trendtex Trading Corporation v Central Bank of Nigeria -LSB- 1977 -RSB- QB 529 , 553-554 Lord Denning MR discussed the two rival schools of thought on the relationship between international law and domestic law : the one saying that the rules of international law as they exist from time to time are `` incorporated into English law automatically and considered to be part of English law unless they are in conflict with an Act of Parliament '' and the other saying that they did not become part of English law unless adopted by `` the decisions of the judges , or by Act of Parliament , or long established custom '' . 	NAN	NAN	NAN	0.6	lord bingham, lord hoffmann
209	326	Lord Denning preferred the former view . 	NAN	NAN	NAN	0.6	lord bingham, lord hoffmann
209	327	More recently , in Kuwait Airways Corporation v Iraqi Airways Co -LRB- Nos 4 and 5 -RRB- -LSB- 2002 -RSB- 2 AC 883 , 1081-1082 , this House refused to recognise the effect of a domestic law of Iraq on the title to property situated within Iraq on the ground that the property had been brought to Iraq after being plundered in the course of the invasion of Kuwait which was contrary to international law and condemned as aggression by the Security Council . 	NAN	NAN	NAN	0.6	lord bingham, lord hoffmann
209	328	58 . 	NAN	NAN	NAN	0.6	lord bingham, lord hoffmann
209	329	Lest it be said that these cases are concerned only with the civil law , the appellants draw attention to cases in which crimes under international law have been treated as ipso facto forming part of domestic law . 	NAN	NAN	NAN	0.6	lord bingham, lord hoffmann
209	330	Blackstone -LRB- Commentaries on the Laws of England , Book IV , Chap 5 -RRB- records that violation of safe-conducts and the rights of ambassadors , as well as piracy , were treated as offences in English law because they were offences against the law of nations . 	NAN	NAN	NAN	0.6	lord bingham, lord hoffmann
209	331	And in In re Piracy Jure Gentium -LSB- 1934 -RSB- AC 586 the Privy Council looked to international law as a `` living and expanding code '' -LRB- p 592 -RRB- for the definition of the crime of piracy triable in a British court . 	NAN	NAN	NAN	0.6	lord bingham, lord hoffmann
209	332	59 . 	NAN	NAN	NAN	0.6	lord bingham, lord hoffmann
209	333	I say nothing about the reception into English law of rules of international law which may affect rights and duties in civil law . 	NAN	NAN	NAN	0.6	lord bingham, lord hoffmann
209	334	But there are two reasons why I think that aggression has not become a domestic crime . 	NAN	NAN	NAN	0.6	lord bingham, lord hoffmann
209	335	One concerns new international law crimes in general and the other reason is peculiar to the crime of aggression . 	NAN	NAN	NAN	0.6	lord bingham, lord hoffmann
209	336	Before explaining them , I should say that I do not rely upon the reason given by the Court of Appeal , namely that the elements of the offence are too uncertain . 	NAN	NAN	NAN	0.6	lord bingham, lord hoffmann
209	337	It is true that there is at present no consensus about the circumstances in which the International Criminal Court should exercise its jurisdiction to try the crime of aggression and in particular whether the imprimatur of the Security Council should have to appear on the indictment . 	NAN	NAN	NAN	0.6	lord bingham, lord hoffmann
209	338	But I think that upon analysis it will be found that these disputes are not about the definition of the crime but about the circumstances in which the International Criminal Court -LRB- as opposed to some domestic or ad hoc international tribunal , such as the International Military Tribunal at Nuremberg -RRB- should try someone for committing it . 	NAN	NAN	NAN	0.6	lord bingham, lord hoffmann
209	339	Of course the definition of a crime so recent and so rarely punished will have uncertainties . 	NAN	NAN	NAN	0.6	lord bingham, lord hoffmann
209	340	But that is true of other crimes as well . 	NAN	NAN	NAN	0.6	lord bingham, lord hoffmann
209	341	If the core elements of the crime are certain enough to have secured convictions at Nuremberg , or to enable everyone to agree that it was committed by the Iraqi invasion of Kuwait , then it is in my opinion sufficiently defined to be a crime , whether in international or domestic law . 	NAN	NAN	NAN	0.6	lord bingham, lord hoffmann
209	342	60 . 	NAN	NAN	NAN	0.6	lord bingham, lord hoffmann
209	343	I come then to the two reasons why I think that aggression is not a crime in English domestic law . 	NAN	NAN	NAN	0.6	lord bingham, lord hoffmann
209	344	The first is the democratic principle that it is nowadays for Parliament and Parliament alone to decide whether conduct not previously regarded as criminal should be made an offence . 	NAN	NAN	NAN	0.6	lord bingham, lord hoffmann
209	345	In the eighteenth century judges were less inhibited about creating new offences . 	NAN	NAN	NAN	0.6	lord bingham, lord hoffmann
209	346	Perhaps the last assertion of that power was by Viscount Simonds in Shaw v Director of Public Prosecutions -LSB- 1962 -RSB- AC 220 , 268 : 61 . 	NAN	NAN	NAN	0.6	lord bingham, lord hoffmann
209	347	But this opinion has since been repudiated . 	NAN	NAN	NAN	0.6	lord bingham, lord hoffmann
209	348	In Knuller -LRB- Publishing , Printing and Promotions -RRB- Ltd v Director of Public Prosecutions -LSB- 1973 -RSB- AC 435 all members of the House were agreed that , as Lord Reid said -LRB- at pp 457-458 -RRB- , the courts do not 62 . 	NAN	NAN	NAN	0.6	lord bingham, lord hoffmann
209	349	The same reasoning applies to the incorporation into domestic law of new crimes in international law . 	NAN	NAN	NAN	0.6	lord bingham, lord hoffmann
209	350	The law concerning safe conducts , ambassadors and piracy is very old . 	NAN	NAN	NAN	0.6	lord bingham, lord hoffmann
209	351	But new domestic offences should in my opinion be debated in Parliament , defined in a statute and come into force on a prescribed date . 	NAN	NAN	NAN	0.6	lord bingham, lord hoffmann
209	352	They should not creep into existence as a result of an international consensus to which only the executive of this country is a party . 	NAN	NAN	NAN	0.6	lord bingham, lord hoffmann
209	353	In Sosa v Alvarez-Machain -LRB- 2004 -RRB- 159 L Ed 2d 718 , 765 , Scalia J recently said : At least so far as the criminal law is concerned , I think that the same is true of English law . 	NAN	NAN	NAN	0.6	lord bingham, lord hoffmann
209	354	63 . 	NAN	NAN	NAN	0.6	lord bingham, lord hoffmann
209	355	My second reason for rejecting aggression as a domestic crime is that , in the absence of statutory authority , the prosecution of that particular crime in a domestic court would be inconsistent with a fundamental principle of our constitution . 	NAN	NAN	NAN	0.6	lord bingham, lord hoffmann
209	356	Aggression is a crime in which the principal is always the state itself . 	NAN	NAN	NAN	0.7	lord bingham, lord hoffmann
209	357	The liability of individuals is in a sense secondary . 	NAN	NAN	NAN	0.7	lord bingham, lord hoffmann
209	358	Thus the International Law Commission 's Draft Code of Crimes Against the Peace and Security of Mankind -LRB- see ILC Yearbook 1996 , Vol II , Part Two , p 42 -RRB- defined individual liability in article 16 by reference to the action of the state : 64 . 	NAN	NAN	NAN	0.7	lord bingham, lord hoffmann
209	359	The commentary explains : 65 . 	NAN	NAN	NAN	0.7	lord bingham, lord hoffmann
209	360	How , consistently with our constitution , is liability for such a crime to be determined in a domestic court ? 	NAN	NAN	NAN	0.7	lord bingham, lord hoffmann
209	361	First , there is the theoretical difficulty of the courts , as the judicial branch of government , holding not merely that some officer of the state has acted unlawfully -LRB- as in , for example , M v Home Office -LSB- 1994 -RSB- 1 AC 377 -RRB- but , as a sine qua non condition , that the state itself , of which the courts form part , has acted unlawfully . 	NAN	NAN	NAN	0.7	lord bingham, lord hoffmann
209	362	Secondly , there is the practical difficulty that the making of war and peace and the disposition of the armed forces has always been regarded as a discretionary power of the Crown into the exercise of which the courts will not enquire . 	NAN	NAN	NAN	0.7	lord bingham, lord hoffmann
209	363	I say that it is a practical difficulty because , as Lord Devlin pointed out in Chandler v Director of Public Prosecutions -LSB- 1964 -RSB- AC 763 , 806-812 , the reason why the courts can not enquire is not the technicality that the powers form part of the royal prerogative . 	NAN	NAN	NAN	0.7	lord bingham, lord hoffmann
209	364	Lord Devlin 's view that the prerogative origin of the powers did not in itself exclude judicial control was affirmed by the House in Council of Civil Service Unions v Minister for the Civil Service -LSB- 1985 -RSB- AC 374 . 	NAN	NAN	NAN	0.7	lord bingham, lord hoffmann
209	365	It is because of the discretionary nature of the power itself . 	NAN	NAN	NAN	0.7	lord bingham, lord hoffmann
209	366	As Lord Devlin said -LRB- at pp.809-810 -RRB- : 66 . 	NAN	NAN	NAN	0.7	lord bingham, lord hoffmann
