277	143	It could , I should have thought , have been argued that just as the deemed supply in Thorn fell to be disregarded , leaving the actual supply in place , so here the deemed supply by Svenska to London Branch on 26 June 1992 fell to be disregarded , leaving the actual supplies between 1987 and 1991 in place . 	NAN	NAN	NAN	0.4	lord hutton
277	144	Mr. Milne was not attracted by this argument -LRB- I do not know where it would have led him -RRB- , and Mr. Pleming regarded it as heretical . 	NAN	NAN	NAN	0.4	lord hutton
277	145	So I say no more about it . 	NAN	NAN	NAN	0.4	lord hutton
277	146	I would decide the case on the same grounds as Carnwath J. I would therefore allow the appeal and restore his judgment . 	lord lloyd	self	outcome	0.5	lord hutton
277	147	------------- NEW JUDGE --------------- 	NAN	NAN	NAN	0.5	lord hutton
277	148	LORD HOPE OF CRAIGHEAD 	NAN	NAN	NAN	0.5	lord hutton
277	149	My Lords , 	NAN	NAN	NAN	0.5	lord hutton
277	150	I have had the advantage of reading in draft the speech which has been prepared by my noble and learned friend Lord Hutton . 	lord hope	lord hutton	ackn	0.5	lord hutton
277	151	For the reasons which he has given I too would dismiss this appeal . 	lord hope	lord hutton	fullagr	0.5	lord hutton
277	151	For the reasons which he has given I too would dismiss this appeal . 	lord hope	self	outcome	0.5	lord hutton
277	152	I was at first impressed by the argument which Mr. Milne Q.C. advanced for Svenska that regulation 34 -LRB- 1 -RRB- -LRB- b -RRB- of the Value Added Tax -LRB- General -RRB- Regulations 1985 directs attention to the actual physical use of the intended taxable supply to which regulation 34 -LRB- 1 -RRB- -LRB- a -RRB- refers and to its appropriation for use in the real world and that , as the supplies in respect of which Svenska had been credited with input tax were used immediately upon their receipt by London Branch , there could be no question of their being treated as having been used again later when London Branch joined the VAT group . 	NAN	NAN	NAN	0.5	lord hutton
277	153	This was the approach which was adopted by Carnwath J. when he allowed Svenska < . ' > 	NAN	NAN	NAN	0.5	lord hutton
277	154	s appeal against the decision of the Value Added Tax Tribunal . 	NAN	NAN	NAN	0.5	lord hutton
277	155	He said that there was nothing in regulation 23 which required the inward supplies which Svenska made to London Branch to be notionally accumulated until the outward supplies became taxable and that , as in the real world they had been fully used already before London Branch was included in the VAT group , the Commissioners < . ' > 	NAN	NAN	NAN	0.5	lord hutton
277	156	claim could not be brought within the language of the statute . 	NAN	NAN	NAN	0.5	lord hutton
277	157	But I was in the end persuaded by Mr. Pleming Q.C. for the Commissioners that this approach is unsound , that the statutory scheme as a whole requires one to depart from the real world when applying it to the facts of this case and that the Court of Appeal were right to restore the order which the tribunal made upholding the assessments . 	NAN	NAN	NAN	0.5	lord hutton
277	158	In order to apply the statutory scheme to the facts of this case it is necessary to read regulation 34 -LRB- 1 -RRB- -LRB- a -RRB- together with regulation 23 which lays down the rules which must be applied in the tax treatment of continuous supplies of services , and it is necessary to read both regulation 34 -LRB- 1 -RRB- -LRB- a -RRB- and regulation 34 -LRB- 1 -RRB- -LRB- b -RRB- together with section 29 of the Value Added Tax Act 1983 which deals with the approach which must be taken where bodies corporate are treated as members of a group . 	NAN	NAN	NAN	0.5	lord hutton
277	159	If this is done the following are the results which are to be drawn from the exercise . 	NAN	NAN	NAN	0.5	lord hutton
277	160	The first point is that the words `` intended taxable supply '' in regulation 34 -LRB- 1 -RRB- -LRB- a -RRB- must be taken to refer to the time when , according to regulation 23 -LRB- 1 -RRB- , the continuous supplies of services which enabled Svenska to obtain credit against them for input tax are to be treated as having been supplied . 	NAN	NAN	NAN	0.5	lord hutton
277	161	Regulation 23 -LRB- 1 -RRB- provides that supplies of this kind are to be treated as separately and successively supplied at the earlier of the time when a payment in respect of the services is received and the time when the supplier issues a tax invoice relating to the supplies . 	NAN	NAN	NAN	0.5	lord hutton
277	162	Neither of these events had yet occurred by the time when London Branch were brought into the VAT group with Svenska . 	NAN	NAN	NAN	0.5	lord hutton
277	163	So these supplies must on that date be treated as having not yet been supplied by Svenska for any of the purposes of value added tax . 	NAN	NAN	NAN	0.5	lord hutton
277	164	It was submitted by Mr. Milne that the services which Svenska supplied to London Branch were taxable supplies when they were made within the meaning of section 2 -LRB- 1 -RRB- of the Act , and that what regulation 23 was concerned with was the time of the supply not whether the supplies were taxable . 	NAN	NAN	NAN	0.5	lord hutton
277	165	He said that the fact that they were taxable supplies was not to be confused with the point of time at which the value added tax became chargeable . 	NAN	NAN	NAN	0.5	lord hutton
277	166	But we are concerned in this case with the question whether an adjustment falls to be made under regulation 34 to the credits which Svenska received by way of input tax . 	NAN	NAN	NAN	0.5	lord hutton
277	167	Section 14 of the Act allows a taxable person to take credit for his allowable input tax and to deduct that amount from any output tax which is due from him on the taxable supplies which he makes . 	NAN	NAN	NAN	0.5	lord hutton
277	168	Regulation 34 -LRB- 1 -RRB- -LRB- a -RRB- assumes that the amount of input tax which has been credited has been attributed to supplies which will attract value added tax because they are taxable . 	NAN	NAN	NAN	0.5	lord hutton
277	169	What it is designed to do is to apply the regulation to what it describes as `` an intended taxable supply '' . 	NAN	NAN	NAN	0.5	lord hutton
277	170	In order to apply this phrase to the facts it is necessary to identify the time at which the supply was intended to become taxable . 	NAN	NAN	NAN	0.5	lord hutton
277	171	It seems to me that regulation 34 -LRB- 1 -RRB- -LRB- a -RRB- requires one to depart from the real world , or from `` real time '' as Mr. Pleming put it , because it is to the statutory rules that one must look in order to discover when the supply would be expected , as at the date when the input tax was credited , to attract value added tax . 	NAN	NAN	NAN	0.5	lord hutton
277	172	The second point is that the effect of the group registration was that , as from 1 August 1991 , the words `` taxable person '' in regulation 34 -LRB- 1 -RRB- -LRB- a -RRB- and `` he '' in regulation 34 -LRB- 1 -RRB- -LRB- b -RRB- must be read as meaning Svenska as the representative member of the group and not Svenska carrying on business on its own as a separate company . 	NAN	NAN	NAN	0.5	lord hutton
277	173	This is because section 29 -LRB- 1 -RRB- of the Act states that , where any bodies are treated as members of a group , any business carried on by a member of the group shall be treated as carried on by the representative member . 	NAN	NAN	NAN	0.5	lord hutton
277	174	Svenska brought with it into the group registration the amounts which had been credited to it as input tax which had been attributed to supplies which were not yet treated as taxable , and London Branch brought into the group the value of the continuous supply of services for which it had not yet paid and not yet been issued with a tax invoice . 	NAN	NAN	NAN	0.5	lord hutton
277	175	The question raised by regulation 34 -LRB- 1 -RRB- -LRB- b -RRB- as to whether , after the group registration , these supplies were used or appropriated for use in making an exempt supply must be answered by applying the rule which section 29 -LRB- 1 -RRB- lays down , that any business carried on by any member of the group must be treated as carried on by the representative member . 	NAN	NAN	NAN	0.5	lord hutton
277	176	For the purposes of this exercise the business carried on by London Branch must be treated as carried on by Svenska as the representative member . 	NAN	NAN	NAN	0.5	lord hutton
277	177	As that business involved the making of exempt supplies outside the group to customers of London Branch , Svenska as the representative member must be treated as having used at least part of the supplies which were attributed to an intended taxable supply for the purpose of obtaining credits of input tax in making exempt supplies . 	NAN	NAN	NAN	0.5	lord hutton
277	178	So the requirements of regulation 34 -LRB- 1 -RRB- are satisfied , with the result that regulation 34 -LRB- 2 -RRB- under which the assessments were made becomes applicable . 	NAN	NAN	NAN	0.6	lord hutton
277	179	I think that the tribunal put the point correctly when they said that this reconstruction of the transactions for VAT purposes , so that inward supplies from outside actually made to Svenska may be looked at with regard to the outward supplies actually made by London Branch , follows from the effect of section 29 . 	NAN	NAN	NAN	0.6	lord hutton
277	180	As Aldous L.J. said at -LSB- 1997 -RSB- S.T.C. 958 , 965A , the change to group status altered the way that VAT had to be accounted for with the result that the supplies were considered as used or appropriated for use in making supplies that were in part exempt . 	NAN	NAN	NAN	0.6	lord hutton
277	181	This conclusion is not easy to grasp if regard is had to what was happening in the real world . 	NAN	NAN	NAN	0.6	lord hutton
277	182	But the statutory scheme does not always follow the real world . 	NAN	NAN	NAN	0.6	lord hutton
277	183	The guiding principle as to relief for input tax as against output tax is that of fiscal neutrality : Rompelman v. Minister van Financien -LRB- Case 268/83 -RRB- -LSB- 1985 -RSB- E.C.R. 655 , 664 paragraph 19 of the judgment . 	NAN	NAN	NAN	0.6	lord hutton
277	184	It is satisfactory to find that the various statutory rules which must be applied in this case have produced a result which is consistent with that principle . 	NAN	NAN	NAN	0.6	lord hutton
277	185	------------- NEW JUDGE --------------- 	NAN	NAN	NAN	0.6	lord hutton
277	186	LORD CLYDE 	NAN	NAN	NAN	0.6	lord hutton
277	187	My Lords , 	NAN	NAN	NAN	0.6	lord hutton
277	188	I have the advantage of reading in draft the speech prepared by my noble and learned friend Lord Hutton , and for the reasons which he gives I too would dismiss this appeal . 	lord clyde	lord hutton	ackn	0.6	lord hutton
277	188	I have the advantage of reading in draft the speech prepared by my noble and learned friend Lord Hutton , and for the reasons which he gives I too would dismiss this appeal . 	lord clyde	lord hutton	fullagr	0.6	lord hutton
277	188	I have the advantage of reading in draft the speech prepared by my noble and learned friend Lord Hutton , and for the reasons which he gives I too would dismiss this appeal . 	lord clyde	self	outcome	0.6	lord hutton
277	189	------------- NEW JUDGE --------------- 	NAN	NAN	NAN	0.6	lord hutton
277	190	LORD HUTTON 	NAN	NAN	NAN	0.6	lord hutton
277	191	My Lords , 	NAN	NAN	NAN	0.6	lord hutton
277	192	Svenska International Plc. -LRB- Svenska -RRB- is a United Kingdom subsidiary of a Swedish Bank , Svenska Handelsbanken . 	NAN	NAN	NAN	0.6	lord hutton
277	193	In December 1987 Svenska Handelsbanken established a branch in London -LRB- `` the London Branch '' -RRB- . 	NAN	NAN	NAN	0.6	lord hutton
277	194	It was agreed that Svenska would provide all management services to the London Branch for a charge . 	NAN	NAN	NAN	0.6	lord hutton
277	195	Svenska in turn contracted with outside suppliers for all goods and services . 	NAN	NAN	NAN	0.6	lord hutton
277	196	The services provided included staff , use of shared premises , office services , telecommunications , electricity , legal and accounting services . 	NAN	NAN	NAN	0.6	lord hutton
277	197	The agreement made between Svenska and the London Branch in or about December 1987 was later recorded in a letter between the parties dated 1 February 1991 , under the terms of which the amount to be paid by the London Branch for the services provided by Svenska was to be calculated on the basis that the total costs incurred by Svenska would be shared between the parties in proportion to the value of the banking and related business undertaken by each party . 	NAN	NAN	NAN	0.6	lord hutton
277	198	Svenska was registered for VAT at all material times . 	NAN	NAN	NAN	0.6	lord hutton
277	199	The London Branch was not registered for VAT when it was established . 	NAN	NAN	NAN	0.6	lord hutton
277	200	In 1988 and 1989 the London Branch , with the support of Svenska , applied to become part of the same VAT group as Svenska , so that it and Svenska would become a single entity for VAT purposes . 	NAN	NAN	NAN	0.6	lord hutton
277	201	However until 1991 it was not possible as a matter of law for a branch of a foreign company to join a VAT group unless it was resident in the United Kingdom . 	NAN	NAN	NAN	0.6	lord hutton
277	202	Therefore between 1987 and 1991 Svenska and the London Branch remained separate entities for VAT purposes . 	NAN	NAN	NAN	0.6	lord hutton
277	203	On 8 July 1991 , following a change in the law announced in the 1991 Budget and introduced by the Finance Act 1991 , the London Branch became eligible to form a group with Svenska . 	NAN	NAN	NAN	0.6	lord hutton
277	204	By a letter dated 2 October 1991 the Commissioners of Customs and Excise -LRB- `` the Commissioners '' -RRB- confirmed that the London Branch would be included in a VAT group with Svenska with effect from 1 August 1991 and that Svenska would be the representative member of the group . 	NAN	NAN	NAN	0.6	lord hutton
277	205	Throughout the period between 1987 and 1 August 1991 pursuant to the agreement between them Svenska provided management services to the London Branch . 	NAN	NAN	NAN	0.6	lord hutton
277	206	It is common ground between the parties that regulation 23 of the Value Added Tax -LRB- General -RRB- Regulations 1985 -LRB- `` the 1985 Regulations '' -RRB- applied to these services . 	NAN	NAN	NAN	0.6	lord hutton
277	207	Regulation 23 -LRB- 1 -RRB- provides : `` Subject to paragraph -LRB- 2 -RRB- below , where services are supplied for a period for a consideration the whole or part of which is determined or payable periodically or from time to time , they shall be treated as separately and successively supplied at the earlier of the following times -- -LRB- a -RRB- whenever a payment in respect of the supplies is received ; or -LRB- b -RRB- whenever the supplier issues a tax invoice relating to the supplies . '' 	NAN	NAN	NAN	0.6	lord hutton
277	208	Svenska did not issue an invoice for the services it provided to London Branch and London Branch did not make any payment for those services until 26 June 1992 , when Svenska issued an invoice to the London Branch in respect of all costs and management services for the period up to 31 December 1991 totalling # 45,330,000 . 	NAN	NAN	NAN	0.6	lord hutton
277	209	Svenska incurred input tax on inward supplies which were intended to form part of a taxable supply of services by it to London Branch . 	NAN	NAN	NAN	0.6	lord hutton
277	210	Regulation 30 -LRB- 1 -RRB- of the 1985 Regulations provides : `` Subject to paragraphs -LRB- 2 -RRB- , -LRB- 3 -RRB- , -LRB- 4 -RRB- and -LRB- 5 -RRB- of this regulation -LSB- and regulation 30B -RSB- , the amount of input tax to be provisionally attributed to taxable supplies by a taxable person shall be determined in any prescribed accounting period by the following method : -LRB- a -RRB- importations by and supplies to the taxable person in the period shall be identified ; -LRB- b -RRB- the input tax on such importations and supplies as are wholly used or to be used by him in making taxable supplies may be deducted ; . 	NAN	NAN	NAN	0.7	lord hutton
277	211	. 	NAN	NAN	NAN	0.7	lord hutton
277	212	. '' 	NAN	NAN	NAN	0.7	lord hutton
277	213	Therefore from 1 June 1987 to 30 March 1990 Svenska recovered in full the input tax attributable to the taxable supplies it intended to make to the London Branch . 	NAN	NAN	NAN	0.7	lord hutton
277	214	In October 1991 the Commissioners issued two notices of assessment to claim back all the input tax which Svenska had claimed up to 30 June 1991 . 	NAN	NAN	NAN	0.7	lord hutton
277	215	Following certain revisions , two assessments remained , one dated 5 January 1993 in the sum of # 20,392 and the other , dated 27 July 1993 , in the sum of # 791,202 . 	NAN	NAN	NAN	0.7	lord hutton
277	216	Svenska appealed against the two assessments to the Value Added Tax Tribunal -LRB- `` the Tribunal '' -RRB- which dismissed its appeal . 	NAN	NAN	NAN	0.7	lord hutton
277	217	Svenska appealed to the High Court and Carnwath J. allowed the appeal . 	NAN	NAN	NAN	0.7	lord hutton
277	218	The Commissioners then appealed to the Court of Appeal which allowed their appeal . 	NAN	NAN	NAN	0.7	lord hutton
277	219	The issue debated in the successive appeals was whether Svenska was obliged to repay to the Commissioners a proportion of the input tax which had been credited to it and , in particular , whether after 1 August 1991 , Svenska had `` used or appropriated for use '' the supplies received by it in making an exempt supplies . 	NAN	NAN	NAN	0.7	lord hutton
277	220	Regulation 34 of the 1985 Regulations provides : '' -LRB- 1 -RRB- This regulation applies where -- -LRB- a -RRB- a taxable person has been credited with an amount of input tax in respect of any importation or supply which has been attributed to an intended taxable supply ; and -LRB- b -RRB- during a period of six years commencing on the first day of the prescribed accounting period in which the attribution was determined , he uses or appropriates for use any such importation or supply in making an exempt supply or in carrying on an activity other than the making of taxable supplies before the intended taxable supply is made . 	NAN	NAN	NAN	0.7	lord hutton
277	221	-LRB- 2 -RRB- Save as the Commissioners otherwise allow , where this regulation applies the taxable person shall on the return next following the date on which the use or appropriation for use occurs account for such proportion of the input tax credited as is attributable to the exempt supply or other activity in accordance with the method which he was required to use when the input tax was credited , and he shall repay the said proportion of input tax to the Commissioners . '' 	NAN	NAN	NAN	0.7	lord hutton
277	222	Section 29 of the Value Added Tax Act 1983 provides : '' -LRB- 1 -RRB- Where , under the following provisions of this section , any bodies corporate are treated as members of a group any business carried on by a member of the group shall be treated as carried on by the representative member , and -- -LRB- a -RRB- any supply of goods or services by a member of the group to another member of the group shall be disregarded ; and -LRB- b -RRB- any other supply of goods or services by or to a member of the group shall be treated as a supply by or to the representative member ; and -LRB- c -RRB- any tax paid or payable by a member of the group on the importation of any goods shall be treated as paid or payable by the representative member and the goods shall be treated for the purposes of section 25 above and paragraph 4 -LRB- 6 -RRB- of Schedule 7 to this Act as imported by the representative member ; and all members of the group shall be liable jointly and severally for any tax due from the representative member . '' 	NAN	NAN	NAN	0.7	lord hutton
277	223	The principal argument advanced by the Commissioners was that services supplied by London Branch to third parties -LRB- which included exempt services -RRB- were , pursuant to section 29 , to be regarded as supplied by Svenska so that Svenska had used the supplies to it to make exempt supplies and accordingly regulation 34 -LRB- 1 -RRB- -LRB- b -RRB- applied . 	NAN	NAN	NAN	0.7	lord hutton
277	224	This argument was accepted by the Tribunal , rejected by Carnwath J. , and accepted by the Court of Appeal . 	NAN	NAN	NAN	0.7	lord hutton
277	225	In the High Court Carnwath J. stated -LSB- 1996 -RSB- S.T.C. 1000 , 1005E : `` The regulation applies where the taxable person ` uses or appropriates for use ' a supply . 	NAN	NAN	NAN	0.7	lord hutton
277	226	It is necessary therefore , to identify something done by the taxable person in relation to the supplies -- some action or decision -- which can be characterised , in the ordinary sense of the words , as a ` use or appropriation for use ' . '' 	NAN	NAN	NAN	0.7	lord hutton
277	227	He then said at p. 1005J that counsel for the Commissioners : '' . 	NAN	NAN	NAN	0.7	lord hutton
277	228	. 	NAN	NAN	NAN	0.7	lord hutton
277	229	. 	NAN	NAN	NAN	0.7	lord hutton
277	230	fails to point to anything done by Svenska which could be regarded as a use or appropriation . 	NAN	NAN	NAN	0.7	lord hutton
277	231	To assert that they ` could only ' be used for banking services begs the question whether they needed to be used at all . 	NAN	NAN	NAN	0.7	lord hutton
277	232	In the real world they had been fully used already , and Svenska had no need to re-use them . 	NAN	NAN	NAN	0.7	lord hutton
277	233	Even if Svenska was to be regarded as notionally ` accumulating ' them for tax purposes , it does not follow that it was to be notionally treated as using them at any particular time or at all . 	NAN	NAN	NAN	0.7	lord hutton
277	234	That argument would have to be supported by the effect of some additional ` deeming ' provision -- express or implied -- to be found in the legislation . 	NAN	NAN	NAN	0.7	lord hutton
277	235	No such provision has been identified . '' 	NAN	NAN	NAN	0.7	lord hutton
277	236	In the Court of Appeal -LSB- 1997 -RSB- S.T.C. 958 Aldous L.J. , with whose judgment Auld L.J. and Butler-Sloss L.J. agreed , stated at p. 964G : `` In the present case it is accepted that credit was properly claimed because Svenska intended to make taxable supplies . 	NAN	NAN	NAN	0.7	lord hutton
277	237	It is also accepted that those taxable supplies were treated for VAT accounting purposes as not being supplied at the actual time of supply and that , in this case where Svenska was going to supply to the London branch , the actual date of supply for accounting purposes would be the date of invoice or payment . 	NAN	NAN	NAN	0.7	lord hutton
277	238	That was the actual intention and therefore the time for payment had not arrived as of 1 August 1991 . 	NAN	NAN	NAN	0.7	lord hutton
277	239	On 1 August 1991 Svenska and the London branch became a group with the result that a new accounting procedure became necessary . 	NAN	NAN	NAN	0.7	lord hutton
277	240	Section 29 provided that a supply by Svenska to the London branch had to be disregarded and any supply by the London branch was treated for VAT purposes as a supply by Svenska . 	NAN	NAN	NAN	0.7	lord hutton
277	241	That resulted in this position . 	NAN	NAN	NAN	0.7	lord hutton
277	242	Svenska had claimed credit for an intended supply to the London branch which could never take place as supplies between Svenska had to be disregarded . 	NAN	NAN	NAN	0.7	lord hutton
277	243	London branch had used the relevant costs to make supplies to third parties and those supplies were for accounting purposes to be treated as made by Svenska . 	NAN	NAN	NAN	0.8	lord hutton
277	244	It followed that for VAT accounting purposes the credit had been claimed in respect of an input attributed to an intended supply to the London branch which had never taken place . 	NAN	NAN	NAN	0.8	lord hutton
277	245	However Svenska had used or at least appropriated for use the intended supplies to make exempt supplies to third parties . 	NAN	NAN	NAN	0.8	lord hutton
277	246	In essence the change to group status altered the way that VAT had to be accounted for with the result that the supplies were considered as used or appropriated for use in making supplies that were in part exempt . 	NAN	NAN	NAN	0.8	lord hutton
277	247	For my part I believe that Carnwath J. was wrong to look solely for an act done by Svenska which could be regarded as a use or an appropriation for use . 	NAN	NAN	NAN	0.8	lord hutton
277	248	Regulation 34 has to be construed in the light of the whole scheme , starting with regulation 23 dealing with when continuous supplies are to be treated as being made , to section 29 which treats what were separate entities as one taxable group . 	NAN	NAN	NAN	0.8	lord hutton
277	249	Once that is done it becomes apparent that a change in use can be caused by the change of accounting provisions brought in by the change to group status . '' 	NAN	NAN	NAN	0.8	lord hutton
277	250	Before this House Mr. Milne Q.C. advanced two main submissions on behalf of the appellant , Svenska . 	NAN	NAN	NAN	0.8	lord hutton
277	251	One submission was that during the period between 1987 and 1 August 1991 Svenska did in fact instantly use the goods and services supplied to it for the intended purpose of providing the onward services to the London Branch . 	NAN	NAN	NAN	0.8	lord hutton
277	252	Therefore when the London Branch joined the VAT group on 1 August 1991 there were no `` accumulated services '' , to use the term employed by the Commissioners , and regulation 34 could not apply , because Svenska had already made `` taxable supplies '' to the London Branch so that there were no supplies which Svenska could `` use or appropriate for use '' . 	NAN	NAN	NAN	0.8	lord hutton
