86	427	Section 35 -LRB- 6 -RRB- was relied on to support the opposite contention , on the basis that , read literally , para -LRB- a -RRB- appears to imply that the court would have power to extend time for service of a notice of appeal . 	NAN	NAN	NAN	0.8	NAN
86	428	However , not only does this seem inconsistent with the effect of section 36 as a whole , as just explained , but there is also the point that para -LRB- b -RRB- is something of a puzzle on any view . 	NAN	NAN	NAN	0.8	NAN
86	429	Once the appeal process is on foot , the need for an extension of time to take a procedural step would be irrelevant , and if the appeal process was not on foot in time , para -LRB- a -RRB- would be the relevant provision . 	NAN	NAN	NAN	0.8	NAN
86	430	The least unsatisfactory analysis of section 35 -LRB- 6 -RRB- appears to me to be as follows . 	NAN	NAN	NAN	0.8	NAN
86	431	Para -LRB- a -RRB- was added as a precautionary provision to emphasise that , if the court would otherwise have any powers to extend time , such an extension could not be relied on by an appellant , or would-be appellant , as it would undermine the time-table laid down in section 35 . 	NAN	NAN	NAN	0.8	NAN
86	432	As to para -LRB- b -RRB- , it seems to have been added out of what Lord Rodger has characterised as hyper-precaution , for the same reason . 	lord neuberger	lord rodger	partagr	0.8	NAN
86	433	78 . 	NAN	NAN	NAN	0.8	NAN
86	434	It is true that the Practice Direction to CPR 52 , and the prescribed form of the notice of appeal both suggest that the court 's powers to extend time under the CPR apply to the appeal process . 	NAN	NAN	NAN	0.8	NAN
86	435	As a general proposition this is of course , true , but it does not follow that the draftsman of those documents considered , let alone was stating , that the court must have such power in relation to every type of appeal . 	NAN	NAN	NAN	0.8	NAN
86	436	In any event , CPR 52.1 -LRB- 4 -RRB- make it clear that the provisions of CPR 52 are `` subject to any rule , enactment or practice direction which sets out special provisions with regard to any particular category of appeal '' , and the Practice Direction is brought into effect through CPR 52.2 . 	NAN	NAN	NAN	0.8	NAN
86	437	79 . 	NAN	NAN	NAN	0.8	NAN
86	438	The Divisional Court in the Moulai appeal thought that the court could nonetheless dispense with service of the appeal notice under CPR 6.9 -LRB- although they declined to make such an order in the event -RRB- . 	NAN	NAN	NAN	0.8	NAN
86	439	I do not agree . 	NAN	NAN	NAN	0.8	NAN
86	440	If , as I have concluded , section 26 -LRB- 4 -RRB- requires the appellant 's notice to be filed and served within seven days , the court can no more make an order dispensing with service than it can extend the time . 	NAN	NAN	NAN	0.8	NAN
86	441	This conclusion , arrived at in a case where the dispensing of service is being sought to avoid having to serve at all or to avoid the 7-day time limit , does not preclude the possibility of the court making an order for substituted service in appropriate cases under the 2003 Act . 	NAN	NAN	NAN	0.8	NAN
86	442	Indeed , on exceptional facts -LRB- e.g. where the respondent was evading service -RRB- , the court might well order that service could be effected in a way that may well lead to the notice not being received by the respondent within the 7-day period , or even - conceivably - at all . 	NAN	NAN	NAN	0.8	NAN
86	443	80 . 	NAN	NAN	NAN	0.8	NAN
86	444	For these reasons , I consider that it is not open to the court to extend time under section 26 -LRB- 4 -RRB- or to dispense with service of the notice of appeal . 	NAN	NAN	NAN	0.8	NAN
86	445	For the same reasons , I reach the same conclusion in relation to section 103 -LRB- 9 -RRB- . 	NAN	NAN	NAN	0.8	NAN
86	446	Service at the end of the 7 or 14 days 81 . 	NAN	NAN	NAN	0.8	NAN
86	447	Both filing and service of documents often occur towards the last minute , and this is particularly likely in cases where the time for filing and service is short . 	NAN	NAN	NAN	0.8	NAN
86	448	Two questions of principle arise in connection with this practical problem in relation to the time limits in sections 26 -LRB- 4 -RRB- and 103 -LRB- 9 -RRB- . 	NAN	NAN	NAN	0.8	NAN
86	449	The first is whether the provisions of CPR 6.7 , which is concerned with deemed service , are applicable to those time limits . 	NAN	NAN	NAN	0.9	NAN
86	450	Thus , under the rules as they were at the time of the instant appeals , a document transmitted by fax after 4.00 pm was deemed to have been served `` on the business day after the day on which it is transmitted '' . 	NAN	NAN	NAN	0.9	NAN
86	451	Such deeming provisions have been consistently held to be irrebuttable - see e.g. Anderton v Clwyd County Council -LSB- 2002 -RSB- EWCA -LRB- Civ -RRB- 933 , -LSB- 2002 -RSB- 1WLR 3174 . 	NAN	NAN	NAN	0.9	NAN
86	452	In these appeals , it appears to have been generally assumed that these provisions govern the question of when a notice of appeal is treated as having been `` given '' under sections 26 -LRB- 4 -RRB- and 103 -LRB- 9 -RRB- . 	NAN	NAN	NAN	0.9	NAN
86	453	82 . 	NAN	NAN	NAN	0.9	NAN
86	454	In my view , that general assumption is wrong . 	NAN	NAN	NAN	0.9	NAN
86	455	Section 26 -LRB- 4 -RRB- requires the appellant 's notice to be issued and served within 7 days , and I can see no warrant for the CPR being invoked to cut down that period . 	NAN	NAN	NAN	0.9	NAN
86	456	If a statute permits something to be done within a specific period , it is hard to see how that period can be cut down by subordinate legislation , as a matter of principle . 	NAN	NAN	NAN	0.9	NAN
86	457	In relation to the first two points of principle raised by these appeals , it is part of the Prosecutor 's case , indeed it is part of my reasoning , that the reference to rules of court in the section govern the manner , not the time , of service . 	NAN	NAN	NAN	0.9	NAN
86	458	In these circumstances , it is particularly hard to see how invocation of provisions of the CPR can be justified in order to curtail that period . 	NAN	NAN	NAN	0.9	NAN
86	459	The point is reinforced by practical considerations : the 7 day period laid down by section 26 -LRB- 4 -RRB- is short , and it does not seem very fair to cut it down , even if only by a few hours . 	NAN	NAN	NAN	0.9	NAN
86	460	Although the 14 days permitted by section 103 -LRB- 9 -RRB- is somewhat longer , the same reasoning applies . 	NAN	NAN	NAN	0.9	NAN
86	461	83 . 	NAN	NAN	NAN	0.9	NAN
86	462	Another point which arises is what happens if it is impossible to give notice on , or during the final part of , the last day . 	NAN	NAN	NAN	0.9	NAN
86	463	For instance , in relation to filing , the Court Office may be closed on the last day because it is Christmas Day or another Bank Holiday , and the Court office will be closed at some point in the late afternoon on the last day . 	NAN	NAN	NAN	0.9	NAN
86	464	Equally , the respondent 's office may be closed for the same reasons . 	NAN	NAN	NAN	0.9	NAN
86	465	84 . 	NAN	NAN	NAN	0.9	NAN
86	466	Where the requisite recipient 's office is closed during the whole of the last day , I consider that the notice will be validly filed or served if it is given at any time during the first succeeding day on which the office is open -LRB- i.e. the next business day -RRB- . 	NAN	NAN	NAN	0.9	NAN
86	467	So if the final day for giving a notice of appeal would otherwise be Christmas Day , filing or service can validly be effected on the 27th December -LRB- unless it is a weekend , in which case it would be the following Monday -RRB- . 	NAN	NAN	NAN	0.9	NAN
86	468	This conclusion accords with that reached in Pritam Kaur v S Russell & Sons Ltd -LSB- 1973 -RSB- 1 QB 336 . 	NAN	NAN	NAN	0.9	NAN
86	469	As Lord Denning MR said at 349E , `` when a time is prescribed by statute for doing any act , and that act can only be done if the court office is open on the day when time expires , then , if it turns out ... that the day is a Sunday or other dies non , the time is extended until the next day on which the court office is open '' . 	NAN	NAN	NAN	0.9	NAN
86	470	I agree , and I can see no reason not to apply the same principle to service on a respondent in relation to the respondent 's office . 	NAN	NAN	NAN	0.9	NAN
86	471	The fact that fax transmission can be effected at any time does not cause me to reconsider that conclusion . 	NAN	NAN	NAN	0.9	NAN
86	472	85 . 	NAN	NAN	NAN	0.9	NAN
86	473	It might be argued that it follows from this that time should be similarly extended to the next business day , in cases where , even if only for a few hours , the required recipient 's office is closed before midnight on the final day -LRB- as will always be true of the court , and will almost always be true of any other recipient -RRB- . 	NAN	NAN	NAN	0.9	NAN
86	474	In my opinion , while there is a real argument based on consistency to support such a proposition , it is not correct , at least where the office in question is open during normal hours . 	NAN	NAN	NAN	0.9	NAN
86	475	While there is no reason to deprive an appellant of his full statutory 7 or 14 days , if , for instance he transmits his notice of appeal by fax , or even if he posts the notice through a letter box in the door of the respondent 's office , just before midnight on the last day for service , it does not follow that he should have cause for complaint if he can not file the notice at the court office , or serve it on the respondent in person , outside normal office hours . 	NAN	NAN	NAN	0.9	NAN
86	476	I believe that this conclusion is consistent with the law as it is understood in relation to time limits for filing and service , when it comes to the operation of the Limitation Act 1980 . 	NAN	NAN	NAN	0.9	NAN
86	477	Lofti Moulai v Deputy Public Prosecutor in Creteil , France 86 . 	NAN	NAN	NAN	0.9	NAN
86	478	On 8 October 2007 , the Deputy Public Prosecutor -LRB- `` the Prosecutor '' -RRB- in Creteil , France -LRB- a Category 1 territory -RRB- issued a European Arrest Warrant for the arrest and extradition of Mr Moulai , on the basis that he had been convicted in his absence on 4 October 2004 for the misappropriation of motor vehicles , and sentenced to 5 years imprisonment . 	NAN	NAN	NAN	0.9	NAN
86	479	The warrant was duly received by SOCA , who , on 10 October 2007 , certified the warrant in accordance with section 2 -LRB- 7 -RRB- and -LRB- 8 -RRB- . 	NAN	NAN	NAN	0.9	NAN
86	480	After some intervening events , which are irrelevant for present purposes , the Extradition Hearing took place on 14 March 2008 , when the District Judge ordered extradition . 	NAN	NAN	NAN	0.9	NAN
86	481	87 . 	NAN	NAN	NAN	0.9	NAN
86	482	Mr Moulai decided to appeal against that decision . 	NAN	NAN	NAN	0.9	NAN
86	483	His appellant 's notice was duly filed in the office of the Administrative Court -LRB- part of the High Court -RRB- at 3.45 in the afternoon of 20 March 2008 . 	NAN	NAN	NAN	0.9	NAN
86	484	It was served by fax on the CPS -LRB- which was acting for the Prosecutor , in the usual way -RRB- shortly after , the fax transmission being completed a few minutes after 4.00 . 	NAN	NAN	NAN	0.9	NAN
86	485	The Prosecutor contended that the service was out of time , and that the appeal was accordingly ineffective . 	NAN	NAN	NAN	0.9	NAN
86	486	Collins J directed that this point be determined as a preliminary issue , which was duly decided on 9 May 2008 , by the Divisional Court -LRB- Hooper LJ and Maddison J -RRB- , -LSB- 2008 -RSB- EWHC 1024 -LRB- Admin -RRB- -LSB- 2008 -RSB- 3 All E R 226 . 	NAN	NAN	NAN	0.9	NAN
86	487	88 . 	NAN	NAN	NAN	0.9	NAN
86	488	The Divisional Court held that -LRB- i -RRB- section 26 -LRB- 4 -RRB- required the appellant 's notice to have been filed , but not served , within 7 days of 14 March 2008 ; although -LRB- ii -RRB- -LRB- a -RRB- if section 26 -LRB- 4 -RRB- does require service within the 7 days , CPR 6.7 applied and a document served by fax after 4.00 pm must be deemed to have been served on the following working day , so Mr Moulai 's notice was served a day late ; but -LRB- ii -RRB- -LRB- b -RRB- time for service could be extended under CPR 3.1 -LRB- 2 -RRB- -LRB- a -RRB- , and in the circumstances it should be so extended . 	NAN	NAN	NAN	0.9	NAN
86	489	The Prosecutor now appeals to your Lordships ' House . 	NAN	NAN	NAN	0.9	NAN
86	490	89 . 	NAN	NAN	NAN	0.9	NAN
86	491	For the reasons already given , I consider that the Divisional Court was wrong on point -LRB- i -RRB- , and , if it was right on point -LRB- ii -RRB- -LRB- a -RRB- , it had no jurisdiction to extend time under point -LRB- ii -RRB- -LRB- b -RRB- . 	NAN	NAN	NAN	0.9	NAN
86	492	However , I would uphold the decision that Mr Moulai 's appeal to the High Court can proceed . 	NAN	NAN	NAN	0.9	NAN
86	493	This is because I do not consider that the Divisional Court was wrong on point -LRB- ii -RRB- -LRB- a -RRB- . 	NAN	NAN	NAN	0.9	NAN
86	494	Section 26 -LRB- 4 -RRB- requires the appellant 's notice to be issued and served within 7 days , and , as explained above , I can see no warrant for the CPR being invoked to cut down that period , even if only by a few hours . 	NAN	NAN	NAN	0.9	NAN
86	495	90 . 	NAN	NAN	NAN	0.9	NAN
86	496	In my view , the service of the appellant 's notice on the respondent at its proper address before midnight on the 20 March 2008 means that the `` notice of -LSB- his -RSB- appeal was given '' by Mr Moulai within the 7 day period required by section 26 -LRB- 4 -RRB- . 	NAN	NAN	NAN	0.9	NAN
86	497	This point was only very briefly taken on behalf of Mr Moulai , but the Prosecutor had a chance to deal with it , and I am of the view that it is plainly correct . 	NAN	NAN	NAN	0.9	NAN
86	498	Vullnet Mucelli v The Government of the Republic of Albania 91 . 	NAN	NAN	NAN	0.9	NAN
86	499	After allegedly committing a murder in Albania -LRB- a Category 2 territory under the 2003 Act -RRB- in 1997 , Mr Mucelli fled the country . 	NAN	NAN	NAN	0.9	NAN
86	500	In October 1998 , he was tried and convicted of the murder , in his absence , and he was sentenced to 25 years imprisonment . 	NAN	NAN	NAN	0.9	NAN
86	501	He was arrested in the UK pursuant to a provisional warrant , in February 2007 . 	NAN	NAN	NAN	0.9	NAN
86	502	On 4 June 2007 , after a hearing , the District Judge decided to send the case to the Secretary of State for a decision whether Mr Mucelli should be extradited . 	NAN	NAN	NAN	1	NAN
86	503	On 18 July 2007 , the Secretary of State decided to order extradition , and informed Mr Mucelli -LRB- who was in prison at the time -RRB- and his solicitors , a couple of days later . 	NAN	NAN	NAN	1	NAN
86	504	Mr Mucelli instructed his solicitors to appeal ; they filed a notice of appeal at the High Court on 31 July 2007 , within the 14 day period laid down by section 103 -LRB- 9 -RRB- . 	NAN	NAN	NAN	1	NAN
86	505	However , those solicitors failed to serve the notice until 13 August at the earliest , well outside the 14 day period . 	NAN	NAN	NAN	1	NAN
86	506	92 . 	NAN	NAN	NAN	1	NAN
86	507	The Divisional Court -LRB- Richards LJ and Aikens J -RRB- held that -LRB- i -RRB- the appellant 's notice had to be served , as well as filed , within 14 days under section 103 -LRB- 9 -RRB- , -LRB- ii -RRB- the court could not extend time for service ; -LRB- iii -RRB- although the court had power to dispense with service , it would not do so in the instant case . 	NAN	NAN	NAN	1	NAN
86	508	- see -LSB- 2007 -RSB- EWHC 2632 -LRB- Admin -RRB- , -LSB- 2008 -RSB- 2 All E R 340 . 	NAN	NAN	NAN	1	NAN
86	509	For reasons already given , I consider that the Divisional Court was right on points -LRB- i -RRB- and -LRB- ii -RRB- . 	NAN	NAN	NAN	1	NAN
86	510	Although they were also , in my view , right not to dispense with service , they were wrong , also for reasons I have given , in thinking that they had power to do so . 	NAN	NAN	NAN	1	NAN
86	511	93 . 	NAN	NAN	NAN	1	NAN
86	512	The Divisional Court expressed doubts -LRB- in paras 23 to 27 of Richards LJ 's judgment -RRB- as to whether Mr Mucelli would get a retrial , or an appeal equivalent to a rehearing , if he was sent back to Albania , as required by section 85 . 	NAN	NAN	NAN	1	NAN
86	513	It is not entirely clear to me what purpose those remarks were intended to serve , given the court 's conclusion that Mr Mucelli 's notice of appeal had been served out of time . 	NAN	NAN	NAN	1	NAN
86	514	However , as the point was discussed by the Divisional Court , it is right briefly to deal with it , as otherwise the outcome of Mr Mucelli 's appeal might appear a little unsatisfactory . 	NAN	NAN	NAN	1	NAN
86	515	94 . 	NAN	NAN	NAN	1	NAN
86	516	The Divisional Court concluded that the evidence before it disclosed `` too many open ends and insufficient clarity '' for it to be satisfied that , if he returned to Albania , Mr Mucelli would be retried , or would be entitled to appeal against his conviction and sentence , in a form which would amount to a retrial . 	NAN	NAN	NAN	1	NAN
86	517	In reaching this conclusion , the court followed the earlier Divisional Court decision in Government of Albania v Bleta -LSB- 2005 -RSB- EWHC 475 -LRB- Admin -RRB- , -LSB- 2005 -RSB- 3 All ER 351 , where very similar evidence as to the Albanian law and practice was put before the court . 	NAN	NAN	NAN	1	NAN
86	518	However , since those two decisions , there has been a further decision of the Divisional Court , Bogdani v Government of Albania -LSB- 2008 -RSB- EWHC 2065 -LRB- Admin -RRB- , in which , on the basis of `` further material evidence '' , the court concluded that `` the Government of Albania in this case have established the existence of legal protection for a returning person such as satisfies the provisions of section 85 -LRB- 3 -RRB- '' - see para 53 of the judgment of Pill LJ , who also gave the judgment in Bleta . 	NAN	NAN	NAN	1	NAN
86	519	. 	NAN	NAN	NAN	1	NAN
86	520	95 . 	NAN	NAN	NAN	1	NAN
86	521	The Government of Albania has applied to put the same `` further material evidence '' before your Lordships . 	NAN	NAN	NAN	1	NAN
86	522	In the light of the conclusion that Mr Mucelli 's appeal is irredeemably out of time , it is not strictly necessary to deal with that application . 	NAN	NAN	NAN	1	NAN
86	523	It is right to say , however , that , had the appeal been capable of being pursued , I think the right course would have been to remit this appeal to the High Court with a direction that the Albanian Government should be permitted to adduce this further evidence , and that Mr Mucelli should be entitled to put in evidence in reply , if so advised . 	NAN	NAN	NAN	1	NAN
86	524	However , as the appeal can not be pursued , it is appropriate simply to say that I very much doubt that the Divisional Court in this case would have reached the same conclusion on the section 85 issue that it did reach , had it seen the further evidence which was before the Court in Bogdani -LSB- 2008 -RSB- EWHC 2065 -LRB- Admin -RRB- . 	NAN	NAN	NAN	1	NAN
86	525	Conclusions 96 . 	NAN	NAN	NAN	1	NAN
86	526	In these circumstances , I would dismiss the Prosecutor 's appeal on the preliminary point in Moulai v Deputy Public Prosecutor , and I would dismiss Mr Mucelli 's appeal in Mucelli v Government of Albania . 	lord neuberger	self	outcome	1	NAN
86	527	If your Lordships agree , I would propose that the parties have 14 days in which to make written submissions as to the costs of these appeals 	NAN	NAN	NAN	1	NAN
