86	298	Section 103 -LRB- 1 -RRB- provides that a person may appeal to the High Court against a decision of a District Judge to send his case to the Secretary of State . 	NAN	NAN	NAN	0.6	NAN
86	299	Subsections -LRB- 4 -RRB- and -LRB- 9 -RRB- of section 103 are in the same terms as subsections -LRB- 3 -RRB- and -LRB- 4 -RRB- of section 26 , save that the period within which `` notice of an appeal ... . 	NAN	NAN	NAN	0.6	NAN
86	300	must be given '' is 14 days , rather than 7 days . 	NAN	NAN	NAN	0.6	NAN
86	301	Section 105 permits an appeal to be brought in the high Court on behalf of a category 2 territory where the District Judge orders a discharge at the extradition hearing ; it has similar provisions to section 103 -LRB- 3 -RRB- and -LRB- 4 -RRB- . 	NAN	NAN	NAN	0.6	NAN
86	302	If an extradition order is made under section 101 , the person concerned may appeal to the High Court under section 105 , which contains similar appeal provisions for present purposes to section 103 . 	NAN	NAN	NAN	0.6	NAN
86	303	If extradition is refused , section 110 confers a similar right of appeal on the issuer of the request for extradition . 	NAN	NAN	NAN	0.6	NAN
86	304	52 . 	NAN	NAN	NAN	0.6	NAN
86	305	Appeals to the High Court under sections 103 , 105 , 108 and 110 must , according to section 113 , begin to be heard by a date prescribed by rules of court . 	NAN	NAN	NAN	0.6	NAN
86	306	Also an appeal may be brought , with leave , against any decision of the High Court to the House of Lords under section 114 . 	NAN	NAN	NAN	0.6	NAN
86	307	53 . 	NAN	NAN	NAN	0.6	NAN
86	308	Section 117 provides as follows : `` -LRB- 1 -RRB- This section applies if -- -LRB- a -RRB- the Secretary of State orders a person 's extradition to a category 2 territory under this Part , and -LRB- b -RRB- no notice of an appeal under section 103 or 108 is given before the end of the permitted period which is 14 days starting with the day on which the Secretary of State informs the person under section 100 -LRB- 1 -RRB- that he has ordered his extradition . 	NAN	NAN	NAN	0.6	NAN
86	309	-LRB- 2 -RRB- The person must be extradited to the category 2 territory before the end of the required period , which is 28 days starting with the day on which the Secretary of State makes the order . 	NAN	NAN	NAN	0.6	NAN
86	310	-LRB- 3 -RRB- If subsection -LRB- 2 -RRB- is not complied with and the person applies to the appropriate judge to be discharged the judge must order his discharge , unless reasonable cause is shown for the delay . 	NAN	NAN	NAN	0.6	NAN
86	311	-LRB- 4 -RRB- These must be ignored for the purposes of subsection -LRB- 1 -RRB- -LRB- b -RRB- -- -LRB- a -RRB- any power of a court to extend the period permitted for giving notice of appeal ; -LRB- b -RRB- any power of a court to grant leave to take a step out of time . '' 	NAN	NAN	NAN	0.6	NAN
86	312	Section 118 deals with `` extradition following appeal '' . 	NAN	NAN	NAN	0.6	NAN
86	313	Sections 122 to 125 are concerned with withdrawals of requests under Part 2 , section 124 dealing with withdrawals `` while appeal to High Court pending '' . 	NAN	NAN	NAN	0.6	NAN
86	314	The requirement that notice of an appeal must be given 54 . 	NAN	NAN	NAN	0.6	NAN
86	315	The first question to be considered is whether the requirements in sections 26 -LRB- 4 -RRB- and 103 -LRB- 9 -RRB- that `` Notice of an appeal ... must be given '' within the period specified requires only that an appeal notice be filed at the Court Office or whether it also requires the notice to be served on the respondent . 	NAN	NAN	NAN	0.6	NAN
86	316	I propose first to address this question by reference to section 26 -LRB- 4 -RRB- . 	NAN	NAN	NAN	0.6	NAN
86	317	55 . 	NAN	NAN	NAN	0.6	NAN
86	318	In that connection , it is important to recognise from the outset that , while the argument before your Lordships focussed on the procedure in the courts of England and Wales , whence both these appeals originate , the 2003 Act applies across the United Kingdom . 	NAN	NAN	NAN	0.6	NAN
86	319	Accordingly , as my noble and learned friend , Lord Rodger of Earlsferry points out , the question , indeed all three questions on this appeal , must be considered by reference to the court procedures in the jurisdictions of Scotland and of Northern Ireland , as well as that of England and Wales , with a view to producing fair and workable answers , which not only comply with the statutory language , but which also produce consistency across the United Kingdom . 	lord neuberger	lord rodger	partagr	0.6	NAN
86	320	56 . 	NAN	NAN	NAN	0.6	NAN
86	321	The word `` given '' in connection with notices of appeal is not to be found in CPR Part 52 , which contains the rules of court , concerned with civil appeals in England and Wales , including those to the High Court . 	NAN	NAN	NAN	0.6	NAN
86	322	Thus , para 22.6 A of Practice Direction 52 , which applies to extradition appeals , by virtue of CPR 52.2 , requires `` the appellant 's notice '' to be `` filed and served before the expiration of 7 days '' , reflecting the language of CPR 52.4 -LRB- 2 -RRB- and CPR 52.4 -LRB- 3 -RRB- Although CPR 52 refers to `` an appeal notice '' , that expression covers a respondent 's notice as well as an appellant 's notice -LRB- see e.g. CPR 52.5 and 52.6 -RRB- . 	NAN	NAN	NAN	0.6	NAN
86	323	57 . 	NAN	NAN	NAN	0.6	NAN
86	324	The position with regard to the language of the relevant provisions which govern appeals under the 2003 Act outside England and Wales is as follows . 	NAN	NAN	NAN	0.6	NAN
86	325	The word `` given '' is to be found in the relevant provisions of the Act of Adjournal -LRB- Criminal Proceedings -RRB- 1996 applicable in Scotland . 	NAN	NAN	NAN	0.6	NAN
86	326	Rule 34.3 of the Act of Adjournal refers to `` notice of an appeal '' being `` given '' by `` serving a copy of the note of appeal '' , and an appeal being `` made '' by `` lodging '' the note at the appropriate court . 	NAN	NAN	NAN	0.6	NAN
86	327	The concept of `` giving '' notice of an appeal is not to be found in the relevant procedural rule in Northern Ireland , Order 61A rule 3 of the Rules of the Supreme Court -LRB- Northern Ireland -RRB- , which refers to `` issu -LSB- ing '' a `` notice of motion '' , `` enter -LSB- ing -RSB- '' the appeal `` for hearing in the appropriate office '' , and `` serv -LSB- ing -RSB- a copy of the notice of motion '' . 	NAN	NAN	NAN	0.6	NAN
86	328	58 . 	NAN	NAN	NAN	0.6	NAN
86	329	The preliminary procedures relating to the bringing of an appeal under section 26 in England and Wales and in Northern Ireland also differ from those in Scotland . 	NAN	NAN	NAN	0.6	NAN
86	330	In the former cases , the appellant 's notice must be filed at court before it is served on the respondent -LRB- see CPR 52.4.3 and Order 61A , rule 3 -LRB- 2 -RRB- -LRB- c -RRB- -RRB- . 	NAN	NAN	NAN	0.6	NAN
86	331	In Scotland , however , rule 34.3 -LRB- 1 -RRB- -LRB- a -RRB- of the Act of Adjournal provides that execution of service of the note of appeal on the Crown Agent must be effected before the appeal is made by lodging it with the court . 	NAN	NAN	NAN	0.6	NAN
86	332	59 . 	NAN	NAN	NAN	0.6	NAN
86	333	At the end of the argument before your Lordships , based as it was solely on the court procedures in England and Wales , my initial conclusion was that section 26 -LRB- 4 -RRB- requires an appellant 's notice to be both filed and served within the seven day period . 	NAN	NAN	NAN	0.6	NAN
86	334	On reading in draft the impressive and cogent opinion of Lord Rodger , explaining why he had arrived at a different result , I realised that it was necessary for me comprehensively to reconsider the question . 	lord neuberger	lord rodger	ackn	0.6	NAN
86	335	For instance , I initially thought that the use of the expressions `` given '' and `` notice of appeal '' in section 26 -LRB- 4 -RRB- , could be contrasted with `` filed '' or `` served '' and `` appellant 's notice '' in CPR 52.4 . 	NAN	NAN	NAN	0.6	NAN
86	336	However , it now seems to me that the wording of the section is explained by the good sense of using expressions which are equally appropriate throughout the United Kingdom . 	NAN	NAN	NAN	0.6	NAN
86	337	Having reconsidered the question on a less parochial basis than before , I have decided to adhere to my conclusion , for a number of reasons . 	NAN	NAN	NAN	0.6	NAN
86	338	60 . 	NAN	NAN	NAN	0.6	NAN
86	339	First , it appears clear that section 26 -LRB- 4 -RRB- requires one to refer to the relevant court rules to discover to whom `` a notice of appeal '' is required to be `` given '' : there is nowhere else to look . 	NAN	NAN	NAN	0.6	NAN
86	340	At least as I see it , if a notice of appeal is required by the relevant rules to be provided to more than one person , the use of the word `` given '' suggests that notice of an appeal must be provided to all such persons . 	NAN	NAN	NAN	0.6	NAN
86	341	For instance , if there were two respondents , it would not have been `` given '' if it was served on only one of them . 	NAN	NAN	NAN	0.6	NAN
86	342	As a matter of ordinary English , therefore , I consider that the rules in all three jurisdictions require a notice of appeal -LRB- i.e. the appellant 's notice in England and Wales , the note of appeal in Scotland , and the notice of motion in Northern Ireland to be `` given '' both to the representative of the authority -LRB- by serving -RRB- and to the relevant court office -LRB- by filing or lodging -RRB- . 	NAN	NAN	NAN	0.6	NAN
86	343	61 . 	NAN	NAN	NAN	0.6	NAN
86	344	Having seen in draft the opinion of my noble and learned friend Lord Phillips of Worth Matravers , I should add that I agree that section 26 -LRB- 4 -RRB- contemplates that the `` rules of court '' will make specific provision for the `` giv -LSB- ing -RSB- of `` notice of an appeal '' . 	lord neuberger	lord phillips	ackn	0.7	NAN
86	344	Having seen in draft the opinion of my noble and learned friend Lord Phillips of Worth Matravers , I should add that I agree that section 26 -LRB- 4 -RRB- contemplates that the `` rules of court '' will make specific provision for the `` giv -LSB- ing -RSB- of `` notice of an appeal '' . 	lord neuberger	lord phillips	ackn	0.7	NAN
86	345	This is what has been done in England and Wales through the provisions of para 22.6 A of the Practice Direction to CPR 52 , in Scotland by rule 34.3 of the Act of Adjournal , and in Northern Ireland by RSC Order 61A . 	NAN	NAN	NAN	0.7	NAN
86	346	62 . 	NAN	NAN	NAN	0.7	NAN
86	347	Secondly , I believe that this conclusion is supported by the desirability for consistency throughout the United Kingdom , both in terms of practice and in terms of language . 	NAN	NAN	NAN	0.7	NAN
86	348	In practical terms , it would mean that , whether one is in Scotland or elsewhere in the United Kingdom , the same tasks have to be completed within the 7 day period , namely giving notice of appeal both to the representative of the relevant authority and to the court . 	NAN	NAN	NAN	0.7	NAN
86	349	It also means that any differences relating to time of service between the rules in the three jurisdictions will be over-ridden , thereby ensuring UK-wide consistency on initiating an appeal under the 2003 Act . 	NAN	NAN	NAN	0.7	NAN
86	350	Accordingly , if a prospective appellant looks at para 26A of the Practice Direction , rule 34.3 of the Act of Adjournal , or Order 61 rule 3 -LRB- 2 -RRB- of the Northern Irish RSC , he or she should get the same answer : the notice of appeal must be both served and filed or lodged within the 7day period . 	NAN	NAN	NAN	0.7	NAN
86	351	63 . 	NAN	NAN	NAN	0.7	NAN
86	352	So far as linguistic consistency is concerned , it would be a little odd if `` given '' meant `` filed '' or `` entered '' -LRB- at the appropriate court office -RRB- in England and Wales and in Northern Ireland , but `` served '' -LRB- on the representative of the authority -RRB- in Scotland . 	NAN	NAN	NAN	0.7	NAN
86	353	Such a result is not , of course , impossible , but it appears to me to represent a more logically satisfactory outcome if `` given '' in section 26 -LRB- 4 -RRB- means both `` filed '' -LRB- or `` lodged '' or `` entered '' , which are the same thing in Scotland and Northern Ireland respectively -RRB- and `` served '' in all three jurisdictions . 	NAN	NAN	NAN	0.7	NAN
86	354	64 . 	NAN	NAN	NAN	0.7	NAN
86	355	I had initially also thought it significant that section 26 -LRB- 4 -RRB- refers to notice of `` an '' appeal being given . 	NAN	NAN	NAN	0.7	NAN
86	356	That suggested to me that what must be done is to not merely to bring an appeal but to give notice that it has been brought , which requires the appellant 's notice to be filed and served on the respondent . 	NAN	NAN	NAN	0.7	NAN
86	357	However , the rather cavalier or indiscriminate way in which the 2003 Act appears to have referred to `` notice of an appeal '' and `` a notice of appeal '' , as described by Lord Rodger , now persuades me that the point has no force : it attributes an unwarranted degree of subtlety to the draftsman of the Act . 	lord neuberger	lord rodger	partagr	0.7	NAN
86	358	65 . 	NAN	NAN	NAN	0.7	NAN
86	359	Thirdly , however , I consider that there is a significant contrast between `` an appeal '' being `` brought '' in section 26 -LRB- 3 -RRB- , and `` -LSB- n -RSB- otice of an appeal '' being `` given '' in section 26 -LRB- 4 -RRB- . 	NAN	NAN	NAN	0.7	NAN
86	360	The different language used in the two adjoining subsections suggests that two different concepts are envisaged . 	NAN	NAN	NAN	0.7	NAN
86	361	If the latter expression was intended to refer only to the filing -LRB- or , in Scotland and Northern Ireland , only to the lodging or entering -RRB- of an appeal notice , it is hard to see why it did not begin `` An appeal under this section must be brought ... '' . 	NAN	NAN	NAN	0.7	NAN
86	362	In other words , the contrast with section 26 -LRB- 3 -RRB- suggests that section 26 -LRB- 4 -RRB- is concentrating on the giving of the notice of appeal to all those to whom it has to be given - namely the authority and the court . 	NAN	NAN	NAN	0.7	NAN
86	363	66 . 	NAN	NAN	NAN	0.7	NAN
86	364	Fourthly , there are practical considerations . 	NAN	NAN	NAN	0.7	NAN
86	365	The structure of Part 1 envisages a relatively strict and tight timetable . 	NAN	NAN	NAN	0.7	NAN
86	366	This is appropriate , not merely for the benefit of the person against whom a warrant is issued , but also in the light of the Framework Decision , which was intended to streamline the surrender procedures referred to in its title . 	NAN	NAN	NAN	0.7	NAN
86	367	Thus , art 17 requires a European arrest warrant to `` be dealt with and executed as a matter of urgency '' , and it then identifies specific , and pretty short , time limits -LRB- and see also art 23 , which requires surrender `` as soon as possible '' -RRB- . 	NAN	NAN	NAN	0.7	NAN
86	368	This is consistent with a tight timetable for appealing , which tends to imply that the time limit in section 26 -LRB- 4 -RRB- includes both filing and service of the notice of appeal . 	NAN	NAN	NAN	0.7	NAN
86	369	67 . 	NAN	NAN	NAN	0.7	NAN
86	370	This point is reinforced by consideration of section 35 . 	NAN	NAN	NAN	0.7	NAN
86	371	The provisions of section 35 -LRB- 1 -RRB- , -LRB- 3 -RRB- and -LRB- 4 -RRB- mean that the consequence of not giving a notice of an appeal within the time prescribed by section 26 -LRB- 4 -RRB- is that the extradition must take place very promptly . 	NAN	NAN	NAN	0.7	NAN
86	372	Lord Phillips pointed out in argument , if section 26 -LRB- 4 -RRB- only requires the appellant 's notice to be filed within the 7 days referred to , then there is no clear and immediate sanction for failing to serve the appellant 's notice on the authority . 	lord neuberger	lord phillips	partagr	0.7	NAN
86	373	In England and Wales , one would be thrown back on CPR 52.4 -LRB- 3 -RRB- , and if its requirements are not met , there would be likely to be delays due to consequential applications and arguments resulting from non-compliance with that rule . 	NAN	NAN	NAN	0.7	NAN
86	374	68 . 	NAN	NAN	NAN	0.7	NAN
86	375	Fifthly , quite apart from this , if section 26 -LRB- 4 -RRB- does not extend to service of the notice of appeal in England and Wales and in Northern Ireland , the authority seeking to enforce the warrant may well assume that section 35 , with its very tight time limit in subsection -LRB- 4 -RRB- , has been triggered in circumstances where it has not . 	NAN	NAN	NAN	0.7	NAN
86	376	This is because , if section 26 -LRB- 4 -RRB- only extends to filing an appeal notice , SOCA may be unaware that an appeal has been brought within the prescribed time , and will therefore proceed promptly with the extradition - especially in the light of section 35 -LRB- 5 -RRB- - when , in fact it would be inappropriate to do so . 	NAN	NAN	NAN	0.7	NAN
86	377	It is no doubt true that , in many cases , SOCA will have been informally alerted to the probability of an appeal , and , indeed , that SOCA can check whether an appeal has been brought . 	NAN	NAN	NAN	0.7	NAN
86	378	However , those factors do not seem to me to meet the force of the point that section 35 does not sit easily with the notion that section 26 -LRB- 4 -RRB- applies only to filing an appeal , and not to serving the appellant 's notice . 	NAN	NAN	NAN	0.7	NAN
86	379	69 . 	NAN	NAN	NAN	0.7	NAN
86	380	I turn to consider the arguments which have been raised the other way . 	NAN	NAN	NAN	0.7	NAN
86	381	First , reliance is placed on the Explanatory Notes to the 2003 Act , which , in para 76 , refer to section 26 and state that `` notice of an appeal must be given to the High Court within 7 days of the extradition order being made by the judge -LRB- subsection -LRB- 4 -RRB- -RRB- . '' 	NAN	NAN	NAN	0.7	NAN
86	382	The function of Explanatory Notes was discussed by Lord Steyn in Westminster City Council v National Asylum Support Services -LSB- 2002 -RSB- 1 WLR 2956 , paras 5 and 6 . 	NAN	NAN	NAN	0.7	NAN
86	383	It seems to me that they are of no real assistance in the present context . 	NAN	NAN	NAN	0.7	NAN
86	384	If my opinion as to the meaning of section 26 -LRB- 4 -RRB- is correct , the Notes are not inaccurate , but merely incomplete . 	NAN	NAN	NAN	0.7	NAN
86	385	Given that their function was to `` assist the reader in understanding the Act '' -LRB- to quote from the first paragraph of the Notes -RRB- , not to give guidance as to the details of the procedures it requires , I can not accept that they assist here . 	NAN	NAN	NAN	0.7	NAN
86	386	Further , I note that para 22.6 A of the Practice Direction to CPR 52 , which is concerned with appeals under the 2003 Act , states in sub-para -LRB- 3 -RRB- -LRB- a -RRB- , that `` the appellant 's notice must be filed and served before the expiry of 7 days '' . 	NAN	NAN	NAN	0.7	NAN
86	387	While that direction can not determine the meaning of section 26 -LRB- 4 -RRB- , it is of no less significance than the Explanatory Notes . 	NAN	NAN	NAN	0.7	NAN
86	388	70 . 	NAN	NAN	NAN	0.7	NAN
86	389	It was also contended that , if section 26 -LRB- 4 -RRB- applied to service of the appellant 's notice , it would lead to difficulties under sections 41 and 42 . 	NAN	NAN	NAN	0.7	NAN
86	390	I do not see that . 	NAN	NAN	NAN	0.7	NAN
86	391	If section 26 -LRB- 4 -RRB- does so apply , there is no `` pending '' appeal unless and until the notice is served in time . 	NAN	NAN	NAN	0.7	NAN
86	392	It was also claimed that it would be inconvenient if section 26 -LRB- 4 -RRB- referred to two events , rather than one . 	NAN	NAN	NAN	0.7	NAN
86	393	In my view , there is noting in that : it requires filing and then service , so , in practice , it logically can be treated as only referring to service . 	NAN	NAN	NAN	0.7	NAN
86	394	It was also said to be rather harsh if there is a 7-day time limit under section 26 -LRB- 4 -RRB- for service , particularly as some people who wish to rely on the right of appeal may have limited English and may be incarcerated . 	NAN	NAN	NAN	0.7	NAN
86	395	But , on any view , there is such a time limit for filing , and it is not greatly different if it also applies to service . 	NAN	NAN	NAN	0.7	NAN
86	396	In any event , an identical time limit applies equally , by virtue of section 28 -LRB- 5 -RRB- , to a case where the appeal is against a refusal to extradite . 	NAN	NAN	NAN	0.8	NAN
86	397	71 . 	NAN	NAN	NAN	0.8	NAN
86	398	It was also suggested that the fact that the legislature has not thought it appropriate to include a timetable for what happens after a notice of appeal assists the view that section 26 -LRB- 4 -RRB- does not , in England and Wales , require service , as well as filing , to be effected within the 7 days . 	NAN	NAN	NAN	0.8	NAN
86	399	On any view , the requirements of section 26 -LRB- 4 -RRB- only apply to a certain point , following which it was no doubt assumed that the framers of the rules of court in the three UK jurisdictions would prescribe an appropriately strict procedural time-scale . 	NAN	NAN	NAN	0.8	NAN
86	400	I do not see how that provides much assistance when it comes to identifying the precise point at which the reach of the section ends . 	NAN	NAN	NAN	0.8	NAN
86	401	72 . 	NAN	NAN	NAN	0.8	NAN
86	402	For these reasons , I conclude that an appellant 's notice must be served , as well as filed , within the 7-day period referred to in section 26 -LRB- 4 -RRB- . 	NAN	NAN	NAN	0.8	NAN
86	403	As for section 103 -LRB- 9 -RRB- , it appears to me that , for substantially the same reasons , it requires an appellant 's notice to be served within the 14-day period to which it refers . 	NAN	NAN	NAN	0.8	NAN
86	404	It is true that the Framework Directive forms no part of the background to part 2 , and that the statutory time-table of Part 2 is somewhat less tight than that of Part 1 , but those two factors do not even get near justifying a different conclusion as to the meaning of section 103 -LRB- 9 -RRB- from that which I have reached in relation to the meaning of section 26 -LRB- 4 -RRB- . 	NAN	NAN	NAN	0.8	NAN
86	405	Can the court extend the time for filing or for service ? 	NAN	NAN	NAN	0.8	NAN
86	406	73 . 	NAN	NAN	NAN	0.8	NAN
86	407	The second question of principle is whether there is any basis on which the court could extend time for filing or service under sections 26 -LRB- 4 -RRB- and 103 -LRB- 9 -RRB- . 	NAN	NAN	NAN	0.8	NAN
86	408	Again , I shall deal first with the position under section 26 . 	NAN	NAN	NAN	0.8	NAN
86	409	74 . 	NAN	NAN	NAN	0.8	NAN
86	410	On the face of it , at any rate , there is a clear and unqualified statutory time limit , namely 7 days , and there would therefore seem to be no basis upon which it could be extended . 	NAN	NAN	NAN	0.8	NAN
86	411	In that connection , viewed from the English and Welsh perspective , I would refer to the CPR , which contain provisions whereby the court can extend time for the taking of any step , under CPR 3.1 -LRB- 2 -RRB- -LRB- a -RRB- , can make an order remedying any error of procedure , under CPR 3.10 , or can make an order dispensing with service of documents , under CPR 6.9 . 	NAN	NAN	NAN	0.8	NAN
86	412	However , these powers can not be invoked to extend a statutory time limit or to avoid service required by statute , unless of course , the statute so provides . 	NAN	NAN	NAN	0.8	NAN
86	413	Apart from being correct as a matter of principle , this conclusion follows from CPR 3.2 -LRB- a -RRB- which refers to time limits in `` any rule , practice direction or court order '' , and from CPR 6.1 -LRB- a -RRB- states that the rules in CPR 6 apply , `` except where any other enactment ... makes a different provision '' . 	NAN	NAN	NAN	0.8	NAN
86	414	75 . 	NAN	NAN	NAN	0.8	NAN
86	415	Accordingly , it would be necessary to find some statutory basis for the court having power to extend time , or indeed to dispense with the service which section 26 -LRB- 4 -RRB- requires . 	NAN	NAN	NAN	0.8	NAN
86	416	The only arguable such basis is to be found in the words `` in accordance with the rules of court '' , which , it is contended , incorporate the various provisions of the CPR to which I have just referred . 	NAN	NAN	NAN	0.8	NAN
86	417	I can not accept that argument . 	NAN	NAN	NAN	0.8	NAN
86	418	First , the way in which the subsection is linguistically structured appears to me to mean that those words govern the way in which `` notice of an appeal '' is to be `` given '' , not the time within which such notice is to be given , which is dictated by the closing part of the subsection . 	NAN	NAN	NAN	0.8	NAN
86	419	76 . 	NAN	NAN	NAN	0.8	NAN
86	420	Secondly , I consider that the argument that time under section 26 -LRB- 4 -RRB- can be extended pursuant to the CPR runs into difficulties with section 35 , which is entitled `` Extradition where there is no appeal '' . 	NAN	NAN	NAN	0.8	NAN
86	421	As already mentioned , the provisions of that section require the extradition process to be resumed and completed within a tight time-table following a decision of the District Judge . 	NAN	NAN	NAN	0.8	NAN
86	422	Section 35 -LRB- 6 -RRB- is clear : the process must be resumed and completed , not merely promptly , but without regard to the possibility of any extensions of time which might otherwise be granted under the relevant rules of court . 	NAN	NAN	NAN	0.8	NAN
86	423	As I see it , the effect of section 35 -LRB- 6 -RRB- -LRB- a -RRB- is that an appeal can only be validly brought if the time limits in section 26 -LRB- 4 -RRB- are strictly complied with . 	NAN	NAN	NAN	0.8	NAN
86	424	The notion that the court could extend time would mean either that section 36 -LRB- 6 -RRB- -LRB- a -RRB- had no effect or that the legislature contemplated that the court could grant an extension of time , which would render an appeal of academic interest only , because , by the time the appeal had been heard , the extradition would have been completed . 	NAN	NAN	NAN	0.8	NAN
86	425	Neither of those possibilities seems to me to be acceptable , in the light of the wording of section 36 -LRB- 6 -RRB- -LRB- a -RRB- , common sense , and the title to the section . 	NAN	NAN	NAN	0.8	NAN
86	426	77 . 	NAN	NAN	NAN	0.8	NAN
