107	102	If one was able to look back and to remove the consequences of the designation of the route for the by-pass as a protected route , other land in the immediate area of the Fletcher land and the Longmore land would have been released for housing development prior to the relevant date . 	NAN	NAN	NAN	0.5	lord hope
107	103	This would have enabled the view to be taken on the relevant date that planning permission for the development of these parcels of land also would have been granted if the land was not proposed to be acquired compulsorily . 	NAN	NAN	NAN	0.5	lord hope
107	104	In short , the local planning authority must disregard the effects and incidents of the proposal as a whole , irrespective of whether they occurred on , before or after the relevant date . 	NAN	NAN	NAN	0.5	lord hope
107	105	The policies and facts should be assumed to be those which would have been applicable if the scheme for the proposed by-pass had never been conceived in the first place . 	NAN	NAN	NAN	0.5	lord hope
107	106	Mr. Purchas submitted that his approach was supported by the reasons which Lord Bridge gave for the decision in Grampian Regional Council v. Secretary of State for Scotland -LSB- 1993 -RSB- 1 W.L.R. 1340 , 1345A-1346C . 	NAN	NAN	NAN	0.5	lord hope
107	107	He accepted that the argument which was rejected in that case was a narrower argument than that for the Secretary of State in the present case . 	NAN	NAN	NAN	0.5	lord hope
107	108	But he said that the essential reasoning which was expressed in Lord Bridge 's judgment as to the purpose for which section 17 -LRB- 4 -RRB- had been enacted supported his argument that it was not just the proposed acquisition that had to be disregarded . 	NAN	NAN	NAN	0.5	lord hope
107	109	It was necessary to consider as a whole what would have happened if the land had not been proposed to be acquired at all . 	NAN	NAN	NAN	0.5	lord hope
107	110	The decision in Grampian In my opinion it is clear , from an examination of the facts and the arguments in the Grampian case , that their Lordships were concerned in that case with a different issue from that which has been argued in this appeal . 	NAN	NAN	NAN	0.5	lord hope
107	111	It is not just that the argument which Mr. Ouseley advanced for the Secretary of State in the present case is not the same as that which was advanced for the Regional Council in Grampian . 	NAN	NAN	NAN	0.5	lord hope
107	112	The argument which Mr. Purchas advanced for the landowners is also different , as he sought to widen the scope of the statutory assumption to include matters which did not arise on the facts which were before the House in Grampian . 	NAN	NAN	NAN	0.5	lord hope
107	113	The Grampian case concerned an area at Westhill , near Aberdeen , for which planning permission in principle was given in 1972 for the building of a new town . 	NAN	NAN	NAN	0.5	lord hope
107	114	It was envisaged that the new town proposals would require the provision of a secondary school and at least two primary schools in the Westhill area . 	NAN	NAN	NAN	0.5	lord hope
107	115	The development proceeded , and in due course a secondary school and one primary school were built on sites which had belonged to the developer . 	NAN	NAN	NAN	0.5	lord hope
107	116	The Regional Council , which had power to acquire these sites compulsorily as education authority , offered to purchase the two sites from the developer . 	NAN	NAN	NAN	0.5	lord hope
107	117	The developer applied to the local planning authority for certificates of alternative development so that compensation for the acquisition could be assessed . 	NAN	NAN	NAN	0.5	lord hope
107	118	The local planning authority issued negative certificates on the basis that , if there had been no proposal to acquire the land , they would nevertheless have granted planning permission only for the erection of the two schools . 	NAN	NAN	NAN	0.5	lord hope
107	119	The developer appealed to the Secretary of State for Scotland , who issued positive certificates on the basis that , if he had to disregard the proposal to acquire , he must also disregard the fact that the two sites had been allocated by the developer for the erection of the two schools in the plans which had accompanied the plans in their application for outline planning permission . 	NAN	NAN	NAN	0.6	lord hope
107	120	Counsel presented the same arguments in the Court of Session when the Regional Council appealed against the Secretary of State 's decision to issue positive certificates . 	NAN	NAN	NAN	0.6	lord hope
107	121	They were summarised in these words by Lord Dunpark 1984 S.C. 1 , 13 , -LRB- 1983 -RRB- 47 P. & C.R. 540 , 552 : `` Counsel for all parties agreed that the grantor of the certificate must disregard the proposal to acquire . 	NAN	NAN	NAN	0.6	lord hope
107	122	The issue between the appellants and the respondents is whether or not the purpose or reasons for the acquisition must also be disregarded for certificate purposes . 	NAN	NAN	NAN	0.6	lord hope
107	123	On the one hand , it is said that it is nonsense to grant a certificate for development for which the grantor knows planning permission would not be granted . 	NAN	NAN	NAN	0.6	lord hope
107	124	On the other hand , it is said that , as this is a hypothetical , not a practical , exercise , if one has to disregard the proposal to acquire , one must also disregard the purpose of the acquisition . '' 	NAN	NAN	NAN	0.6	lord hope
107	125	Having considered these arguments Lord Dunpark observed , at p. 553 , in a passage which was quoted with approval by Lord Bridge -LSB- 1983 -RSB- 1 W.L.R. 1340 , 1345C-D : `` It seems to me to follow from the fact that the value of the land is not to be affected by the prospect of compulsory acquisition that its value is not to be affected by the development proposed by the acquiring authority . 	NAN	NAN	NAN	0.6	lord hope
107	126	One can not discount the one without the other . '' 	NAN	NAN	NAN	0.6	lord hope
107	127	In the House of Lords the argument for the Regional Council , as noted by Lord Bridge , at p. 1344H , was unchanged : `` Whilst -LSB- the -RSB- offers must be ignored , so runs the argument , the underlying requirement to devote these sites to fulfil the needs of public education remains and affords a complete answer to the claims for positive certificates . '' 	NAN	NAN	NAN	0.6	lord hope
107	128	It was in response to this argument , which he rejected , that Lord Bridge said , at p. 1345F-G : `` The primary purpose of this provision , in my view , is to obviate the possibility that where , as in the usual case , urban land is allocated in the development plan for a necessary public purpose for which it will in due course need to be acquired , that provision of the plan can be relied on to deny the landowner a positive certificate . 	NAN	NAN	NAN	0.6	lord hope
107	129	If the planning need to use land for a public purpose , which underlies a proposed compulsory acquisition , is not a sufficient ground to withhold a positive certificate where that need is recognised and provided for in the development plan , I do not see how the underlying planning need can ever be such a sufficient ground . '' 	NAN	NAN	NAN	0.6	lord hope
107	130	No question was raised in the Grampian case about the wider effects of the proposal , which is the point to which Mr. Purchas 's argument was directed . 	NAN	NAN	NAN	0.6	lord hope
107	131	This is because , on the facts of that case , the issue about wider effects did not arise . 	NAN	NAN	NAN	0.6	lord hope
107	132	It was not disputed that , if the underlying requirement for schools to be built on the sites were to be disregarded , the way was clear for the granting of positive certificates . 	NAN	NAN	NAN	0.6	lord hope
107	133	The facts were simple . 	NAN	NAN	NAN	0.6	lord hope
107	134	The sites would have formed part of the housing development in the surrounding area had they not been set aside for the schools . 	NAN	NAN	NAN	0.6	lord hope
107	135	No changes had taken place prior to the relevant date which would have justified the issuing of negative certificates . 	NAN	NAN	NAN	0.6	lord hope
107	136	Mr. Ouseley made it clear that his argument was a different one from that which had been presented for the Regional Council in Grampian . 	NAN	NAN	NAN	0.6	lord hope
107	137	As he pointed out , his argument was entirely consistent with the decision in that case . 	NAN	NAN	NAN	0.6	lord hope
107	138	He accepted that section 17 -LRB- 4 -RRB- required the local planning authority to disregard not only the notice of the making of the compulsory purchase order but also the purpose which underlay the need for the land to be acquired for public purposes . 	NAN	NAN	NAN	0.6	lord hope
107	139	The key issue in the present case to which he directed his argument was as to the wider effects of the assumption directed by section 17 -LRB- 4 -RRB- on the facts of this case , which did not arise for consideration in Grampian . 	NAN	NAN	NAN	0.6	lord hope
107	140	Section 17 -LRB- 4 -RRB- It is necessary in these circumstances to examine the wording of section 17 -LRB- 4 -RRB- more closely in order to see whether the assumption which it directs can accommodate the wider effects for which Mr Purchas contended on behalf of the landowners . 	NAN	NAN	NAN	0.7	lord hope
107	141	The critical words in the subsection to which attention must be directed are to be found in the phrase `` if it were not proposed to be acquired . '' 	NAN	NAN	NAN	0.7	lord hope
107	142	Those words must be examined in the light of the agreed fact that the relevant date , as at which the local planning authority is required by the subsection to issue its opinion regarding the grant of planning permission , is the date of the section 22 -LRB- 2 -RRB- -LRB- a -RRB- notice . 	NAN	NAN	NAN	0.7	lord hope
107	143	The language is , as Buxton L.J. observed -LSB- 1999 -RSB- Q.B. 1144 , 1155F , not of the past but of the present conditional . 	NAN	NAN	NAN	0.7	lord hope
107	144	The assumption which has to be made is that the land is not `` proposed to be acquired '' at the relevant date . 	NAN	NAN	NAN	0.7	lord hope
107	145	The words `` proposed to be acquired '' are given a particular meaning by the statute . 	NAN	NAN	NAN	0.7	lord hope
107	146	They appear in section 17 -LRB- 1 -RRB- which identifies the time when the parties may apply for a certificate of alternative development , and they appear again in section 17 -LRB- 3 -RRB- which describes the contents of the application for a certificate . 	NAN	NAN	NAN	0.7	lord hope
107	147	The circumstances in which an interest in land shall be taken to be an interest proposed to be acquired are defined in section 22 -LRB- 2 -RRB- . 	NAN	NAN	NAN	0.7	lord hope
107	148	It is by reference to the circumstances defined in section 22 -LRB- 2 -RRB- that the relevant date for the determination of the issue about planning permission is identified . 	NAN	NAN	NAN	0.7	lord hope
107	149	The effect of that subsection is that an interest in land can not be taken to be an interest proposed to be acquired for the purposes of section 17 until one or other of the circumstances which it describes has occurred . 	NAN	NAN	NAN	0.7	lord hope
107	150	The position appears therefore to be quite straightforward upon a consideration of the ordinary meaning of the words used in the statute . 	NAN	NAN	NAN	0.7	lord hope
107	151	The assumption which the local planning authority must make relates to the situation as at the relevant date . 	NAN	NAN	NAN	0.7	lord hope
107	152	The scheme for which the land is proposed to be acquired , together with the underlying proposal which may appear in any of the planning documents , must be assumed on that date to have been cancelled . 	NAN	NAN	NAN	0.7	lord hope
107	153	No assumption has to be made as to may or may not have happened in the past . 	NAN	NAN	NAN	0.7	lord hope
107	154	Wider considerations This conclusion as to the meaning of the words used in section 17 -LRB- 4 -RRB- is consistent with the nature of the exercise which the local planning authority is required to perform . 	NAN	NAN	NAN	0.7	lord hope
107	155	The system of planning control which requires planning permission to be obtained for the development of land brings into account a variety of facts and circumstances . 	NAN	NAN	NAN	0.7	lord hope
107	156	Factors such as predictions of population growth and the availability of suitable land for development affect the need for more land to be released for housing in the area . 	NAN	NAN	NAN	0.7	lord hope
107	157	These factors need to be re-assessed at regular intervals . 	NAN	NAN	NAN	0.7	lord hope
107	158	A need which was identified ten or five years ago may have disappeared . 	NAN	NAN	NAN	0.7	lord hope
107	159	The predicted growth on which it was based may have been reduced . 	NAN	NAN	NAN	0.7	lord hope
107	160	The need may have been fully met by the building of the required number of houses in the given area . 	NAN	NAN	NAN	0.7	lord hope
107	161	Or other factors may have changed , leading to the conclusion that the need must be met elsewhere . 	NAN	NAN	NAN	0.7	lord hope
107	162	It is one thing to examine these factors , on the assumption that the proposal has been cancelled on the relevant date , in the light of existing circumstances . 	NAN	NAN	NAN	0.8	lord hope
107	163	It is quite another to look back into the past and to try to reconstruct the planning history of the area on the assumption that the proposal had never come into existence at all . 	NAN	NAN	NAN	0.8	lord hope
107	164	The further back in time one goes , the more likely it is that one assumption as to what would have happened must follow on another and the more difficult it is likely to be to reach a conclusion in which anybody can have confidence . 	NAN	NAN	NAN	0.8	lord hope
107	165	In Jelson v. Minister of Housing and Local Government -LSB- 1970 -RSB- 1 Q.B. 243 , where a proposed ring road had been cancelled owing to the construction of a motorway , the landowners applied for certificates of appropriate alternative development . 	NAN	NAN	NAN	0.8	lord hope
107	166	The Minister confirmed the negative certificates which had been issued by the local planning authority . 	NAN	NAN	NAN	0.8	lord hope
107	167	It was contended that the question whether planning permission might reasonably have been expected to be granted should be considered not as at the date of the section 22 -LRB- 2 -RRB- -LRB- a -RRB- notice but as at a date before there had been any proposal for the strip of land to be used for a ring road . 	NAN	NAN	NAN	0.8	lord hope
107	168	The landowners ' appeals were dismissed on the ground that the local planning authority must determine the question of planning permission as at the date of the notice , in the circumstances then existing , and not by looking at events in the past . 	NAN	NAN	NAN	0.8	lord hope
107	169	Lord Denning M.R. and Sachs L.J. saw the question as one of construction . 	NAN	NAN	NAN	0.8	lord hope
107	170	They reached their conclusion by examining the meaning of the words used in section 17 -LRB- 4 -RRB- . 	NAN	NAN	NAN	0.8	lord hope
107	171	But Phillimore L.J. added these observations , at p. 255C : `` An important factor is that , apart from the question of construction , once you start looking back , the whole exercise becomes hopelessly uncertain . 	NAN	NAN	NAN	0.8	lord hope
107	172	Did it all result from the designation of this strip as required for the ring road ? 	NAN	NAN	NAN	0.8	lord hope
107	173	How far was the state of the land due to the appellants ' own action in building right up to the strip ? 	NAN	NAN	NAN	0.8	lord hope
107	174	Could they have avoided loss by serving notice to purchase in 1959 when the provisions of the Act of 1961 were first -LSB- enacted -RSB- ? 	NAN	NAN	NAN	0.8	lord hope
107	175	Have they really suffered any loss , or did they pay for the strip on the basis that it was blighted land ? 	NAN	NAN	NAN	0.8	lord hope
107	176	At any rate , when they acquired it they knew this to be the case . 	NAN	NAN	NAN	0.8	lord hope
107	177	It seems to me that to look back beyond the date of the deemed notice to treat would open up a considerable filed of guesswork which would often make it impossible to give firm advice to any member of the public as to his rights . 	NAN	NAN	NAN	0.8	lord hope
107	178	Accordingly , both as a matter of construction and on wider grounds , I would dismiss these appeals . '' 	NAN	NAN	NAN	0.8	lord hope
107	179	Some of Phillimore L.J. 's observations in that passage relate to issues which are for consideration by the Lands Tribunal and not by the local planning authority . 	NAN	NAN	NAN	0.8	lord hope
107	180	None of his questions as to the actions of the landowners have been raised in the present case . 	NAN	NAN	NAN	0.8	lord hope
107	181	But there is much force in his point that once one starts looking back in time the exercise becomes clouded in uncertainty . 	NAN	NAN	NAN	0.8	lord hope
107	182	The questions which are likely to arise will be complex and difficult . 	NAN	NAN	NAN	0.8	lord hope
107	183	They will involve matters of evidence as to past events , the assessment of which is likely to lie outside the expertise of the local planning authority . 	NAN	NAN	NAN	0.9	lord hope
107	184	Its normal function is to examine planning issues in the light of existing circumstances . 	NAN	NAN	NAN	0.9	lord hope
107	185	The fact that applications for certificates of appropriate alternative development are made to the local planning authority lies at the heart of the matter . 	NAN	NAN	NAN	0.9	lord hope
107	186	It supports the view that the determination as to the contents of the certificate should be arrived at by applying ordinary planning principles to the existing circumstances , not by assessing what may or may not have happened in the past . 	NAN	NAN	NAN	0.9	lord hope
107	187	The question which the local planning authority , and in his turn the Secretary of State for the Environment , had to answer in this case was therefore a relatively simple one . 	NAN	NAN	NAN	0.9	lord hope
107	188	It was capable of being determined , on the assumption that the proposal had been cancelled on the relevant date , in the light of the circumstances existing at that date and by the application of ordinary planning principles . 	NAN	NAN	NAN	0.9	lord hope
107	189	The question was whether reasons existed for the refusal of planning permission which were quite independent of any scheme for the acquisition of the land for use for the purposes of the proposed by-pass : see per Lord Bridge in Grampian Regional Council v. Secretary of State for Scotland at p. 1346F . 	NAN	NAN	NAN	0.9	lord hope
107	190	Lord Bridge said in Grampian at p. 1345G-H , that the overriding consideration which impelled him to reject the argument for the appellants in that case was that it would , if accepted , defeat the essential purpose of the procedure for obtaining certificates of appropriate alternative development as part of the overall scheme of the Act which was to secure the payment of fair compensation to landowners who were being compulsorily expropriated . 	NAN	NAN	NAN	0.9	lord hope
107	191	The flaw which he observed in the appellants ' argument was that to allow reliance on the underlying public requirement to determine the question would lead to the issue of a negative certificate in every case . 	NAN	NAN	NAN	0.9	lord hope
107	192	This purposive approach to the words used in section 17 -LRB- 4 -RRB- led inevitably to a rejection of the argument advanced by the acquiring authority that , while the acquisition itself must be discounted , the underlying proposal should not be . 	NAN	NAN	NAN	0.9	lord hope
107	193	The position which Mr. Ouseley has adopted in the present case removes that difficulty . 	NAN	NAN	NAN	0.9	lord hope
107	194	The assumption , which he accepts , that the underlying proposal must be taken to have been cancelled on the relevant date , as well as the section 22 -LRB- 2 -RRB- -LRB- a -RRB- notice which gave effect to it , meets the objection that the cancellation approach will always lead to the issue of a negative certificate . 	NAN	NAN	NAN	0.9	lord hope
107	195	On his approach , the scheme for the payment of fair compensation can be put into effect in a way which will reflect the development value of the land at the relevant date independently of any scheme for the proposed by-pass . 	NAN	NAN	NAN	0.9	lord hope
107	196	I can find nothing in the overall scheme of the Act which requires the question whether planning permission would have been granted for any classes of alternative development to be determined by reference to events which may or may not have happened in the past if the proposal had not come into existence . 	NAN	NAN	NAN	0.9	lord hope
107	197	It may be , as Mr. Ouseley suggested , that these wider issues can be raised under section 9 of the Act when the amount of the compensation which is to be paid for land which is to be taken compulsorily is being assessed by the Lands Tribunal : see Jelson Ltd. v. Blaby District Council -LSB- 1977 -RSB- 1 W.L.R. 1020 , in which Jelsons were held to be entitled to the full economic value of the land which had been taken from them disregarding the effects of the scheme under section 9 of the Act of 1961 . 	NAN	NAN	NAN	0.9	lord hope
107	198	But that is not a matter which your Lordships need to resolve in this case . 	NAN	NAN	NAN	0.9	lord hope
107	199	I would hold that these wider issues are not relevant to the determination which the local planning authority must make as to the contents of a certificate of appropriate alternative development . 	NAN	NAN	NAN	0.9	lord hope
107	200	I would dismiss these appeals . 	lord hope	self	outcome	0.9	lord hope
107	201	------------- NEW JUDGE --------------- 	NAN	NAN	NAN	0.9	lord hope
107	202	LORD CLYDE 	NAN	NAN	NAN	0.9	lord hope
107	203	My Lords , 	NAN	NAN	NAN	0.9	lord hope
107	204	I have had the advantage of reading in draft the speech of my noble and learned friend , Lord Hope of Craighead . 	lord clyde	lord hope	ackn	0.9	lord hope
107	205	I agree with it , and for the reasons he gives I too would dismiss the appeals . 	lord clyde	lord hope	fullagr	1	lord hope
107	205	I agree with it , and for the reasons he gives I too would dismiss the appeals . 	lord clyde	self	outcome	1	lord hope
107	206	------------- NEW JUDGE --------------- 	NAN	NAN	NAN	1	lord hope
107	207	LORD HOBHOUSE OF WOODBOROUGH 	NAN	NAN	NAN	1	lord hope
107	208	My Lords , 	NAN	NAN	NAN	1	lord hope
107	209	I too agree that these appeals should be dismissed for the reasons given by my noble and learned friend Lord Hope of Craighead . 	lord hobhouse	lord hope	fullagr	1	lord hope
107	209	I too agree that these appeals should be dismissed for the reasons given by my noble and learned friend Lord Hope of Craighead . 	lord hobhouse	self	outcome	1	lord hope
107	210	------------- NEW JUDGE --------------- 	NAN	NAN	NAN	1	lord hope
107	211	LORD MILLETT 	NAN	NAN	NAN	1	lord hope
107	212	My Lords , 	NAN	NAN	NAN	1	lord hope
107	213	I have had the advantage of reading in draft the speech of my noble and learned friend , Lord Hope of Craighead . 	lord millett	lord hope	ackn	1	lord hope
107	214	I agree with it , and for the reasons he gives I too would dismiss the appeals . 	lord millett	lord hope	fullagr	1	lord hope
107	214	I agree with it , and for the reasons he gives I too would dismiss the appeals . 	lord millett	self	outcome	1	lord hope
