86	149	Such a rule change would still , of course , leave the court with a measure of flexibility to deal with situations where the appeal has been filed but , for some reason , service has not actually been effected in accordance with the rule . 	NAN	NAN	NAN	0.3	NAN
86	150	23 . 	NAN	NAN	NAN	0.3	NAN
86	151	A rule of that kind would meet the possible difficulties in operating section 35 which are prayed in aid as a reason for reading section 26 -LRB- 4 -RRB- as referring to service . 	NAN	NAN	NAN	0.3	NAN
86	152	It is hard , in any event , to see that these could have been the reason for the language used in sections 26 -LRB- 4 -RRB- and 103 -LRB- 9 -RRB- . 	NAN	NAN	NAN	0.3	NAN
86	153	After all , exactly the same language is used in sections 28 -LRB- 4 -RRB- and 105 -LRB- 5 -RRB- , which deal with appeals against the person 's discharge . 	NAN	NAN	NAN	0.3	NAN
86	154	Section 35 has no part to play in appeals of that kind . 	NAN	NAN	NAN	0.3	NAN
86	155	24 . 	NAN	NAN	NAN	0.3	NAN
86	156	For all these reasons I am not persuaded by either the substantive or the linguistic arguments advanced in favour of Lord Neuberger 's interpretation . 	lord rodger	lord neuberger	fulldisa	0.3	NAN
86	157	I would interpret sections 26 -LRB- 4 -RRB- and 103 -LRB- 9 -RRB- as simply requiring the appellant 's notice to be filed within 7 and 14 days respectively . 	NAN	NAN	NAN	0.3	NAN
86	158	25 . 	NAN	NAN	NAN	0.3	NAN
86	159	So far as filing an appellant 's notice is concerned , I respectfully agree with Lord Neuberger 's conclusion that the time limits under sections 26 -LRB- 4 -RRB- and 103 -LRB- 9 -RRB- can not be extended . 	lord rodger	lord neuberger	NAN	0.3	NAN
86	160	But that point does not arise in these cases . 	NAN	NAN	NAN	0.3	NAN
86	161	26 . 	NAN	NAN	NAN	0.3	NAN
86	162	For my part , I would dismiss the appeal in Mr Moulai 's case since his appellant 's notice was filed within 7 days , as required by both the 2003 Act and the relevant practice direction , and it was also , in fact , served within 7 days as required by the practice direction . 	NAN	NAN	NAN	0.3	NAN
86	163	In Mr Mucelli 's case , his appellant 's notice was filed within 14 days , as required by both the 2003 Act and the relevant practice direction . 	NAN	NAN	NAN	0.3	NAN
86	164	Admittedly , his notice was not served on the Crown Prosecution Service within 14 days , but that was simply a requirement of PD22 .6 A -LRB- 5 -RRB- . 	NAN	NAN	NAN	0.3	NAN
86	165	The Divisional Court would therefore have had power to extend the time for service or to dispense with service . 	NAN	NAN	NAN	0.3	NAN
86	166	But , on any view , the mere failure to serve within the time specified in the practice direction is not a basis for dismissing an appeal which has been duly filed within the 14 days allowed by Parliament . 	NAN	NAN	NAN	0.3	NAN
86	167	I would accordingly allow Mr Mucelli 's appeal . 	lord rodger	self	outcome	0.3	NAN
86	168	27 . 	NAN	NAN	NAN	0.3	NAN
86	169	On that basis , it would be appropriate , as Lord Neuberger indicates , to direct that the Albanian Government should be permitted to adduce the further evidence about the fairness of trials in that country . 	lord rodger	lord neuberger	partagr	0.3	NAN
86	170	This is in line with the approach adopted by this House in Saber v Secretary of State for the Home Department 2003 SLT 1409 ; -LSB- 2007 -RSB- UKHL 47 -LRB- unreported -RRB- . 	NAN	NAN	NAN	0.3	NAN
86	171	The appellant had sought asylum on the basis of the situation in Iraq . 	NAN	NAN	NAN	0.3	NAN
86	172	By the time the appeal reached the Second Division of the Court of Session , the situation had changed as a result of the United States-led invasion in March 2003 . 	NAN	NAN	NAN	0.3	NAN
86	173	The House of Lords affirmed the view of the Second Division that , in considering whether the appellant had a proper claim to asylum , the court was entitled to take into account up-to-date information about the situation in Iraq . 	NAN	NAN	NAN	0.3	NAN
86	174	------------- NEW JUDGE --------------- 	NAN	NAN	NAN	0.3	NAN
86	175	LORD CARSWELL 	NAN	NAN	NAN	0.3	NAN
86	176	My Lords , 	NAN	NAN	NAN	0.3	NAN
86	177	28 . 	NAN	NAN	NAN	0.3	NAN
86	178	I have had the advantage of reading in draft the opinions prepared by my noble and learned friends Lord Brown of Eaton-under-Heywood and Lord Neuberger of Abbotsbury . 	lord carswell	lord brown	ackn	0.3	NAN
86	178	I have had the advantage of reading in draft the opinions prepared by my noble and learned friends Lord Brown of Eaton-under-Heywood and Lord Neuberger of Abbotsbury . 	lord carswell	lord neuberger	ackn	0.3	NAN
86	179	I agree with the reasons expressed and conclusions reached by both and shall add only a few words . 	lord carswell	lord brown	fullagr	0.3	NAN
86	179	I agree with the reasons expressed and conclusions reached by both and shall add only a few words . 	lord carswell	lord neuberger	fullagr	0.3	NAN
86	180	29 . 	NAN	NAN	NAN	0.3	NAN
86	181	It is clearly desirable that the time limits for appealing against the order of a court permitting extradition should operate similarly in the different constituent parts of the United Kingdom . 	NAN	NAN	NAN	0.3	NAN
86	182	Given the difference in the Scottish practice from that of the other jurisdictions in the timing of service of notices of appeal , the decision of the House will have that result . 	NAN	NAN	NAN	0.3	NAN
86	183	30 . 	NAN	NAN	NAN	0.3	NAN
86	184	I should add only , for the sake of completeness in the Moulai appeal , that there is no provision in the Northern Ireland rules of court for service by fax -LRB- except in cross-jurisdictional proceedings -RRB- , and accordingly no provision operating in matters relating to extradition equivalent to that in the CPR which deems a document transmitted after 4 pm to have been served on the next business day . 	NAN	NAN	NAN	0.3	NAN
86	185	In that jurisdiction , accordingly , the issue which is of importance in Moulai 's case will not arise . 	NAN	NAN	NAN	0.4	NAN
86	186	31 . 	NAN	NAN	NAN	0.4	NAN
86	187	I would dismiss both appeals . 	lord carswell	self	outcome	0.4	NAN
86	188	------------- NEW JUDGE --------------- 	NAN	NAN	NAN	0.4	NAN
86	189	LORD BROWN OF EATON-UNDER-HEYWOOD 	NAN	NAN	NAN	0.4	NAN
86	190	My Lords , 	NAN	NAN	NAN	0.4	NAN
86	191	32 . 	NAN	NAN	NAN	0.4	NAN
86	192	Section 26 -LRB- 4 -RRB- of the Extradition Act 2003 provides that : `` Notice of an appeal -LSB- against a district judge 's order for extradition -RSB- must be given in accordance with rules of court before the end of seven days starting with the day on which the order is made '' . 	NAN	NAN	NAN	0.4	NAN
86	193	A number of other sections in the Act provide in similar terms for the giving of notices of appeal within a specified period , sometimes seven days , sometimes fourteen . 	NAN	NAN	NAN	0.4	NAN
86	194	The core questions at the heart of these two appeals are , first , what is meant by the requirement that notice be `` given '' -- does that mean merely filed with the court or both filed with the court and served on the respondent ? 	NAN	NAN	NAN	0.4	NAN
86	195	; secondly , whichever is meant , is such judicial discretion as is ordinarily available under the rules of court -- variously to extend time for compliance with any rule -LRB- CPR r. 3.1 -LRB- 2 -RRB- -LRB- a -RRB- -RRB- , to vary the time limit for filing an appeal notice -LRB- r. 52.6 -LRB- 1 -RRB- -RRB- , to dispense with service -LRB- r. 6.9 -RRB- , or perhaps more generally to remedy errors -LRB- r. 3.10 -RRB- -- available in this context to overcome any failure to give notice within the specified time ? 	NAN	NAN	NAN	0.4	NAN
86	196	33 . 	NAN	NAN	NAN	0.4	NAN
86	197	In both cases before your Lordships it so happens that notice of the proposed appeal was filed with the court within the specified time -- seven days in Moulai 's case , fourteen days in Mucelli 's -LRB- under section 103 -LRB- a -RRB- -RRB- . 	NAN	NAN	NAN	0.4	NAN
86	198	But in neither case was it served within the specified time -- unless receipt of the notice of Moulai 's appeal on the respondent 's fax machine by just after 4 pm on the seventh day can be regarded as service before the end of that day for the purposes of section 26 -LRB- 4 -RRB- , a question to which I shall return . 	NAN	NAN	NAN	0.4	NAN
86	199	34 . 	NAN	NAN	NAN	0.4	NAN
86	200	On both these central issues -- the meaning in section 26 -LRB- 4 -RRB- of `` given '' and the question whether any discretion arises -- your Lordships were treated to a series of elaborate arguments involving the minute examination of a large number of the 2003 Act 's many sections . 	NAN	NAN	NAN	0.4	NAN
86	201	I confess to having found most of them ultimately unhelpful -- and , indeed , there is a risk of the court actually being misled by them , as was Hooper LJ in Moulai 's case by the reference in section 213 -LRB- 3 -RRB- -LRB- a -RRB- to the `` period permitted for giving notice of an appeal to the High Court , '' an expression which he understood to mean that notice had to be given -LRB- only -RRB- to the High Court , but is no less capable of meaning that notice -LRB- of an appeal to the High Court -RRB- has to be given , leaving open the question of whether only to the Court or also to the respondent . 	NAN	NAN	NAN	0.4	NAN
86	202	For my part I think the issues can be comparatively shortly resolved and are best considered compendiously rather than as two discrete questions . 	NAN	NAN	NAN	0.4	NAN
86	203	35 . 	NAN	NAN	NAN	0.4	NAN
86	204	Article 17 -LRB- 1 -RRB- of the Framework Decision requires that European arrest warrants `` be dealt with and executed as a matter of urgency '' . 	NAN	NAN	NAN	0.4	NAN
86	205	Part 1 of the 2003 Act was enacted to give effect to this obligation . 	NAN	NAN	NAN	0.4	NAN
86	206	It is hardly surprising , therefore , that section 26 -LRB- 4 -RRB- should specify so short a time limit or that section 35 should , in turn , require the fugitive 's extradition within 17 days -LRB- it used to be only 10 -RRB- of the judge 's extradition order , unless -LRB- section 35 -LRB- 1 -RRB- -LRB- b -RRB- -RRB- `` notice of an appeal under section 26 is given before the end of the -LSB- 7-day -RSB- period '' . 	NAN	NAN	NAN	0.4	NAN
86	207	36 . 	NAN	NAN	NAN	0.4	NAN
86	208	On any view section 26 -LRB- 4 -RRB- requires the notice of appeal to be filed within 7 days . 	NAN	NAN	NAN	0.4	NAN
86	209	It is scarcely even arguable that the 7-day period is extendable under the rules in respect of filing , and certainly this was not the view of either Divisional Court below : plainly something must be done to keep the extradition challenge alive and to stop time running for the fugitive 's physical removal . 	NAN	NAN	NAN	0.4	NAN
86	210	But if the 7-day period is unextendable for filing , why should it not have been intended to apply also to service and to be unextendable in respect of that too ? 	NAN	NAN	NAN	0.4	NAN
86	211	Plainly the respondent has to be served and needs to know , not least for section 35 purposes , whether the 17-day period for effecting extradition has stopped running . 	NAN	NAN	NAN	0.4	NAN
86	212	If `` giving '' meant only filing and not also serving , then there would be no statutory provision at all for service and that matter would be left entirely to the rules . 	NAN	NAN	NAN	0.4	NAN
86	213	-LRB- In Scotland , of course , filing follows service so that a time limit for filing by definition encompasses also service . -RRB- 	NAN	NAN	NAN	0.4	NAN
86	214	37 . 	NAN	NAN	NAN	0.4	NAN
86	215	If , moreover , the time for filing is unextendable , surely it makes no sense to allow time for service to be extendable , let alone to allow service to be dispensed with . 	NAN	NAN	NAN	0.4	NAN
86	216	True , in these particular cases , certainly in Mucelli , it would make a difference . 	NAN	NAN	NAN	0.4	NAN
86	217	But generally that would not be so . 	NAN	NAN	NAN	0.4	NAN
86	218	There is no more difficulty in serving in time than in filing in time and usually both will be , and invariably both should be , achieved more or less contemporaneously before the specified period elapses . 	NAN	NAN	NAN	0.4	NAN
86	219	And just as there is really very little purpose in allowing flexibility for the time of service when there can be none for the time of filing , so too there would be disproportionate disadvantages in such an arrangement , notably the complete loss of clarity and certainty so essential to the efficient and expeditious working of the new extradition scheme . 	NAN	NAN	NAN	0.4	NAN
86	220	38 . 	NAN	NAN	NAN	0.4	NAN
86	221	Against this background it seems to me tolerably plain both that section 26 -LRB- 4 -RRB- is requiring the notice of any appeal to be both filed and served within the stipulated 7-day period and that this , being a statutory time limit , is unextendable . 	NAN	NAN	NAN	0.4	NAN
86	222	The rules of court are to dictate everything about the filing and serving of the notice save only the period within which this must be done ; this is expressly dictated by the section itself . 	NAN	NAN	NAN	0.4	NAN
86	223	Whatever discretions arise under the rules are exercisable only insofar as is consistent with the filing and serving of the notice before the statutory time limit expires . 	NAN	NAN	NAN	0.4	NAN
86	224	39 . 	NAN	NAN	NAN	0.4	NAN
86	225	But by the same token that the court has no discretion under the rules to extend time for filing and serving the notice beyond the 7-day limit , so too the rules themselves can not operate to limit the period for achieving service to less than the stipulated 7 days . 	NAN	NAN	NAN	0.4	NAN
86	226	Effectively that is what rule 6.7 -LRB- 1 -RRB- does by deeming a faxed notice , transmitted after 4 pm on a business day , to be served not on that day but on the next business day . 	NAN	NAN	NAN	0.4	NAN
86	227	On any view the court can not be denied a discretion to make an order which operates to extend time up to midnight on the seventh day . 	NAN	NAN	NAN	0.4	NAN
86	228	Here all that is required in Moulai 's case is to treat his failure to complete the transmission of his faxed notice of appeal by 4 pm as remediable under rule 3.10 , alternatively to extend time for faxing the notice to shortly after 4 pm on the day in question . 	NAN	NAN	NAN	0.4	NAN
86	229	40 . 	NAN	NAN	NAN	0.4	NAN
86	230	For these reasons , which really do no more than echo a part of the altogether fuller reasoning contained in the opinion of my noble and learned friend Lord Neuberger of Abbotsbury , which I have had the advantage of reading in draft and with all of which I am in complete agreement , I too would dismiss both appeals . 	lord brown	lord neuberger	ackn	0.4	NAN
86	230	For these reasons , which really do no more than echo a part of the altogether fuller reasoning contained in the opinion of my noble and learned friend Lord Neuberger of Abbotsbury , which I have had the advantage of reading in draft and with all of which I am in complete agreement , I too would dismiss both appeals . 	lord brown	lord neuberger	fullagr	0.4	NAN
86	230	For these reasons , which really do no more than echo a part of the altogether fuller reasoning contained in the opinion of my noble and learned friend Lord Neuberger of Abbotsbury , which I have had the advantage of reading in draft and with all of which I am in complete agreement , I too would dismiss both appeals . 	lord brown	self	outcome	0.4	NAN
86	231	------------- NEW JUDGE --------------- 	NAN	NAN	NAN	0.4	NAN
86	232	LORD NEUBERGER OF ABBOTSBURY 	NAN	NAN	NAN	0.4	NAN
86	233	My Lords , 	NAN	NAN	NAN	0.4	NAN
86	234	41 . 	NAN	NAN	NAN	0.4	NAN
86	235	These two appeals concern the time limits in Part 1 and Part 2 of the Extradition Act 2003 governing appeals to the High Court against an order of a District Judge permitting extradition . 	NAN	NAN	NAN	0.4	NAN
86	236	Section 26 -LRB- 4 -RRB- and section 103 -LRB- 9 -RRB- provide that `` Notice of an appeal ... must be given in accordance with rules of court before the end of ... . 	NAN	NAN	NAN	0.4	NAN
86	237	-LSB- 7 or 14 -RSB- days starting with the day on which the order is made '' . 	NAN	NAN	NAN	0.4	NAN
86	238	Three questions of principle arise : -LRB- a -RRB- Must the appeal notice be both filed in the High Court and served on the respondent within the 7 or 14 days ? 	NAN	NAN	NAN	0.5	NAN
86	239	-LRB- b -RRB- Is the Court precluded from extending time for the filing and/or the service of the appeal notice ? 	NAN	NAN	NAN	0.5	NAN
86	240	-LRB- c -RRB- What happens if the office of the recipient of the notice is closed before the last moment for service ? 	NAN	NAN	NAN	0.5	NAN
86	241	Depending on the answers to these three questions , other , more case-specific , issues fall to be considered in each appeal . 	NAN	NAN	NAN	0.5	NAN
86	242	In these circumstances , I propose first to identify the relevant statutory provisions , then to address the three questions of principle , and finally to consider the issues in the two appeals . 	NAN	NAN	NAN	0.5	NAN
86	243	The provisions of the 2003 Act 42 . 	NAN	NAN	NAN	0.5	NAN
86	244	Part 1 of the 2003 Act was enacted to give effect to the Council Framework Decision `` on the European arrest warrant and the surrender procedures between Member States '' -LRB- 2002/584/JHA -RRB- . 	NAN	NAN	NAN	0.5	NAN
86	245	By virtue of section 2 , Part 1 applies where `` a judicial authority '' of a so-called `` category 1 territory '' issues a warrant containing a statement that `` the person in respect of whom -LSB- it -RSB- is issued is accused in the ... territory of the commission of an offence specified in the warrant '' . 	NAN	NAN	NAN	0.5	NAN
86	246	The warrant must be presented to `` the designated authority '' in the United Kingdom , who will then certify that it was appropriately issued . 	NAN	NAN	NAN	0.5	NAN
86	247	The Serious Organised Crime Agency -LRB- `` SOCA '' -RRB- is the designated authority in England and Wales for the purposes of Part 1 of the 2003 Act . 	NAN	NAN	NAN	0.5	NAN
86	248	43 . 	NAN	NAN	NAN	0.5	NAN
86	249	Section 3 then authorises the arrest of the person concerned , who is required , by section 6 , to be brought before a District Judge within 48 hours of his arrest . 	NAN	NAN	NAN	0.5	NAN
86	250	Under section 7 , the District Judge must first satisfy himself that the person who has been arrested is the person in respect of whom the warrant was issued . 	NAN	NAN	NAN	0.5	NAN
86	251	If the District Judge is so satisfied , section 8 requires him to fix an extradition hearing , which must be `` not later than ... . 	NAN	NAN	NAN	0.5	NAN
86	252	21 days starting with the date of the arrest '' , although the hearing can be postponed , pursuant to an application , if such postponement is `` in the interests of justice '' . 	NAN	NAN	NAN	0.5	NAN
86	253	Section 9 sets out , in very general terms , the District Judge ' powers . 	NAN	NAN	NAN	0.5	NAN
86	254	The following twelve sections identify the various defences to extradition , each of which is required to be considered in turn . 	NAN	NAN	NAN	0.5	NAN
86	255	If any of these defences is established , the District Judge `` must order the person 's discharge '' . 	NAN	NAN	NAN	0.5	NAN
86	256	44 . 	NAN	NAN	NAN	0.5	NAN
86	257	The penultimate potential defence is in section 20 , which applies where the person has been convicted in his absence . 	NAN	NAN	NAN	0.5	NAN
86	258	If so , the District Judge must consider whether , unless the person had been deliberately absent , he would , if returned , `` be entitled to a retrial or ... to a review amounting to a retrial '' . 	NAN	NAN	NAN	0.5	NAN
86	259	If not , he `` must order the person 's discharge '' ; if so , `` he must proceed under section 21 '' , which is concerned with the last of the various defences . 	NAN	NAN	NAN	0.5	NAN
86	260	Section 21 raises the question whether the extradition would be `` compatible with the Convention rights within the meaning of the Human Rights Act 1998 '' . 	NAN	NAN	NAN	0.5	NAN
86	261	If it would not be so compatible , the District Judge must order that the person discharged ; if it would be , the District Judge must order the person to be extradited . 	NAN	NAN	NAN	0.5	NAN
86	262	45 . 	NAN	NAN	NAN	0.5	NAN
86	263	Section 26 provides : `` -LRB- 1 -RRB- If the appropriate judge orders a person 's extradition under this Part , the person may appeal to the High Court against the order . 	NAN	NAN	NAN	0.5	NAN
86	264	... -LRB- 3 -RRB- An appeal under this section may be brought on a question of law or fact . 	NAN	NAN	NAN	0.5	NAN
86	265	-LRB- 4 -RRB- Notice of an appeal under this section must be given in accordance with rules of court before the end of the permitted period , which is 7 days starting with the day on which the order is made . '' 	NAN	NAN	NAN	0.5	NAN
86	266	46 . 	NAN	NAN	NAN	0.5	NAN
86	267	Section 28 makes similar provision for an appeal against a refusal to extradite . 	NAN	NAN	NAN	0.5	NAN
86	268	Section 31 provides that a hearing of any appeal to the High Court must start within a period prescribed by rules of court , although , by virtue of section 31 -LRB- 4 -RRB- , the High Court can extend the period in a particular case `` if it believes it to be in the interests of justice to do so '' . 	NAN	NAN	NAN	0.5	NAN
86	269	Section 32 provides for an appeal -LRB- with leave -RRB- to the House of Lords against a decision of the High Court under section 26 or 28 . 	NAN	NAN	NAN	0.5	NAN
86	270	47 . 	NAN	NAN	NAN	0.5	NAN
86	271	Section 35 is in these terms `` -LRB- 1 -RRB- This section applies if -- -LRB- a -RRB- the appropriate judge orders a person 's extradition to a category 1 territory under this Part , and -LRB- b -RRB- no notice of an appeal under section 26 is given before the end of the period permitted under that section . 	NAN	NAN	NAN	0.5	NAN
86	272	... -LRB- 3 -RRB- The person must be extradited to the category 1 territory before the end of the required period . 	NAN	NAN	NAN	0.5	NAN
86	273	-LRB- 4 -RRB- The required period is -- -LRB- a -RRB- 17 days starting with the day on which the judge makes the order , or -LRB- b -RRB- if the judge and the authority which issued the Part 1 warrant agree a later date , 10 days starting with the later date . 	NAN	NAN	NAN	0.5	NAN
86	274	-LRB- 5 -RRB- If subsection -LRB- 3 -RRB- is not complied with and the person applies to the appropriate judge to be discharged the judge must order his discharge , unless reasonable cause is shown for the delay . 	NAN	NAN	NAN	0.5	NAN
86	275	-LRB- 6 -RRB- These must be ignored for the purposes of subsection -LRB- 1 -RRB- -LRB- b -RRB- -- -LRB- a -RRB- any power of a court to extend the period permitted for giving notice of appeal ; -LRB- b -RRB- any power of a court to grant leave to take a step out of time . '' 	NAN	NAN	NAN	0.5	NAN
86	276	-LRB- The period in section 35 -LRB- 4 -RRB- was originally 10 days , and was recently extended to 17 days -RRB- . 	NAN	NAN	NAN	0.5	NAN
86	277	Sections 36 is concerned with `` extradition following appeal '' . 	NAN	NAN	NAN	0.5	NAN
86	278	48 . 	NAN	NAN	NAN	0.5	NAN
86	279	Sections 41 to 43 are concerned with the procedure where a warrant is withdrawn . 	NAN	NAN	NAN	0.5	NAN
86	280	Section 42 applies , according to subsection -LRB- 2 -RRB- , if the warrant is withdrawn after `` -LRB- a -RRB- ... . 	NAN	NAN	NAN	0.5	NAN
86	281	notice of an appeal to the -LSB- High -RSB- -LSB- C -RSB- ourt is given by the person or the authority which issued the warrant '' and before `` -LRB- b -RRB- ... proceedings on the appeal are discontinued or the court makes its decision on the appeal '' . 	NAN	NAN	NAN	0.5	NAN
86	282	49 . 	NAN	NAN	NAN	0.5	NAN
86	283	Part 2 of the 1993 Act is concerned with extradition to so-called `` category 2 territories '' . 	NAN	NAN	NAN	0.5	NAN
86	284	The procedure is slightly different from that under Part 1 . 	NAN	NAN	NAN	0.5	NAN
86	285	It starts with a territory making a request for extradition to the Secretary of State under section 70 . 	NAN	NAN	NAN	0.5	NAN
86	286	The Secretary of State must then issue a certificate , and send the papers to a District Judge . 	NAN	NAN	NAN	0.5	NAN
86	287	Under section 71 , the District Judge then issues a warrant for the arrest of the person concerned . 	NAN	NAN	NAN	0.5	NAN
86	288	The warrant must be served on him `` as soon as practicable '' - section 72 -LRB- 2 -RRB- - and he must thereupon be brought before the District judge `` as soon as practicable '' - section 72 -LRB- 3 -RRB- . 	NAN	NAN	NAN	0.5	NAN
86	289	The District Judge must then fix an extradition hearing which , by virtue of section 75 -LRB- 2 -RRB- , must be within `` 2 months starting with the date on which the person first appears ... before -LSB- him -RSB- '' . 	NAN	NAN	NAN	0.5	NAN
86	290	50 . 	NAN	NAN	NAN	0.5	NAN
86	291	Section 77 sets out in general terms the District Judge 's powers at the extradition hearing . 	NAN	NAN	NAN	0.6	NAN
86	292	Sections 78 to 87 identify the various possible defences to extradition which the District Judge should consider in turn . 	NAN	NAN	NAN	0.6	NAN
86	293	Sections 86 and 87 are very similar in their effect to sections 20 and 21 in Part 1 . 	NAN	NAN	NAN	0.6	NAN
86	294	However , under section 87 -LRB- 3 -RRB- , if the District Judge is satisfied that extradition would involve no breach of the Convention rights , instead of ordering extradition as in Part 1 , he `` must send the case to the Secretary of State for his decision whether the person is to be extradited '' . 	NAN	NAN	NAN	0.6	NAN
86	295	The subsequent possibilities are set out in sections 93 to 102 , which include , in section 101 , the making of an extradition order , by the Secretary of State -LRB- or another Minister , Under-Secretary of State , or senior official , or , in Scotland , by a member of the Scottish Executive , a junior Scottish minister or senior official -RRB- . 	NAN	NAN	NAN	0.6	NAN
86	296	Section 99 requires any decision to extradite to be made within two months of `` the appropriate day '' as defined in section 102 . 	NAN	NAN	NAN	0.6	NAN
86	297	51 . 	NAN	NAN	NAN	0.6	NAN
