289	146	Troy Hurst , the respondent 's son , was stabbed to death by a neighbour on 25 May 2000 , just a few months before the coming into force of the Human Rights Act 1998 on 2 October 2000 . 	NAN	NAN	NAN	0.3	lord brown
289	147	That , as will shortly appear , is a crucial consideration in this appeal . 	NAN	NAN	NAN	0.3	lord brown
289	148	26 . 	NAN	NAN	NAN	0.3	lord brown
289	149	Following the killer 's conviction for manslaughter the respondent urged the coroner to re-open the inquest into her son 's death : the risk of such a violent incident had long been apparent and the police and housing authority were open to criticism for not doing more to avert it . 	NAN	NAN	NAN	0.3	lord brown
289	150	The coroner 's refusal to re-open the inquest is the decision under challenge in these proceedings . 	NAN	NAN	NAN	0.3	lord brown
289	151	The respondent 's whole case depends upon the scope and findings of any such inquest being determined in accordance with the United Kingdom 's investigatory obligation arising under article 2 of the European Convention on Human Rights . 	NAN	NAN	NAN	0.3	lord brown
289	152	It is not contended that the coroner 's decision can be impugned except by reference to the article 2 duty . 	NAN	NAN	NAN	0.3	lord brown
289	153	An inquest conducted in accordance with domestic coronial law prior to the coming into force of the Human Rights Act would satisfy neither the respondent 's desire for wide-ranging findings upon the circumstances leading up to her son 's death nor the United Kingdom 's article 2 duty . 	NAN	NAN	NAN	0.3	lord brown
289	154	The critical question for your Lordships ' determination is whether those seeking such an investigation into a pre-Human Rights Act death are entitled in domestic law to the benefit of the Convention . 	NAN	NAN	NAN	0.3	lord brown
289	155	27 . 	NAN	NAN	NAN	0.4	lord brown
289	156	It may be helpful at this introductory stage to clarify the issues by making brief reference to just four cases . 	NAN	NAN	NAN	0.4	lord brown
289	157	The Court of Appeal decided in R v Coroner for North Humberside and Scunthorpe , Ex p Jamieson -LSB- 1995 -RSB- QB 1 -LRB- Jamieson -RRB- that the function of an inquest is to determine `` by what means '' and not `` in what broad circumstances '' the deceased came by his death : that is the meaning to be given to the word `` how '' in section 11 -LRB- 5 -RRB- -LRB- b -RRB- -LRB- ii -RRB- of the Coroners Act 1988 and rule 36 -LRB- 1 -RRB- -LRB- b -RRB- of the Coroners Rules 1984 , both of which specify the inquest 's purpose to be ascertaining `` how the deceased came by his death '' . 	NAN	NAN	NAN	0.4	lord brown
289	158	Jamieson concerned the form of the verdict rather than the scope of the inquiry , the latter being left essentially as a matter for the coroner . 	NAN	NAN	NAN	0.4	lord brown
289	159	28 . 	NAN	NAN	NAN	0.4	lord brown
289	160	The following year the European Court of Human Rights in McCann v United Kingdom -LRB- 1995 -RRB- 21 EHRR 97 -LRB- McCann -RRB- -LRB- the `` Death on the Rock '' case -RRB- first identified the procedural duty implicit in article 2 of the Convention , a duty developed in subsequent Strasbourg case law to require the full investigation of any death involving or possibly involving a violation of the State 's substantive obligation to protect human life arising under article 2 -LRB- essentially wherever state agents or bodies may bear responsibility for the death -RRB- . 	NAN	NAN	NAN	0.4	lord brown
289	161	Such an investigation , moreover , must be able to state its conclusions on the main issues arising , for example , the justification of any use of lethal force or the responsibility for any systemic failure to protect human life . 	NAN	NAN	NAN	0.4	lord brown
289	162	29 . 	NAN	NAN	NAN	0.4	lord brown
289	163	The other two cases principally bearing on this appeal are the decisions of differently constituted Appellate Committees of this House , both given on 11 March 2004 : R -LRB- Middleton -RRB- v West Somerset Coroner -LSB- 2004 -RSB- 2 AC 182 -LRB- Middleton -RRB- and In re McKerr -LSB- 2004 -RSB- 1 WLR 807 -LRB- McKerr -RRB- . 	NAN	NAN	NAN	0.4	lord brown
289	164	Middleton approved Jamieson , recognised that in the case of certain deaths a Jamieson inquest -LRB- as for convenience I shall call an inquest conducted in accordance with that decision -RRB- would not meet the United Kingdom 's obligations under article 2 of the Convention , and held that in those cases -LRB- assuming always that the obligation were to be satisfied by an inquest rather than some other form of inquiry -RRB- the word `` how '' in the relevant provisions should be construed pursuant to section 3 of the Human Rights Act to mean `` not simply ` by what means ' but ` by what means and in what circumstances ' '' . 	NAN	NAN	NAN	0.4	lord brown
289	165	Thus the jury 's verdict would be able to state their conclusions on the important underlying issues : in that case -LRB- concerning a prisoner 's suicide in prison -RRB- whether he should have been recognised as a suicide risk and whether appropriate precautions should have been taken to prevent it . 	NAN	NAN	NAN	0.4	lord brown
289	166	30 . 	NAN	NAN	NAN	0.4	lord brown
289	167	McKerr decided that in domestic law the article 2 procedural duty applies only in the case of deaths occurring on or after 2 October 2000 : the Human Rights Act is not retrospective and the investigatory obligation is necessarily linked to the death itself . 	NAN	NAN	NAN	0.4	lord brown
289	168	-LRB- Middleton and R -LRB- Sacker -RRB- v West Yorkshire Coroner -LSB- 2004 -RSB- 1 WLR 796 , - an appeal heard together with Middleton -- were both in fact concerned with deaths occurring before 2 October 2000 but , as stated in the Committee 's opinion in each case , no question had been raised there as to the retrospective application of the Human Rights Act and the Convention ; rather they were assumed to be applicable and therefore nothing in those opinions was to be understood to throw doubt on the conclusion of the House in McKerr . -RRB- 	NAN	NAN	NAN	0.4	lord brown
289	169	31 . 	NAN	NAN	NAN	0.4	lord brown
289	170	Against that background it is now possible to state the central issue in this way : would any resumed inquest here be a Jamieson inquest or a Middleton inquest -LRB- as I shall describe the fuller process provided for by that decision -RRB- ? 	NAN	NAN	NAN	0.4	lord brown
289	171	The appellant Commissioner of Police -LRB- supported by the Attorney General for the Lord Chancellor as intervener -RRB- submits that it could only be a -LRB- necessarily inadequate -RRB- Jamieson inquest and accordingly that the coroner acted perfectly reasonably in refusing to reopen it . 	NAN	NAN	NAN	0.4	lord brown
289	172	The respondent contends , and the Court of Appeal held , that it would be a Middleton inquest and that the coroner 's decision was accordingly irrational . 	NAN	NAN	NAN	0.4	lord brown
289	173	32 . 	NAN	NAN	NAN	0.4	lord brown
289	174	It is agreed between the parties -LRB- Mrs Hurst and the Commissioner -RRB- that the United Kingdom is indeed under an international law obligation pursuant to article 2 of the Convention to conduct a further investigation into the death of the deceased and that , were such obligation sought to be discharged by reopening the inquest , it would need to be a Middleton inquest . 	NAN	NAN	NAN	0.4	lord brown
289	175	The Attorney General , I should note , makes no such concession as to the requirement even under international law for any further investigation : he reserves his position both as to whether the circumstances of this death engaged the article 2 investigatory obligation in the first place and , even were it engaged , as to whether the contested criminal proceedings brought against the deceased 's killer in that event satisfied it . 	NAN	NAN	NAN	0.4	lord brown
289	176	33 . 	NAN	NAN	NAN	0.4	lord brown
289	177	It might perhaps have been submitted -- as in the two Northern Ireland cases -LRB- Jordan v Lord Chancellor and McCaughey v Chief Constable of the Police Service of Northern Ireland -LSB- 2007 -RSB- UKHL 14 -RRB- heard together with the present appeal -- that even a Jamieson inquest here would satisfy the requirements of the article 2 procedural duty and that the coroner ought in any event therefore to have reopened the inquest . 	NAN	NAN	NAN	0.4	lord brown
289	178	Not only , however , was this nowhere raised in the Statement of Facts and Issues as an issue for your Lordships ' determination -LRB- and so not addressed either by the appellant or the intervener -RRB- , but Mr Keir Starmer QC in argument expressly disavowed any suggestion that the coroner 's decision could be impugned without reference to the United Kingdom 's international obligations under the Convention . 	NAN	NAN	NAN	0.4	lord brown
289	179	Given , moreover , the decision in Middleton that a section 3 construction of the governing legislation was required to enable an article 2 compliant inquest to take place in that -LRB- to my mind analogous -RRB- case , it is difficult to see how such an argument could have succeeded . 	NAN	NAN	NAN	0.4	lord brown
289	180	The position here is quite different from that arising in the two Northern Ireland cases where the deceased were directly killed by State agents . 	NAN	NAN	NAN	0.4	lord brown
289	181	As McCann had shown , the article 2 obligation in those cases can be satisfied by a Jamieson inquest . 	NAN	NAN	NAN	0.4	lord brown
289	182	34 . 	NAN	NAN	NAN	0.4	lord brown
289	183	My noble and learned friends , Baroness Hale of Richmond and Lord Mance , whilst accepting all this , would nevertheless dismiss the Commissioner 's appeal and so leave in force the Divisional Court 's order that the inquest into Troy Hurst 's death be re-opened -LRB- or require at least that the Coroner re-take the decision whether or not to re-open it -RRB- , on the basis that even a Jamieson inquest would be likely , although of course at the Coroner 's discretion , to `` examine the conduct of the police and the housing authority that fateful day if not before '' -LRB- para 22 of Lady Hale 's opinion -RRB- . 	lord brown	lady hale	partagr	0.4	lord brown
289	183	My noble and learned friends , Baroness Hale of Richmond and Lord Mance , whilst accepting all this , would nevertheless dismiss the Commissioner 's appeal and so leave in force the Divisional Court 's order that the inquest into Troy Hurst 's death be re-opened -LRB- or require at least that the Coroner re-take the decision whether or not to re-open it -RRB- , on the basis that even a Jamieson inquest would be likely , although of course at the Coroner 's discretion , to `` examine the conduct of the police and the housing authority that fateful day if not before '' -LRB- para 22 of Lady Hale 's opinion -RRB- . 	lord brown	lord mance	partagr	0.4	lord brown
289	184	Given , however , as both Lady Hale and Lord Mance in terms accept , that , upon the conclusion of such an inquest , the jury would be debarred from expressing any views whatever upon the conduct which they had been examining -LRB- the whole point of a Middleton inquest being , as I have explained above , to enable the jury to state their conclusions on the important underlying issues such as what risks should have been recognised and what precautions taken -RRB- the value of such an inquest may be doubted . 	lord brown	lady hale	partagr	0.4	lord brown
289	184	Given , however , as both Lady Hale and Lord Mance in terms accept , that , upon the conclusion of such an inquest , the jury would be debarred from expressing any views whatever upon the conduct which they had been examining -LRB- the whole point of a Middleton inquest being , as I have explained above , to enable the jury to state their conclusions on the important underlying issues such as what risks should have been recognised and what precautions taken -RRB- the value of such an inquest may be doubted . 	lord brown	lord mance	partagr	0.4	lord brown
289	185	It might , indeed , be thought the worst of all worlds . 	NAN	NAN	NAN	0.4	lord brown
289	186	Lady Hale and Lord Mance expressly acknowledge that it would not satisfy the UK 's international obligations under article 2 of the Convention . 	lord brown	lady hale	partagr	0.4	lord brown
289	186	Lady Hale and Lord Mance expressly acknowledge that it would not satisfy the UK 's international obligations under article 2 of the Convention . 	lord brown	lord mance	partagr	0.4	lord brown
289	187	Nor would it satisfy the respondent 's understandable desire for detailed findings to be made upon the circumstances leading to her son 's death . 	NAN	NAN	NAN	0.4	lord brown
289	188	At best it could occasion a report from the Coroner to a responsible authority under Rule 43 -LRB- see para 74 of Lord Mance 's opinion -RRB- . 	lord brown	lord mance	partagr	0.4	lord brown
289	189	Small wonder that such an inquest was not one for which Mr Starmer has ever contended . 	NAN	NAN	NAN	0.4	lord brown
289	190	35 . 	NAN	NAN	NAN	0.4	lord brown
289	191	I must turn now in a little more detail to the circumstances in which this death occurred and then indicate something of the course of events leading up to the present appeal . 	NAN	NAN	NAN	0.4	lord brown
289	192	36 . 	NAN	NAN	NAN	0.4	lord brown
289	193	The deceased -LRB- then aged 39 -RRB- was stabbed to death by his neighbour , Albert Reid , on 25 May 2000 . 	NAN	NAN	NAN	0.4	lord brown
289	194	Both were Barnet Council tenants on the Stroud Green Estate in North London . 	NAN	NAN	NAN	0.4	lord brown
289	195	There had been a long history of disruptive behaviour and violence by Reid towards other tenants on the Estate dating back to 1997 . 	NAN	NAN	NAN	0.4	lord brown
289	196	Police and local authority reports record a number of instances of Reid 's use and concealment of weapons and threats of violence . 	NAN	NAN	NAN	0.4	lord brown
289	197	37 . 	NAN	NAN	NAN	0.4	lord brown
289	198	In April 2000 the Council began possession proceedings against Reid . 	NAN	NAN	NAN	0.4	lord brown
289	199	Reid thought the deceased in part responsible . 	NAN	NAN	NAN	0.5	lord brown
289	200	Increasing concerns about Reid 's behaviour were expressed in the weeks leading up to the hearing date , 25 May . 	NAN	NAN	NAN	0.5	lord brown
289	201	One police entry recorded that he was `` extremely dangerous and has the potential to seriously injure or kill . '' 	NAN	NAN	NAN	0.5	lord brown
289	202	In the event the proceedings were adjourned on 25 May and the court refused the Council 's application for an injunction in the meantime to remove Reid from the estate . 	NAN	NAN	NAN	0.5	lord brown
289	203	That evening there occurred a series of encounters between Reid and the Hurst family , each reported to the police with increasing urgency . 	NAN	NAN	NAN	0.5	lord brown
289	204	Two of the calls were met with the response that there were `` no units available . '' 	NAN	NAN	NAN	0.5	lord brown
289	205	The final call informed the police of the fatal stabbing . 	NAN	NAN	NAN	0.5	lord brown
289	206	A substantially fuller account of the background to the killing appears in the judgment of the Divisional Court -LRB- Rose LJ and Henriques J -RRB- -LSB- 2003 -RSB- EWHC 1721 -LRB- Admin -RRB- ; -LSB- 2004 -RSB- UKHRR 139 , at paras 39-97 . 	NAN	NAN	NAN	0.5	lord brown
289	207	38 . 	NAN	NAN	NAN	0.5	lord brown
289	208	On 30 May 2000 an inquest was opened but immediately adjourned pursuant to section 16 -LRB- 1 -RRB- of the Coroners Act because Reid had been charged with murder . 	NAN	NAN	NAN	0.5	lord brown
289	209	Following Reid 's conviction for manslaughter on 16 July 2001 the coroner was strongly pressed to re-open the inquest under the provisions of section 16 -LRB- 3 -RRB- of the 1988 Act : `` After the conclusion of the relevant criminal proceedings the coroner may resume the adjourned inquest if in his opinion there is sufficient cause to do so . '' 	NAN	NAN	NAN	0.5	lord brown
289	210	By letter dated 19 November 2002 the coroner refused to do so , expressing the view that `` all the matters required to be ascertained have been fully explored and ascertained during criminal proceedings . '' 	NAN	NAN	NAN	0.5	lord brown
289	211	The coroner further found no reason to reopen the inquiry pursuant to the United Kingdom 's procedural duty under article 2 of the Convention -LRB- upon which the respondent had particularly relied -RRB- : he did not regard the circumstances of the death as imposing any such obligation on the United Kingdom and , even were that wrong , expressed the view that an inquest would not satisfy it . 	NAN	NAN	NAN	0.5	lord brown
289	212	39 . 	NAN	NAN	NAN	0.5	lord brown
289	213	On 4 July 2003 the respondent 's challenge to that decision succeeded before the Divisional Court . 	NAN	NAN	NAN	0.5	lord brown
289	214	It was held that notwithstanding that the death occurred before the coming into force of the Human Rights Act a freestanding right arose to an article 2 compliant investigation and that the coroner 's refusal to reopen the inquest `` breached his obligation under the Human Rights Act to act compatibly with the European Convention . '' 	NAN	NAN	NAN	0.5	lord brown
289	215	The coroner was accordingly directed to resume the inquest . 	NAN	NAN	NAN	0.5	lord brown
289	216	Before he did so , however , this House decided in McKerr that the procedural duty under article 2 applies in domestic law only to deaths occurring on or after 2 October 2000 . 	NAN	NAN	NAN	0.5	lord brown
289	217	Indeed Lord Nicholls expressly stated that the Divisional Court 's decision in the present case `` fell into error by failing to keep clearly in mind the distinction between -LRB- 1 -RRB- rights arising under the Convention and -LRB- 2 -RRB- rights created by the 1998 Act by reference to the Convention . '' 	NAN	NAN	NAN	0.5	lord brown
289	218	The Commissioner of Police of the Metropolis -LRB- who had appeared before the Divisional Court as an interested party -RRB- thereupon obtained leave to appeal out of time . 	NAN	NAN	NAN	0.5	lord brown
289	219	Unsurprisingly in those circumstances the respondent totally re-cast her case , no longer relying on section 6 of the 1998 Act but instead invoking section 3 . 	NAN	NAN	NAN	0.5	lord brown
289	220	As Buxton LJ came to put it in his leading judgment in the Court of Appeal , the respondent sought `` to uphold the Divisional Court 's order on grounds that were neither before that court nor before the House of Lords in In re McKerr . 	NAN	NAN	NAN	0.5	lord brown
289	221	-LSB- The appeal -RSB- turned into an inquiry wholly different from that in the Divisional Court '' -- -LSB- 2005 -RSB- 1WLR 3892 , 3896 -LRB- para 8 -RRB- . 	NAN	NAN	NAN	0.5	lord brown
289	222	40 . 	NAN	NAN	NAN	0.5	lord brown
289	223	In the result , the Court of Appeal dismissed the Commissioner 's appeal , holding , first , that '' -LSB- e -RSB- ven before the HRA domestic tribunals were bound to give full weight to the United Kingdom 's international obligations to be found in the ECHR -LSB- and that -RSB- it was not open to the coroner in terms of rationality as a matter of English domestic law to conclude otherwise than that the article 2 obligation required the resumption of the inquest '' -LRB- Buxton LJ at para 29 -RRB- ; and , secondly , that the interpretative obligation under section 3 of the 1998 Act is `` to give effect to this country 's international obligations , and not merely to its domestic obligations as created by the HRA '' -LRB- Buxton LJ at para 61 -RRB- . 	NAN	NAN	NAN	0.5	lord brown
289	224	On the appeal before your Lordships both those holdings are strenuously contested by the Commissioner and the Lord Chancellor . 	NAN	NAN	NAN	0.5	lord brown
289	225	41 . 	NAN	NAN	NAN	0.5	lord brown
289	226	Recognising that her case for a resumed inquest depends upon establishing that it would not be confined to a Jamieson proceeding but held rather in accordance with the broader Middleton approach , the respondent puts her case on two alternative bases . 	NAN	NAN	NAN	0.5	lord brown
289	227	First she seeks to rely on section 3 of the 1998 Act , the argument which succeeded before the Court of Appeal . 	NAN	NAN	NAN	0.5	lord brown
289	228	Secondly she submits that , even assuming section 3 can not avail her , the Middleton approach must now be applied to all inquests , either because section 11 -LRB- 5 -RRB- -LRB- b -RRB- -LRB- ii -RRB- must now be re-interpreted to bring our domestic law into conformity with our international obligations or because Middleton is now to be regarded as binding authority on the meaning of section 11 in all cases . 	NAN	NAN	NAN	0.5	lord brown
289	229	Both these arguments were rejected by the Court of Appeal -LRB- the first simply on the basis that that court was bound by Jamieson -RRB- . 	NAN	NAN	NAN	0.5	lord brown
289	230	Section 3 42 . 	NAN	NAN	NAN	0.5	lord brown
289	231	McKerr concerned a challenge to the Secretary of State 's refusal to provide an article 2 compliant investigation into a pre-1998 Act death , a challenge founded on section 6 -LRB- 1 -RRB- of the 1998 Act : `` It is unlawful for a public authority to act in a way which is incompatible with a Convention right . '' 	NAN	NAN	NAN	0.5	lord brown
289	232	The House held that `` a Convention right '' for this purpose meant such a right -LRB- as identified in section 1 of the Act -RRB- created by the Act in domestic law . 	NAN	NAN	NAN	0.5	lord brown
289	233	Since the Act was not retrospective , the secondary right to an article 2 compliant investigation accordingly arises only in respect of deaths occurring on or after 2 October 2000 . 	NAN	NAN	NAN	0.5	lord brown
289	234	43 . 	NAN	NAN	NAN	0.5	lord brown
289	235	What the Court of Appeal held in the present case is that McKerr says nothing as to the interpretative obligation under section 3 and that `` it is the international obligations of the state that section 3 requires to be used in reading and giving effect to legislation '' -LRB- original emphasis given by Buxton LJ at para 58 -RRB- . 	NAN	NAN	NAN	0.5	lord brown
289	236	Section 3 provides : `` So far as it is possible to do so , primary legislation and subordinate legislation must be read and given effect in a way which is compatible with the Convention rights . '' 	NAN	NAN	NAN	0.5	lord brown
289	237	Those Convention rights , said Buxton LJ -LRB- at para 44 -RRB- , mean the rights and fundamental freedoms set out in the various articles of the Convention and they `` exist and have force because of the United Kingdom 's adherence to the ECHR rather than because of the passage of the HRA . '' 	NAN	NAN	NAN	0.5	lord brown
289	238	44 . 	NAN	NAN	NAN	0.5	lord brown
289	239	For my part I have the greatest difficulty with this approach which necessarily involves construing the words `` the Convention rights '' where they appear in section 3 differently from their meaning in section 6 -LRB- `` a Convention right '' -RRB- . 	NAN	NAN	NAN	0.5	lord brown
289	240	But why should they be construed differently ? 	NAN	NAN	NAN	0.5	lord brown
289	241	The plain object of section 3 is to avoid where possible action by a public authority which would otherwise be unlawful under section 6 . 	NAN	NAN	NAN	0.5	lord brown
289	242	It applies only where there would otherwise be a breach of a Convention right under domestic law . 	NAN	NAN	NAN	0.5	lord brown
289	243	In the present case , as McKerr established , it would not be unlawful under domestic law for no further investigation to be carried out into Mr Hurst 's death . 	NAN	NAN	NAN	0.5	lord brown
289	244	The scheme of the 1998 Act and the link between sections 3 and 6 are to my mind plain . 	NAN	NAN	NAN	0.6	lord brown
289	245	This is perhaps most clearly demonstrated by the language of section 6 -LRB- 2 -RRB- -LRB- b -RRB- , language which expressly mirrors that of section 3 : `` Subsection -LRB- 1 -RRB- does not apply to an act if -LRB- b -RRB- in the case of one or more provisions of , or made under , primary legislation which can not be read or given effect in a way which is compatible with the Convention rights , the authority was acting so as to give effect to or enforce those provisions . '' 	NAN	NAN	NAN	0.6	lord brown
289	246	45 . 	NAN	NAN	NAN	0.6	lord brown
289	247	The Divisional Court in Pearson v Inner London North Coroner -LSB- 2005 -RSB- EWHC 833 -LRB- Admin -RRB- had to confront the very issue now arising . 	NAN	NAN	NAN	0.6	lord brown
289	248	A new inquest into a pre-1998 Act death was there sought under section 13 of the 1988 Act on the ground of insufficiency of inquiry . 	NAN	NAN	NAN	0.6	lord brown
289	249	The main argument before the court was that the coroner had conducted a Jamieson inquest , whereas he should have conducted an article 2 compliant inquest . 	NAN	NAN	NAN	0.6	lord brown
289	250	Maurice Kay LJ -LRB- with whom Moses J agreed -RRB- rejected the section 3 argument : 46 . 	NAN	NAN	NAN	0.6	lord brown
289	251	Buxton LJ disagreed with that conclusion : it was clear , he said , that `` the Divisional Court did not have the benefit of the detailed argument that has been deployed before us . '' 	NAN	NAN	NAN	0.6	lord brown
289	252	For my part , however , and despite Mr Starmer 's `` detailed argument '' , I find Maurice Kay LJ 's judgment compelling . 	NAN	NAN	NAN	0.6	lord brown
289	253	It is true , of course , that section 3 was not in play in McKerr : what was there under challenge was the Secretary of State 's refusal to exercise a general administrative discretion to set up an inquiry . 	NAN	NAN	NAN	0.6	lord brown
289	254	I can not suppose , however , that our conclusion there would have been different had it been a section 3 case . 	NAN	NAN	NAN	0.6	lord brown
289	255	Otherwise , as in Pearson itself , section 13 of the 1988 Act could be invoked in all these old cases with a view to the ordering of a new inquest -- precisely the concern expressed by the House in McKerr . 	NAN	NAN	NAN	0.6	lord brown
289	256	As Lord Hoffmann put it -LRB- at para 67 -RRB- : 47 . 	NAN	NAN	NAN	0.6	lord brown
