133	102	Therefore , in his application to the employment tribunal he included a complaint of a breach of the `` Working Time Regulations '' . 	NAN	NAN	NAN	0.2	lord neuberger, lord rodger, lord walker
133	103	-LRB- He also complained of matters relating to earlier periods of employment , but those complaints are no longer live and are not relevant for present purposes . -RRB- 	NAN	NAN	NAN	0.2	lord neuberger, lord rodger, lord walker
133	104	18 . 	NAN	NAN	NAN	0.2	lord neuberger, lord rodger, lord walker
133	105	The employment tribunal found in favour of Mr Ainsworth . 	NAN	NAN	NAN	0.2	lord neuberger, lord rodger, lord walker
133	106	The relevant part of their decision was that the Revenue `` made an unauthorised deduction from the wages of the applicant by failing to make a payment representing holiday accrued and untaken upon the termination of his employment and the respondents are directed to pay the applicant the sum of # 16.14 . '' 	NAN	NAN	NAN	0.2	lord neuberger, lord rodger, lord walker
133	107	This was plainly a decision upholding Mr Ainsworth 's complaint , under section 23 of the 1996 Act , of an unauthorised deduction from his wages , contrary to section 13 -LRB- 1 -RRB- . 	NAN	NAN	NAN	0.2	lord neuberger, lord rodger, lord walker
133	108	19 . 	NAN	NAN	NAN	0.2	lord neuberger, lord rodger, lord walker
133	109	The Revenue now accept that , in the light of the ruling of the European Court of Justice , they were obliged by regulation 14 -LRB- 2 -RRB- of the 1998 Regulations to pay Mr Ainsworth the sum in question . 	NAN	NAN	NAN	0.2	lord neuberger, lord rodger, lord walker
133	110	So , as they accept , he would have been entitled to succeed in his complaint brought under regulation 30 of the 1998 Regulations . 	NAN	NAN	NAN	0.2	lord neuberger, lord rodger, lord walker
133	111	20 . 	NAN	NAN	NAN	0.2	lord neuberger, lord rodger, lord walker
133	112	The Revenue contend , however , that Mr Ainsworth was not entitled to make a complaint to the employment tribunal under section 23 of the 1996 Act and so the tribunal had no jurisdiction to make the order that they did . 	NAN	NAN	NAN	0.2	lord neuberger, lord rodger, lord walker
133	113	The Revenue argue that a payment under regulation 14 does not fall within the definition of `` wages '' in section 27 of the 1996 Act and so , even if an employer fails to pay such a sum , he does not make a deduction from `` wages '' , contrary to section 13 -LRB- 1 -RRB- of the Act . 	NAN	NAN	NAN	0.2	lord neuberger, lord rodger, lord walker
133	114	So Mr Ainsworth 's only remedy was under regulation 30 of the 1998 Regulations . 	NAN	NAN	NAN	0.2	lord neuberger, lord rodger, lord walker
133	115	The Court of Appeal not only held that Mr Ainsworth was not entitled to any payment under regulation 14 , but also upheld the contention for the Revenue that his only remedy for an alleged breach of regulation 14 was a complaint under regulation 30 : -LSB- 2005 -RSB- ICR 1149 , 1158-1159 , paras 21-24 . 	NAN	NAN	NAN	0.2	lord neuberger, lord rodger, lord walker
133	116	Mr Ainsworth appeals to this House . 	NAN	NAN	NAN	0.2	lord neuberger, lord rodger, lord walker
133	117	21 . 	NAN	NAN	NAN	0.2	lord neuberger, lord rodger, lord walker
133	118	As already explained , the Revenue accept that Mr Ainsworth 's appeal on his entitlement to a payment under regulation 14 must be allowed . 	NAN	NAN	NAN	0.2	lord neuberger, lord rodger, lord walker
133	119	And , actually , he himself gained nothing by presenting his complaint relating to the period from 1 to 4 November 2002 under section 23 of the 1996 Act as well as under regulation 30 of the 1998 Regulations . 	NAN	NAN	NAN	0.2	lord neuberger, lord rodger, lord walker
133	120	Not only was Mr Ainsworth 's application in respect of that complaint lodged in time , but , in addition , it relates to a single deduction , rather than to a series of deductions - so he had no occasion to invoke any extended time-limit under section 23 -LRB- 3 -RRB- for presenting his application . 	NAN	NAN	NAN	0.2	lord neuberger, lord rodger, lord walker
133	121	But the appellant 's counsel , Mr Jeans QC , told the House that the decision of the Court of Appeal - that no complaint about a deduction of holiday pay due under the 1998 Regulations could be brought under section 23 of the 1996 Act - had led to successive applications being made to employment tribunals to avoid the time-limit in regulation 30 , in relation to a series of deductions of payments allegedly due under regulation 16 . 	NAN	NAN	NAN	0.3	lord neuberger, lord rodger, lord walker
133	122	The applicants were incurring unnecessary expense and the tribunal system was being cluttered up with unnecessary applications . 	NAN	NAN	NAN	0.3	lord neuberger, lord rodger, lord walker
133	123	But for the Court of Appeal 's decision , the applicants in question could have relied on the extended time-limit in section 23 -LRB- 3 -RRB- and made one application within three months of the last deduction in the series . 	NAN	NAN	NAN	0.3	lord neuberger, lord rodger, lord walker
133	124	On that narrative I accept that the point is one of practical importance which the House should decide . 	NAN	NAN	NAN	0.3	lord neuberger, lord rodger, lord walker
133	125	22 . 	NAN	NAN	NAN	0.3	lord neuberger, lord rodger, lord walker
133	126	Since the time-limit was said to give rise to the practical issue behind this aspect of the appeal , counsel tended to come back to that aspect in their submissions . 	NAN	NAN	NAN	0.3	lord neuberger, lord rodger, lord walker
133	127	Naturally , Mr Jeans emphasised the inconvenience of the successive applications . 	NAN	NAN	NAN	0.3	lord neuberger, lord rodger, lord walker
133	128	For his part , Mr Cavanagh QC suggested that Parliament might have chosen not to include any sums due under regulation 14 or 16 in the definition of `` wages '' in section 27 of the 1996 Act in order to make sure that all complaints relating to holiday pay were brought promptly . 	NAN	NAN	NAN	0.3	lord neuberger, lord rodger, lord walker
133	129	I consider that it would be unwise , however , to concentrate on the time-limits . 	NAN	NAN	NAN	0.3	lord neuberger, lord rodger, lord walker
133	130	The real issue is much broader : whether a failure to pay sums due under regulations 14 and 16 of the 1998 Regulations is properly regarded as the kind of impermissible deduction from wages that Parliament wanted to prevent by enacting section 13 of the 1996 Act . 	NAN	NAN	NAN	0.3	lord neuberger, lord rodger, lord walker
133	131	If it is , then employees have the benefit of the system provided by the 1996 Act , which includes the extended time-limit in section 23 -LRB- 3 -RRB- . 	NAN	NAN	NAN	0.3	lord neuberger, lord rodger, lord walker
133	132	But if a failure to pay the sums is not properly regarded as this kind of impermissible deduction from wages , then employees have to content themselves with the provisions of the 1998 Regulations - including the shorter time-limit in regulation 30 -LRB- 2 -RRB- . 	NAN	NAN	NAN	0.3	lord neuberger, lord rodger, lord walker
133	133	The time-limits do not dictate the interpretation of the definition of `` wages '' in section 27 ; rather , the correct interpretation of `` wages '' determines which statutory régimes apply and , hence , which time-limits apply . 	NAN	NAN	NAN	0.3	lord neuberger, lord rodger, lord walker
133	134	So the case turns on the interpretation and application of section 27 . 	NAN	NAN	NAN	0.3	lord neuberger, lord rodger, lord walker
133	135	23 . 	NAN	NAN	NAN	0.3	lord neuberger, lord rodger, lord walker
133	136	Before turning to that section , a minor point which surfaced in the judgment of the Court of Appeal can be disposed of quickly . 	NAN	NAN	NAN	0.3	lord neuberger, lord rodger, lord walker
133	137	Section 205 -LRB- 2 -RRB- of the 1996 Act provides that the remedy of a worker in respect of a contravention of section 13 is by way of a complaint under section 23 `` and not otherwise '' . 	NAN	NAN	NAN	0.3	lord neuberger, lord rodger, lord walker
133	138	In something of a throwaway line , Maurice Kay LJ suggested , -LSB- 2005 -RSB- ICR 1149 , 1159 , para 24 , that , if the failure to pay the sum due under regulation 14 could indeed be treated as a violation of section 13 of the 1996 Act , then the effect of section 205 -LRB- 2 -RRB- would be that the only remedy for that failure would be under section 23 . 	NAN	NAN	NAN	0.3	lord neuberger, lord rodger, lord walker
133	139	In other words , thus interpreted , the provision would prevent the worker from raising proceedings under regulation 30 of the 1998 Regulations . 	NAN	NAN	NAN	0.3	lord neuberger, lord rodger, lord walker
133	140	For the Revenue , Mr Cavanagh rightly accepted that the argument was fallacious . 	NAN	NAN	NAN	0.3	lord neuberger, lord rodger, lord walker
133	141	Section 205 -LRB- 2 -RRB- simply prescribes that a complaint of a violation of section 13 -LRB- 1 -RRB- must be made to an employment tribunal under section 23 - and not , for example , by proceedings in the ordinary civil courts . 	NAN	NAN	NAN	0.3	lord neuberger, lord rodger, lord walker
133	142	But if the aggrieved employee wishes to present his complaint simply as a failure by his employer to pay a sum due under regulation 14 , nothing in section 205 -LRB- 2 -RRB- prevents him from making that complaint under regulation 30 . 	NAN	NAN	NAN	0.3	lord neuberger, lord rodger, lord walker
133	143	Section 205 -LRB- 2 -RRB- is accordingly irrelevant for present purposes . 	NAN	NAN	NAN	0.3	lord neuberger, lord rodger, lord walker
133	144	24 . 	NAN	NAN	NAN	0.3	lord neuberger, lord rodger, lord walker
133	145	Section 27 came before this House in Delaney v Staples -LSB- 1992 -RSB- 1 AC 687 where it was held that payments in lieu of notice , being payments relating to the termination of employment rather than to the provision of services by the employee , were not `` wages '' within the meaning of what is now section 27 . 	NAN	NAN	NAN	0.3	lord neuberger, lord rodger, lord walker
133	146	Lord Browne-Wilkinson , who gave the only substantive speech , said , at p 692A-C , that it was important to approach the definition of `` wages '' in the section : `` bearing in mind the normal meaning of that word . 	NAN	NAN	NAN	0.3	lord neuberger, lord rodger, lord walker
133	147	I agree with the Court of Appeal that the essential characteristic of wages is that they are consideration for work done or to be done under a contract of employment . 	NAN	NAN	NAN	0.3	lord neuberger, lord rodger, lord walker
133	148	If a payment is not referable to an obligation on the employee under a subsisting contract of employment to render his services it does not in my judgment fall within the ordinary meaning of the word ` wages ' . 	NAN	NAN	NAN	0.3	lord neuberger, lord rodger, lord walker
133	149	It follows that if an employer terminates the employment -LRB- whether lawfully or not -RRB- any payment of wages in respect of the period after the date of such termination is not a payment of wages -LRB- in the ordinary meaning of that word -RRB- since the employee is not under obligation to render services during that period . '' 	NAN	NAN	NAN	0.3	lord neuberger, lord rodger, lord walker
133	150	Applying that approach , it seems to me that payment in respect of annual leave , as envisaged by regulation 16 , is plainly part of the consideration which the employee receives in return for the work done , or to be done , under his contract of employment . 	NAN	NAN	NAN	0.3	lord neuberger, lord rodger, lord walker
133	151	So , leaving aside the express inclusions and exclusions , payment in respect of statutory annual leave falls to be regarded as coming within the normal meaning of the word `` wages '' in section 27 . 	NAN	NAN	NAN	0.3	lord neuberger, lord rodger, lord walker
133	152	25 . 	NAN	NAN	NAN	0.3	lord neuberger, lord rodger, lord walker
133	153	The payment which is due under regulation 14 is , at first sight at least , slightly different . 	NAN	NAN	NAN	0.3	lord neuberger, lord rodger, lord walker
133	154	The payment is described as a `` payment in lieu of leave '' and therefore has something of the flavour of compensation for leave not taken - the compensation taking the form of a liquidated sum calculated according to the formula in regulation 14 -LRB- 3 -RRB- . 	NAN	NAN	NAN	0.3	lord neuberger, lord rodger, lord walker
133	155	But , as the passage from the judgment of the European Court in these proceedings , quoted at para 12 above , suggests , the purpose of the payment is , in effect , to make sure that the worker whose employment is terminated and who can not take the period of leave in question , at least receives the pay which he is due in respect of that leave . 	NAN	NAN	NAN	0.3	lord neuberger, lord rodger, lord walker
133	156	True enough , the right to the payment accrues only when the worker 's employment has been terminated and , in Delaney v Staples -LSB- 1992 -RSB- 1 AC 687 , 697E-F , Lord Browne-Wilkinson said that the basic concept of wages excludes `` all payments in respect of the termination of the contract save to the extent that such latter payments are expressly included in the definition in section 7 -LRB- 1 -RRB- -LSB- of the Wages Act 1986 -RSB- '' . 	NAN	NAN	NAN	0.3	lord neuberger, lord rodger, lord walker
133	157	But he was there contrasting payments in respect of termination of the employment -LRB- such as payments in lieu of notice -RRB- with `` payments in respect of the rendering of services during the employment '' . 	NAN	NAN	NAN	0.3	lord neuberger, lord rodger, lord walker
133	158	As the method of calculation adopted in regulation 14 -LRB- 3 -RRB- makes plain , the payment in lieu of leave is one which the worker has earned by working for the relevant proportion of the leave year . 	NAN	NAN	NAN	0.3	lord neuberger, lord rodger, lord walker
133	159	So , even though he receives it only when his employment has been terminated , just like any other final payment of wages , it is part of the consideration for the services which he has previously performed under his contract of employment . 	NAN	NAN	NAN	0.3	lord neuberger, lord rodger, lord walker
133	160	The payment therefore falls within the normal meaning of the word `` wages '' and the interpretation of section 27 must be approached on that basis . 	NAN	NAN	NAN	0.3	lord neuberger, lord rodger, lord walker
133	161	26 . 	NAN	NAN	NAN	0.3	lord neuberger, lord rodger, lord walker
133	162	Although counsel concentrated on section 27 -LRB- 1 -RRB- , the definition of `` wages '' extends over subsections -LRB- 1 -RRB- and -LRB- 2 -RRB- - with further clarification being given in subsection -LRB- 3 -RRB- . 	NAN	NAN	NAN	0.3	lord neuberger, lord rodger, lord walker
133	163	Presumably to avoid subsection -LRB- 1 -RRB- becoming overloaded , the draftsman has split the definition into two subsections . 	NAN	NAN	NAN	0.3	lord neuberger, lord rodger, lord walker
133	164	But both the express inclusions in subsection -LRB- 1 -RRB- and the express exclusions in subsection -LRB- 2 -RRB- have to be considered . 	NAN	NAN	NAN	0.3	lord neuberger, lord rodger, lord walker
133	165	Given that the definition contains both , in Delaney v Staples -LSB- 1992 -RSB- 1 AC 687 , 695B , Lord Browne-Wilkinson held that `` there is no room for an argument that by expressly excluding certain items the draftsman was indicating that such items would otherwise be payments ` in connection with ' the employment . '' 	NAN	NAN	NAN	0.3	lord neuberger, lord rodger, lord walker
133	166	Reversing the point , given the specific exclusions as well as inclusions , I am not disposed to attach any considerable weight to the Revenue 's argument that the inclusion of payments under certain specific statutory provisions implies that payments under the 1998 Regulations , which are not listed , are excluded from the scope of `` wages '' . 	NAN	NAN	NAN	0.3	lord neuberger, lord rodger, lord walker
133	167	If they were intended to be excluded , why were they not added to subsection -LRB- 2 -RRB- by an appropriate amendment ? 	NAN	NAN	NAN	0.3	lord neuberger, lord rodger, lord walker
133	168	With this caveat , I turn to look more closely at subsection -LRB- 1 -RRB- . 	NAN	NAN	NAN	0.3	lord neuberger, lord rodger, lord walker
133	169	27 . 	NAN	NAN	NAN	0.4	lord neuberger, lord rodger, lord walker
133	170	Counsel for Mr Ainsworth argued that sections 88 and 89 contained examples of payments under a statutory provision which would fall within the scope of the term `` wages '' in section 27 , even though they were not expressly included in subsection -LRB- 1 -RRB- . 	NAN	NAN	NAN	0.4	lord neuberger, lord rodger, lord walker
133	171	But the payments under those sections are payments which an employee is entitled to receive during the period of notice of termination of his employment , provided only that he is ready and willing to work -LRB- section 88 -LRB- 1 -RRB- -LRB- a -RRB- and section 89 -LRB- 2 -RRB- -RRB- or is unable to work for some legitimate reason -LRB- section 88 -LRB- 1 -RRB- -LRB- b -RRB- - -LRB- c -RRB- and section 89 -LRB- 3 -RRB- -RRB- . 	NAN	NAN	NAN	0.4	lord neuberger, lord rodger, lord walker
133	172	In other words , they are not actually payments in consideration of services which the employee performs under his contract of employment . 	NAN	NAN	NAN	0.4	lord neuberger, lord rodger, lord walker
133	173	Following the reasoning of the House in Delaney v Staples -LSB- 1992 -RSB- 1 AC 687 , 697E-F , they may therefore more properly fall to be regarded as payments in connection with the termination of employment and so as not amounting to `` wages '' . 	NAN	NAN	NAN	0.4	lord neuberger, lord rodger, lord walker
133	174	It is unnecessary to decide the point ; it is enough to say that the draftsman of section 27 -LRB- 1 -RRB- may have taken that view . 	NAN	NAN	NAN	0.4	lord neuberger, lord rodger, lord walker
133	175	It would accordingly be rash to affirm positively either that payments under section 88 and 89 are impliedly included in an employee 's wages for the purpose of section 27 or that the omission of any reference to these sections must have been due to an oversight on the part of the draftsman . 	NAN	NAN	NAN	0.4	lord neuberger, lord rodger, lord walker
133	176	Indeed since , as I go on to explain , the draftsman of the 1996 Act was alive to the need to make appropriate cross-references , an oversight on his part is not , perhaps , a plausible explanation . 	NAN	NAN	NAN	0.4	lord neuberger, lord rodger, lord walker
133	177	28 . 	NAN	NAN	NAN	0.4	lord neuberger, lord rodger, lord walker
133	178	The House is , of course , concerned with a possible failure to amend section 27 -LRB- 1 -RRB- when the 1998 Regulations were drafted . 	NAN	NAN	NAN	0.4	lord neuberger, lord rodger, lord walker
133	179	If Homer nodded , doubtless Solon did too . 	NAN	NAN	NAN	0.4	lord neuberger, lord rodger, lord walker
133	180	So there is always the possibility of a simple error . 	NAN	NAN	NAN	0.4	lord neuberger, lord rodger, lord walker
133	181	And , in fact , there happens to be positive evidence of a slip by Parliamentary counsel in updating the predecessor of section 27 -LRB- 1 -RRB- , section 7 -LRB- 1 -RRB- of the Wages Act 1986 . 	NAN	NAN	NAN	0.4	lord neuberger, lord rodger, lord walker
133	182	The 1996 Act began life as a consolidation Bill in the 1994-1995 Session . 	NAN	NAN	NAN	0.4	lord neuberger, lord rodger, lord walker
133	183	At that stage it was considered by the Joint Select Committee on Consolidation Bills under the chairmanship of Lord Lloyd of Berwick . 	NAN	NAN	NAN	0.4	lord neuberger, lord rodger, lord walker
133	184	The draftsman of the consolidation Bill explained to the committee that , when para 10 of Schedule 5 to the Trade Union Reform and Employment Rights Act 1993 added a new section 78 to the Employment Protection -LRB- Consolidation -RRB- Act 1978 , a reference to that section should have been , but was not , included in section 7 -LRB- 1 -RRB- of the 1986 Act . 	NAN	NAN	NAN	0.4	lord neuberger, lord rodger, lord walker
133	185	Clause 27 -LRB- 1 -RRB- -LRB- h -RRB- of the consolidation Bill had been drafted to correct that oversight by including a reference to section 130 , which was to re-enact section 78 of the 1978 Act . 	NAN	NAN	NAN	0.4	lord neuberger, lord rodger, lord walker
133	186	The committee accepted this explanation and section 27 -LRB- 1 -RRB- -LRB- h -RRB- was accordingly enacted in that form . 	NAN	NAN	NAN	0.4	lord neuberger, lord rodger, lord walker
133	187	See the minutes of evidence attached to the Fourth Report of the Joint Select Committee , dated 7 June 1995 . 	NAN	NAN	NAN	0.4	lord neuberger, lord rodger, lord walker
133	188	If such a mistake was made by Parliamentary counsel in the past , it is at least possible that the officials in the Department of Trade and Industry who were responsible for the 1998 Regulations failed to consider whether section 27 -LRB- 1 -RRB- should be amended to include a reference to the regulations on payments in respect of annual leave . 	NAN	NAN	NAN	0.4	lord neuberger, lord rodger, lord walker
133	189	29 . 	NAN	NAN	NAN	0.4	lord neuberger, lord rodger, lord walker
133	190	In the end , however , the dispute on interpretation must be resolved by reference to the words of section 27 -LRB- 1 -RRB- as enacted . 	NAN	NAN	NAN	0.4	lord neuberger, lord rodger, lord walker
133	191	I have already indicated my view that a payment under regulation 14 falls within the normal meaning of `` wages '' . 	NAN	NAN	NAN	0.4	lord neuberger, lord rodger, lord walker
133	192	More particularly , it is a sum payable to a worker in connection with his employment . 	NAN	NAN	NAN	0.4	lord neuberger, lord rodger, lord walker
133	193	So it comes squarely within the opening words of section 27 -LRB- 1 -RRB- . 	NAN	NAN	NAN	0.4	lord neuberger, lord rodger, lord walker
133	194	And , as Mr Jeans observed , there is nothing to take it out of the scope of those words . 	NAN	NAN	NAN	0.4	lord neuberger, lord rodger, lord walker
133	195	If one continues into paragraph -LRB- a -RRB- , even if the right to the payment under regulation 14 was created as part of a scheme for improving the health and safety of employees , the payment itself must surely be classified as `` holiday pay '' . 	NAN	NAN	NAN	0.4	lord neuberger, lord rodger, lord walker
133	196	Regulation 17 treats annual leave under the 1998 Regulations as being equivalent to annual leave under a contract of employment . 	NAN	NAN	NAN	0.4	lord neuberger, lord rodger, lord walker
133	197	This must include the entitlement under regulation 16 to pay during the period of leave . 	NAN	NAN	NAN	0.4	lord neuberger, lord rodger, lord walker
133	198	Indeed I understood Mr Cavanagh eventually to acknowledge that it was not possible to draw any plausible distinction between `` holiday pay '' under a contract and the kind of payment envisaged by regulation 14 . 	NAN	NAN	NAN	0.4	lord neuberger, lord rodger, lord walker
133	199	In any event , the payment under regulation 14 would count as an `` emolument '' . 	NAN	NAN	NAN	0.4	lord neuberger, lord rodger, lord walker
133	200	30 . 	NAN	NAN	NAN	0.4	lord neuberger, lord rodger, lord walker
133	201	Mr Cavanagh conceded that , if the concluding words of para -LRB- a -RRB- had been `` whether payable under his contract or under statute `` , then the regulation 14 payment would have been covered , even though the Regulations had been passed after the 1996 Act . 	NAN	NAN	NAN	0.4	lord neuberger, lord rodger, lord walker
133	202	So the eventual issue was whether the words `` whether payable under his contract or otherwise '' were capable of referring to a payment under a regulation passed after the 1996 Act . 	NAN	NAN	NAN	0.4	lord neuberger, lord rodger, lord walker
133	203	31 . 	NAN	NAN	NAN	0.4	lord neuberger, lord rodger, lord walker
133	204	In my view , the words `` or otherwise '' are broad and are apt to cover holiday pay which is payable , whatever the source of the employer 's legal obligation to make the payment . 	NAN	NAN	NAN	0.4	lord neuberger, lord rodger, lord walker
133	205	Plainly , the reference to holiday pay that is payable under the employee 's contract is not confined to pay that was payable under contracts which existed at the time when the 1996 Act was passed . 	NAN	NAN	NAN	0.4	lord neuberger, lord rodger, lord walker
133	206	I can therefore see no reason why the immediately following words `` or otherwise '' should be confined to other sources of obligation , whether statutes or statutory instruments -LRB- or indeed something else entirely -RRB- , which existed when the Act was passed . 	NAN	NAN	NAN	0.4	lord neuberger, lord rodger, lord walker
133	207	In my view , the words are ambulatory and so are apt to cover holiday pay that is payable under regulation 14 of the 1998 Regulations . 	NAN	NAN	NAN	0.4	lord neuberger, lord rodger, lord walker
133	208	I accordingly conclude that a failure to pay a sum due under regulation 14 is the kind of impermissible deduction from wages that Parliament wanted to prevent by enacting section 13 of the 1996 Act . 	NAN	NAN	NAN	0.4	lord neuberger, lord rodger, lord walker
133	209	32 . 	NAN	NAN	NAN	0.4	lord neuberger, lord rodger, lord walker
133	210	In these circumstances I do not find it necessary to have regard to the principle of equivalence , but I respectfully agree with what Lord Walker and my noble and learned friend , Lord Neuberger , say about it . 	lord rodger	lord walker	NAN	0.4	lord neuberger, lord rodger, lord walker
133	210	In these circumstances I do not find it necessary to have regard to the principle of equivalence , but I respectfully agree with what Lord Walker and my noble and learned friend , Lord Neuberger , say about it . 	lord rodger	lord neuberger	NAN	0.4	lord neuberger, lord rodger, lord walker
133	211	33 . 	NAN	NAN	NAN	0.4	lord neuberger, lord rodger, lord walker
