242	118	There was a second point raised before the Divisional Court . 	NAN	NAN	NAN	0.5	lord hutton
242	119	It was described as follows by Blofeld J. : `` There is a second point in this appeal , which Mr. McGuire recognises has now been overtaken by the decision in this court in Fraser v . 	NAN	NAN	NAN	0.5	lord hutton
242	120	The Director of Public Prosecutions -LRB- unreported -RRB- , 29 January 1997 . 	NAN	NAN	NAN	0.5	lord hutton
242	121	Prior to that decision an argument could have been mounted that it was required for the police officer before asking the appellant to give any reply to his lengthy question also to make clear to him that he could refuse to give a sample of blood for medical reasons . 	NAN	NAN	NAN	0.5	lord hutton
242	122	As it happens , that situation never in fact arose here . 	NAN	NAN	NAN	0.5	lord hutton
242	123	The police officer concerned came to the conclusion that the reply was an unequivocal refusal . 	NAN	NAN	NAN	0.5	lord hutton
242	124	That decision was upheld by the judge and his colleagues . 	NAN	NAN	NAN	0.5	lord hutton
242	125	Consequently there was no need to ask any further questions . '' 	NAN	NAN	NAN	0.5	lord hutton
242	126	In the lengthy question which the police officer put to the defendant he did say : `` I should tell you that your only right to object to giving blood and to give urine instead will be for medical reasons to be determined by a medical practitioner . '' 	NAN	NAN	NAN	0.5	lord hutton
242	127	Therefore when Blofeld J. said that prior to the decision in Fraser v. Director of Public Prosecutions -LSB- 1997 -RSB- R.T.R. 373 an argument could have been mounted `` that it was required for the police officer to make clear to him that he could refuse to give a sample of blood for medical reasons , '' I think this argument would have been that the police officer must by an express question ask the driver whether there are any medical reasons for refusing to give a specimen of blood , and I think this is confirmed by the wording of the point of law certified by the Divisional Court which was as follows : `` When a motorist who is entitled to make a claim under s. 8 -LRB- 2 -RRB- of the Road Traffic Act 1988 declines to do so , is it incumbent on a police officer to ensure that the motorist has understood his rights by asking whether there are any medical reasons for his refusal to supply an alternative specimen ? '' 	NAN	NAN	NAN	0.5	lord hutton
242	128	The judgment in Warren 's case Before giving further consideration to the judgments of the Divisional Court in Jackson and Stanley it will be convenient to turn to the speech of Lord Bridge in Warren 's case -LSB- 1993 -RSB- A.C. 319 , with which the other members of the House agreed , because much of the argument addressed to your Lordships in the present appeals related to the effect of that speech . 	NAN	NAN	NAN	0.5	lord hutton
242	129	The issue which came before the House on that appeal was whether , when a driver was requested under section 7 -LRB- 3 -RRB- of the Act to provide a specimen of blood or urine , the police officer was required to ask him whether he had a preference for giving blood or urine . 	NAN	NAN	NAN	0.5	lord hutton
242	130	The House held that the Act imposed no such requirement and this was the ratio of the decision . 	NAN	NAN	NAN	0.5	lord hutton
242	131	But in his speech in order to give guidance as to the appropriate procedures to be followed by a police officer in a section 7 -LRB- 3 -RRB- case and a section 8 -LRB- 2 -RRB- case Lord Bridge stated certain requirements as to what a police officer should tell or ask the driver . 	NAN	NAN	NAN	0.5	lord hutton
242	132	Those requirements are set out in the following passages of the speech . 	NAN	NAN	NAN	0.5	lord hutton
242	133	He stated , at pp. 327-328 : `` Taking the second case first , it is clear that under section 8 -LRB- 2 -RRB- the driver , in order that he may decide whether or not to claim that the breath specimen be replaced , should be fully informed of the nature of the option open to him and what will be involved if he exercises it . 	NAN	NAN	NAN	0.5	lord hutton
242	134	He should be told that the specimen of breath which he has given containing the lower proportion of alcohol exceeds the statutory limit but does not exceed 50 microgrammes of alcohol in 100 millilitres of breath ; that in these circumstances he is entitled to claim to have this specimen replaced by a specimen of blood or urine if he wishes ; but that , if he does so , it will be for the constable to decide whether the replacement specimen is to be of blood or urine and that if the constable requires a specimen of blood it will be taken by a doctor unless the doctor considers that there are medical reasons for not taking blood , when urine may be given instead . 	NAN	NAN	NAN	0.5	lord hutton
242	135	I can see no ground whatever , on the face of the statute , why in a section 8 -LRB- 2 -RRB- case the driver should be invited to state whether he prefers to give blood or urine or to state any reasons for his preference . 	NAN	NAN	NAN	0.5	lord hutton
242	136	Indeed , to invite him to do so , it seems to me , can only be misleading in suggesting that the driver is entitled to some say in the matter . 	NAN	NAN	NAN	0.5	lord hutton
242	137	The statute gives him no such say . 	NAN	NAN	NAN	0.5	lord hutton
242	138	The driver is faced with the prospect of conviction on the basis of the breath specimen which he has given containing the lower proportion of alcohol . 	NAN	NAN	NAN	0.5	lord hutton
242	139	His only chance of escape from that prospect is by opting to give and then in fact giving a replacement specimen of whichever kind the constable requires of him , subject only to his right to object to giving blood on medical grounds , and , if they are accepted by the doctor , then to give urine instead . 	NAN	NAN	NAN	0.5	lord hutton
242	140	Again , so far as the language of the statute is concerned , I can see no reason in principle why the constable in the course of explaining to the driver his rights under section 8 -LRB- 2 -RRB- should not tell him , if it be the case , that he , the constable , will require the replacement specimen to be of blood . 	NAN	NAN	NAN	0.5	lord hutton
242	141	`` In a case where the reason for requiring a specimen of blood or urine arises under section 7 -LRB- 3 -RRB- , there is no question of the driver having any option to exercise . 	NAN	NAN	NAN	0.5	lord hutton
242	142	Hence , whatever necessity there may be to explain the position to him , the reasons why it is necessary to give such an explanation can not be the same as those which arise under section 8 -LRB- 2 -RRB- . 	NAN	NAN	NAN	0.5	lord hutton
242	143	Again , on the face of the statute , I can not see any reason why in this case the constable should do more than tell the driver the reason under section 7 -LRB- 3 -RRB- why breath specimens can not be taken or used ; tell him that in these circumstances he is required to give a specimen of blood or urine but that it is for the constable to decide which ; warn him that a failure to provide the specimen required may render him liable to prosecution ; and then , if the constable decides to require blood , ask the driver if there are any reasons why a specimen can not or should not be taken from him by a doctor . 	NAN	NAN	NAN	0.5	lord hutton
242	144	This will certainly give the driver the opportunity to raise any objection he may have to giving blood , either on medical grounds or indeed for any other reason which might afford a ` reasonable excuse ' under section 7 -LRB- 6 -RRB- . 	NAN	NAN	NAN	0.6	lord hutton
242	145	Here again , provided the driver has such an opportunity , I can see nothing in the language of the statute which would justify a procedural requirement that the driver be invited to express his own preference for giving blood or urine , either before a constable indicates which specimen he will require or at all . '' 	NAN	NAN	NAN	0.6	lord hutton
242	146	And he stated , at p. 332 : `` At the end of this necessarily lengthy examination of the decided cases I have found nothing which causes me to depart from the view I expressed before embarking on that examination as to the appropriate procedure to be followed under section 7 -LRB- 3 -RRB- and section 8 -LRB- 2 -RRB- considered simply on the basis of the statutory language . 	NAN	NAN	NAN	0.6	lord hutton
242	147	Restating those views in summary form , in a case where the necessity to require a specimen of blood or urine under section 7 -LRB- 4 -RRB- arises for one of the reasons specified in section 7 -LRB- 3 -RRB- , what is required is no more and no less than the formula used in the instant case or words to the like effect . 	NAN	NAN	NAN	0.6	lord hutton
242	148	In a case where the driver 's option is to be explained to him under section 8 -LRB- 2 -RRB- , the driver should be told that if he exercises the right to have a replacement specimen taken under section 7 -LRB- 4 -RRB- , it will be for the constable to decide whether that specimen is to be of blood or urine and , if the constable intends to require a specimen of blood to be taken by a medical practitioner , the driver should be told that his only right to object to giving blood and to give urine instead will be for medical reasons to be determined by the medical practitioner . 	NAN	NAN	NAN	0.6	lord hutton
242	149	In neither case is there any need to invite the driver to express his preference for giving blood or urine . '' 	NAN	NAN	NAN	0.6	lord hutton
242	150	As Lord Bingham of Cornhill C.J. observed in Fraser v. Director of Public Prosecutions -LSB- 1997 -RSB- R.T.R. 373 , 380F it had been hoped that the judgment in Warren 's case would settle the law on the vexed topic of the procedures to be followed by the police , but unfortunately this has not been achieved and there has been a continuing stream of cases coming before the Divisional Court . 	NAN	NAN	NAN	0.6	lord hutton
242	151	In these circumstances I understand your Lordships to be agreed that this House should give further thought to the judgment in Warren 's case to consider whether additional guidance could be given to assist the courts which have to apply section 7 -LRB- 3 -RRB- and section 8 -LRB- 2 -RRB- . 	lord hutton	all	partagr	0.6	lord hutton
242	152	The principal difficulty which has arisen following the judgment in Warren 's case is that different approaches have been taken in two lines of cases to the question whether the requirements stated by Lord Bridge are mandatory , so that a failure to observe a requirement must lead to an acquittal , or whether a breach of a requirement is not necessarily a bar to a conviction . 	NAN	NAN	NAN	0.6	lord hutton
242	153	The approach in one line of cases is exemplified by the statement of Leggatt L.J. in Reg . 	NAN	NAN	NAN	0.6	lord hutton
242	154	v. Cheshire Justices , Ex parte Cunningham -LSB- 1995 -RSB- R.T.R. 287 , 291 when referring to the decision in Warren 's case he said : `` Since that decision of the House of Lords there have been other cases in this court , in particular Edge v. Director of Public Prosecutions -LSB- 1993 -RSB- R.T.R. 146 , Meade v. Director of Public Prosecutions -LSB- 1993 -RSB- R.T.R. 151 , and the more recent case of Ogburn v. Director of Public Prosecutions -LSB- 1994 -RSB- R.T.R. 241 . 	NAN	NAN	NAN	0.6	lord hutton
242	155	Those subsequent cases have refuted attempts by the prosecution to blur the requirements enunciated by Lord Bridge , and to insist that the requirements which he stipulated were to be strictly complied with . 	NAN	NAN	NAN	0.6	lord hutton
242	156	There has been a suggestion made in one of the subsequent cases that the relevant parts of his speech were not to be read as though they were part of a statute . 	NAN	NAN	NAN	0.6	lord hutton
242	157	That is , of course , exactly what they were , or at all events they represented such rendition of the statute as the House of Lords thought appropriate . 	NAN	NAN	NAN	0.6	lord hutton
242	158	Accordingly , those requirements are to be strictly complied with . '' 	NAN	NAN	NAN	0.6	lord hutton
242	159	The approach in the other line of cases is exemplified by the statement of Waller J. in Hayes v. Director of Public Prosecutions -LSB- 1994 -RSB- R.T.R. 163 , 172 : `` It is important to appreciate that what Lord Bridge was saying in the passages quoted above was not by reference to the sort of facts that one has in the present case . 	NAN	NAN	NAN	0.6	lord hutton
242	160	Furthermore , they are not the words of a statute to be analysed as such . '' 	NAN	NAN	NAN	0.6	lord hutton
242	161	The same approach was taken by Curtis J. in Baldwin v. Director of Public Prosecutions -LSB- 1996 -RSB- R.T.R. 238 , 246 : `` I would observe that the words of Lord Bridge in Director of Public Prosecutions v. Warren -LSB- 1993 -RSB- R.T.R. 58 are not a statute . 	NAN	NAN	NAN	0.6	lord hutton
242	162	As I have endeavoured to set out , they are words to guide the lower courts in the interpretation of the statute and how this branch of the law should be approached . 	NAN	NAN	NAN	0.6	lord hutton
242	163	In my judgment , so long as the option given by the statute is explained fairly and properly so that the driver can make an informed decision , the requirements of justice and the efficacy of the driver 's option given by the statute under section 8 -LRB- 2 -RRB- are ensured . 	NAN	NAN	NAN	0.6	lord hutton
242	164	Of course , it is right , as Turner v. Director of Public Prosecutions -LRB- Note-1994 -RRB- -LSB- 1996 -RSB- R.T.R. 274 , 278L-279A requires , that the explanation of the matters that the driver has to be told in order to exercise his proper right should be detailed . 	NAN	NAN	NAN	0.6	lord hutton
242	165	However , on the facts of this case , in my judgment , this particular defendant did make an informed decision and was given all the necessary explanations and information that he would need to make a proper and informed decision . '' 	NAN	NAN	NAN	0.6	lord hutton
242	166	In considering the issue raised by these two lines of cases it is necessary to have regard to the respective functions of the police officer and the doctor set out in the sections . 	NAN	NAN	NAN	0.6	lord hutton
242	167	Section 7 -LRB- 4 -RRB- provides that if a specimen other than a specimen of breath may be required under that section it is for the police officer to decide whether the specimen will be blood or urine . 	NAN	NAN	NAN	0.6	lord hutton
242	168	But section 11 -LRB- 4 -RRB- provides that the specimen of blood is to be taken by a doctor . 	NAN	NAN	NAN	0.6	lord hutton
242	169	In addition the right of the police officer to choose whether the specimen will be of blood or urine is subject to the qualification that if a medical reason is raised why a specimen of blood can not or should not be taken , the issue is to be decided by a doctor and not by the police officer . 	NAN	NAN	NAN	0.6	lord hutton
242	170	In Johnson v. West Yorkshire Metropolitan Police -LSB- 1986 -RSB- R.T.R. 167 Mustill L.J. , stated at p. 175 -LRB- I have substituted the numbers of the similar sections in the Act of 1988 for the numbers of the sections in the Road Traffic Act 1972 , as modified by section 25 of , and Schedule 8 to , the Transport Act 1981 , which Mustill L.J. was considering -RRB- : `` The taking of a sample is a much more serious infringement of the subject 's ordinary liberties than causing him to blow into a machine , and medical questions of real significance and difficulty may arise . 	NAN	NAN	NAN	0.7	lord hutton
242	171	Accordingly section -LSB- 7 -LRB- 4 -RRB- -RSB- introduced the medical practitioner as the arbiter . 	NAN	NAN	NAN	0.7	lord hutton
242	172	It makes no reference to the police officer . 	NAN	NAN	NAN	0.7	lord hutton
242	173	The implication is to my mind clear that in deciding the medical issue the constable has no role to play . 	NAN	NAN	NAN	0.7	lord hutton
242	174	This does not however lead to an interpretation at the opposite extreme , which would require the officer to act as no more than a messenger , obliged to turn out the medical practitioner whenever the suspect contrived to utter a form of words suggesting a claim for medical immunity . 	NAN	NAN	NAN	0.7	lord hutton
242	175	The police officer can not have the power to rule upon a medical issue , but he must have the power to form a view on whether such an issue has been raised at all , for otherwise the medical practitioner would be troubled by excuses which have nothing to do with the expertise which is the reason for his being given a part to play under section -LSB- 7 -LRB- 4 -RRB- -RSB- . '' 	NAN	NAN	NAN	0.7	lord hutton
242	176	Moreover an offence under section 7 -LRB- 6 -RRB- for failure to provide a specimen of blood or urine or an offence under section 5 -LRB- 1 -RRB- , proved by a specimen of breath where the driver has not claimed under section 8 -LRB- 2 -RRB- to replace it with a specimen of blood or urine , is an unusual offence in that in the police station prior to the charge being made the driver has a choice to make . 	NAN	NAN	NAN	0.7	lord hutton
242	177	Where a driver is charged under section 7 -LRB- 6 -RRB- for failing to provide a specimen of blood , he will have been faced with the choice whether he will give a specimen of blood or risk a prosecution , and this choice arises in the context that if he has a medical reason for not giving a specimen of blood the validity of the reason is to be decided by a doctor and not by the police officer . 	NAN	NAN	NAN	0.7	lord hutton
242	178	Mustill L.J. referred to this choice in Johnson 's case at p. 174 : `` Equally , where the question of an alternative specimen arises under section -LSB- 7 -LRB- 3 -RRB- -RSB- rather than -LSB- 8 -LRB- 2 -RRB- -RSB- , one would need to find specific language to produce the result that the constable , by means of a final ruling on a medical objection , could put the suspect to the choice of allowing a specimen of blood or risking prosecution under section -LSB- 7 -LRB- 6 -RRB- -RSB- without access to a practitioner . '' 	NAN	NAN	NAN	0.7	lord hutton
242	179	And under section 8 -LRB- 2 -RRB- the driver is faced with the choice whether he will claim that the specimen of breath should be replaced by such specimen as may be required under section 7 -LRB- 4 -RRB- . 	NAN	NAN	NAN	0.7	lord hutton
242	180	It is because the driver has these choices , and because a doctor has a role to play both in taking a specimen of blood and in deciding the validity of a reason advanced by the driver as to why a specimen of blood can not or should not be taken , that Lord Bridge in Warren 's case -LSB- 1993 -RSB- A.C. 319 , immediately before stating what the driver should be told , said , at p. 327 : `` it is clear that under section 8 -LRB- 2 -RRB- the driver , in order that he may decide whether or not to claim that the breath specimen be replaced , should be fully informed of the nature of the option open to him and what will be involved if he exercises it . '' 	NAN	NAN	NAN	0.7	lord hutton
242	181	It has been observed in a number of subsequent cases that the requirements stated by Lord Bridge in respect of section 7 -LRB- 3 -RRB- and -LRB- 4 -RRB- and section 8 -LRB- 2 -RRB- are not contained in the express words of the Act ; the only express requirement set out in the sections is the requirement in section 7 -LRB- 7 -RRB- that a police officer must warn a driver that a failure to provide a specimen may render him liable to prosecution . 	NAN	NAN	NAN	0.7	lord hutton
242	182	In Joiner v. Director of Public Prosecutions -LSB- 1997 -RSB- R.T.R. 387 Holland J. described the submission advanced on behalf of the defendant as follows , at p. 390 : `` Mr. Ley draws our attention to that last exchange between the police officer and the defendant . 	NAN	NAN	NAN	0.7	lord hutton
242	183	He submits that that exchange was defective because it did not include words from the officer to the defendant : ` You can only object to giving blood on medical grounds . ' 	NAN	NAN	NAN	0.7	lord hutton
242	184	That submission is not based at all upon the Road Traffic Act 1988 which does not make any such warning mandatory . 	NAN	NAN	NAN	0.7	lord hutton
242	185	What it is founded upon is the speech of Lord Bridge of Harwich in Director of Public Prosecutions v. Warren -LSB- 1993 -RSB- R.T.R. 58 . '' 	NAN	NAN	NAN	0.7	lord hutton
242	186	And he stated , at p. 393 : `` Turning back to the submission that has been made to us by Mr. Ley in this matter , the procedure adopted by the police officer could only , in my judgment , be faulted by reference to a specific statutory provision . 	NAN	NAN	NAN	0.7	lord hutton
242	187	Mr. Ley himself accepts that there are no merits at all to support the submission that he is making in this case . 	NAN	NAN	NAN	0.7	lord hutton
242	188	He simply invokes what he submits the law to be . 	NAN	NAN	NAN	0.7	lord hutton
242	189	In my happy judgment , the law is not as he submits it to be . 	NAN	NAN	NAN	0.7	lord hutton
242	190	It is as cited in Baldwin v. Director of Public Prosecutions -LSB- 1996 -RSB- R.T.R. 238 . 	NAN	NAN	NAN	0.7	lord hutton
242	191	For that reason I would dismiss this appeal , not only on the first ground , but on the second ground . '' 	NAN	NAN	NAN	0.7	lord hutton
242	192	I think it is clear that it was considerations of fairness to the driver , to which he referred in the words at p. 327D set out above , which led Lord Bridge to hold that the requirements which he stated were implicit in the Act . 	NAN	NAN	NAN	0.7	lord hutton
242	193	It is also apparent that Lord Bridge considered that in the application in practice of the provisions contained in sections 7 and 8 both the legitimate interests of drivers and the efficient working of the procedures by the police would be assisted by the statement of specific requirements to be observed by the police . 	NAN	NAN	NAN	0.7	lord hutton
242	194	However subsequent cases have shown that in this area of the law there are a number of disadvantages if formulae stated by an appellate court for use by the police , which are based on the need for fairness to the driver but which are not required by the express words of the Act , are regarded as mandatory requirements . 	NAN	NAN	NAN	0.7	lord hutton
242	195	One disadvantage is that the facts of individual cases and the exchanges between a driver and a police officer in the police station within the confines of the procedures laid down by sections 7 and 8 of the Act of 1988 can vary considerably , so that one prescribed form of words may not be appropriate in every case . 	NAN	NAN	NAN	0.7	lord hutton
242	196	Another disadvantage is that in some cases there is no unfairness and no resultant injustice if a driver is convicted notwithstanding that one of the Warren requirements has not been observed . 	NAN	NAN	NAN	0.8	lord hutton
242	197	Robinson -LRB- Dena -RRB- v. Director of Public Prosecutions -LRB- Note -RRB- -LSB- 1997 -RSB- R.T.R. 403 was such a case ; there the breath specimen was in excess of the prescribed limit but did not exceed 50 microgrammes of alcohol in 100 millilitres of breath and the defendant declined to exercise the option given by section 8 -LRB- 2 -RRB- and was convicted by the justices , and the conviction was upheld by the crown court . 	NAN	NAN	NAN	0.8	lord hutton
242	198	On appeal by case stated the defendant contended that the full Warren formula had not been put to her because she had not been told that a specimen of blood would be taken by a doctor and that any medical reason she raised for not giving a specimen of blood would be determined by a doctor . 	NAN	NAN	NAN	0.8	lord hutton
242	199	However the case stated said : `` The defendant said in evidence that she had appreciated it was inherent in what Sergeant Tinsley had said to her that a doctor would be called to take any specimen of blood . 	NAN	NAN	NAN	0.8	lord hutton
242	200	She further stated that she knew of no medical reason why she should not give a specimen of blood . '' 	NAN	NAN	NAN	0.8	lord hutton
242	201	and it was agreed that this should be treated as a finding of fact . 	NAN	NAN	NAN	0.8	lord hutton
242	202	Therefore it was clear that the defendant had not been prejudiced and the appeal was dismissed , Pill L.J. stating , at pp. 408-409 : `` What is put depends on the circumstances . 	NAN	NAN	NAN	0.8	lord hutton
242	203	There could be circumstances in which a defendant in deciding whether to exercise his or her option under section 8 was prejudiced by the absence of the knowledge contained in the sentences of the Warren formula which were not put at the time the choice was exercised . 	NAN	NAN	NAN	0.8	lord hutton
242	204	This , however , is far from being one of those cases . 	NAN	NAN	NAN	0.8	lord hutton
242	205	In my judgment , this is a hopeless appeal . 	NAN	NAN	NAN	0.8	lord hutton
242	206	I would answer the question posed for this court by saying that the judges in the Crown Court were right to hold that the omission by Sergeant Tinsley to state all matters contained in the Warren formula did not prejudice the defendant , and I would dismiss the appeal . '' 	NAN	NAN	NAN	0.8	lord hutton
242	207	In Robinson 's case the Divisional Court followed the approach taken by Kennedy L.J. in Director of Public Prosecutions v. Charles -LRB- Note -RRB- -LSB- 1996 -RSB- R.T.R. 247 in a number of appeals heard together in section 8 -LRB- 2 -RRB- cases . 	NAN	NAN	NAN	0.8	lord hutton
242	208	In giving judgment Kennedy L.J. stated , at p. 270 : `` it would be a question of fact for the justices to decide in any given case whether the breach -LSB- of the Warren requirements -RSB- deprived the driver of the opportunity to exercise the option , and in some cases a court might be prepared to find that it did . 	NAN	NAN	NAN	0.8	lord hutton
